time,title,context
2021-05-11,美 한미정상회담 하루 전 삼성전자 호출…투자압박 듯,미 상무부 일 반도체 기업 호출 삼성 인텔 구글 아마존 등 조 바 미국 대통령 지난달 일 현지시간 백악관 화상 진행 반도체 회의 참석 발언 웨이퍼 미국 정부 일 삼성전자 비롯 전 세계 자동차 반도체 기업들 한번 호출해 반도체 공급망 점검 회의 예정 것 일 현지시간 조 바 미국 대통령 지난달 일 삼성전자 등 전 세계 반도체 자동차 통신 등 개 기업 화상 회의 약 달여 만 삼성전자 미국 내 반도체 투자 바 행정부 압박 전망 이날 블룸버그통신 등 미국 정부 일 글로벌 반도체 업체들 초대해 한번 반도체 공급 부족 문제 논의 예정 참석 대상 삼성전자 제네럴 모터스 포드 등 차 회의 당시 참석 기업들 구성 것 구글 아마존 등 테크기업 대상 포함 러몬 미 상무장관 이번 회의 반도체 공급망 문제 대화 것 이 반도체 공급자 소비자 러몬 장관 일 방송 인터뷰 수십 년 우리 충분한 반도체 미국 생산 며 이 최우선 순위 우리 공격적 사안 이 지난달 미국 차 반도체 공급망 점검 회의 국내 기업 중 유일 호출 삼성전자 이번 명단 이번 반도체 현지 생산 점검 이슈 감안 최시영 파운드리사업부장 사장 의 참석 가능성 무게 공교 이번달 회의 날짜 일 미 워싱턴 한미정상회담 점 삼성전자 상무부 주재 회의 이후 투 방안 지 관심 것 전망 삼성전자 반도체 회의 참석 인텔 백악관 요청 투자 리 발표 점 삼성전자 파운드 신규 투 발표 임박 관측 노정동 한경닷컴 기자
2021-05-11,한미 정상회담 하루 美 삼성전자 호출,상무부 일 차 반도체 회의 소집 지난달 이 여 투 압박 조 바 미국 대통령 지난달 일 현지 시간 미국 백악관 반도체 회의 참석 웨이퍼 참석 조 바 미국 대통령 웨이퍼 연합뉴스 서울경제 미국 이달 개최 예정 한미 정상회담 하루 삼성전자 포함 차 반도체 회의 를 개최 블룸버그 통신 일 이하 현지 시간 소식통 인용 러만 미국 상무장관 반도체 칩 부족 문제 대응 방안 논의하기 유관 업계 화상 회의 일 열 계획 보도 일 개최 예정 한미 정상회담 하루 기업들 소집 것 블룸버그 이번 회의 인텔 등 자국 반도체 업체 한국의 삼성전자 대 도 초대 반도체 수요 업체 제너럴모터스 포드 구글 아마존 포함 상무부 이 회사 초대장 이번 회의 목표 반도체 공급망 문제 관련해 대화 것 반도체 칩 공급업체 수요업체 상무부 직원들 참석 회사 관계자들 의제 조율 것 러만 장관 일 조 바 대통령 장관들 회의 후 반도체 부족 문제 해법 모색 중 해결책 것 이 단기적 부족 문제 완화 수 것 것 이 한 바 장기적 해결책 중국 대 의존도 줄 미국 반도체 것 이 미국 정부 지난달 일 제이크 설리번 백악관 국가안보보좌관 주재 삼성전자 인텔 포드 등 초청 화상 회의 당시 회의 조 바 미국 대통령 참석 반도체 웨이퍼 미국 반도체 산업 투자 강조 바 조양준 기자
2021-05-11,이통 3사 이 삼성전자도…국내 기업들 외면,세계 최대 모바 전시회 월 행사 한달 기업들 불참 선언 국내 이통 이 삼성전자 온라인 대 참석 취소 올해 월 예정 세계 최대 모바 전시회 삼성전자 포함 국내 기업들 줄 발 사진 년 행사 당시 삼성전자 부스 아시아경제 차민영 기 올해 월 예정 세계 최대 모바 전시회 삼성전자 포함 국내 기업들 줄 발 국내 포함 글로벌 기업들 온라인 참석 참 선택 주최 측 세계이동통신사업자연합회 의 고민 일 업계 삼성전자 올해 월 일 월 일 스페 바르셀로나 오프라 전시 참여 결정 대 온라인 참석 예정 매년 월말 월초 스페 바르셀로나 개최 주요 통신사 조사들 신제품 서비스 자리 작년 코 여파 개최 취소 올해 개최 시 월 올해 코 상황 지속 탓 주요 기업들 불참 의사 전세계 백신 접종 완료 상태 참여 실익 판단 해외 주요 기업들 초 불참 선언 구글 노키아 에릭슨 소 오라클 등 해외 주요 기업들 코 여파 여행 제한 올해 불참 발표 국내 이동통신 확률 국내 기업 중 도 지난달 오프라 전시 참여 유플러스 전자 오프라 부스 공동 전자 모바 사업 철수 불참 텔레콤 공식적 의사 전시 준비 삼성전자 측은 임직원 파트너 고객들 건강 전 최우선 올해 오프라 전시 참여 며 모바 경험 발전 온라인 참여 예정 업계 파트너들 지속 협력 올해 행사 강행 의지 입장 상태 여명 키노트 컨퍼런스 연사 명단 공개 올해 주제 커넥티드 임팩트 로 인공지능 빅데이터 사물인터넷 등 전망 차민영 기자
2021-05-11,"군지원센터, 삼성 가전제품 군인할인 이벤트 실시",사진제공 군지원센터 이데일리 이윤정 기 군인 군인가족 복지혜택 할 지원사업 군지원센터 삼성 가전제품 군 할 이벤트 실시 일 할 품목 삼성전자 주변기 포함 가전제품 전역폰 포함 군 휴대폰 구매 시 월 가정 달 특별 할인 제공 이벤트 재고 소진시 진행 군지원센터 회원가입 시 현금 사용 가능 포인트 지급 삼성가전제품 구입 시 포인트 추가 증정 군지원센터 사업담당자 군지원센터 홈페이지 회원가입 후 내 군 군인가족 인증 군인휴대폰 전역폰 삼성가전제품 등 상품 군인복지 할인가가 자동적용 설명 이 센터 서울 용산구 국방부 인근 소재한 본점 외 계룡대점 진해기지사령부 전투비행단 등 전국 각지 개 직영매장 운영 중 온라인 다이렉트샵에서 서비스 제공 며 이번 행사 대한민국 국방 군인장병 군인가족 관계자들 막중 책임감 보람 할인 관련 자세한 사항 군지원센터 홈페이지 확인 수 이윤정
2021-05-11,삼성 펀치홀 애플 도입[1일IT템,갤럭시 폴드 내부 접이식 디스플레이 쪽 언더 디스플레이 카메라 적용 펀치홀 수 출처 샘모바 파이낸셜뉴스 삼성전자 하반기 플래그십 전략무기 갤럭시 폴드 펀치홀 전망 년 애플 아이폰 노치 펀치홀 도입 것 관측 상황 삼성 한발자국 것 미국 정보기술 전문매체 샘모바일 일 현지시간 갤럭시 폴드 의 카메라 사양 유출 보도 유출 사양 언더 디스플레이 카메라 적용 그동안 갤럭시 시리즈 등 펀치 구멍 카메라 홀 것 샘모바일 정보유출 트위터리안 트론 의 주장 인용 갤럭시 폴드 대 카메라 셀카 카메라 대 후 카메라 대 트론 전면 커버 디스플레이 펀치홀 내부 셀카 카메라 픽셀 장착 내부 접이식 디스플레이 픽셀 의 언더 디스플레이 카메라 사용 이 내부 디스플레이 펀치홀 의미 후면 화소 광각 카메라 화소 초광각 카메라 화소 망원 카메라 구성 삼각 카메라 설정 후 카메라 초점 거리 휴대폰 광학영상안정화 기능 배 망원 렌즈 장착 것 예상 를 도입 저조 조건 선명 사진 비디오 촬영 수 카메라 비디오 녹화 수 갤럭시 폴드 방진 방수 기능 공식 등급 확보 사실 인치 접이식 디스플레이 인치 커버 디스플레이 재생률 지원 안드로이드 을 실행 수 스냅드래곤 프로세서 내부 저장 장치 펜 배터리 장착 것 한편 삼성 갤럭시 갤럭시 폴드 갤럭시 플립 등 세 개 하 엔드 스마트폰 월 공개 전망 애플 삼성 갤럭시 폴드 언더디스플레이카메라 갤럭시 플립 카메라사양 갤럭시 김아름 기자
2021-05-11,5월 실적강세 전기전자株 재탄력 받나…삼성전자,주요 전기전자 종목 컨센 개월 상향조정 컨센 상회 경기민감주 대비 저평가 컨센 상회 전망 사업 체질 개선 맑음 삼성전자 주 상승 모멘텀엔 변수 필요 이데일리 이은정 기 상대적 부진 전기전자 대형 종목들 분기 실적 강세 밸류에이션 재평가 기대감 경기민감주 대비 저평가 분기 이 분기 시장 기대치 실적 기록 사업 체질 개선 나서면서다 반도체 부족 생산 타격 예상 타격 점 재평가 요인 코스피 대장주인 삼성전자 분기 추 상승 모멘텀 필요 분석 이데일리 문승용 기 일 에프앤가이드 삼성전자 하이닉스 디스플레이 삼성전기 이노텍 전자 등 전기전자 개 기업 분기 영업이익 컨센서스 평균치 월말 조 억원 월말 조 억원 월말 조 억원 조 억원 상향조정 주가 지지부진 연초 대비 이날 종 기준 상승률 삼성전자 하이닉스 전자 삼성전기 이노텍 로 코스피 상승률 를 하회 디스플레이 정도 로 벤치마크 박강호 대신증권 연구원 주요 종목 지난해 이후 매크로 지표 호조 순환적 금융주 운송 화학 등 경기민감주 업종 상대적 저평가 며 반도체 부족 이슈 생산 우려 개월 주 횡보 영향 것 말 주요 기업들 분기 영업이익 컨센서스 상향 조정 반도체 부족 생산 타격 예상 점 여기 사업 포트폴리오 개선 밸류에이션 재평가 기회 수 분석 박 연구원 전자 삼성전기 이노텍 등 분기 실적 컨센서스 상회 가능성 연간 최고 실적 추가 추정치 상향 밸류에이션 재평가 진행 것 며 고부 중심 포트폴리오 전환 주요 제품 가격 인상 시장 지배력 말 기업 저수익 사업중단 신성장 사업 투자 강화 점 신성장 경쟁력 확보 과정 밸류에이션 상향 연결 전망 연간 고수익 중심 포트폴리오 개선 최고 영업이익 기록 것 예상 전자 모바일커뮤니케이션 사업 중단 이후 가전 판매 집중 프리미엄 시장 점유율 확대 이익 반영 전망 유기발광다이오드 로 프리미엄 입지 확대 수익률 개선 것 장기적 전장 기업간거래 부문 투자 집중 점 긍정적 요인 에프앤가이드 전자 연간 영업이익 컨센서스 일 종 기준 조 억원 연초 대비 증가 삼성전기 저수익 사업 무선충전모듈 등 중단 이후 고용량 분야 점유율 확대 전장 분야 진출로 성장기회 맞이 평 반도체 인쇄회로기판 공급 부족 심화 고부 영역 시장 지배력 확대 삼성전자향 카메라모듈 중국향 폴디드 카메라 비중 확대 긍정적 전망 삼성전기 연간 영업이익 컨센서스 조 억원 연초 대비 이노텍 애플 내 프리미엄 카메라 모듈 점유율 유지한 가운데 기능 상향 평균공급단가 상승 안정적 수익성 예상 저수익 사업 중단 이후 반도체 영역 점유율 증가 수익성 창출 업종 내 저평가 기업 판단 설명 이노텍 연간 영업이익 억원 연초 대비 연초 이후 만원 초반대 주 횡보 중 삼성전자 관심 삼성전자 연간 영업이익 컨센서스 일 종 기준 조 억원 월 대비 증 추세 주 상승 폭 이익 추정치 추 상향 투 등 변수 필요 박 연구원 삼성전자 분기 메모리 가격 상승 선반영 만큼 분기 반도체 가격 분기 이익 추정치 상승 투 등 변수 며 부문 부진 가전 최고점 것 평가 반도체 견인 관건 이슈 필요 것 이 말 공매 부분재개 월 일 이후 펀더멘털 기업 중심 타격 적 것 예상 점 긍정적 대형 전기전자 종목 공매 대상 코스피 포함 재개 첫 주 월 일 상승률 기록 중소형주 대비 주가 영향 평 이은정
