time,title,context
2021-03-18,"한샘·삼성전자, 인테리어+가전 개념 리모델링",머니투데이 이재윤 기 한샘 삼성전자 한샘리하우스 스마트패키지 자료사진 한샘 종합 홈 인테리 전문기업 한샘 삼성전자 가전 리모델링 한번 설계 시공 수 스마트패키지 를 출시 일 한샘 인테리 전문가 리하우스 디자이너 리모델링 계획 중 고객 집 설계 때 삼성전자 생활 가전 패키지 제안 방식 리모델링 때 가구 건자재 가전 설계 편리 조화로운 디자인 공간 수 소비자들 다양한 취향 반영한 인테리어 가능 스마트패키지 구매 고객 삼성전자 쿡탑 포함 가전 종 이상 구매 시 가전 제품 최대 할인 스마트패키지 전국 한샘디자인파크 한샘리하우스 대리점 수 스마트패키지 리모델링 사업 확대 판매 연계 스마트홈 솔루션 구현 등 관련해 지난해 월 업무협약 한샘 삼성전자 출시 서비스 한샘 삼성전자 상품 개발 유통망 공유 사업 등 광범위 협력 전개 예정 안흥국 한샘 리하우스 사업본부장 사장 년 라이프스타일 노하우 축적 한샘 세계 최고 가전 기업 삼성전자 협력 미래 삶 주거 공간 을 제안 말 이재윤 기자
2021-03-18,삼성 독일서 게이밍 성능 인증 업계최초,제품 이미지 게이밍 성능 인증 로고 삼성전자 제공 파이낸셜뉴스 삼성전자 네오 퀀텀닷발광다이오드 업계 최초 독 인증 기관 의 게이밍 성능 인증 일 의 게이밍 성능 인증 최단시간 인풋 랙 하이다이내믹레인지 이상 삼성 테스트 결과 게임 구간 인풋 랙 이하 측정 기준 통과 인풋 랙 게임패드 입력 명령 화면 것 리 시간 뜻 삼성 게이밍 환경 이상 구현 인증 획득 기능 화면 화면 표현 기술 제품 컬러 볼륨 비트 백라이트 컨트롤 영상 디테일 정확 색상 표현 가능 업계 최초 와이드 게임 뷰 적용 대 대 등 화 조절 수 게임바 기능 탑재해 다양한 게임 관련 정보 화면 표시 수 외 모션 엑셀러레이터 터보 로 의 게임 모션 구현 번 프리 인공지능 기반 게임 서라운드 무빙 사운드 등 특장점 삼성전자 년 업계 최초 연결 기 분석 최적 환경 설정 오토 게임 모드 도입 등 게이밍 개발 결과 년 올해 년 연속 게이밍 부문 혁신상 수상 미국 테크 전문 그룹 포럼 은 타 추종 불허 게이밍 성능 평가 영국 테크레이더 에디터스 초이스 로 선정 최용훈 삼성전자 영상디스플레이사업부 부사장 소비자들 고화질 화면 게이밍 경험 중요 생각 며 중심 게이밍 경험 지속적 발전 것 이 말 김경민 기자
2021-03-18,삼성 업계 최초 독 '게이밍 성능,년형 개 모델 대상 인풋 랙 이하 이상 성능 이데일리 신중섭 기 삼성전자 올해 신제품 업계 최초 독 인증 기관 의 게이밍 성능 을 인증 일 제품 이미지 게이밍 성능 인증 로고 삼성전자 인증 모델 개 모델 등 의 게이밍 성능 인증 최단시간 인풋 랙 과 니트 화 밝기 단위 이상 으 테스트 결과 삼성 게임 구간 인풋 랙 이하 측정 기준 통과 인풋 랙 게임패드 입력 명령 화면 것 리 시간 뜻 시간 게임 실감도 삼성 게이밍 환경 이상 구현 데 성공 은 화면 화면 표현 최적 명암비 제공 기능 프리싱크 프리미엄 프로 기능 탑재 등 게이머들에 중요 인식 삼성 로부터 인증 최단시간 인풋 랙 구현 외 다양한 게이밍 관련 기능들 탑재 컬러 볼륨 비트 백라이트 컨트롤 영상 디테일 정확 색상 표현 가능 업계 최초 와이드 게임 뷰 를 적용해 등 화 조절 수 게임바 기능 탑재해 다양한 게임 관련 정보 화면 표시 수 밖 모션 엑셀러레이터 터보 로 의 게임 모션 구현 고정 게임 번 걱정 게임 수 번 프리 인공지능 기반 게임 서라운드 사운드 무빙 사운드 등 몰입감 사운드 구현 가능 삼성전자 년 업계 최초 연결 기 분석 최적 환경 설정 오토 게임 모드 를 도입 등 게이밍 개발 결과 년 올해 년 연속 게이밍 부문 혁신상 수상 한편 미국 유럽 테크 전문 매체들 호평 미국 테크 전문 그룹 포럼 은 타 추종 불허 게이밍 성능 을 평가 영국 테크레이더 프리싱크 프리미엄 프로 최단 시간 인풋 랙 등 게이밍 기능 호평 에디터스 초이스 로 선정 최용훈 삼성전자 영상디스플레이사업부 부사장 소비자들 고화질 화면 게이밍 경험 중요 생각 며 중심 게이밍 경험 지속적 발전 것 이 말 신중섭
2021-03-18,통곡 일 이재용 얘 목소리 개미들…삼성전자 주총 '후끈,머니투데이 수원 경기 오문영 기 만명 동학개미 주주들 보유 삼성전자 주주총회 일 경기 수원컨벤션센터 주총 현장 여명 주주들 참석 지난해 여명 의 배 규모 주주들 경영진 질문 주총 시간 여분 만 끝났다 이날 주총 이재용 부회장 거취 주주들 논쟁 벌 이례적 상황 현장 명 코 방역 전 삼성전자 일 오전 경기 수원시 영통구 수원컨벤션센터 저 기 삼성전자 정기주주총회 주주들 입장 뉴스 일 수원컨벤션센터 주총 시작 시간 전 주주들 시작 개월 아기 주주 대 한 할머니 엄마 권유 공부 주식 주 초등학생 이모 등 주총장 나 눈길 삼성전자 주총 시작 오전 시 기준 명 참석자 수 주총 진행 동안 지속적 최종 참석 인원 여명 집계 삼성전자 온라인 주총 시청 주주 수 삼성전자 지난해 수원컨벤션센터 층 대관해 주총 진행 올해 주주 수 지난해 비교 때 배 가량 점 층 대관했다 삼성전자 주주 수 지난해 기준 명 층 출입구 설치 열화상카메라 통과 주주들 진행 요원들 체온계 차례 온도 재고 발열 등 문제 행사장 수 주총장 내부 층 층 의 좌석 서로간 의 거리 배치 사태 대비해 삼성전자 주전 수원컨벤션센터 방역 실시 이날 컨벤션센터 건강확인소 내부 곳 외부 곳 설치 구급차 대 지상 주차장 대기 이상 증상 주주들 진료 의료진 상주 송곳 질문 주주들 김기남 부회장 업계 위 의안 상정 주총 주주들 질문 경영진 답변 방식 진행 현장 주주들 뿐 사전 접수 온라인 시청자들 질문 답변 주주들 반도체 공급난 스마트폰 생산 차질 해외 업체 메모리반도체 부문 추격 등 질문 삼성전자 스마트폰 무선사업 총괄 고동진 모바 부문 대표 반도체 공급 부족 제품 생산 가능성 주주 질문 수급 불균형 심각 상태 라 분기 문제 예상 임직원들 노력 만큼 결과 답 삼성전자 미국 마이크론 등 메모리반도체 부문 추격 것 지적 김기남 삼성전자 디바이스솔루션 부문 부회장 향후 지속적 연구개발 기술우위 한편 차별화 제품 고객 유치 우수 제품 지속 공급해 업계 위 위상 파운드 업체 와 경쟁 주주 질문 파운드 사업 육성하기 규모 경제 를 달성 것 중요 부회장 삼성전자 파운드 사업 시작 지 얼마 선두업체 시장점유율 생산능력 고객 수 부족한 것 이 선단 공정 경쟁력 손색 이 규모 경제 실현 수 효율적 투자 생산능력 마련 이 경쟁 격차 이날 상정 재무제표 승 사내 사외이사 선 감사위원회 위원 사외이사 선 이사 보수한 승 등 원안 통과 세계 최대 의결권 자문사 사외이사 박병국 서울대 교수 김종훈 키스모바 회장 김선욱 전 법제처장 등 사외이사 재선 고객사 반대투표 권고 원안 가결 김기남 삼성전자 대표이사 부회장 일 오전 경기 수원시 영통구 수원컨벤션센터 저 기 삼성전자 정기주주총회 발언 뉴스 이재용 거취 두 논쟁 시민단체 문제제 주주들 발언권 요청 이재용 부회장 거취 주주들 논쟁 벌 이례적 상황 참여연대 경제개혁연대 등 부회장 취업제한 문제 이사회 이사들 압박 주주들 반박 것 참여연대 관계자 발언 기회 부회장 년 개월 실형 선고 수감생활 시작 이후 상근 비상근 출근 형태 변경 뿐 부회장직 유지 며 이사회 부회장 해 요구 시민단체 강 비판 주주들 발언 신청 반박 의견 일반 자격 참석 한 주주 회사 경쟁력 강화 부회장 경영 복귀 수 주주들 뜻 주주 땅 통곡 일 이 우리나라 방향 말 주주들 발언 주총장 박수 주총 의장 김기남 부회장 이 관련 글로벌 네트워크 미래사업 결정 등 부회장 역할 회사 상황 법 규정 종합 검토 결정 답 삼성 준법감시위원회 부회장 취업제한 논의 것 가운데 준법위 논의 부적절 주장 주주 외부감시기구 준법위 부회장 취업 문제 것 월권 이 주장 부회장 준법위 역할 준법위 설립 이래 준법경영 의견 제시 며 계열사 최고경영진 간담회 등 준법문화 정착 활동 지속 정리 수원 경기 오문영 기자
2021-03-18,삼성전자 현대차 등 車반도체,머니투데이 세종 안재용 기 자동차 반도체 협회 반도체 협력 체결 자동차 반도체 업계 차량용 반도체 부족 위 극복 한국자동차협회 한국반도체협회 양해각서 를 체결 차량용반도체 공동기술개발 생산시설 확대 계획 자동차협회 반도체협회 일 서울 서초구 자동차회관 국내 차량용반도체 산업발전 양해각서 체결 기업 교류회 기업교류회 현대차 등 완성차 업체 만 오토모티브 등 차량용반도체 주문자상표부착생산 업체 네오와인 라닉스 등 반도체 팹리스 업체 참석 자동차협회 반도체협회 체결 차량용반도체 생산시설 증설 기업간 공동기술개발 차량용반도체 시제품 공동평가 인증 지원 업계간 협력모델 발굴 등 추진 기업교류회 팹리스 업체 보유 기술 제품 시연 비즈니스 정보 교환 정부 연구개발 지원 신속통관 등 장단기 지원 정부 차량용반도체 년 억원 투입 차량용 애플리케이션프로세서 엣지컴퓨터 칩 레벨 자율차용 기술개발 차량용반도체 부족 문제 중장기적 해결 계획 기존 차량용 반도체 차량용 전환 사용 수 사업화 지원 이 수요기반형 고신뢰성 차량용 반도체 개발사업 을 신설 자동차 업계 수요 기반 전기차 전력제 반도체모듈 자율주행용 통신반도체 인공지능 반도체 영역별 통합제어 반도체 모듈 등 신규 과제 기획 지원 추진 자율주행 반도체 개발시 필요 학습용데이터 다음달 개방 팹리스 반도체 파운드리 시제품 제작 수 정부지원 리 파운드 증설 투자지원 강화 현대차 삼성전자 등 완성차 반도체 기업 참여 미래차 반도체 연대 협력 협의체 를 구성 정기적 를 협력채널 정례화 박진규 산업부 차관 차량용반도체 수급문제 글로벌 자동차 업계 강타 지금 양 협회 차량용반도체 자립화 협력 것 시의적절 의미 활동 이 정부 기업 연대화 협력 뒷받침 미래차 핵심 차량용반도체 육성 적극 지원 것 이 세종 안재용 기자
