time,title,context
 2021.03.07 13:34,이재용 부회장 삼성합병 의혹 재판 11일 재개,삼성그룹 불법 합병 회계부정 의혹 기소 이재용 삼성전자 부회장 재판 이번 주 재개 첫 준비기일 지 개월 만 일 법조계 서울중앙지법 형사합 부 부장판사 박정제 박사 권성수 일 오후 시 자본시장 금융투자업 법률 위반 등 혐의 재판 부회장 삼성그룹 관계자들 두 번 공판준비기일 이재용 삼성전자 부회장 연합뉴스 검찰 삼성그룹 미래전략실 부회장 안정적 경영권 승계 삼성물산 제일모직 합병 계획 부회장 비롯 삼성 관계 명 지난해 월 재판 부회장 자본시장법상 부정거래행위 시세조종 업무상배 등 혐의 이 부회장 측은 합병 경영상 필요 합법적 경영 활동 며 혐의 부인 첫 공판준비기일 지난해 월 부회장 측이 기록 방대 검토 시간 필요 요구해 두 번 준비기일 월 올해 초 코 재확산 법원 정기 인사 등 이유 재판 연기 약 개월 만 열리 재판 형사합 부장판사 명 구성 대등재판부 부회장 사건 심리 전 재판장 임정엽 부장판사 김선희 부장판사 지난달 전보 재판장 박정제 부장판사 판결문 초안 작성 주 박사 부장판사 한편 부회장 월 국정농단 사건 파기환송심 징역 년 개월 선고 서울구치소 복역 중 공판준비기일 피고인 출석 의무 부회장 이날 법정 것 이재 기자
 2021.03.07 13:09,삼성전자 주주총회 전자투표시스템 오픈‥16일까지 투표,김기남 삼성전자 대표이사 부회장 경기 수원시 영통구 수원컨벤션센터 삼성전자 저 기 정기주주총회 발언 뉴스 조태형 기 뉴스 파이낸셜뉴스 일 정기주주총회 삼성전자 주주총회 참석 의결권 행사 수 전자투표시스템 일 주주들 이날 오전 시 일 오후 시 전자투표 주총 참석 사전 의안 의결권 행사 수 삼성전자 지난해 전자투표 제도 도입 전자투표 주주들 주총 개최 자 장소 등 시간적 물리적 제약 간편 의결권 행사 수 마련 주주들 나 모바 중 본인 방식 시스템 접속 주주 본인 확인 후 의안별 전자투표 행사 수 주주확인용 인증서로 코스콤 증권거래용 인증 금용결제원 개인용도제한용 인증 등 이용 수 삼성전자 주주들 발송 저 기 정기주주총회 소집통지서 박재완 이사회 의장 김기남 대표이사 부회장 올해 코 로 주주총회 참석 어려움 예상 며 전자투표 활용 의결권 행사 주주들 당부 바 삼성전자 주주총회 참석 주주들 올해 처음 주주총회 온라인 중계 온라인 중계 시청 사전 신청 필요 주주들 신청 사이트 전자투표 행사 기간 월 일 오전 시 일 오후 시 신청 수 삼성전자 온라인 중계 시청 주주들 사전 질문 접수 예정 주주들 주총 당 중계 실시간 질문 수 삼성전자 이번 주주총회 재무제표 승 사외 사내이사 선 감사위원회 위원 사외이사 선 이사 보수한 승 등 현행법상 주총 당 온라인 중계 시청 주총 안건 온라인 투표 것 불가능 삼성전자 일 경기 수원컨벤션센터 저 기 정기주주총회 개최 김서원 기자
 2021.03.07 12:10,삼성전자 정기주총 전자투표시스템 오픈,연합뉴스 헤럴드경제 양대근 기 삼성전자 일 경기 수원컨벤션센터 저 기 정기주주총회 주주들 온라인 의결권 행사 수 전자투표시스템 일 오픈 주주들 일 오전 시 일 오후 시 전자투표 주총 참석 사전 의안 의결권 행사 수 삼성전자 지난해 전자투표 제도 도입 전자투표 주주들 주총 개최 자 장소 등 시간적 물리적 제약 간편 의결권 행사 수 마련 주주들 나 모바 중 본인 방식 시스템 접속 주주 본인 확인 후 의안별 전자투표 행사 수 주주확인용 인증서로 코스콤 증권거래용 인증 금용결제원 개인용도제한용 인증 등 이용 수 삼성전자 주주들 발송 저 기 정기주주총회 소집통지서 박재완 이사회 의장 김기남 대표이사 부회장 올해 코 로 주주총회 참석 어려움 예상 면 전자투표 활용 의결권 행사 주주들 당부 삼성전자 주주총회 참석 주주들 올해 처음 주주총회 온라인 중계 온라인 중계 시청 사전 신청 필요 주주들 신청 사이트 전자투표 행사 기간 월 일 오전 시 일 오후 시 신청 수 삼성전자 온라인 중계 시청 주주들 사전 질문 접수 예정 주주들 주총 당 중계 실시간 질문 수 삼성전자 이번 주주총회 재무제표 승 사외 사내이사 선 감사위원회 위원 사외이사 선 이사 보수한 승 등 현행법상 주총 당 온라인 중계 시청 주총 안건 온라인 투표 것 불가능
 2021.03.07 09:15,삼성전자 정기주총 전자투표시스템 오픈…오늘부터 의결권 행사,오늘 전자투표 사전 의결권 행사 주총 온라인 중계 사전 신청 접수 시작 이데일리 피용익 기 삼성전자 저 기 정기주주총회 주주들 온라인 의결권 행사 수 전자투표시스템 오픈 일 삼성전자 주총 일 일 경기 수원컨벤션센터 주주들 일 오전 시 일 오후 시 전자투표 주총 참석 사전 의안 의결권 행사 수 삼성전자 지난해 전자투표 제도 도입 전자투표 주주들 주총 개최 자 장소 등 시간적 물리적 제약 간편 의결권 행사 수 마련 주주들 나 모바 중 방식 시스템 접속 주주 본인 확인 후 의안별 전자투표 행사 수 주주확인용 인증서로 코스콤 증권거래용 인증 금용결제원 개인용도제한용 인증 등 이용 수 삼성전자 주주들 발송 저 기 정기주주총회 소집통지서 박재완 이사회 의장 김기남 대표이사 부회장 올해 코 로 주주총회 참석 어려움 예상 면 전자투표 활용 의결권 행사 주주들 당부 삼성전자 주주총회 참석 주주들 올해 처음 주주총회 온라인 중계 온라인 중계 시청 사전 신청 필요 주주들 신청 사이트 일 오전 시 일 오후 시 신청 수 삼성전자 온라인 중계 시청 주주들 사전 질문 접수 예정 주주들 주총 당 중계 실시간 질문 수 삼성전자 이번 주주총회 재무제표 승 사외 사내이사 선 감사위원회 위원 사외이사 선 이사 보수한 승 등 현행법상 주총 당 온라인 중계 시청 주총 안건 온라인 투표 것 불가능 피용익
 2021.03.07 09:14,삼성전자 주총 의결권 행사 전자투표 '오픈'…사상 첫 온라인 중계,이미지출처 연합뉴스 아시아경제 김혜원 기 삼성전자 일 경기 수원컨벤션센터 저 기 정기주주총회 주주들 온라인 의결권 행사 수 전자투표시스템 일 오픈 주주들 이날 오전 시 일 오후 시 전자투표 사전 의안 의결권 행사 수 현행법상 주총 당 온라인 중계 시청 주총 안건 온라인 투표 것 불가능 삼성전자 지난해 전자투표 제도 도입 전자투표 주주들 주총 개최 자 장소 등 시간적 물리적 제약 간편 의결권 행사 수 마련 주주들 나 모바 중 본인 방식 시스템 접속 주주 본인 확인 후 의안별 전자투표 행사 수 주주확인용 인증서로 코스콤 증권거래용 인증 금용결제원 개인용도제한용 인증 등 이용 수 삼성전자 주주들 발송 저 기 정기주주총회 소집통지서 박재완 이사회 의장 김기남 대표이사 부회장 올해 코 로 주주총회 참석 어려움 예상 면 전자투표 활용 의결권 행사 주주들 당부 삼성전자 주주총회 참석 주주들 올해 처음 주주총회 온라인 중계 온라인 중계 시청 사전 신청 필요 주주들 신청 사이트 전자투표 행사 기간 이날 오전 시 일 오후 시 신청 수 삼성전자 온라인 중계 시청 주주들 사전 질문 접수 예정 주주들 주총 당 중계 실시간 질문 수 삼성전자 이번 주주총회 재무제표 승 사외 사내이사 선 감사위원회 위원 사외이사 선 이사 보수한 승 등 김혜원 기자
