time,title,context
2021-05-13,속보 삼성전자 8만원 붕괴,파이낸셜뉴스 삼성전자 일 오전 시 분 유가증권시장 전 거래 대비 하락 원 거래 전 종 기준 만원 거래 삼성전자 주가 거래 연속 하락세 최두선 기자
2021-05-13,삼성전자 이틀 연속 8만원 붕괴···‘칠만전자' 되,삼성전자 주가 이틀 연속 만원선 삼성전자 서초 사옥 일 오전 시 삼성전자 원 거래 시작 전날 종가 만원 삼성전자 전날 일 장중 때 원 하락 삼성전자 만원선 것 지난해 월 일 이후 처음 노자운 기자
2021-05-13,"'수직상승'하 글로벌 램 매출…삼성·SK, 슈퍼호황 시동",머니투데이 오문영 기 글로벌 램 매출액 올해 분기 전분기 대비 상승 것 전망 모바일 용 비롯 데이터센터 서버용 램 분야 수요 증가 때문 낸드플래시 값 반등세 메모리반도체 시장 본격적 호황기 진입 것 관측 업계 일 시장조사업체 트렌드포스 올해 분기 램 글로벌 매출 억 달러 약 조 억원 로 전분기 약 조 억원 비교 증가 트렌드포스 코 여파 재택근무 원격교육 확산 램 수요 예상치 분석 여기 오포 비보 샤오미 등 중국 스마트폰 업체들 화웨이 미국 규제 공백 시장 조달 확대 점 수요 증가 분기 이후 견조한 수요 것 분석 모바 그래픽 등 분야 램 수요 양호 램 가격 것 상승 지속 대비해 업체들 재고 확보 차원 신규 조달 것 판단 트렌드포스 분기 램 평균판매단가 전분기 대비 증가 것 예상 면 비트 출하량 증가 가격 상승 분기 램 매출액 이상 증가 것 이 말 점진적 회복 서버 제조업체 램 수요 매출액 증가 견인 요소 트렌드포스 서버 제조업체 램값 지속적 상승 것 예상 신규 조달 계획 실행 시작 며 이 평균판매단가 증가 것 말 서버용 램 페이스북 애플 아마존 넷플릭스 구글 으 글로벌 클라우드서비스업체 데이터센터 서버 구축 데 필수적 서버용 램 용 고부가가치 서버용 램 년 반도체 슈퍼호황기 지난해 코 상황 삼성전자 역대급 실적 제품 공급 과잉 년 하락세 면치 낸드플래시 가격 반등세 업계 메모리반도체 시장 장기호황 시작 것 관측 삼성전자 하이닉스 분기 실적 발표 이후 진행 컨퍼런스콜 전화회의 메모리반도체 업황 긍정적 전망 램 비트그로스 비트 단위 생산량 증가율 연간 낸드 중반 수준 것 양사 슈퍼사이클 장기화 염두 기회 극대화 작업 추진 삼성전자 평택 캠퍼스 신규 생산라인 조 가동 설비 반입 속도 평택 캠퍼스 양산 일정 방안 고 것 하이닉스 업황 개선세 선제적 투자 예 장비 리드타임 셋업 기간 내년 투자분 일부 올해 하반기 집행 것 램 경우 주력 나노 세대 제품 생산량 리 극자 장비 활용 연내 세대 제품 양산 시작 계획 오문영 기자
2021-05-13,한미 정치권 반도체 백신확보 전쟁 사이 삼성,머니투데이 오동희 산업 부 선임기자 년 월 일 산시성 시안시 진행 메모리 반도체 공장 준공식 산시성 성 자오정용 산시성 성장 러우친젠 공신부 부장 먀오웨 국가발개위 부주 쉬셴핑 권영세 주중 한국대사 전재원 주시안 총영사 권오현 부회장 등 삼성전자 경영진 참석 사진제공 삼성전자 뉴스룸 삼성 반도체 백신 확보 한미 정치권 압박 사이 고 기업 독립적 경영전략 구사할 여지 고민 전세계 자동차용 반도체 백신 확보 전쟁 국내외 정치권 해결 수 문제 도움 요청 압박 것 부담감 현장 경영상 필요 정치적 필요성 요구 곤혹 분위기 일례 미국 바 정부 반도체 배터리 업체들 압박 화 백신 확보 관련한 정치권발 압력 삼성바이오로직스 화 백신 위탁 생산 루머 부담 삼성바이오로직스 일 오전 화 백신 월 생산 것 정치권발 풍문 보도 곤욕 삼성바이오로직스 이날 오전 한국거래소 개장 전 풍문 보도 해명 공시 금 일 신문 보도 삼성바이오 화 백신 면 면 은 사실 라 정치권 취재원 입 보도 개장 전 부인공시 불구 삼성바이오로직스 주가 장중 가량 등 혼란 삼성바이오로직스 정통한 소식통 정치권 관계자 입 보도 내용 정치권 바람 얘기 것 며 삼성 화 백신 생산물량 수주 압박 지적 그 일부 화이자 비밀유지협약 때문 부인공시 를 것 사실무근 이 표현 것 풍문 답변 수 것 이 이 말 기업 글로벌 네트워크 활용 백신물량 확보 정치권 압박 해석 워싱턴 뉴시스 일 현지시간 미국 워싱턴 백악관 루즈벨트룸 반도체 공급망 복원 최고경영자 화상 회의 참석 실리콘 웨이퍼 바 대통령 삼성전자 등 참석 이번 회의 기업 압박 국내 미국 등 해외 지속 지난달 조 바 미국 대통령 이 일 현지시간 지 레이먼 미국 상무장관 삼성전자 등 반도체 관련 기업 자동차 업체들 온라인 화상회의 예정 제너럴모터스 등 자국 자동차 업체들 반도체 부족 문제 논의 목적 문제 삼성전자 메모리반도체 세계 위 기업 반도체위탁생산 파운드 위 기업이긴 공급부족 자동차용 반도체 무관 점 반도체 업계 정통한 소식통 미국 정부 요구 적 문제 자동차용 반도체 공급부족 관련해 삼성전자 수 얘 것 이 최첨단 공정 반도체 생산 삼성전자 입장 수익성 회로공정 기술 난이도 자동차용 반도체 신경 여력 때문 관계자 삼성전자 기술력 정도 요구 수 미 정치권 요구 무시 것 기업들 부담 라 말 배상근 전국경제인연합회 전무 바 행정부 경우 투자기업들 행정부 규제적 권능 국 수반 바 대통령 요청 경우 기업 부담 것 말 기업 거부하기 압박 얘 전무 우리 기업 나 대기업 사업보국 등 기업 정신 가능 할려 노력 정치권 요구 무리한 경우 기업경영 전략 차질 수 우 나 등 배터리 시설투자 압박 마찬가지 필요 투자 수 수요 감안 미국 정부 전략적 선택 동참 결단 필요 상황 년 월 일 이노베이션 미국 조지아주 자동차 배터리 공장 기공식 주요 인사들 붓 느낌표 화룡정점 전 기념촬영 왼쪽 윤예선 이노베이션 배터리사업대표 데이브 필립 포드 이사 스테판 좀머 폭스바겐 이사 윌버 로스 미국 상무장관 브라이언 켐프 조지아 주지사 최재원 수석부회장 덕 콜린스 미 연방 하원의원 톰 크로우 잭슨카운티 위원장 힐 커머스시장 이노베이션 제공 일례 년 월 삼성 반도체 준공 중국 산시성 시안 메모리 반도체 공장 정치적 고객 필요 것 삼성전자 당시 시진핑 중국 국 주석 고향 시안 낸드플래시 공장 결정 년 동일본 이후 안정적 반도체 공급 요구 애플 등 고객사들 요구 것 한국 내 공장 경우 발생 지 지진 공급 차질 발생 때 백업 수 한국 이외 지역 라인 구축 고객사들 요구 일환 수요처 중국 라인 구축 것 중국 내 위치 어디 것이냐 문제 시진핑 주석 고향 선택 것 뿐 고객 요구 정치권 요구 얘 재계 관계자 일 대통령 주재 반도체 전략 보고대회 정부 우리 반도체 경쟁력 확보 기업 필요 것 무엇 지 이유 라 말 오동희 산업 부 선임기자
2021-05-13,코스닥 메모 13일 공모주청약=제주맥주(대신) 진시스템 삼성,공모주청약 제주맥주 대 진시스템 삼성
