,날짜,기사제목,본문내용
0,2021-05-27,"하이트진로, 여름 성수기 '필라이트 후레쉬' 신규 CF 공개",이데일리 김범준 기자 하이트진로는 본격 여름 성수기를 맞아 필라이트 후레쉬 신규 광고 공들여 만든 상쾌함 편 을 지상파와 케이블 채널을 통해 공개한다고 일 밝혔다 필라이트 새 광고 공들여 만든 상쾌함 편 스틸컷 사진 하이트진로 제공 발포주 브랜드 필라이트는 이번 광고를 통해 패키지 리뉴얼과 품질력을 강조하고 가정시장 대표 브랜드로서의 입지를 더욱 강화한다는 전략이다 새로운 광고는 말도 안되게 공들여 만든 상쾌함 이라는 슬로건 아래 필라이트 후레쉬의 가지 핵심 강점인 국내산 보리 프레시 저온 숙성 맥아와 보리의 황금 비율 을 전달한다 새롭게 변신한 필라이트의 캐릭터 필리 가 상쾌한 맛과 품질력을 전한다 오성택 하이트진로 마케팅실 상무는 이번 광고를 통해 국내 발포주 브랜드 필라이트에 얼마나 공을 들여 만들었는지 소비자에게 전달할 것 이라며 올해도 가정시장에서 더욱 독보적인 브랜드로 자리잡기 위해 다양한 마케팅 활동을 펼칠 예정 이라고 말했다 하이트진로는 지난해 한정판으로 출시했던 필라이트 라들러를 올해 정식 출시하고 세대의 흥미를 끌기 위해 필리 캐릭터를 활용한 굿즈를 출시하는 등 색다른 시도를 할 계획이다 김범준
1,2021-05-27,"""말도 안되게~""…하이트진로, '필라이트 후레쉬' 여름 마케팅 가동",사진 제공 하이트진로 하이트진로 대표 김인규 는 발포주 필라이트 후레쉬 신규 광고를 시작으로 여름 마케팅을 본격 가동한다고 일 밝혔다 발포주는 기존 맥주제조공법에 맥아 등 원료 비중을 달리해 원가를 낮추면서도 품질은 동일하게 유지한 제품이다 필라이트는 국내 발포주 위다 출시 년 개월만에 누적판매 억캔을 돌파했다 필라이트는 이번 광고를 통해 패키지 리뉴얼과 품질력을 강조하고 가정시장 대표 브랜드로서의 입지를 더욱 강화한다는 전략이다 신규 광고는 말도 안되게 에 초점을 맞췄다 말도 안되게 공들여 만든 상쾌함 이라는 슬로건 아래 국내산 보리 프레쉬 저온 숙성 맥아와 보리의 황금 비율을 전달한다 필라이트 캐릭터 필리 가 밭에서 말도 안되게 까다로운 국내산 보리를 수확하고 말도 안되게 혹독한 얼음물에서 버티며 저온 숙성을 강조하고 물 위에서도 캔이 떨어지지 않을 정도로 말도 안되게 균형잡힌 맥아와 보리의 황금비율을 구현한다 오성택 하이트진로 마케팅실 상무는 하이트진로가 필라이트에 얼마나 많은 공을 들였는지 소비자에게 전달하고 높은 가성비에도 최고의 품질을 지키며 제대로 만든 제품이라는 것을 알리기 위해 이번 광고를 제작했다 고 말했다 최기성 매경닷컴 기자
2,2021-05-27,"하이트진로, 새로워진 필라이트 소비자 앞으로 더 가까이",하이트진로 대표 김인규 가 본격적인 여름 성수기를 맞아 필라이트 후레쉬 신규 광고를 지상파와 케이블 채널을 통해 공개한다 이번 광고는 패키지 리뉴얼과 품질력을 강조함으로써 가정시장 대표 브랜드의 입지를 강화하기 위한 것으로 말도 안 되게 공들여 만든 상쾌함이라는 슬로건 아래 필라이트 후레쉬의 가지 강점을 알린다 국내산 보리 저온 숙성 맥아와 보리의 황금 비율을 강조하고 새롭게 변신한 캐릭터 필리가 시원하면서도 상쾌한 맛을 전한다 필리가 밭에서 까다로운 국내산 보리를 수확하고 혹독한 얼음물에서 버티는 모습을 통해 저온 숙성을 강조하면서 물 위에서도 캔이 떨어지지 않는 장면으로 균형 잡힌 맥아와 보리의 비율을 알리며 필라이트가 만들어지기까지 노력을 보여준다 이렇게 만들어진 필라이트가 소비자에게 전달되고 마시는 순간 강력한 탄산이 화면 가득 펼쳐지며 상쾌한 맛을 극대화한 장면으로 마무리된다 하이트진로는 지난해 한정판으로 출시한 필라이트 라들러를 올해 정식 출시하고 세대의 흥미를 끌기 위해 캐릭터를 활용한 굿즈를 출시하는 등 다양한 시도를 할 계획이다 한편 필리는 출시 년 개월 만에 누적판매 억 캔 판매를 돌파하며 메가 브랜드로 성장했다
3,2021-05-27,"하이트진로, 필라이트 후레쉬 신규 광고 공개",파이낸셜뉴스 하이트진로가 본격적인 여름 성수기를 맞아 필라이트 후레쉬의 신규 광고를 공개한다고 일 밝혔다 국내 발포주 시장 위 브랜드 필라이트는 이번 광고를 통해 패키지 리뉴얼과 품질력을 강조하고 가정시장 대표 브랜드로서의 입지를 더욱 강화한다는 전략이다 새로운 광고는 말도 안되게 공들여 만든 상쾌함 이라는 슬로건 아래 필라이트 후레쉬의 가지 핵심 강점인 국내산 보리 저온 숙성 맥아와 보리의 황금 비율을 명쾌하게 전달한다 새롭게 변신한 필라이트의 캐릭터 필리 가 시원상쾌한 맛과 품질력을 전해 눈길을 끈다 광고 내용은 필라이트가 만들어지까지 필리의 노력을 보여준다 필리는 밭에서 말도 안되게 까다로운 국내산 보리를 수확하고 말도 안되게 혹독한 얼음물에서 버티며 저온 숙성을 강조하고 물 위에서도 캔이 떨어지지 않을 정도로 말도 안되게 균형잡힌 맥아와 보리의 황금비율을 구현한다 이렇게 만들어진 필라이트가 소비자에게 전달되고 마시는 순간 강력한 탄산이 화면 가득 펼쳐지며 상쾌한 맛을 극대화한 장면으로 마무리된다 하이트진로 마케팅실 오성택 상무는 이번 광고를 통해 국내 발포주 브랜드 필라이트에 얼마나 공을 들여 만들었는지 소비자에게 전달하고 높은 가성비에도 최고의 품질을 지키며 제대로 만든 제품이라는걸 알리고자 했다 며 올해도 가정시장에서 더욱 독보적인 브랜드로 자리잡기 위해 다양한 마케팅 활동을 펼칠 예정 이라고 전했다 조지민 기자
4,2021-05-27,"청년 꿈·자립 돕고 소방관 노고에 감사하고 ...하이트진로, 3대 사회...",하이트진로가 소방 청년 환경 등 대 부문에 걸쳐 적극적인 사회공헌 활동으로 이목을 끌고 있다 일 하이트진로에 따르면 청년자립 지원사업인 빵그레 사진 를 포함해 소방공무원 처우개선활동 환경활동 등을 대 사회공헌 사업으로 정하고 매년 지속적인 활동을 진행하고 있다 빵그레 는 지난해 하이트진로가 저소득 청년들의 자립을 돕고자 기획한 청년 자립 지원 프로젝트이다 경남 창원에서 처음 문을 연 빵그레 호점은 매출이 꾸준히 증가하며 안착하고 있다 지난 일에는 오픈 주년을 맞아 한달 매출의 를 창원지역자활센터에 기부하기로 했다 기부금은 청년들의 제과 제빵 자격증 취득 관련 비용으로 사용될 예정이다 오는 월에는 광주광역시에 빵그레 호점 을 오픈해 이 지역 저소득 청소년의 꿈 실현을 지원할 계획이다 하이트진로는 또 지난 년 소방공무원 가족 처우 개선과 국민안전의식 제고 를 위한 업무협약을 체결한 후 관련 활동도 진행하고 있다 지난 월에는 산불예방 지원을 위해 산불의 주요 원인인 화목보일러 사용 가구에 간이형 스프링클러 설치를 지원했다 이와 함께 소방 유가족을 지원하는 한편 소방의 날에는 소방서에 간식차를 보내기도 했다 하이트진로는 환경 활동 역시 적극적이다 해양수산부의 연안관리 정화사업 바다가꾸기 에 동참하고 있고 글로벌 재활용 컨설팅 전문기업 테라사이클 과 함께 캔 페트 등 용기의 체계적 재활용 및 분리배출 활성화를 위한 캠페인을 진행 중이다 또 테라 진로 등 주요 제품의 환경성적표지인증을 획득하기도 했다 김인규 하이트진로 대표는 년 뒤 맞게 되는 주년 이상의 지속가능한 성장을 위해 다양한 사회공헌활동에 앞장서 왔다 고 말했다 신소연 기자
