time,title,context
2021-05-06,‘주먹밥 돌풍’ 제일제당 가정간편식 라인업 확대,제일제당 냉동 주먹밥 라인업 확대 가정간편식 의 인기 주먹밥 판매가 출시 개월 만 만봉 등 인기 때문 일 제일제당 치즈닭갈비 주먹밥 전주비빔 주먹밥 등 주먹밥 신제품 종이 이날 출시 전주비빔 주먹밥 은 소고 콩나물 표고버섯 등 각종 채소 매콤한 고추장 양념 제품 치즈닭갈비 주먹밥 은 매콤한 닭갈비 모짜렐라 치즈 속 노릇노릇하 이번 신제품 출시 주먹밥 종이 냉동밥 라인업 볶음밥 한끼식사용 애용 삼각형 모양 주먹밥 식 식사 선호도 실제 주먹밥 년 월 출시 후 올해 월 개월 누적 판매액 약 억원 누적 판매량 약 만봉 기록 초등자녀 가구 중심 인기 올해 월 매출 전년 동기 대비 배 가량 증가 신소연 기자
2021-05-06,제일제당 치즈닭갈비·전주비빔 주먹밥 출시,머니투데이 박미주 기 주먹밥 년 냉동밥 전체 매출 차 제품군 지속 확대 제일제당 제일제당 주먹밥 제품군 확장 냉동밥 시장 제일제당 치즈닭갈비 주먹밥 전주비빔 주먹밥 을 출시 일 전주비빔 주먹밥 소고 콩나물 표고버섯 등 각종 채소 고추장 양념 제품 치즈닭갈비 주먹밥 닭갈비 모짜렐라 치즈 속 이번 신제품 출시 주먹밥 종 주먹밥 식 식사 선호도 년 월 출시 후 지난달 개월 누적 판매액 약 억원 누적 판매량 약 만봉 기록 올해 월 매출 전년 동기 대비 증가 성장세 지속 냉동밥 전체 매출 주먹밥 비중 출시 초반 매출 비중 올해 로 기존 스테디셀러 볶음밥 매출 비슷 수준 주먹밥 냉동밥 시장 전체 성장 견인 냉동밥 시장 닐슨 코리아 기준 년 억원 년 억원 년 억원 규모 주춤 지난해 집밥족 증가 주먹밥 성장 억원 규모 제일제당 관계자 취식빈도 메뉴 중심 포트폴리오 확대 소비자 선택권 다양화 시장 것 이 말 박미주 기자
2021-05-06,"간편식 시장 커지자…CJ제일제당, 주먹밥 라인업 확대",전주비빔 치즈닭갈비 출시 종 식사 개월 만봉 판매 제일제당 일 출시 신제품 전주비빔 주먹밥 제일제당 제공 헤럴드경제 신소연 기 제일제당 냉동 주먹밥 라인업 확대 가정간편식 의 인기 주먹밥 판매가 출시 개월 만 만봉 등 인기 때문 일 제일제당 치즈닭갈비 주먹밥 전주비빔 주먹밥 등 주먹밥 신제품 종이 이날 출시 전주비빔 주먹밥 은 소고 콩나물 표고버섯 등 각종 채소 매콤한 고추장 양념 제품 치즈닭갈비 주먹밥 은 매콤한 닭갈비 모짜렐라 치즈 속 노릇노릇하 이번 신제품 출시 주먹밥 기존 김치치즈 주먹밥 불고기 주먹밥 버터장조 주먹밥 종이 냉동밥 라인업 볶음밥 한끼식사용 애용 삼각형 모양 주먹밥 식 식사 선호도 실제 주먹밥 년 월 출시 후 올해 월 개월 누적 판매액 약 억원 누적 판매량 약 만봉 기록 초등자녀 가구 중심 인기 올해 월 매출 전년 동기 대비 배 가량 증가 냉동밥 전체 매출 주먹밥 비중 로 스테디셀러 볶음밥 비슷 주먹밥 제품 전 전체 냉동밥 시장 성장 추세 닐슨 코리아 국내 냉동밥 시장 년 억원 년 억원 년 억원 규모 주춤 지난해 집밥족 증가 주먹밥 성장 억원 규모 제일제당 관계자 주먹밥 차별화 기술력 전문 셰프 레시피 토대 맛 품질 확보 제품 이 취식빈도 메뉴 중심 포트폴리오 확대 시장 것 이 말
2021-05-06,제일제당 ‘비비 주먹밥’ 라인업 확대,치즈닭갈비 전주비빔 종 추 출시 주먹밥 라 냉동밥 매출 비중 증 이데일리 김무연 기 제일제당 주먹밥 라인업 확장 냉동밥 시장 제일제당 치즈닭갈비 주먹밥 전주비빔 주먹밥 등 주먹밥 신제품 종 출시 일 주먹밥 신제품 종 제일제당 전주비빔 주먹밥 은 소고 콩나물 표고버섯 등 각종 채소 고추장 양념 제품 치즈닭갈비 주먹밥 은 매콤한 닭갈비 모짜렐라 치즈 속 이번 신제품 출시 주먹밥 기존 김치치즈 주먹밥 불고기 주먹밥 버터장조 주먹밥 종 냉동밥 라인업 볶음밥 한끼식사용 애용 삼각형 모양 주먹밥 식 식사 선호도 실제 주먹밥 년 월 출시 후 월 개월 누적 판매액 약 억원 누적 판매량 약 만봉 기록 초등자녀 가구 중심 인기 올해 월 매출 전년 동기 대비 증가 냉동밥 전체 매출 주먹밥 비중 출시 초반 매출 비중 올해 로 기존 스테디셀러 볶음밥 매출 비슷 수준 주먹밥 냉동밥 시장 전체 성장 견인 냉동밥 시장 닐슨 코리아 기준 년 억원 년 억원 년 억원 규모 주춤 지난해 집밥족 증가 주먹밥 성장 억원 규모 제일제당 관계자 주먹밥 차별화 기술력 전문 셰프 레시피 토대 맛 품질 확보 제품 이 취식빈도 메뉴 중심 포트폴리오 확대 소비자 선택권 다양화 시장 것 이 말 김무연
2021-05-06,제일제당 주먹밥 라인업 확대,파이낸셜뉴스 제일제당 치즈닭갈비 주먹밥 전주비빔 주먹밥 등 주먹밥 신제품 종 출시 일 전주비빔 주먹밥 소고 콩나물 표고버섯 등 각종 채소 고추장 양념 제품 치즈닭갈비 주먹밥 매콤한 닭갈비 모짜렐라 치즈 속 노릇노릇하 이번 신제품 출시 주먹밥 기존 김치치즈 주먹밥 불고기 주먹밥 버터장조 주먹밥 종 냉동밥 라인업 볶음밥 한끼식사용 애용 삼각형 모양 주먹밥 식 식사 선호도 실제 주먹밥 년 월 출시 후 올해 월 개월 누적 판매액 약 억원 누적 판매량 약 만봉 기록 초등자녀 가구 중심 인기 올해 월 매출 전년 동기 대비 증가 성장세 지속 냉동밥 전체 매출 주먹밥 비중 출시 초반 매출 비중 올해 로 기존 스테디셀러 볶음밥 매출 비슷 수준 주먹밥 냉동밥 시장 전체 성장 견인 냉동밥 시장 닐슨 코리아 기준 년 억원 년 억원 년 억원 규모 주춤 지난해 집밥족 증가 주먹밥 성장 억원 규모 제일제당 관계자 주먹밥 차별화 기술력 전문 셰프 레시피 토대 맛 품질 확보 제품 이 취식빈도 메뉴 중심 포트폴리오 확대 소비자 선택권 다양화 시장 것 이 말 이정 기자
2021-05-06,"식품 주문·보관 레시피까지 추천…CJ제일제당, 가전협업 실험",제일제당 주방가전 연계 서비스 협력 박차 삼성전자 간편식 스캔쿡 전자 레시픽 등 식재료별 최적 보관 레시피 추천 접목 먹거리 디바이스 연결 맛 품질 만족 이데일리 김범준 기 워킹맘 최민주 주방 가전 김치냉장고 인공지능 맞춤보관 기능 제품 인식 적합한 보관 온도 시간 자동 설정 김치 되면서다 최씨 보관 중 식재료 사용 데이터 조합 레시피 요리법 를 제공 냉장고 가정간편식 쇼핑 최적 조리 오븐 구매 올초 미국 전자 스마트 냉장고 비전팩 레시픽 기술 냉장고 안 식재료 스마트폰 확인 레시피 식품 인공지능 으 추천 수 제일제당 올리브네트웍스 협업 전자 제일제당 제공 일 업계 제일제당 주방 가전 조사들 협업 식품 서비스 박차 제품 구매 보관 조리 개인화 최적화 서비스 소비자들 편의 최고 맛 품질 제공 제일제당 삼성전자 비스포크 직화오븐 간편식 스캔쿡 기능 탑재 사용자 간편식 제품 바코드 스마트폰 스마트싱스 애플리케이션 앱 으 스캔하 식품 최적화 레시피 온도 시간 등 세팅 값 조리기 자동 전송 오븐 전자레인지 조리 수 알고리즘 최적화 제일제당 식품몰 연계해 온라인 간편 쇼핑 수 요리 조리법 나 레시피 저장 수 음식 취향 등 개인별 데이터 기반해 맞춤형 레시피 식단 추천 제일제당 올리브네트웍스 전자 협업 개인화 식품 레시피 추천 기술 레시픽 도 전자 초 미국 스마트 냉장고 소비자 연결 상호작용 생활 맞춤형 콘텐츠 제공 기술 검증 소개 영상 사용자 냉장고 연결 스마트폰 냉장고 속 제일제당 고추소스 채소 등 식재료 확인 선호 메뉴 취향 반영해 만두 요리 레시피 추천 전자 스마트 냉장고 연결 사용자 스마트폰 레시픽 서비스 제일제당 만두 요리 레시피 제공 모습 전자 제일제당 제공 이번 레시픽 기술 올리브네트웍스 융합연구소 전자 인공지능연구소 협업 개발 제일제당 각종 요리 레시피 식재료 사회관계망서비스 식품 리뷰 등 방대 학습 데이터 기반 로 이미지 영상 인식하 전자 비전팩 기술 스마트 냉장고 안 식재료 스마트폰 확인 수 자신 생활 양식 레시피 뿐 식품 추천 수 제일제당 전자 협력 지난해 디오스 김치톡톡 냉장고 인공지능 맞춤보관 기능 처음 적용 스마트 홈 씽큐 앱 포장김치 바코드 촬영 김치냉장고 제품 인식 적합한 온도 시간 설정 앱 내 스토어 제품 주문 수 제품 출시 지난해 월 달 동안 전년 동기 대비 약 등 소비자들 호응 제일제당 앞 다양한 주방 가전 협업 냉장 냉동제품 최적 상태 보관 조리 기술 서비스 확대 계획 이 식품 구매 식탁 최적 맛 품질 유 고객 경험 감동 선사 방침 제일제당 관계자 집밥 수요 증가 식문화 변화 주방 가전제품 진화 식품기업 조사 협업 사례 며 먹거리 디바이스 연결 디지털 접목 등 다양한 시도 최고 맛 품질 편리 제공 것 이 말 김범준
