,날짜,기사제목,본문내용
0,2021-02-22,'주포자'의 눈물…“동학개미 될 걸” 삼성전자만 68% 수익[株포트라이...,지난해 저점 개인순매수 상위 개 중 개 상승 현대차 삼성 등도 고수익 상위 위 중 인버스 원유 선물 만 하락 헤럴드경제 김현경 기자 지난해 남들 다 할 때라도 주식을 시작할 걸 그랬다 이른바 주포자 주식투자를 포기한 사람 들의 한탄이 깊어지고 있다 직장인 송모 씨는 지난해 월 시작된 개인 투자자들의 주식 투자 열풍 이른바 동학개미운동 에 동참하지 않은 것을 후회하고 있다 직장 친구 등 주변에서 주식으로 돈을 번 사람들의 얘기를 들을 때면 유행에 뒤처진 것 같은 느낌마저 든다고 한다 지금은 증시가 너무 많이 오른 것 같아 선뜻 나서지도 못한다 실제로 동학개미들은 이례적으로 큰 수익을 올렸다 지난해 월 순매수한 대부분 종목에서 큰 폭의 이익을 실현했다 일 한국거래소에 따르면 지난해 월 개인 투자자들의 순매수 상위 개 종목 중 개 종목이 현재까지 평균매입가 대비 플러스 수익률을 기록했다 동학삼전운동 이라는 말을 낳을 정도로 개인이 가장 많이 산 삼성전자는 당시 평균매입가가 만 원이었으나 이날 시초가는 만 원으로 주당 만 원의 수익을 낳았다 주가수익률은 에 달한다 개인이 두 번째로 많이 산 레버리지는 증시가 상승하면서 평균매입가 원에서 현재가 만 원으로 만 원 올랐다 순매수 상위 종목에 이름을 올린 현대차 삼성전자우 하이닉스 화학 등도 높은 수익률을 기록했다 삼성 와 이노베이션 은 두 배가 넘는 수익을 안겼다 순매수 상위 위권 종목 중 가장 높은 수익률을 기록한 것은 한화솔루션으로 상승했다 코스닥 레버리지 전자 카카오 등도 이상 수익을 냈다 이에 반해 지난해 월 개인 순매수 상위 개 종목 중 평단가 대비 주가가 떨어진 종목은 인버스 상장지수펀드 와 원유 선물 상장지수증권 밖에 없다 선물인버스 는 평단가가 원이었으나 현재 원으로 원 하락했고 인버스 코스닥 선물인버스 도 마이너스 수익률을 나타냈다 삼성 레버리지 원유 선물 과 신한 레버리지 원유 선물 은 각각 의 손실을 기록했다
1,2021-02-22,"야나두, 상장 주관사로 한투·삼성證 선정…""내년 상장 목표""",김정수 대표 조 기업가치로 내년 상장할 것 야나두 사업구조 사진 야나두 이데일리 김호준 기자 카카오 에듀테크 계열사 야나두는 한국투자증권과 삼성증권을 상장 주관사로 선정하고 본격적인 기업공개 절차에 돌입한다고 일 밝혔다 지난해 초 카카오키즈와 야나두의 기업결합을 통해 탄생한 통합 법인 야나두 는 억원 규모의 투자유치에 성공하는 등 꾸준하게 성장하고 있다 야나두는 이번 기업공개를 통해 종합 교육기업에서 더 나아가 어학공부 취미 운동까지 모든 일상의 성취를 돕는 전 국민 성공 플랫폼 으로 회사를 성장시키겠다는 계획이다 김정수 야나두 공동대표는 올해는 지난해 선보인 홈트레이닝 중심의 헬스케어 서비스 야나두 피트니스 를 통한 사업확대에 집중할 계획 이라며 이를 통해 코로나 이후 급성장하고 있는 대표 언택트 산업인 이러닝과 홈트레이닝 두 분야를 아우르는 기업으로 성장해 조원의 기업가치로 내년 상장하는 것이 목표 라고 말했다 김호준
2,2021-02-22,"에스에프에이, 삼성디스플레이 설비투자 본격화로 수혜 -하이",이데일리 김소연 기자 하이투자증권은 일 에스에프에이 에 대해 주력 고객사인 삼성디스플레이의 디스플레이 설비 투자가 본격화할 경우 수혜가 클 것으로 전망했다 하반기 주가 상승을 대비해 저점에서 비중확대 전략이 필요한 시점이라고 분석했다 이에 투자의견 매수 유지 목표주가 기존 만 원에서 만 원으로 상향 조정했다 정원석 하이투자증권 연구원은 이날 보고서에서 최근 언론에 따르면 삼성전자 는 삼성디스플레이와 함께 년에 를 출시할 것으로 알려졌다 삼성전자가 새로운 전략으로 출시를 본격화한다면 년부터 삼성디스플레이 신규설비투자의 빅사이클이 도래할 것 이라고 전망했다 이어 삼성디스플레이의 설비투자 규모가 년에 큰 폭의 증가세를 나타낼 것으로 기대한다 며 삼성디스플레이의 세대 디스플레이 신규 설비투자 확대가 예상되고 스마트폰용 패널 침투율 상승과 폴더블 스마트폰 시장 확대 태블릿 노트북 채택 증가 등으로 중소형 패널 수요가 점진적인 성장세를 보일 것이다 올해 분기에 월 규모의 세대 플렉서블 투자가 재개될 것 이라고 예상했다 정 연구원은 이에 따라 삼성디스플레이의 연간 규모도 년 약 조원에서 년 약 조원으로 큰 폭의 증가세가 예상된다 며 애플이 아이폰 에 플렉서블 를 도입하기로 결정하면서 공격적인 투자가 이루어진 지난 년 이후 가장 높은 수준일 것 으로 내다봤다 주력 고객사인 삼성디스플레이의 디스플레이 설비 투자가 본격화할 경우 물류 자동화설비를 공급하는 에스에프에이의 수혜가 클 것으로 정 연구원은 전망했다 에스에프에이는 전방 산업 제품군을 기존 주력이었던 디스플레이 부문 외에도 신규 장비를 바탕으로 스마트 팩토리 이차전지 반도체 분야로도 다각화하고 있다 정 연구원은 에스에프에이는 전방 산업의 투자가 활발한 이차전지 부문의 경우 주력 고객사인 이노베이션 의 헝가리 미국 등 해외 신규 공장 건설이 확대하면서 신규 수주가 이어질 것 이라며 올해 중국 디스플레이 업체들의 플렉서블 설비 투자가 전년 대비 감소할 것으로 예상되나 지난해 연말 수주잔고 약 억원 과 다양한 사업포트폴리오를 바탕으로 올해 약 조원으로 추정되는 신규 수주 확보로 안정적 실적을 이어갈 것 으로 덧붙였다 에스에프에이의 올해 연결기준 매출액과 영업이익은 각각 조 억원 억원을 기록할 것으로 추정했다 정 연구원은 지난해 국내 디스플레이 장비 업체들의 주가는 국내 업종 내 가장 부진했다 에스에프에이의 년 초 대비 연간 주가상승률은 풍부한 유동성에 의한 전세계 증시의 상승 랠리에도 불구하고 하락했다 며 조금 이르다고 느낄 수 있지만 하반기 주가상승세를 대비한 저점에서의 비중 확대 전략이 필요하다 고 강조했다 김소연
3,2021-02-22,"LGD, 삼성전자 OLED TV 진입시 주가 재평가…목표가↑-하이",하이투자 올해 매출 중 가 차지하는 비중이 넘어설 것 이데일리 이슬기 기자 삼성전자 의 시장 진입 기대감이 높아지면서 디스플레이 의 주가 재평가가 이뤄질 수 있을 것이라는 분석이 제기됐다 정원석 하이투자증권 연구원은 일 보고서에서 올해 전체 매출 중 가 차지하는 비중이 약 로 를 넘어설 것으로 예상된다 며 삼성전자의 시장진입이 가시화될 경우 디스플레이 주가의 멀티플 재평가에 긍정적 영향이 미칠 것 이라고 내다봤다 목표주가는 기존 대비 올린 만 원으로 새로 제시했다 최근 보도에 따르면 내년 초 삼성전자가 시장에 진입하는 것으로 알려졌다 전세계에서 유일하게 패널을 양산 중인 디스플레이에게 삼성전자의 시장 진입 가능성은 중국 업체들에 맞서 대형 진영의 경쟁력을 키울 수 있다는 점에서 의미가 크다는 게 정 연구원의 판단이다 정 연구원은 전세계 점유율 위 업체인 삼성전자의 시장진입으로 에코시스템이 확장될 경우 패널 생산 원가 절감에 따른 수익성 개선에 긍정적인 영향을 미칠 것으로 전망된다 며 주요 세트업체들이 패널을 공급받을 수 있는 곳은 디스플레이가 유일하며 대형 패널 사업의 전략 방향을 에서 로 변화시키기 위해 오랜 기간 노력해 온 동사의 패널사업에 대한 가치가 재조명될 것으로 판단된다 고 전망했다 계절적 비수기인 분기에도 견조한 실적이 예상된다 코로나 사태의 장기화로 패널 출하가 견조할 것으로 예상되는 까닭이다 부품 공급 차질 영향으로 시장 내 패널 세트 재고 수준도 낮다 정 연구원은 특히 지난해 하반기부터 가파르게 상승한 패널가격으로 주요 세트업체들의 수익성이 악화되면서 프리미엄 제품인 패널물량 확대에 긍정적으로 작용하고 있다 며 아이폰 신제품 출시 지연효과와 판매 호조세로 패널 재고조정은 크지 않을 것 이라고도 추정했다 따라서 디스플레이 투자는 매력이 있다는 평가다 정 연구원은 예상보다 더 좋은 업황 사이클이 이어지고 있으며 재무구조도 점차 개선세를 보이고 있다 며 패널 가격은 하반기에 접어들면서 수익성 악화를 버티지 못한 세트업체들의 제품 가격 인상 조치로 수요 부진에 따른 점진적인 하락세가 나타날 가능성이 크지만 올해 전체 매출 중 가 차지하는 비중이 로 를 넘어설 것으로 예상되는 가운데 삼성전자의 시장 진입이 가시화될 경우 디스플레이의 멀티플 재평가에 긍정적 영향을 미칠 것 이라고 분석했다 이슬기
4,2021-02-22,"車반도체 대란에도 삼성 구원등판 거리두기, 왜",머니투데이 오문영 기자 편집자주 공급 부족에 미국 텍사스 한파 등 돌발 변수까지 등장하면서 차량용 반도체난이 쉽사리 해소되지 않고 있다 자동차 생산 차질이 확산될 경우 완성차 업체는 물론 자동차 생산을 떠받치고 있는 전후방 업체들까지 영향권에 들게 된다 자동차 반도체 공급 부족이 발생한 배경과 현황 자동차 및 반도체 기업들의 대응 전략 등을 점검하고 우리 경제에 미칠 영향을 진단한다 리포트 반도체 대란의 이면 차량용 반도체 품귀 현상이 장기화될 것으로 예상되면서 세계 주요국 정부들이 공급난 해소를 위해 팔을 걷고 나섰다 글로벌 파운드리 위탁생산 최강자인 대만 가 해외 생산기지 확장 등 적극적인 모습을 보이는 가운데 위 파운드리 기업인 삼성전자의 움직임에도 재계의 관심이 쏠린다 삼성전자는 세계 각 국과 기업에서 쏟아지는 러브콜에도 아직 어떤 움직임도 보이지 않고 있다 업계에서는 수익성과 기회비용을 감안했을 때 삼성이 단독으로 투자를 진행하기보다는 인수합병 이나 협력체계 구축을 통해 기회를 만들 것이라 본다 일 관련 업계에 따르면 차랑용 반도체는 인공지능 나 스마트폰용 반도체에 비해 제조 품질관리가 훨씬 까다로운 반면 수익률은 적어 사업성이 떨어진다 전체 반도체 시장의 정도로 그 규모도 작다 운영 중인 생산라인의 품목을 바꾸기도 어렵다 제품 양산까지 걸리는 기간을 포함한 비용 손실이 적지 않다는 이유에서다 최근 품귀 현상이 빚어진 차량용 반도체를 자율주행차 같은 미래차에 대한 투자와 연결짓기도 어렵다 와 를 바탕으로 운행되는 자율주행차에는 일반 자동차와 비교할 수 없을 정도의 정보 처리 능력이 요구된다 요즘 차량에 탑재되는 반도체와는 성능에서 차이가 크다 한 업계 관계자는 상대적으로 우위를 점하고 있는 삼성이 더 열악한 시장에 선제적으로 뛰어들 이유는 없다 며 상대 기업이나 국가에서 자금 지원이나 세금 혜택 등 동기 유인을 충분히 제공해야 할 것 이라고 말했다 시장에서 삼성전자가 단독으로 차량용 반도체 시장에 뛰어들기보다는 나 협력체계를 구축할 가능성이 제기되는 것도 이 대목에서다 삼성전자는 지난달 실적 콘퍼런스콜 전화회의 에서 년까지 전략적 를 진행하겠다 고 선언했다 삼성전자의 현금 보유액은 지난해 말 기준 조원으로 국내외 시설 투자금을 제외해도 에 투입할 여력이 충분하다 후보로 언급되는 업체는 글로벌 자동차 반도체 시장의 주요 플레이어인 네덜란드 독일 인피니언 미국 텍사스인스트루먼트 스위스 마이크로일렉트로닉스 등이다 는 그동안 대상으로 여러차례 언급됐다 년 퀄컴이 억달러 조 억원 상당 에 인수하려다 무산됐을 당시 가 삼성전자에도 협상 의사를 타진했던 것으로 알려진다 는 포드 도요타 등 주요 완성차 제조사들을 고객사로 보유하고 있다 다만 이재용 삼성전자 부회장의 부재로 당장 빅딜 결단이 나오기는 쉽지 않다는 관측도 나온다 에 년 이라는 데드라인을 제시한 것도 이 부회장의 수감 기간을 염두에 둔 것이 아니냐는 해석이다 오문영 기자
