time,title,context
2021-03-22,카카오커머스 신입 개발자 스톡옵션 1억 지급,월 일 공개채용 진행 카카오커머스 년 신입 경력 개발자 영입 공개채용 공채 을 진행 일 이번 공채 입사 합격자 억원 상당 스톡옵션 주식매수선택권 지급 경력 개발자 추 보너스 원 카카오커머스 진행 개발자 직군 카카오메이커스 관련 프론트엔드 개발 백엔드 개발 카카오톡선물하 쇼핑 카카오쇼핑라이브 등 백엔드 개발 정산플랫폼 서버 개발 대용량처리 신뢰성공학 엔지니어 데이터 분석 엔지니어 머신러닝 엔지니어 등 개 부문 공채 지원 월 일 시 카카오커머스 공개채용 페이지 가능 김미희 기자
2021-03-22,카카오커머스 개발자 입사 스톡옵션 1억,월 일 월 일 시 공채 서류접수 진행 입사시 억원 상당 스톡옵션 보너스 만원 지급 파이낸셜뉴스 카카오커머스 년 신입 경력 개발자 영입 공개채용 공채 을 진행 일 이번 공채 입사 합격자 억원 상당 스톡옵션 주식매수선택권 지급 경력 개발자 추 보너스 원 카카오커머스 진행 개발자 직군 카카오메이커스 관련 프론트엔드 개발 백엔드 개발 카카오톡선물하 쇼핑 카카오쇼핑라이브 등 백엔드 개발 정산플랫폼 서버 개발 대용량처리 신뢰성공학 엔지니어 데이터 분석 엔지니어 머신러닝 엔지니어 등 개 부문 카카오커머스 개발자 공개채용 포스터 카카오커머스 제공 공채 지원 월 일 시 카카오커머스 공개채용 페이지 가능 영입 부문 코딩 과제 테스트 진행 수 면접과정 최종 합격자 선발 카카오톡선물하 카카오메이커스 김미희 기자
2021-03-22,"카카오커머스, 개발자 공채···“1억원 상당 스톡옵션 쏜다”",다음 달 일 일 지원 서울경제 카카오 커머스 신입 경력 개발자 공개 채용 일 이번 공채 입사 합격자 억 원 상당 주식매수선택권 스톡옵션 을 지급 경력 개발자 경우 추가 사이닝 보너스 원 모집 개발 직군 카카오메이커스 프론트엔드 개발 백엔드 개발 선물하기 쇼핑 카카오쇼핑라이브 등 카카오커머스 서비스 백엔드 개발 정산플랫폼 서버 개발 대용량처리 엔지니어 데이터 분석 엔지니어 머신러닝 엔지니어 등 개 부문 카카오메이커스에서 신입 개발자 외 서비스 경력직 개발자 공채 지원 이날 다음 달 일 시 카카오커머스 공개채용 페이지 수 포지션 코딩 과제 테스트 진행 수 면접 과정 최종 합격자 선발 카카오커머스 관계자 명 회원 사용 서비스 성장세 카카오커머스 대용량 트래픽 경험 서비스 개발 개발자분 지원 부탁 말 한편 카카오커머스 입사 시 년 개월 식 휴가 휴가비 지급 등 다양한 복지 혜택 제공 포괄임금제 폐 조직장 승 크루 임직원 들 업무 스케줄 조정 수 완전 선택적 근 시간제 를 도입 바 백주원 기자
2021-03-22,"카카오·네이버, 뭐 가상자산 랠리",클레이 배 링크 네이버 카카오 등 국내 대표 기업들 가상자산 가치 연고점 돌파 시장 관심 집중 지난해말 만원 비트코 이달 만원 전체 가상자산 시장 가격 견인 가운데 국내 대표 기업들 블록체 사업 기대감 모양새 일 가상자산 시황분석 사이트 코인마켓캡 카카오 클레이 네이버 라인 링크 한해 배 가격 지난해 초 가격 집계 시작 이래 년여 가격 변화 클레이 링크 이달 최고가 상승 랠리 코인마켓캡 기준 클레이 일 사상 최고가 원 기록 전년 동기 대비 가량 가격 지난달 원 클레이 한달 이상 가격 연초 비교 약 배 가치 일 기준 원대 거래 고가 경신한 라인 링크 클레이 비슷 가격 변화 추이 링크 지난해 월 원대 올해 월 원 약 배 가량 일 만원 올해 가격 폭등 것 양사 가격 단번 만 주요 마일스톤 도달 것 블록체 비즈니스 한 확장 서비스 대중화 기대감 비트코 불장 코인 최고 경신 일조한 것 풀이 비트코인 주말 국내 거래 만원 돌파 사상 최고치 갈아치운바 전세계적 주목 대체불가능한토큰 분야 클레이 상승 한몫했다 평 카카오 블록체 자회사 그라운드 블록체 클레이튼 기반 다양 자산 주력 일례 그동안 미술품 게임 아이템 비상장주식 투자확인 명품교환권 등 클레이튼 로 발행 엔터테인먼트 플랫폼 메이크스타 협업 아이돌 포토카드 도 현재 내부개발 중 라 자체 블록체 플랫폼 라 블록체인 일본 시장 공략 박차 다양 개발사들 협업 라 블록체인 각종 블록체 애플리케이션 앱 을 출시 일본 사용자 대상 이 것 김소라 기자
2021-03-22,"강자 네이버-카카오, 코인 잘나가네…올해 10배",클레이 링크 이달 최고 경신 비트코 불장 수혜 블록체 서비스 확대 기대감 파이낸셜뉴스 네이버 카카오 등 국내 대표 기업들 가상자산 가치 연고점 돌파 시장 관심 집중 지난해말 만원 비트코 이달 만원 전체 가상자산 시장 가격 견인 가운데 국내 대표 기업들 블록체 사업 기대감 모양새 클레이 링크 올해 급등 카카오 클레이 네이버 라인 링크 한해 배 가격 상승 가상자산 시장 관심 집중 뉴시스 일 가상자산 시황분석 사이트 코인마켓캡 카카오 클레이 네이버 라인 링크 한해 배 가격 지난해 초 가격 집계 시작 이래 년여 가격 변화 클레이 링크 이달 최고가 상승 랠리 코인마켓캡 기준 클레이 일 사상 최고가 원 기록 전년 동기 대비 가량 가격 지난달 원 클레이 한달 이상 가격 연초 비교 약 배 가치 일 기준 원대 거래 고가 경신한 라인 링크 클레이 비슷 가격 변화 추이 링크 지난해 월 원대 올해 월 원 약 배 가량 일 만원 올해 가격 폭등 것 양사 가격 단번 만 주요 마일스톤 도달 것 블록체 비즈니스 한 확장 서비스 대중화 기대감 비트코 불장 코인 최고 경신 일조한 것 풀이 비트코인 주말 국내 거래 만원 돌파 사상 최고치 갈아치운바 블록체 대중화 서비스 발굴 박차 올해 라 링크 가격 변화 추 코인마켓캡 전세계적 주목 대체불가능한토큰 분야 클레이 상승 한몫했다 평 카카오 블록체 자회사 그라운드 블록체 클레이튼 기반 다양 자산 주력 일례 그동안 미술품 게임 아이템 비상장주식 투자확인 명품교환권 등 클레이튼 로 발행 엔터테인먼트 플랫폼 메이크스타 협업 아이돌 포토카드 도 현재 내부개발 중 이 한류팬 자신 아티스트 블록체 를 소통채널 것 라 자체 블록체 플랫폼 라 블록체인 일본 시장 공략 박차 다양 개발사들 협업 라 블록체인 각종 블록체 애플리케이션 앱 을 출시 일본 사용자 대상 이 것 이달 출시 라 블록체 기반 비디오 스트리밍 플랫폼 쎄타티비 자체 서비스 리워드 라인 자체 가상자산 거래소 비트맥스 링크 전환 수 등 링크 토큰 생태계 연계 방안 구축 양사 기 개발한 블록체 플랫폼 개발 도구 바탕 올해 블록체 서비스 확대 주력 방침 그라운드 측은 자체 가상자산 지갑 클립 서비스형블록체 카스 등 블록체 서비스 활성화 사용자 확보 집중 말 라 측은 라 블록체 개발 도구 라 디벨로퍼스 일본 현지 규제 준수 다양 블록체 앱 서비스 개발 중 말 라 카카오 네이버 링크 클레이 김소라 기자
2021-03-22,"큐리오스튜디오, 카카오벤처스·포스텍홀딩스서 초기투자 유치",머니투데이 이민 기 믹서 로고 차원 콘텐츠 플랫폼 믹서 를 운영 큐리오스튜디오 카카오벤처스 포스텍홀딩스로부터 억원 규모 초기단계 시드 투자 유치 일 믹서 공간 컴퓨팅 기술 기반 차원 증강 가상현실 콘텐츠 플랫폼 공간 컴퓨팅 기술 활용 가상 세계 물체 실제 구현 수 지난해 홍콩투자청 디캠프 공동 주최 창업경진대회 우승 정주영 창업경진대회 본상 수상 지난해 월 네이버웹툰 코핀커뮤니케이션즈 등 국내 콘텐츠 기업 파트너십 유미 세포들 모죠 대학일기 아라찌 친구들 등 캐릭터 콘텐츠 제작 앞 콘텐츠 제작 서비스 고도화 집중 계획 연내 사용자들 수집 가상 콘텐츠 활용 자신만 가상 공간 공유 수 서비스 예정 손범준 큐리오스튜디오 대표 나 콘텐츠 공유 수 플랫폼 자리매김 말 이민 기자
2021-03-22,"카카오벤처스, 검색 플랫폼 ‘키노라이츠’ 초 투자",머니투데이 이민 기 카카오벤처스 신한캐피탈 온라인동영상서비스 검색 플랫폼 운영 키노라이츠 억원 규모 초 단계 시드 투자 집행 일 키노라이츠 영화 드라마 애니메이션 프로그램 등 검색 감상 수 플랫폼 서비스 국내 시장 지속적 확대 추세 넷플릭스 웨이브 왓챠 티빙 아마존프라임 포함 디즈니플러스 맥스 등 국내 진출 계획하 것 키노라이츠에서 서비스별 작품 정보 확인 수 신작 업데이트 목록 독점작 라이선스 만료 종료 예정작 등 정보 수 구독 중 플랫폼 작품 평점순 장르별 국가별 연대별 터 분류 수 키노라이츠 지난해 월 정식 서비스 이후 년 만 앱 애플리케이션 누적 다운로드 수 건 달 동안 서비스 이용자 수 명 기록 장승룡 카카오벤처스 수석 글로벌 콘텐츠 밸류체인 플랫폼 중심 재편 콘텐츠 선택 문제 지금 수 밖 며 플랫폼 경쟁 치열 콘텐츠 메타 서비스 키노라이츠 수요 것 이 투 이유 설명 이번 투 유치 발판 키노라이츠 쿠팡플레 디즈니플러스 등 신규 플랫폼 관련 서비스 고도 계획 양준영 키노라이츠 대표 콘텐츠 때 키노라이츠 하나 기준 수 노력 말 이민 기자
2021-03-22,"카카오커머스, 개발자 입사시 1억원 스톡옵션…인재영입전",입사 시 억 원 상당 스톡옵션 헤럴드경제 오연주 기 카카오커머스 년 신입 경력 개발자 영입 공개채용 진행 일 개발자 경쟁 커머스 업계 가세 분위기 이번 영입 개발자 직군 카카오메이커스 프론트엔드 개발 백엔드 개발 선물하기 쇼핑 카카오쇼핑라이브 등 카카오커머스 서비스 백엔드 개발 정산플랫폼 서버 개발 대용량처리 엔지니어 데이터 분석 엔지니어 머신러닝 엔지니어 등 개 부문 카카오메이커스 경우 신입 개발자 외 서비스 영입 포지션 경력직 개발자 영입 계획 공채 지원 이날 월 일 시 카카오커머스 공개채용 페이지 지원 가능 포지션 코딩 과제 테스트 진행 수 면접 과정 최종 합격자 선발 이번 공채 입사 합격자 억 원 상당 스톡옵션 지급 경력 개발자 경우 추가 사이닝 보너스 원 지급 카카오커머스 입사 시 년 개월 식 휴가 휴가비 지급 등 다양한 복지 혜택 제공 포괄임금제 폐 조직장 승 크루 임직원 들 업무 스케줄 조정 수 완전 선택적 근 시간제 를 도입 카카오커머스 관계자 회원 사용 서비스 성장세 카카오커머스 대용량 트래픽 경험 서비스 개발 개발자분 지원 말
2021-03-22,"삼성전자 부럽다…네이버·카카오, 평균 연봉 1억 돌파",카카오 평균 연봉 억 만원 네이버 억 만원 인재 확보 경쟁 업계 연봉 연쇄 상승 임직원들 경기 성남시 분당 네이버 본사 건물 허문찬 기 네이버 카카오 등 국내 대표 정보기술 기업들 임직원 평균 연봉 억원 돌파 일 금융감독원 전자공시시스템 카카오 임직원 명 지난해 인 평균 급여액 억 만원 기록 지난해 만원 가량 급등 카카오 관계자 지난해 최고 실적 상여 스톡옵션 주식매수선택권 효과 때문 이 설명 네이버 엔씨소프트 임직원 평균 연봉 억원 네이버 지난해 직원 명 평균 연봉 억 만원 전년 만원 대비 가량 증가 엔씨소프트 지난해 직원 명 평균 연봉 억 만원 직전 년 만원 통신 업계 텔레콤 년 연속 평균 연봉 억원 기록 텔레콤 사업보고서 지난해 임직원 평균연봉 억 만원 전년 증가 지난해 임직원 평균 급여 만원 년 만원 유플러스 만원 년 만원 소폭 텥레콤 임직원 평균 연봉 경쟁사 유플러스보다 최소 만원 삼성전자 지난해 직원 평균연봉 억 만원 것 텔레콤 연봉 업계 상위권 분류 업계 호황 지난해 신종 코로나바이러스 감염증 코 확산 비대 언택트 문화 확산 영향 올해 비대 사업 확대 것 예상 각사 인재 유출 우려 경쟁적 연봉 분석 조아 한경닷컴 기자
