time,title,context
 2021.02.14 18:07,"ESG경영 닻 네이버-카카오, 그린IT 물결",데이터센터 탄소배출량 줄 알고리즘 윤리헌장 양사 기업지배구조평 우수 빅테크기업 사회적 책 앞장 애플 마이크로소프트 등 글로벌 빅테크 기업 경쟁 가운데 네이버 카카오 등 경영 을 강화 환경 사회 지배구조 를 통칭 기업 경쟁력 지속적 리 경영전략 급부상하면 친환경 데이터 센터 탄소저감 앞장 일 관련 업계 네이버 카카오 전담조직 확대 개편 네이버 지난해 월 이사회 내 위원회 신설 데 이 최고재무책임자 산하 전담조직 운영 카카오 김범수 의장 총괄 위원회 구성 양사 를 전면 친환경 데이터 센터 설립 운영 총력 세대 이동통신 기반 데이터 사용량 급증 비대 경제 여 활동 등 온택트 온라인 소통 활성화 양사 데이터 센터 탄소배출량 수 밖 때문 이 네이버 강원 춘천 위치한 데이터 센터 과 세종시 완공 저 데이터 센터 탄소저감 솔루션 년 네거티브 를 달성 계획 네거티브 온실가스 배출량 양 탄소 감축 상쇄 배출량 이하 전략 카카오 년 준공 목표 건립 중 데이터 센터 에너지 효율성 극대화 친환경 데이터 센터 운영 목표 디지털 경제 프라이버시 네이버 카카오 등 기업 사회적 책 노사관계 공정거래 데이터 주권 확보 인공지능 윤리 등 광범위 적용 전 국민 온오프라 경제 사회활동 네이버 카카오 등 플랫폼 비즈니스 안 이뤄지면서다 네이버 년 네이버 프라이버시 센터 개인정보 프라이버시 주제 연구 결과 공개 것 맥락 네이버 개정 데이터 법 개정 개인정보보호법 신용정보법 정보통신망법 관련 연구 결과 백서 발간 개인정보 보호 데이터 활용 두 가지 가치 충족 노력 방침 피력 카카오 핵심 기업 디지털 책 을 공언 인권경영선언문 제정 공표 온라인 증오발언 근절 원칙 수립 아동 청소년 보호 정책 등 대표적 자체 윤리 알고리즘 윤리 헌장 을 차별 경계 등 관련 내용 지속적 업데이트하 카카오 측은 구글 페이스북 애플 삼성 등 국내외 주요 기업 참여 디지털 권리 기업책임지수 평 작업 참여 며 디지털 권리 랭킹 평가 표현 자유 프라이버시 등 비즈니스 전반 점검 개 방향 모색 초경쟁 경영 네이버 카카오 경영 투명성 독립성 핵심 지배구조 관련해 두각 네이버 한국기업지배구조원 기업지배구조평가 시가총액 상위 위 기업 중 유일 지배구조 부문 등급 네이버 이사회 의장 외부인사 변대규 휴맥스 홀딩스 회장 독립성 유지 개 최대주주 지분 를 카카오 창업자 최대주주 김범수 의장 카카오 주식 등 개 재산 를 사회 환원 것 계획 자체 기업지배구조헌장 주주 이사회 감사기구 이해관계 시장 경영 감시 등 개 영역 운영 방향 관련 환경 사회적 가치 재무 수익률 연결 임팩트 펀드 등 투자업계 화두 국내 임팩트 투 전문 벤처캐피털 관계자 글로벌 투 펀드들 를 주요 투자지표 관련 기업 투자하 규모 조원 육박 며 경영 기업 재무 안정성 지속가능경영 데이터 지수 발표 초경쟁 시대 생존전략 강조 김미희 기자
 2021.02.14 13:21,디지털경제 빅2 네이버-카카오 ‘ESG경영’ 닻,친환경 데이터 센터 데이터 주권 확보 경영 독립성 경영 투자유치 가능 경제적 가치 파이낸셜뉴스 애플 마이크로소프트 등 글로벌 빅테크 기업 경쟁 가운데 네이버 카카오 등 경영 을 강화 환경 사회 지배구조 를 통칭 기업 경쟁력 지속적 리 경영전략 급부상하면 글로벌 자산운용사 블랙록 필두 전 세계 투자은행 금융기관 국민연금 등 공적 연기금 투자 확대 디지털 경제 사회 기업들 경영 가속화 네이버 친환경 데이터 센터 탄소저감 앞장 일 관련 업계 네이버 카카오 전담조직 확대 개편 네이버 지난해 월 이사회 내 위원회 신설 데 이 최고재무책임자 산하 전담조직 운영 카카오 김범수 의장 총괄 위원회 구성 양사 를 전면 친환경 데이터 센터 설립 운영 총력 세대 이동통신 기반 데이터 사용량 급증 비대 경제 여 활동 등 온택트 온라인 소통 활성화 양사 데이터 센터 탄소배출량 수 밖 때문 이 네이버 강원 춘천 위치한 데이터 센터 과 세종시 완공 저 데이터 센터 탄소저감 솔루션 년 네거티브 를 달성 계획 네거티브 온실가스 배출량 양 탄소 감축 상쇄 배출량 이하 전략 카카오 년 준공 목표 건립 중 데이터 센터 에너지 효율성 극대화 친환경 데이터 센터 운영 목표 카카오 카카오 제공 디지털 경제 프라이버시 네이버 카카오 등 기업 사회적 책 노사관계 공정거래 데이터 주권 확보 인공지능 윤리 등 광범위 적용 전 국민 온오프라 경제 사회활동 네이버 카카오 등 플랫폼 비즈니스 안 이뤄지면서다 네이버 년 네이버 프라이버시 센터 개인정보 프라이버시 주제 연구 결과 공개 것 맥락 네이버 개정 데이터 법 개정 개인정보보호법 신용정보법 정보통신망법 관련 연구 결과 백서 발간 개인정보 보호 데이터 활용 두 가지 가치 충족 노력 방침 피력 카카오 핵심 기업 디지털 책 을 공언 인권경영선언문 제정 공표 온라인 증오발언 근절 원칙 수립 아동 청소년 보호 정책 등 대표적 자체 윤리 알고리즘 윤리 헌장 을 차별 경계 등 관련 내용 지속적 업데이트하 카카오 측은 구글 페이스북 애플 삼성 등 국내외 주요 기업 참여 디지털 권리 기업책임지수 평 작업 참여 며 디지털 권리 랭킹 평가 표현 자유 프라이버시 등 비즈니스 전반 점검 개 방향 모색 초경쟁시대 경영 네이버 카카오 경영 투명성 독립성 핵심 지배구조 관련해 두각 네이버 한국기업지배구조원 기업지배구조평가 시가총액 상위 위 기업 중 유일 지배구조 부문 등급 네이버 이사회 의장 외부인사 변대규 휴맥스 홀딩스 회장 독립성 유지 개 최대주주 지분 를 특정인 적 지분 회사 주요 의사결정 지배력 것 핵심 카카오 창업자 최대주주 김범수 의장 카카오 주식 등 개 재산 를 사회 환원 것 계획 자체 기업지배구조헌장 주주 이사회 감사기구 이해관계 시장 경영 감시 등 개 영역 운영 방향 관련 환경 사회적 가치 재무 수익률 연결 임팩트 펀드 등 투자업계 화두 국내 임팩트 투 전문 벤처캐피털 관계자 세계 최대 자산 운용사 블랙록 투자 기업들 탄소배출량 감축 계획서 요구 등 글로벌 투 펀드들 를 주요 투자지표 관련 기업 투자하 규모 조원 육박 며 경영 기업 재무 안정성 지속가능경영 데이터 지수 발표 초경쟁 시대 생존전략 강조 소셜임팩트 데이터주권 친환경데이터센터 지배구조개선 임팩트펀드 김미희 기자
 2021.02.14 17:26,"이낙연, 카카오 김범수' 언 이익공유 가능하단 희망",김범수 재산 절반 사회 기부 선언 이낙연 신선한 충격 이익공유 희망 이낙연 더불어민주당 대표 일 오후 서울 여의 국회 민심 기자간담회 발언 연합뉴스 서울경제 이낙연 더불어민주당 대표 일 카카오 창업자 김범수 이사회 의장 재산 절반 사회 환원 선언 협력이익공유제 희망 대표 이날 국회 민심 기자간담회 최근 카카오 창업자 김범수 의장 선언 신선한 충격 며 이익공유 가능 희망 강조 대표 자신 불평등 완화 제안 상생연대 법 영업제한 손실보상제 협력이익공유제 사회연대기금 과 관련해 가지 입법 면 법안 심의 난이도 적 이익공유 수 생각 말 상생연대 법 가운데 협력이익공유제 유일 제정안 개정안 만큼 비교적 입법 처리 것 김범수 카카오 의장 카카오 제공 맥락 의장 조 원 재산 절반 사회 기부 선언 협력이익공유제 실현 힘 의장 일 카카오톡 채널 카카오 공동체 타임스 를 앞 동안 재산 절반 이상 사회문제 해결 기부 며 카카오 접근 영역 사회문제 해결 사람 지원 생각 이 말 카카오 네이버 중소사업자 들 상생 지원책 네이버 자사 플랫폼 사업 파트너 스마트스토어 판매자 자금 회전 기존 배송완료 이틀 후 무료 정산 배송완료 다음날 무료정산 서비스 도입 미래에셋캐피탈 스마트스토어 사업자 대출 문턱 대상 조건 개월 연속 매출 월 만원 월 만원 변경 여권 신종 코로나바이러스 감염증 코 장기화 수혜 기업 이익 코 집중 자영업자 제안 가운데 대표적 코 수혜 업종 기업들 자발적 사회적 책 강조 것 김혜린 기자
 2021.02.14 10:24,코스피 주간 개 순매 1위 카카오,이데일리 이광수 기 이광수
 2021.02.14 10:24,코스피 주간 외국 순매수 1위 카카오,이데일리 이광수 기 이광수
 2021.02.14 09:02,카카오 올해 폭발적 성장…목표주 60만원 株포트라이트,증권 카카오 매출 영업익 동반 성장 주목 주요 자회사 로 기업가치 상승 기대 제공 삼성증권 헤럴드경제 김성미 기 증권업계 카카오 지난해 이 올해 폭발적 성장 지속 것 자회사 기업공개 로 카카오 기업가치 동반 성장 것 목표주가 오동환 삼성증권 연구원 지난해 분기 카카오 매출 전년 동기대비 증가 조 억원 기록 며 톡비즈 매출 비즈보드 커머스 매출 증가 기간 증가 페이 모빌리티 거래액 증가 사업 매출도 성장 유료 콘텐츠 픽코마 폭발적 매출 증가 기간 증가 말 이 인건비 마케팅 비용 등 영업비용 증 추세 매출 고성장 영업 레버리지 효과 지난해 분기 영업이익 기간 증가 억원 컨센서스 상회 최관순 증권 연구원 지난해 의 매출 성장 의 영업이익 성장 기록 카카오 올해 성장 예상 며 광고 커머스 동시 성장 톡비즈 부문 의 성장 한국 일본 유료콘텐츠 판매 호조 콘텐츠 부문 의 매출 증가 예상 말 이 주차 서비스 추가 모빌리티 호조 사업 증 올해 카카오 매출 증가율 예상 며 카카오재팬 모빌리티 매출 증가 손익 개 이익 레버리지 톡비즈 부문 성장 이익률 증가 전망 이 설명 증권 카카오 올해 매출 조 억원 영업이익 억원 전망 등 매출 성장 수익성 개선 지속 것 예측 이 카카오 목표주가 만원 증권사 삼성증권 카카오 페이 등 주요 자회사 상장 주요 자회사들 기업가치 시장 것 이 이 카카오 전체 기업가치 상향 요인 발생 목표주가 기존 만원 만원 상향 강조 이 메리츠증권 카카오 목표주가 만원 증권 만원 제시 한편 카카오 일 전 거래일 원 원 장 등 만원 눈앞
