time,title,context
2021-05-04,카카오 전직원 스톡옵션 500억 규모 부여…창사 이래,년 주 부 계획 김범수 카카오 이사회 의장 카카오 제공 이데일리 노재웅 기 카카오 다음 합병 이후 처음 올해 본사 전 직원 주 억여억원 주식매수선택권 스톡옵션 을 부 지난해 실적 급증 직원들 보상 요구 목소리 것 조치 풀이 카카오 본사 직원 명 인 주 만원 상당 수준 주 스톡옵션 부 일 공시 행사가격 원 억 만원 추산 행사기간 년 월 일 년 월 일 일 기준 년 이상 재직 명 주 개월 이상 년 미만 명 주 신입공채 인턴 경우 개월 미만 주 카카오 올해 시작 년 주 최대 주 부 예정 카카오 측은 직원들 동기부여 회사 지속적 성장 의미 라 부 목적 노재웅
2021-05-04,카카오 전 직원 3년 최대 600주 스톡옵션 부여,머니투데이 윤지혜 기 카카오 직원들 년 최대 주 스톡옵션 제공 카카오 네이버 이 카카오 직원 보상 강화 년 년 최대 주 주식매수선택권 스톡옵션 을 부 방침 일 카카오 본사 직원 명 인 만원 상당 자사주 주 스톡옵션 부 공시 주 억원 규모 행사 이날 종가 원 저렴한 원 카카오 올해 시작 년 주 최대 주 지급 회사 성장 과실 직원들 취지 이 월 출범 사내 인사 태스크포스 길 인사 보상 개편방안 논의한 결과 카카오 관계자 직원들 동기부여 회사 지속적 성장 의미 스톡옵션 제도 도입 말 한편 네이버 월 년 매년 만원 상당 주식 무상 지급 스톡그랜트 제도 발표 이 스톡옵션 현금 수 제도 재직기간 차등 지급 윤지혜 기자
2021-05-04,결단 카카오 전 직원 스톡옵션,연합뉴스 카카오 직원들 주식매수선택권 스톡옵션 을 카카오느 일 직원 명 스톡옵션 주 부 공시 카카오 이래 전 직원 일괄적 스톡옵션 것 이번 처음 행사 가격 원 억원 규모 년 이상 재직 명 주 미만 명 주 행사 기간 년 월 일 년 월 일 앞 년 근속 후 년 근속 후 나머지 행사 수 이송렬 한경닷컴 기자
2021-05-04,카카오 539억 규모 본사 직원 대상 스톡옵션 부 결정,아시아경제 구은모 기 카카오 본사 직원 명 인 주 약 만원 상당 수준 주식매수선택권 스톡옵션 을 부 결정 일 공시 이번 결정 부 스톡옵션 주 행사 원 기준 억원 규모 년 이상 재직 명 주 미만 명 주 행사 기간 년 월 일 년 월 일 앞 년 근속 후 년 근속 후 나머지 행사 수 카카오 측은 올해 시작 년 주 최대 주 부 예정 이 직원들 동기부여 회사 지속적 성장 의미 라 설명 구은모 기자
2021-05-04,카카오 全직원 2200만원 스톡옵션,명 억 규모 지급 카카오 네이버 이 인재경영 닻 정보기술 업계 우수 인재 확보 전쟁 가운데 스톡옵션 부 개인 성장 회사 성장 연계 전략 카카오 본사 직원 명 인 주 약 만원 상당 수준 스톡옵션 부 일 공시 주 억 원 규모 행사 원 카카오 올해 시작 년 주 최대 주 부 예정 년 이상 재직 명 주 미만 명 주 행사 기간 년 월 일 년 월 일 년 근속 후 년 근속 후 나머지 행사 수 카카오 전 직원 일괄적 스톡옵션 부 것 창사 이래 처음 월 행사 조건 수 보너스 자사주 를 전 임직원 주 바 카카오 관계자 직원들 동기부여 회사 지속적 성장 의미 라 네이버 전 직원 처분 수 만원 상당 자사주 지급 네이버 지난달 일 임시 이사회 스톡그랜트 프로그램 승인 스톡그랜트 회사 보유 주식 임원 제외 직원 무상 부 보상 방식 세부 조건 다양 주식매수선택권 스톡옵션 현금화 것 강점 자사주 지급 기간 년 매년 스톡그랜트 적용 대상 약 명 월 초 다음해 월 초 등 회 가량 재직 기간 부 월 초 지급 예정 네이버 측은 보상 프로그램 일회성 지속 가능 방안 우리 회사 보상 철학 기반 개인 성장 회사 성장 연계 방안 구상 김아름 기자
2021-05-04,네이버 이 카카오 전직원 스톡옵션,직원 명 스톡옵션 주 부 파이낸셜뉴스 카카오 네이버 이 인재경영 닻 정보기술 업계 우수 인재 확보 전쟁 가운데 스톡옵션 부 개인 성장 회사 성장 연계 전략 카카오 본사 직원 명 인 주 약 만원 상당 수준 스톡옵션 부 일 공시 주 억 원 규모 행사 원 카카오 올해 시작 년 주 최대 주 부 예정 년 이상 재직 명 주 미만 명 주 행사 기간 년 월 일 년 월 일 년 근속 후 년 근속 후 나머지 행사 수 카카오 전 직원 일괄적 스톡옵션 부 것 창사 이래 처음 월 행사 조건 수 보너스 자사주 를 전 임직원 주 바 카카오 관계자 직원들 동기부여 회사 지속적 성장 의미 라 네이버 전 직원 처분 수 만원 상당 자사주 지급 네이버 지난달 일 임시 이사회 스톡그랜트 프로그램 승인 스톡그랜트 회사 보유 주식 임원 제외 직원 무상 부 보상 방식 세부 조건 다양 주식매수선택권 스톡옵션 현금화 것 강점 자사주 지급 기간 년 매년 스톡그랜트 적용 대상 약 명 월 초 다음해 월 초 등 회 가량 재직 기간 부 월 초 지급 예정 네이버 측은 보상 프로그램 일회성 지속 가능 방안 우리 회사 보상 철학 기반 개인 성장 회사 성장 연계 방안 구상 김아름 기자
2021-05-04,"""리딩방서 퇴직금 2억 날렸다""…카카오, 방조 혐의 고발당해",출처 연합뉴스 유명 펀드매니저 증권사 직원 등 사칭 주식 리딩방 우후죽순 가운데 소비자단체들 이 방치 카카오 검찰 고발 주식 리딩방이란 지시 대 고수익 수 선전 투 자문료 소셜미디 계정 자본시장법상 금융투자업 등록 채널 이용 투자상담 것 불법 계정들이 법무법 황다연 변호사 일 서울중앙지방검찰청 사단법인 금융소비자연맹 소비자와함께 해피맘 등 대리 카카오 자본시장법위반 방조 등 혐의 고발장 접수 카카오톡 카카오채널 유명 애널리스트 펀드매니저 등 명의 도용 불법 투자상담방 운영 이 방치 비난 일례 퇴직 후 은퇴자금 씨 월 증권사 펀드매니저 사칭 사람 자금운용 상담 펀드매니저 전화번호 저장 뒤 상담 다음날 카카오톡 해당 펀드매니저 얼굴 사진 이름 소속 직함 카카오채널 계정 인사 이후 카카오톡 투자상담 계속 펀드매니저 안내 은행 계좌 억원 송금 카카오톡 채널 대화한 사람 실제 펀드매니저 명의 도용 계정 해당 사실 계좌 송금 돈 뒤 증권사 애널리스트 월 자신 사칭 투자금 모집 카카오채널 발견 카카오톡 카카오 개월 현재 명의도용 채널 삭제 조치 등 것 황다연 변호사 카카오 명의도용 애널리스트 펀드매니저들 신고 사칭계정 삭제 발생치 조치 수수방관 국민들 피해 주장 그 이 거대 플랫폼 운영 소비자 책 신종 금융사기 근거지 잘못된 현실 강조 한편 금융당국 주식리딩방 관련 속출 포상금 상향 조정 카카오톡 비롯 텔레그램 등 선행매매 증권계좌 대 허위정보 유포 등 피해 투자자들 신고 확대 조치 불공정거래 등급별 기준금액 등급 최대 억원 등급 만원 금융당국 중요도 등급 중 등급 제외 등급 지급한도액 방침 금융당국 관계자 풍문만 근거 경우 실제 심리 조사 진행 며 때 불공정거래 종목 행위자 일시 방법 관련 점포 등 구체적 내용 사진 스마트폰 화 캡처 등 증거자료 첨부 효과적 조사 가능 설명 류영상 매경닷컴 기자
