time,title,context
2021-04-27,"카카오 웹툰, 태국 상륙…1위 네이버 정면승부",플랫폼 동남아시장 공략 카카오엔터 월 서비스 연내 웹툰 개 작품 출시 플랫폼 강 세력확장 경쟁 플랫폼 동남아 공략 카카오엔터테인먼트 월 태국 대만 웹툰 서비스 출시 네이버 웹툰 현지 위 메신저 라인 기반 위 시장 정면 도전장 두 회사 웹툰 시장 일본 미국 이 태국 대 형국 일 카카오엔터 관계자 올해 상반기 내 태국 대 시장 웹툰 서비스 출시 며 동남아시아 시장 경쟁 치열해 지역 성장성 글로벌 플랫폼 도전 일환 이 말 카카오엔터 태국 개 작품 시작 연내 최대 개 계획 한국 일본 성공 웹소설 웹툰 액션 로맨스 판타지 중심 마케팅 강화 전략 태국 네이버 관계사 라인 텃밭 월간 이용자 만명 라 메신저 기반 라인웹툰 라인그룹 최초 뱅킹 플랫폼 라 를 론칭한 곳 모바 뱅킹 서비스 라 고객 돌파 라인맨 웡나 배달 사업 올해 태국 전역 개 도 서비스 확장 계획 그 강력 플랫폼 구축 네이버 상대 카카오 도전장 셈 웹툰 양사 지역 거점 경쟁 벌 것 이번 라인웹툰 카카오 픽코마 일본 경쟁 미국 시장 양사 상장 타진 북미 시장 네이버 왓패드 카카오 파스미디어 인수 세력 확장 힘 카카오엔터 관계자 때 삼성 경쟁 벌 글로벌 가전 시장 한국의 위상 네이버 카카오 글로벌 시장 경쟁 웹툰 글로벌 플랫폼화 말 동남 시장 도전장 한국 플랫폼 기업들 동남 지역 인구 억 만명 중남미 시장 때문 평균연령 세 불과 년 중산층 억명 정도 성장 중산층 억 동남아 네이버 이 쿠팡 배민 격 소비력 동남아 시장 한류 플랫폼 기지개 라 태국 이용자 뱅킹 배달 서비스 확장 배민 베트남 시장 네이버 관계사 라인 배달 서비스 라인맨 라이더들 태국 아유타야 오토바이 포즈 제공 라 한국 플랫폼 기업들 동남아 시장 도전장 태국 비롯 동남아 거점 구축 네이버 대표적 이 카카오 네이버 전략 답습 영역 최근 쿠팡 배달의민족 쇼핑 기반 플랫폼 기업 가세 형국 중국 동남아 방향 사례 동남아 인 소득 한국의 분 수준 불과 년 중산층 억명 정도 성장 시장 인도네시 자카르타 비롯 일부 지역 인 소득 만달러 이상 인구 글로벌 플랫폼 업체들 치열 각축전 벌 그랩 고젝 동남아 현지 발원 기업들 슈퍼앱 등극 시장 장악 경우 한국 플랫폼 기업들 한류 바람 시장 기지개 모습 이번 태국 웹툰 서비스 시작 카카오엔터테인먼트 지난해 법인 설립 준비 카카오 별 앱 웹툰 서비스 시작 계획 라인 일본 대 외 태국 인도네시아 전략 톱 지역 라 인도네시아 법인 라인 라 오픈챗 라 스플릿빌 서비스 운영 중 라 베트남법인 개 개발센터 네이버 라인 별도 동남아 행보 이달 인도네시아 엠텍 억 만달러 약 억원 의 투자 결정 엠텍 인도네시아 현지 엔터테인먼트 평가 회사 회사 스토리텔링 지식재산권 활용 사업 벌 것 베트남 법인 네이버 현지 최고 명문 공과대학 하노이과학기술대학 인공지능 분야 연구개발 비롯 다양한 산학협력 진행 전용 연구 공간 네이버 센터 도 베트남 국내 개발 인력 인플레 현상 대안 지역 중 미국 성공적 상장한 쿠팡 첫 해외 사업 지역 싱가포르 낙점했다 명 인원 신규 채용 사업 시작 준비 쿠팡 해외 직구 서비스 미국 중국 법인 설립 적 이번 인력 채용 해외 직구 관계 것 유통 업계 관계자 직구매 풀필먼트 배달 사업 유통 환경 나라 적용 싱가포르 도시 국 형태 쿠팡 사업 모델 해외 적용 만한 첫 행선지 적합해 말 배달의민족 운영 우아한형제들 베트남 시장 배민 서비스 운영 배달의민족 년 라인 일본 시장 첫발 당시 음식 배달 활성화 일본 시장 상황상 조 철수 지난해 월 진출 베트남 배달 시장 호찌민 하노이 서비스 제공 중 급 감성 마케팅 으 베트남 현지 시장 공략 호찌민시 하노이시 중심 지역 업체별 라이더 노출 빈 업소 시장 업체별 주문 수 현황 조사한 결과 배민 호찌민시에선 주요 경쟁사 그랩푸드 등 비슷 수준 우아한형제들 세 뼘 가방 문구 에코백 출시 화제 바 세 뼘 가방 은 베트남 전래동화 금은보화 가방 햇빛 노출 현지 정서 전신 수 의류 라이더에 호응 베트남 사업 진출 초반 현재 비교 일 평균 주문 수 서비스 시작 초창기 약 배 상태 김봉진 우아한형제들 의장 딜리버리히어 설립 싱가포르 합작회사 우아 아시아 를 아시아 개 나라 음식 배달 공유 주방 퀵커머스 서비스 총괄 우아한형제들 지난해 실적 해외 법 콜 만건 전년 대비 일본 베트남 등 해외 법 총상품판매액 은 증가 만유 약 억 만원 를 기록 이동 기자
2021-04-27,"네이버, 카카오 쿠팡 경쟁자들",수익창구 커머스 웹툰 분야 성장세 뚜렷 웹 브라우저 웨 구글 크롬 도전 파이낸셜뉴스 네이버 경쟁자 카카오 비롯 쿠팡 텔레콤 등 기존 검색광고 등 서치플랫폼 전자상거래 커머스 콘텐츠 분야 매출 비중 증가하면서다 웹툰 등 콘텐츠 커머스 해외 진출 가시화 네이버 경쟁자 다양 전망 네이버쇼핑 서비스 관련 홈페이지 갈무리 커머스 시장 쿠팡 이베이 각축 일 관련 업계 네이버 금융 미래에셋증권 유통 신세계 물류 등 전통강자 혈맹 반면 카카오 쿠팡 텔레콤 등 플랫폼 사업자 전방위적 경쟁구도 플랫폼 사업자 경쟁분야 커머스 콘텐츠 등 사업 다각화 네이버 쿠팡 로켓배송 익일배송 서비스 연내 가동 주력 국내외 웹툰 웹소설 업체 인수 것 맥락 증권업계 네이버 성장 동력 커머스 시장경쟁 치열 전망 유안타 증권 이창영 애널리스트 네이버 보고서 쿠팡 기업공개 자금유입 공격경영 가능성 대기업 이베이코리아 수 가능성 커머스 시장경쟁 격화 것 이 네이버쇼핑 검색 트래픽 기반 오픈마켓 모델 수익성 경쟁업체 대비 상황 이 말 네이버 커머스 경쟁력 해외 수익 창구 것 관측 한국투자증권 정호윤 연구원 네이버 합작법인 지분 보유 홀딩스 일본 커머스 간편결제 등 다양한 산업 핵심 플레이어 성장 것 점 투자포인트 라 강조 이 금융정보업체 에프앤가이드 추정 네이버 분기 매출 영업이익 전년동기 대비 매출 반면 영업이익 상승 조 억원 억원 기록 라 부문 분리 지난해 분기 매출 조 억원 감소 것 네이버 사업역량 것 의미 웹 브라우저 웨 구글 크롬 도전 네이버 모바 플랫폼 사업 경쟁 카카오 웹툰 웹소설 등 콘텐츠 분야 경쟁 모색 중 포털 메신저 이 콘텐츠 플랫폼 시장 우위 승부 예고 전 세계 월간활성사용자 만 네이버웹툰 글로벌 엔터테인먼트 시장 공략 올해 세자릿수 개발자 등 기술 역량 스토리텔링 경쟁력 네이버 자체 개발한 웹 브라우저 웨 을 구글 크롬 을 국내 위 비전 제시 글로벌 빅테크 기업 구글로부터 국내 포털사이트 시장 것 웨 경쟁력 웹 서비스 플랫폼 을 선점 목표 웨 기반 차량용인포테인먼트 등 모빌리티 서비스 중장기적 준비 한편 전자 웨 기반 노트북 웨일북 도 하반기 예정 웨 서비스 네이버 김효 책임리더 디스플레이 네트워크 차량 로봇 공장 등 브라우저 생태계 확장 가능 년 내 글로벌 사업자 국내 브라우저 시장 위 목표 포부 웹툰 스마트스토어 네이버쇼핑 김미희 기자
2021-04-27,"신한카드, 호칭 부서장 방 “카카오·네이버 경쟁”",디지털 조직문화 혁신방안 발표 임영진 대표 님 지역거점 사무 수도권 곳 추 신한카드 직책명 를 포함 임원 부서장 등 장 직책명 대 님 호칭 을 사용 계열 카드 전임직원 호칭 대 별칭 현대차그룹 계열 현대카드 지정석 둘 것 은행지주계열 신한카드 처음 신한카드 일 마이데이터 출범 일 맞이 발표 디지털 조직문화 혁신방안 을 님 호칭 문화 전 직책 확대 스마트워크플레이스 자율좌석제 등 도입 것 골자 신한카드 직급 직무 중심 조직문화 구축 지난해 말 부서장 밑 직급 님 호칭 을 사용 중 이번 포함 임직원 확대 하반기 부서장 급 사용 개 공간 조직 팀 구분 하나 업무공간 구성해 부서장 포함 일 자리 자유 선택 수 좌율좌석제 도 순차적 도입 신한카드 관계자 카카오 네이버 등 기업 경쟁 업무 환경 조직문화 확실 일 의미 라 설명 지역거점 사무실 스마트워크플레이스 를 수도권 지역 곳 추가 서울 본사 직원들 지방 일할 수 환경 조성 업무공간 스마트워크플레이스 부산 대전 대구 제주 곳 운영 회의 비대면 대면 필요 경우 본사 출근 임영진 대표이사 라이프 앤 파이낸스 플랫폼 기업 도약 기반 역량 과 사업 모델 기업 구조 관점 회사 리빌딩하자 혁신전략 을 추진 중 박자연 기자
2021-04-27,"신한카드, 호칭 부서장 방 뺀다…“카카오·네이버 경쟁”",집 인근 사무실 확대 임영진 대표 님 디지털 조직문화 혁신 헤럴드경제 박자연 기 신한카드 직책명 를 포함 임원 부서장 등 장 직책명 대 님 호칭 을 사용 계열 카드 전임직원 호칭 대 별칭 현대차그룹 계열 현대카드 지정석 둘 것 은행지주계열 신한카드 처음 신한카드 일 마이데이터 출범 일 맞이 발표 디지털 조직문화 혁신방안 을 님 호칭 문화 전 직책 확대 스마트워크플레이스 자율좌석제 등 도입 것 골자 신한카드 직급 직무 중심 조직문화 구축 지난해 말 부서장 밑 직급 님 호칭 을 사용 중 이번 포함 임직원 확대 하반기 부서장 급 사용 개 공간 조직 팀 구분 하나 업무공간 구성해 부서장 포함 일 자리 자유 선택 수 좌율좌석제 도 순차적 도입 신한카드 관계자 카카오 네이버 등 기업 경쟁 업무 환경 조직문화 확실 일 의미 라 설명 지역거점 사무실 스마트워크플레이스 를 수도권 지역 곳 추가 서울 본사 직원들 지방 일할 수 환경 조성 업무공간 스마트워크플레이스 부산 대전 대구 제주 곳 운영 회의 비대면 대면 필요 경우 본사 출근 임영진 대표이사 라이프 앤 파이낸스 플랫폼 기업 도약 기반 역량 과 사업 모델 기업 구조 관점 회사 리빌딩하자 혁신전략 을 추진 중이
2021-04-27,특징주 카카오 자회사 상장 기대감 강세,카카오페이 상장 예 청구 일 오전 장중 대 강세 서울경제 카카오 자회사 상장 기대감 일 장중 강세 이날 오전 시 분 현재 유가증권시장 카카오 전날 원 원 거래 자회사 상장 기업가치 재평가 기대감 주 강세 배경 풀이 전날 일 한국거래소 유가증권시장본부 카카오 간편결제 플랫폼 카카오페이 제출 주권 상장예비심사 신청서 접수 거래소 상장심사 기간 영업 기준 최대 일 이내 만큼 하반기 중 상장 것 성종화 이베스트증권 연구원 카카오페이 기업가치 조원 규모 평가 양사록 기자
2021-04-27,특징주 카카오 카카오페이 상장 소식 4 급등,아시아경제 지연진 기 카카오 일 전자결제기업 카카오페이 상장 소식 급등 중 카카오 이날 오전 시 분 기준 유가증권시장 전일대비 상승 원 거래 카카오페이 한국거래소 주권 상장예비심사 신청서 접수 카카오뱅크 이 카카오페이 기업공개 를 추진 이날 카카오 주가 것 풀이 년 월 국내 최초 간편결제 서비스 시작 카카오페이 년 월 분사해 카카오 테크핀 전문 자회사 출범 이후 년 만 누적 가입자 수 만명 돌파 국내 대표 생활 금융 플랫폼 최대주주 카카오 지연진 기자
2021-04-27,카카오 3 상승…카카오페 코스피 상장 추진,카카오 주가 카카오페이 유가증권시장 상장 절차 착수 소식 알려지면서다 일 오전 시 분 현재 유가증권시장 카카오 전일 원 상승 원 거래 투자은행 업계 카카오페이 전날 한국거래소 유가증권시장 상장 예비심사 청구 상장 예상 시기 하반기 카카오뱅크 상장 시 만큼 시점 조율 진행 것 카카오페이 기업가치 조원 거론 카카오페이 올해 손익분기점 것 전망 데 성장 속도 점 기업가치 조원 평가 전망 김수현 한경닷컴 기자
2021-04-27,"18조원 가치 카카오페이 본격화…카카오, 장 초반 3. 39%↑",머니투데이 김태현 기 카카오 전날 카카오페이 본격적 기업공개 절차 소식 강세 일 오전 시 분 카카오 전일대비 원 원 거래 전날 장 마감 후 발표 카카오페이 예비심사신청서 제출 호재 카카오페이 전날 한국거래소 예비심사신청서 제출 예비심사신청서 상장 첫 절차 예비심사 통과 발행사 증권신고서 제출 기관 수요예측 일반 공모청약 상장하 카카오페이 코스피 상장한다 카카오페이 대표 주관사 삼성증권 골드만삭스 모 년 월 국내 최초 간편결제 서비스 시작 카카오페이 년 월 분사해 카카오 테크핀 전문 자회사 출범 누적 가입자 수 만명 최근 단순 결제 투 보험 대출 자산관리 등 금융 서비스 출시 플랫폼 안착시켰다 올해 흑자 전환 성종화 이베스트투자증권 연구원 카카오페이 올해 영업손익 손익분기점 돌파 예상 며 년 예상 거래액 조원 멀티플 배 적용 기업가치 조원 평가 진단 김태현 기자
