,날짜,기사제목,본문내용
21,2021-04-29,"LG·LG디스플레이·LG이노텍·LG유플, '기후변화 대응·물 경영 우...",디스플레이 이노텍 유플러스 등 개 상장사가 일 글로벌 지속가능경영 평가기관 가 발표한 기후변화 대응 물 경영 우수기업 에 선정됐다 는 기후변화 대응 관련 경영 정보를 분석해 평가하는 비영리 기관으로 매년 국내 시가총액 상위 대 기업의 기후변화 대응 성과를 평가해 탄소 경영 부문 상위 개사 물 경영 부문 상위 개사를 선정한다 전 세계적으로는 여개 기업을 대상으로 평가를 하고 그 결과는 가장 신뢰받는 지속가능경영 평가 지표 중 하나로 활용된다 디스플레이는 탄소 경영과 물 경영 모두 최고 등급인 리더십 를 획득하며 우수기업으로 선정됐다 디스플레이는 친환경 생산 설비에 억원을 투자해 지난해 온실가스 배출량을 온실가스 배출권 거래제도 시행 이전인 년 대비 인 약 만 줄이는 성과를 거둬 평가 결과 상위 개사에만 수여하는 탄소 경영 아너스 클럽에 년 연속으로 선정됐다 물 경영 부문에서는 수자원 보호를 위한 공정 개선 및 지속적인 폐수 재이용 설비에 투자를 진행하는 등 선제적인 수자원 관리 노력을 인정받아 년 연속 수상기업에 이름을 올렸다 이노텍은 탄소 경영과 물 경영 부문 우수기업에 년 연속 뽑혔다 이노텍은 태양광 폐열 스팀 등 신재생 에너지 도입 확대 및 고효율 생산 설비 도입 등을 통해 지난해 에너지 비용을 억원 이상 절감했으며 매출액 대비 온실가스 배출량을 매년 씩 줄이고 있다 유플러스는 올해 통신 업계에서 유일하게 탄소 경영 우수기업에 선정되며 년 연속으로 우수기업에 이름을 올렸다 유플러스는 인터넷 데이터 센터의 냉각탑 운전방식을 인버터 기술을 활용한 친환경 구조로 변경해 연간 전력 사용량을 이상 줄여 온실가스 배출량을 대폭 감축했다 이 밖에도 빌딩의 옥상 등에 를 연계한 태양광 발전 시설을 설치해 운영하는 친환경 비즈니스를 발굴하는 등 탄소 절감에 기여한 점을 높게 평가 받았다 는 에너지 효율화를 통한 탄소 배출량 감축 등 그룹 전반의 기후변화 대응을 체계적으로 실행한 성과를 인정받아 탄소 경영 부문 우수기업에 년 연속 선정됐다 이상규 매경닷컴 기자
22,2021-04-29,"LG 4개 상장사, 기후변화 대응 우수기업 선정",서울 뉴시스 홍효식 기자 사진 뉴시스 파이낸셜뉴스 디스플레이 이노텍 유플러스 등 개 상장사가 일 글로벌 지속가능경영 평가기관 가 발표한 기후변화 대응 물 경영 우수기업 에 선정됐다 는 기후변화 대응 관련 경영 정보를 분석해 평가하는 비영리 기관으로 매년 국내 시가총액 상위 대 기업의 기후변화 대응 성과를 평가해 탄소 경영 부문 상위 개사 물 경영 부문 상위 개사를 선정한다 전 세계적으로는 여개 기업을 대상으로 평가를 하고 그 결과는 가장 신뢰받는 지속가능경영 평가 지표 중 하나로 활용된다 디스플레이는 탄소 경영과 물 경영 모두 최고 등급인 리더십 를 획득하며 우수기업으로 선정됐다 디스플레이는 친환경 생산 설비에 억원을 투자해 지난해 온실가스 배출량을 온실가스 배출권 거래제도 시행 이전인 년 대비 인 약 만톤 줄이는 성과를 거둬 평가 결과 상위 개사에만 수여하는 탄소 경영 아너스 클럽에 년 연속으로 선정됐다 물 경영 부문에서는 수자원 보호를 위한 공정 개선 및 지속적인 폐수 재이용 설비에 투자를 진행하는 등 선제적인 수자원 관리 노력을 인정받아 년 연속 수상기업에 이름을 올렸다 이노텍은 탄소 경영과 물 경영 부문 우수기업에 년 연속으로 선정됐다 이노텍은 태양광 폐열 스팀 등 신재생 에너지 도입 확대 및 고효율 생산 설비 도입 등을 통해 지난해 에너지 비용을 억원 이상 절감했으며 매출액 대비 온실가스 배출량을 매년 씩 줄이고 있다 또 수자원 재활용 설비 투자를 확대하고 용수 사용을 원단위로 관리하는 등 체계적 관리를 통한 수자원 사용량 절감 노력에 대해 긍정적인 평가를 받아 물 경영 부문 우수기업에 년 연속 선정됐다 유플러스는 올해 통신 업계에서 유일하게 탄소 경영 우수기업에 선정되며 년 연속으로 우수기업에 이름을 올렸다 유플러스는 인터넷 데이터 센터의 냉각탑 운전방식을 인버터 기술을 활용한 친환경 구조로 변경해 연간 전력 사용량을 이상 줄여 온실가스 배출량을 대폭 감축했다 이 밖에도 빌딩의 옥상 등에 를 연계한 태양광 발전 시설을 설치해 운영하는 친환경 비즈니스를 발굴하는 등 탄소 절감에 기여한 점을 높게 평가 받았다 는 에너지 효율화를 통한 탄소 배출량 감축 등 그룹 전반의 기후변화 대응을 체계적으로 실행한 성과를 인정받아 탄소 경영 부문 우수기업에 년 연속 선정됐다 한편 는 최근 상장회사 이사회 내에 경영의 최고 심의 기구로서 환경 안전 고객가치 주주가치 지배구조 등 환경 사회 지배구조 관련 전사 주요 정책을 심의하는 위원회 를 상반기 내로 신설하기로 하는 등 경영을 강화하고 있다 김서원 기자
23,2021-04-29,기후변화대응부터 물경영까지…LG 4개 상장사 '우수기업' 선정,로부터 디스플레이 이노텍 유플러스 등 선정 이노텍 온실가스 배출량 대폭 감축 수자원보호 설비 유플러스 인터넷 데이터 센터 전력 사용량 감축 이데일리 배진솔 기자 디스플레이 이노텍 유플러스 등 개 상장사는 글로벌 지속가능경영 평가기관 가 발표한 기후변화 대응 물 경영 우수기업 에 선정됐다고 일 밝혔다 사진 연합뉴스 는 기후변화 대응 관련 경영 정보를 분석해 평가하는 비영리 기관으로 매년 국내 시가총액 상위 대 기업의 기후변화 대응 성과를 평가해 탄소 경영 부문 상위 개사 물 경영 부문 상위 개사를 선정한다 전 세계적으로는 여개 기업을 대상으로 평가를 하고 그 결과는 가장 신뢰받는 지속가능경영 평가 지표 중 하나로 활용된다 디스플레이는 탄소 경영과 물 경영 모두 최고 등급인 리더십 를 획득하며 우수기업으로 선정됐다 디스플레이는 친환경 생산 설비에 억원을 투자해 지난해 온실가스 배출량을 온실가스 배출권 거래제도 시행 이전인 년 대비 인 약 만톤 줄이는 성과를 거둬 평가 결과 상위 개사에만 수여하는 탄소 경영 아너스 클럽에 년 연속으로 선정됐다 물 경영 부문에서는 수자원 보호를 위한 공정 개선 및 지속적인 폐수 재이용 설비에 투자를 진행하는 등 선제적인 수자원 관리 노력을 인정받아 년 연속 수상기업에 이름을 올렸다 이노텍은 탄소 경영과 물 경영 부문 우수기업에 년 연속으로 선정됐다 이노텍은 태양광 폐열 스팀 등 신재생 에너지 도입 확대 및 고효율 생산 설비 도입 등을 통해 지난해 에너지 비용을 억원 이상 절감했으며 매출액 대비 온실가스 배출량을 매년 씩 줄이고 있다 또 수자원 재활용 설비 투자를 확대하고 용수 사용을 원단위로 관리하는 등 체계적 관리를 통한 수자원 사용량 절감 노력에 대해 긍정적인 평가를 받아 물 경영 부문 우수기업에 년 연속 선정됐다 유플러스는 올해 통신 업계에서 유일하게 탄소 경영 우수기업에 선정되며 년 연속으로 우수기업에 이름을 올렸다 유플러스는 인터넷 데이터 센터의 냉각탑 운전방식을 인버터 기술을 활용한 친환경 구조로 변경해 연간 전력 사용량을 이상 줄여 온실가스 배출량을 대폭 감축했다 이 밖에도 빌딩의 옥상 등에 를 연계한 태양광 발전 시설을 설치해 운영하는 친환경 비즈니스를 발굴하는 등 탄소 절감에 기여한 점을 높게 평가 받았다 는 에너지 효율화를 통한 탄소 배출량 감축 등 그룹 전반의 기후변화 대응을 체계적으로 실행한 성과를 인정받아 탄소 경영 부문 우수기업에 년 연속 선정됐다 한편 는 최근 상장회사 이사회 내에 경영의 최고 심의 기구로서 환경 안전 고객가치 주주가치 지배구조 등 환경 사회 지배구조 관련 전사 주요 정책을 심의하는 위원회 를 상반기 내로 신설하기로 하는 등 경영을 강화하고 있다 배진솔
24,2021-04-29,"LG 4개 상장사, 기후변화 대응 우수기업 선정",이미지출처 연합뉴스 아시아경제 정현진 기자 디스플레이 이노텍 유플러스 등 개 상장사가 글로벌 지속가능경영 평가기관 가 발표한 기후변화 대응 물 경영 우수기업 에 선정됐다고 일 밝혔다 는 기후변화 대응 관련 경영 정보를 분석해 평가하는 비영리 기관으로 매년 국내 시가총액 상위 대 기업의 기후변화 대응 성과를 평가해 탄소 경영 부문 상위 개사 물 경영 부문 상위 개사를 선정한다 는 에너지 효율화를 통한 탄소 배출량 감축 등 그룹 전반의 기후변화 대응을 실행한 성과를 인정받아 탄소 경영 부문 우수기업에 년 연속 선정됐다 디스플레이는 탄소 경영과 물 경영 모두 최고 등급인 리더십 를 받아 우수기업으로 선정됐다 디스플레이는 친환경 생산 설비에 억원을 투자해 지난해 온실가스 배출량을 온실가스 배출권 거래제도 시행 이전인 년 대비 인 약 만 감축시켰다 이에 평가 결과 상위 개사에만 수여하는 탄소 경영 아너스 클럽에 년 연속으로 선정됐다고 는 밝혔다 물 경영 부문에서도 수자원 보호를 위한 공정 개선과 지속적인 폐수 재이용 설비 투자를 감안해 년 연속 우수기업에 선정됐다 이노텍은 탄소 경영과 물 경영 부문 우수기업에 년 연속으로 뽑혔다 이노텍은 태양광 폐열 스팀 등 신재생 에너지 도입 확대 고효율 생산 설비 도입 등을 통해 지난해 에너지 비용을 억원 이상 절감했고 매출액 대비 온실가스 배출량을 매년 씩 줄이고 있다 또 수자원 재활용 설비 투자를 확대하고 용수 사용을 원 단위로 관리하는 등 체계적 관리를 통한 수자원 사용량 절감 노력에 대해 긍정적인 평가를 받아 물 경영 부문 우수기업에 년 연속 선정됐다 유플러스는 년 연속으로 탄소 경영 우수기업에 이름을 올렸다 관계자는 유플러스는 올해 통신 업계에서 유일하게 탄소 경영 우수기업에 선정됐다 면서 인터넷 데이터 센터의 냉각탑 운전방식을 인버터 기술을 활용한 친환경 구조로 변경해 연간 전력 사용량을 이상 줄여 온실가스 배출량을 대폭 감축했다 고 설명했다 또 빌딩의 옥상 등에 를 연계한 태양광 발전 시설을 설치해 운영하는 친환경 비즈니스를 발굴하는 등 탄소 절감에 기여한 점을 긍정적으로 평가 받았다 한편 는 최근 상장회사 이사회 내에 위원회 를 상반기 내로 신설하기로 했다 이 위원회는 환경 안전 고객가치 주주가치 지배구조 등 환경 사회 지배구조 관련 전사 주요 정책을 심의하는 경영의 최고 심의 기구가 된다 정현진 기자
25,2021-04-29,"스타트가 좋다‥LG 생활가전, 美월풀 제치고 글로벌 No.1 수성(종합...",전자 사업부문별 실적 전자 제공 파이낸셜뉴스 전자 생활가전 사업부가 마의 억 영업이익을 넘기며 사상 최대 신기록을 세웠다 건조기 스타일러 식기세척기 등 스팀가전과 공간 인테리어 가전 오브제컬렉션 의 쌍끌이 전략으로 작년보다 조원 더 벌어들이며 글로벌 가전명가 월풀도 가뿐히 제쳤다 전자는 일 올 분기 연결기준 매출액 조 억원 영업이익 조 억원을 기록했다고 밝혔다 이는 매출액과 영업이익은 전년 동기 대비 각각 증가한 수치다 기존 최대 매출액 조 억원 년 분기 과 영업이익 조 억원 년 분기 을 웃돌며 이번에 역대 분기 사상 최대 실적을 새로 쓴 것이다 전자는 전체 영업이익의 이상을 생활가전에서 남겼다 생활가전을 담당하는 사업본부는 매출액 조 억원 영업이익 억원을 달성했다 매출액은 국내와 해외에서 각각 전년 동기 대비 두 자릿수의 성장률을 보였다 분기 영업이익 억원을 넘긴 것도 단일 사업부에서 이번이 처음이다 특히 미국 가전업체 월풀의 실적을 훨씬 웃돌며 올해 연간 매출 기준 세계 위 청신호가 켜졌다는 기대가 커지고 있다 월풀은 분기 매출 억 만 달러 약 조 억원 영업이익 억 만 달러 약 억원 을 기록하며 매출과 영업익 각각 전자와 억원 억원 가량 격차가 벌어졌다 지난해 분기보다 양사의 매출 격차가 억원 가랑 더 벌어진 셈이다 전자 관계자는 월풀에는 없는 독보적인 스팀가전과 공간 인테리어 가전 오브제컬렉션 이 큰 인기를 얻은 게 실적에 고스란히 반영됐다 면서 특히 세탁기 부문에서 드럼 통돌이뿐 아니라 나머지 시장의 분의 에 해당하는 교반식 봉돌이 세탁기도 판매 위를 달성했다 고 밝혔다 교반식 세탁기는 프리미엄 제품군의 경쟁력에서 밀린 미국 현지업체들의 마지막 텃밭으로 알려져 있다 여기에 차별화된 케어솔루션 서비스는 국내 수요를 촉진하고 있다 전자의 렌탈사업은 최근 년간 연평균 가량 성장해 왔다 를 총괄하는 사업본부는 매출액 조 억원 영업이익 억원을 기록 전년 동기 대비 각각 증가했다 북미 유럽 등 주요 시장에서 수요가 회복됨에 따라 올레드 나노셀 초대형 등 프리미엄 제품의 인기 덕분에 매출액은 전년 동기 대비 조 원 이상이 늘었다 특히 분기 올레드 판매량이 전년 동기 대비 배 이상 늘었다 영업이익은 액정표시장치 패널가격이 크게 상승했지만 프리미엄 제품의 판매 비중 확대와 투입 자원의 효율적인 집행으로 분기 만에 억 원을 넘었다 미래 먹거리로 점찍고 집중 투자 중인 전장 사업본부도 적자 영업손실 억원 폭을 줄였다 북미 유럽 등 주요 완성차 시장의 회복과 전기차 파워트레인과 인포테인먼트 분야의 신규 프로젝트가 늘며 매출액은 전년 동기 대비 늘어난 조 억원을 기록했다 세계 위 자동차 부품 업체인 마그나와 함께 설립하는 합작법인 엘지마그나 이파워트레인 가칭 은 올 월 일자로 출범할 예정이다 이 밖에도 사업을 총괄하는 사업본부는 매출액 조 억원 영업이익 억원을 기록했다 재택근무 원격교육이 지속되며 분기 사상 매출액을 냈다 분기 모바일 사업본부는 영업손실 억원을 내며 적자 폭을 키웠으나 분기엔 월 말 사업종료 예정인 휴대폰 사업의 실적이 영업이익에 반영되지 않고 중단영업손실로 처리되면서 올해 연간 영업이익이 역대 최고치를 달성할 가능성이 높게 점쳐진다 시장에선 올해 전자의 연간 영업익을 조원대로 예상하고 있다 회사 관계자는 생활가전 등 주력사업의 시장 지배력을 강화하고 자동차 부품 인공지능 사업 등에 대한 투자를 확대해 글로벌 시장에서 경쟁 우위를 확보할 계획 이라고 말했다 김서원 기자
26,2021-04-29,기후변화대응·물 경영분야 LG 4개社 '우수기업' 뽑혀,그룹이 주 디스플레이 이노텍 유플러스 등 개 상장사가 글로벌 지속가능경영 평가기관 탄소정보공개프로젝트 가 발표한 기후변화 대응 물 경영 우수기업 에 선정됐다고 일 밝혔다 비영리 기관인 는 매년 전 세계 여 개 기업을 대상으로 기후변화 대응 관련 경영 정보를 평가한다 국내에선 시가총액 상위 대 기업을 평가해 탄소 경영 부문 상위 개사 물 경영 부문 상위 개사를 선정한다 디스플레이는 탄소 경영과 물 경영에서 모두 최고 등급인 리더십 를 획득하며 우수기업으로 선정됐다 유플러스는 올해 통신 업계에서 유일하게 탄소 경영 우수기업에 선정됐다 박재영 기자
27,2021-04-29,"LG그룹 4개 상장사, CDP 기후변화대응 우수기업 선정돼",탄소 물경영 모두 최고등급 받은 비롯 총 개 그룹 상장사 선정 우수기업 자료사진 서경 서울경제 그룹은 와 디스플레이 이노텍 유플러스 등 개 상장사가 글로벌 지속가능경영 평가기관 탄소정보공개프로젝트 가 발표한 기후변화대응 물 경영 우수기업 에 선정됐다고 일 밝혔다 는 기후변화 대응 관련 경영 정보를 분석해 평가하는 비영리 기관으로 매년 국내 시가총액 상위 대 기업의 기후변화 대응 성과를 평가해 탄소 경영 부문 상위 개사 물 경영 부문 상위 개사를 선정한다 디스플레이는 탄소 경영과 물 경영 모두 최고 등급인 리더십 를 획득하며 우수기업으로 선정됐다 디스플레이는 지난해 온실가스 배출량을 년 대비 줄이고 수자원 보호를 위한 공정 개선 및 폐수 재이용 설비 투자 등 노력을 인정받았다 이노텍은 탄소 경영과 물 경영 부문 우수기업에 년 연속으로 선정됐다 신재생 에너지 도입 확대와 수자원 사용량 절감 노력을 높게 평가받았다고 설명했다 아울러 유플러스는 올해 통신 업계에서 유일하게 탄소 경영 우수기업에 선정됐고 도 탄소 경영 부문 우수기업에 년 연속 선정됐다 한편 는 최근 상장회사 이사회 내에 환경 안전과 고객가치 지배구조 등 환경 사회 지배구조 관련 전사 주요 정책을 심의하는 위원회 를 상반기 내로 신설하기로 하는 등 경영을 강화하고 있다 이수민 기자
28,2021-04-29,"‘인적 분할’ LG, 가치 재평가에 주가 상승 여력 高高 [株포트라이트...",전자 화학 등 주력 사업 강화 보유 현금자산 바탕으로 신규사업 발굴 헤럴드경제 이태형 기자 분할을 앞두고 거래 정지에 들어간 그룹 주가가 연일 신고가를 기록하며 주목을 받고 있다 전자 화학 통신 등 주력 계열사들의 실적 개선 전망과 신사업 발굴을 통한 신규 성장동력 확보로 현재 할인된 주가가 재평가를 받을 것이란 분석이다 일 금융투자업계에 따르면 일부터 월 일까지 주식 거래가 정지되는 는 마지막 거래일인 지난 일 만 원으로 주 신고가를 기록하며 거래를 마쳤다 앞서 이사회는 지난해 월 개 자회사 중에서 상사 실리콘웍스 하우시스 등 개 자회사 출자부문을 인적분할해 신규 지주회사인 홀딩스를 설립하는 분할계획안을 결의했다 변경 및 재상장일은 월 일이다 자료 하이투자증권 인적분할 이슈 등으로 지난 월 일 만 원이던 주가는 한달새 급등했지만 월 재상장 이후에도 추가 상승 여력이 충분하다고 증권업계는 전망한다 가 지주사라는 점을 감안해도 순자산가치 대비 할인율이 수준으로 주가가 저평가돼 있다는 분석이다 무엇보다 최근 실적 전망이 긍정적이다 금융정보업체 에프앤가이드에 따르면 지난해 영업이익이 전년 대비 늘어난 데 이어 올해 영업이익은 조 억원에 달할 것으로 전망된다 분기에만 약 억원의 영업이익을 냈을 것으로 추정된다 주력 계열사인 전자는 가전 및 사업 덕분에 시장 컨센서스를 크게 상회하는 잠정 실적을 공시했다 화학도 석유화학제품 수요가 급증하면서 사상 최대 분기 실적을 거뒀다 김동양 투자증권 연구원은 올해 주요 계열사들의 실적호조로 영업이익이 성장할 것으로 전망된다 며 코퍼레이션 등 비상장 자회사도 실적 개선이 지속되고 있다 고 분석했다 주력 사업 강화와 신사업 발굴에 따른 경쟁력 향상도 주가 상승의 기대감을 키우고 있다 그룹은 화학의 에너지솔루션 물적분할 전자와 캐나다 마그나의 전기차파워트레인 합작법인 설립 전자의 스마트폰 사업 정리 등 주력 사업에 집중하기 위한 구조 개편 작업을 진행 중이다 는 지난해 말 기준으로 조 억원 규모의 현금 및 현금성자산을 보유하고 있어 계열사 간 시너지를 낼 수 있는 신성장 동력 확보에도 박차를 가할 것으로 예상된다 이상헌 하이투자증권 연구원은 보유중인 현금 등을 활용해 관점에서 향후 스마트홈 모빌리티 등 딥테크와 바이오 디지털헬스케어 등에 투자함으로써 성장모멘텀을 찾을 것으로 예상된다 고 말했다 자회사로부터의 배당수입 증가 비상장자회사 지분 일부 유동화를 통한 현금유입 신성장 포트폴리오 강화 등으로 주가가 재평가 받을 것으로 예상되면서 증권사들도 목표주가를 상향 조정하고 있다 하이투자증권은 만원에서 만 원으로 상향조정했고 투자증권은 만 원을 제시했다 투자증권은 직전 만원에서 만원까지 목표주가를 높였다
29,2021-04-29,"‘인적 분할’ LG, 강력한 성장 모멘텀...“주가 여전히 저평가”",전자 화학 통신 등 주력 사업 강화 현금자산 바탕 새사업 발굴 속도 분할을 앞두고 거래 정지에 들어간 그룹 주가가 연일 신고가를 기록하며 주목을 받고 있다 전자 화학 통신 등 주력 계열사들의 실적 개선 전망과 신사업 발굴을 통한 신규 성장동력 확보로 현재 할인된 주가가 재평가를 받을 것이란 분석이다 일 금융투자업계에 따르면 이날부터 월 일까지 주식 거래가 정지되는 는 마지막 거래일인 지난 일 만 원으로 주 신고가를 기록하며 거래를 마쳤다 앞서 이사회는 지난해 월 개 자회사 중에서 상사 실리콘웍스 하우시스 등 개 자회사 출자부문을 인적분할해 신규 지주회사인 홀딩스를 설립하는 분할계획안을 결의했다 변경 및 재상장일은 월 일이다 인적분할 이슈 등으로 지난 월 일 만 원이던 주가는 한달새 급등했지만 월 재상장 이후에도 추가 상승 여력이 충분하다고 증권업계는 전망한다 가 지주사라는 점을 감안해도 순자산가치 대비 할인율이 수준으로 주가가 저평가돼 있다는 분석이다 무엇보다 최근 실적 전망이 긍정적이다 금융정보업체 에프앤가이드에 따르면 지난해 영업이익이 전년 대비 늘어난 데 이어 올해 영업이익은 조 억원에 달할 것으로 전망된다 분기에만 약 억원의 영업이익을 냈을 것으로 추정된다 주력 계열사인 전자는 가전 및 사업 덕분에 시장 컨센서스를 크게 상회하는 잠정 실적을 공시했다 화학도 석유화학제품 수요가 급증하면서 사상 최대 분기 실적을 거뒀다 김동양 투자증권 연구원은 올해 주요 계열사들의 실적호조로 영업이익이 성장할 것으로 전망된다 며 코퍼레이션 등 비상장 자회사도 실적 개선이 지속되고 있다 고 분석했다 주력 사업 강화와 신사업 발굴에 따른 경쟁력 향상도 주가 상승의 기대감을 키우고 있다 그룹은 화학의 에너지솔루션 물적분할 전자와 캐나다 마그나의 전기차파워트레인 합작법인 설립 전자의 스마트폰 사업 정리 등 주력 사업에 집중하기 위한 구조 개편 작업을 진행 중이다 는 지난해 말 기준으로 조 억원 규모의 현금 및 현금성자산을 보유하고 있어 계열사 간 시너지를 낼 수 있는 신성장 동력 확보에도 박차를 가할 것으로 예상된다 이상헌 하이투자증권 연구원은 보유중인 현금 등을 활용해 관점에서 향후 스마트홈 모빌리티 등 딥테크와 바이오 디지털헬스케어 등에 투자함으로써 성장모멘텀을 찾을 것으로 예상된다 고 말했다 자회사로부터의 배당수입 증가 비상장자회사 지분 일부 유동화를 통한 현금유입 신성장 포트폴리오 강화 등으로 주가가 재평가 받을 것으로 예상되면서 증권사들도 목표주가를 상향 조정하고 있다 하이투자증권은 만원에서 만 원으로 상향조정했고 투자증권은 만 원을 제시했다 투자증권은 직전 만원에서 만원까지 목표주가를 높였다 이태형 기자
