,날짜,기사제목,본문내용
30,2021-04-12,"바이든, '삼성 참석' 반도체 긴급 회의 직접 챙긴다",백악관 대통령 화상으로 참석할 것 조 바이든 미국 대통령 사진 조 바이든 미국 대통령이 일 이하 현지시간 화상으로 열리는 반도체 긴급 대책 회의에 직접 모습을 드러낸다 미 백악관은 이날 언론에 배포한 일정을 통해 바이든 대통령이 미국의 반도체 공급망 강화를 포함한 주요 분야들을 논의하기 위해 반도체와 공급망 복원 화상 회의 에 잠시 참석할 예정 이라고 밝혔다 이번 회의는 백악관 루스벨트 룸에서 이날 낮 시 한국시간 일 새벽 시 에 비공개 화상 회의 방식으로 열린다 삼성전자를 비롯해 대만 인텔 글로벌파운드리 등 전 세계 반도체 자동차 통신 기업 곳이 참석한다 삼성전자에선 이재용 부회장을 대신해 최시영 파운드리사업부장 사장 이 화상으로 회의에 참여할 것으로 알려졌다 제이크 설리번 미 국가안보보좌관이 주재하는 이번 회의는 글로벌 반도체 공급난에 대한 대응 방안과 함께 미국 내 반도체 공급망 체계를 강화할 목적으로 진행된다 이 때문에 업계에선 백악관이 삼성전자에 미 본토 투자 확대를 요구할 것으로 관측하고 있다 미국은 글로벌 반도체 공급망을 안보 와 직결된 이슈로 바라보고 있다 바이든 대통령은 취임 직후부터 희토류를 포함해 반도체 전기차 배터리 등 핵심 품목의 공급망 검토를 지시하는 행정명령에 서명하고 글로벌 파운드리 위 의 모국인 대만 당국에도 증산을 요청하는 등 반도체 부족을 중요한 과제로 인식하고 대응해왔다 이에 바이든 행정부는 미국 내 파운드리 신규 공장 투자를 비롯 삼성전자의 미국 현지 투자를 독려하고 있는 것으로 알려졌다 노정동 한경닷컴 기자
31,2021-04-12,"바이든, 삼성 참여 '반도체 대책회의' 직접 챙긴다",머니투데이 황시영 기자 일 삼성전자 등 개사 참석 반도체 부족 미국의 아젠다이자 미중전쟁 핵심 워싱턴 뉴시스 조 바이든 미국 대통령이 일 현지시간 백악관 사우스코트 강당에서 미국의 인프라 일자리 투자 법안에 관해 연설하고 있다 조 바이든 미국 대통령이 일 현지시간 글로벌 반도체 부족 현상을 타개하기 위해 백악관이 주최하는 반도체 서밋 에 직접 참석한다 이 회의에는 삼성전자를 비롯한 개 기업이 참석할 예정이다 백악관은 일 바이든 대통령의 일정을 공개하면서 그가 일 오후 한국 시각 일 새벽 에 열리는 반도체 공급 관련 화상 대책 회의에 참석한다고 밝혔다 백악관은 바이든 대통령은 미국 일자리 계획과 미국의 반도체 및 다른 핵심 분야 공급망의 탄력성을 강화하기 위한 조치를 논의하기 위해 화상 서밋에 잠시 참여할 것 이라고 밝혔다 회의에는 제이크 설리번 백악관 국가안보보좌관과 브라이언 디스 국가경제위원회 위원장 지나 레이몬도 상무장관도 참석할 예정이다 당초 이번 회의는 설리번 보좌관 주최로 개최될 예정이었으나 세계적인 반도체 대란과 미중 대립 속 공급망 확충 전략 등의 무게를 감안해 그 의미가 확대된 것으로 보인다 회의 참석 기업은 삼성전자와 대만 구글 모회사 알파벳 커민스 델 테크놀로지 포드 글로벌 파운드리 인텔 메드트로닉 마이크론 노스럽 그러먼 피스톤그룹 스카이워터 테크놀로지 스텔란티스 등 개사라고 백악관은 밝혔다 국내 기업 중 유일하게 참석 요청을 받은 삼성전자는 현재 미국 텍사스 오스틴에서 파운드리 반도체 위탁생산 공장을 운영 중이다 코로나 팬데믹 세계적 대유행 이후 세계 산업계는 미 중 갈등 가전 업계의 반도체 수요 증가 등 복합적 원인으로 반도체 품귀 현상을 겪고 있다 이로 인해 전세계적으로 자동차와 가전 스마트폰 등의 생산이 차질을 빚고 있다 백악관의 이번 회의 개최의 차적 목표는 당면한 반도체 부족 문제 해결일 수 있지만 그 이면에는 중국과 반도체 패권을 경쟁하고 있는 상황에서 주도권을 잡기 위한 의도가 깔려 있다는 해석이 나온다 이와 관련 뱅크오브아메리카 는 반도체 자급률을 높이는 것이 미국의 국가적인 아젠다로 등장했다 면서 미중 기술전쟁에서도 반도체가 핵심 이라고 분석했다 설리번 보좌관은 반도체 부족은 바이든 행정부가 가장 긴급하다고 여기는 경제와 국가안보의 최우선 순위 라며 반도체 부족으로 공장 가동이 멈춰서면서 미국인의 일상생활에 영향을 끼치고 있다 고 말한 바 있다 일본 니혼게이자이신문은 이번 회의에서 현재 아시아에 집중된 반도체 공급망 재편이라는 과제도 논의된다고 전했다 바이든 행정부가 일본 한국 대만과 연계해 보조금을 지급하고 미국내 반도체 생산을 늘리려 한다는 것이다 인텔은 이미 년 가동을 목표로 신공장 건설을 결정했고 삼성전자도 미국내 추가 공장 건설 문제를 협의 중이다 황시영 기자
32,2021-04-12,‘백악관 반도체 회의’ 바이든 대통령도 참석한다…삼성·TSMC 등 투자...,백악관 일정 발표에서 바이든 대통령 참석 최종 확정 일 현지시간 회의 참석 예정인 삼성 압박 커질 전망 조 바이든 미국 대통령 연합뉴스 헤럴드경제 양대근 기자 조 바이든 미국 대통령이 일 현지시간 삼성전자를 포함해 개 글로벌 기업을 대상으로 미국 정부가 진행하는 반도체 화상 회의 에 참석한다 미 대통령까지 회의에 직접 나서면서 삼성전자와 대만 등에 대한 투자 압박 수위가 더 강해질 수 있다는 관측도 제기된다 백악관은 이날 언론에 배포한 일정을 통해 바이든 대통령이 미국의 일자리 계획과 반도체 공급망 확대를 포함한 경제 대책을 논의하기 위한 반도체 기업들과 회의에 참여할 예정 이라고 밝혔다 루스벨트 룸에서 열리는 이날 회의는 제이크 설리번 국가안보보좌관과 브라이언디스 국가경제위원회 위원장이 주재하고 지나 러만도 상무장관도 참석한다 삼성전자를 비롯해 대만 구글 모회사 알파벳 커민스 델 테크놀로지 포드 글로벌 파운드리 인텔 메드트로닉 마이크론 노스럽 그러먼 피스톤그룹 스카이워터 테크놀로지 스텔란티스 등 개 기업이 초청됐다 삼성전자는 화상으로 이날 회의에 참석할 예정이며 반도체 부문의 최시영 사장 파운드리 사업부장 의 참석이 유력하다 반도체 업계에서는 이번 회의를 기점으로 삼성전자와 의 초대형 투자 계획과 관련 상당 부분 윤곽이 드러날 것으로 예상한다 현재 양사는 모두 미국 현지에 수백억 달러 규모의 투자를 검토하고 있는 상황이다 로이터통신 등 주요 외신들은 조 바이든 행정부가 이번 회의에서 미국 중심의 반도체 공급망 체계를 강화하고 자국 내 투자와 일자리 창출에 기여하는 방안을 모색할 것 이라고 분석했다 또한 삼성과 에 대한 투자 압박이 기존보다 더 커질 수 있다는 관측이 제기된다 당장 는 오는 일 분기 실적 발표 및 컨퍼런스콜을 개최한다 이날 컨퍼런스콜에서 애리조나와 일본 투자 등에 대한 구체적인 언급이 나올 전망이다 는 지난해 월 애리조나에 억 달러 약 조 억원 를 투자해 최첨단 반도체 공장을 짓겠다 고 발표한 바 있다 이를 위해 피닉스 북부에 대규모 반도체 공장을 건립하기 위한 부지를 매입했다 하지만 그 이후 피닉스시 당국과 보조금 등 협상이 지연되면서 공식 계약 및 발표가 미뤄지고 있다 애리조나 지역 언론은 가 당초 계획보다 배 더 큰 금액을 투자해 개의 반도체 공장을 지을 것 이라고 보도했지만 측은 이와 관련 공식 언급을 하지 않고 있다 삼성전자도 상황이 비슷하다 삼성은 억 달러 약 조원 를 투자해 반도체 공장을 증설하기로 하고 텍사스 뉴욕 애리조나주 등과 협상을 벌이고 있다 현재 텍사스주 오스틴시를 유력 후보지로 놓고 시 당국과 전력 수도 리스크 등을 감안한 새로운 인센티브 규모를 놓고 협상을 벌이고 있는 것으로 전해졌다 일각에선 백악관이 삼성과 측에 상당한 청구서 를 내밀 공산이 크다고 지적한다 삼성전자 고위 경영진들은 지난 주말도 반납하고 긴급 회의를 열어 미국의 요구에 어떻게 대응할 지 검토한 것으로 전해졌다
33,2021-04-12,베일 벗는 ‘백악관 회의’...삼성·TSMC 투자압박 ↑,일 컨퍼런스콜서 투자 계획 발표 천문학적 투자앞둔 삼성전자도 상황 예의주시 일 현지시간 미국 백악관이 주최하는 반도체 공급망 확충 회의가 임박한 가운데 파운드리 반도체 위탁생산 공룡 인 삼성전자와 대만 에 대한 미국의 투자 압박도 한층 거세지고 있다 업계에 따르면 대만의 반도체 업체 는 오는 일 분기 실적 발표 및 컨퍼런스콜을 개최해 애리조나와 일본 투자 등에 대해 구체적인 내용을 언급할 예정이다 사실상 신규 투자를 확정하는 수순이 될 것으로 예상된다 대형 투자를 고민하고 있는 삼성전자도 긴장 속에 상황을 주시하고 있다 로이터통신 등 주요 외신들은 조 바이든 행정부가 이번 회의에서 미국 중심의 반도체 공급망 체계를 강화하고 자국 내 투자와 일자리 창출에 기여하는 방안을 모색할 것 이라고 분석했다 반도체 업계에서는 이번 회의를 기점으로 그동안 베일에 쌓였던 두 회사의 초대형 투자 계획과 관련 상당 부분 윤곽이 드러날 것으로 예상한다 이번 회의에는 미국의 주요 반도체 통신 기업과 완성차 및 자동차 부품회사를 비롯해 글로벌 파운드리 및 차량용 반도체 회사 등 총 개 기업이 참석한다 초청장을 받은 삼성전자와 는 화상으로 회의에 참석할 것이 확실시된다 삼성과 에 대한 투자 압박이 기존보다 더 커질 수 있다는 관측이 제기된다 는 지난해 월 애리조나에 억 달러 약 조 억원 를 투자해 최첨단 반도체 공장을 짓겠다 고 발표한 바 있다 이를 위해 피닉스 북부에 대규모 반도체 공장을 건립하기 위한 부지를 매입했다 하지만 그 이후 피닉스시 당국과 보조금 등 협상이 지연되면서 공식 계약 및 발표가 미뤄지고 있다 애리조나 지역 언론은 가 당초 계획보다 배 더 큰 금액을 투자해 개의 반도체 공장을 지을 것 이라고 보도했지만 측은 이와 관련 공식 언급을 하지 않고 있다 삼성전자도 상황이 비슷하다 삼성은 억 달러 약 조원 를 투자해 반도체 공장을 증설하기로 하고 텍사스 뉴욕 애리조나주 등과 협상을 벌이고 있다 현재 텍사스주 오스틴시를 유력 후보지로 놓고 시 당국과 전력 수도 리스크 등을 감안한 새로운 인센티브 규모에 대해 줄다리기를 벌이고 있지만 지난 월 북극발 한파 등의 여파로 논의가 지연되고 있다 또한 백악관 회의에서 차량용 반도체 공급망 확충 관련 삼성전자와 에 구체적인 요구 사항이 나올 지도 주목된다 한국자동차연구원은 이날 산업동향보고서를 통해 최근 수급 차질이 가장 큰 품목은 차량의 전장 시스템을 제어하는 마이크로콘트롤유닛 이라고 지적했다 일례로 대만 는 반도체 주문 폭주로 생산 리드 타임 발주부터 납품까지의 소요시간 이 기존 주에서 현재 주 주까지 늘어났다 한국자동차연구원은 국내 자동차 업계는 차량용 반도체의 를 해외에 의존하고 있고 등 주요 품목의 국내 공급망은 존재하지 않는 상황 이라며 국내 기업들은 보다는 애플리케이션프로세서 와 같은 고성능 차량용 반도체 시장에서 기회를 모색할 필요가 있다 고 조언했다 양대근 기자
34,2021-04-12,이정배 삼성전자 사장의 ‘조용한’ 반도체산업협회장 취임,전임 협회장 대신해 지난달 임기 시작 삼성에선 메모리사업부장이 협회장 맡는 관행 협회 외부에 적극 알리지 않아 코로나 상황에 전임 협회장 예우 이 사장의 겸손한 성품도 영향 내년 취임 협회장은 하이닉스 이정배 신임 반도체산업협회장 삼성전자 메모리사업부장 한경 이정배 삼성전자 메모리사업부장 사장 사진 이 지난달 대 반도체산업협회장으로 취임했다 일 업계에 따르면 협회는 지난 월 이사회와 정기총회를 서면 회의로 대체하고 이 협회장 취임을 임원사들에 공지했다 반도체산업협회는 국내 최대 규모 업종협회 중 한 곳으로 꼽힌다 회원사 수는 여곳이다 삼성전자 하이닉스 뿐만 아니라 동진쎄미켐 주성엔지니어링 등 장비 소재 업체 램리서치 같은 외국계 기업들도 가입해있다 협회는 과거 협회장 취임 때 행사 사진과 취임사 등을 외부에 공개했다 하지만 지난달 이 협회장 취임 땐 별도 외부 공지 없이 조용히 넘어갔다 이유가 뭘까 전임자 임기가 남은 상황에서 이 협회장이 중도 취임한 영향이 크다는 분석이 나온다 삼성전자에서 협회장을 맡을 땐 램 낸드플래시 사업을 총괄하는 메모리사업부장이 나서는 게 관행이다 전임 협회장인 진교영 삼성전자 종합기술원장 사장 도 년 월 협회장 취임 당시 메모리사업부장이었다 지난해 월 삼성 사장단 인사에서 진 사장이 삼성의 선행기술 연구개발 을 총괄하는 종합기술원장으로 이동했고 이정배 당시 메모리사업부 램개발실장 부사장 이 사장으로 승진 메모리사업부장에 올랐다 일각에선 진 사장이 삼성전자 현직이고 임기 년 중 년이 남은 만큼 계속 협회장을 맡을 것이란 관측이 나왔다 하지만 진 사장이 고사했고 결국 신임 메모리사업부장인 이 사장이 협회장에 취임했다 과거에도 삼성전자 출신 협회장이 중도퇴임하고 후임이 잔여 임기를 채운 사례가 있었다 년 월 김기남 당시 메모리사업부장이 삼성 사장으로 옮긴 전동수 협회장을 대신한 적이 있다 당시엔 취임행사가 열렸고 취임사 등이 외부로 나갔다 이번에 협회가 신임 협회장 취임 등을 외부에 알리지 않은 건 코로나 상황 전임 협회장인 진 사장에 대한 예우 외부에 드러나는 걸 원치 않는 이 사장의 성품 등이 복합적으로 작용했다는 평가가 나온다 협회 관계자는 회원사 인사에 따른 협회장 변동은 협회장을 맡은 회사에서 결정할 사안 이라고 설명했다 이 협회장의 임기는 내년 월 끝난다 차기 협회장엔 하이닉스 대표 가 취임할 예정이다 삼성전자와 하이닉스가 년 임기 협회장을 번갈아가며 맡는 게 암묵적인 룰이다 황정수 기자
35,2021-04-12,"삼성전자, 반도체 해외 인재 공격적 수혈",센터 구글 출신 임원 영입 반도체 공정 자동화 구현 목표 영역 전문가 등 파격적 투자 경영지원실엔 전문가 삼성전자 연구원들이 반도체 제조 공정을 점검하고 있다 삼성전자 제공 삼성전자가 반도체 사업 부문 에서 해외 젊은 인재 영입에 박차를 가하고 있다 마이크론 등 글로벌 반도체 기업들이 인력 확보 전쟁을 벌이는 있는 상황에서 공격적인 채용으로 우위를 점하겠다는 전략으로 풀이된다 최근 반도체 부족 현상에 업황 호황으로 우수한 인재 확보 경쟁은 치열해질 것으로 예상된다 일 업계에 따르면 삼성전자는 부문 데이터 센터는 올 초 소프트웨어 전문가 명을 담당임원으로 선임했다 이 가운데 특히 구글 출신의 년생 젊은 임원이 눈에 띈다 삼성전자는 최근 윤석진 박창서 연구위원을 센터 상무로 선임했다 센터는 제조 공정에 인공지능 을 접목해 반도체 사업에 필요한 데이터를 관리하고 엔지니어링 업무의 혁신을 이끌기 위해 신설된 조직이다 삼성은 로드맵을 수립하고 관련 인프라스트럭처와 플랫폼을 구축하기 위해 관련 인재 영입에 힘을 싣고 있으며 그 일환으로 소프트웨어 전문가로 꼽히는 윤 상무와 박 상무도 영입된 것으로 분석된다 특히 박 상무는 서울대 컴퓨터공학과를 나와 미국 스탠포드대 컴퓨터공학 석사 미국 버클리 컴퓨터공학 박사 학위를 취득한 후 구글에서 년간 소프트웨어 엔지니어로 근무한 인재로 꼽힌다 그는 년생 임원으로 젊은 인재 수혈 차원에서 이번에 영입됐다는 평가가 나온다 삼성전자는 지난해 부문 산하에 로드맵을 수립하고 관련 인프라스트럭처와 플랫폼을 구축하는 센터를 신설했다 반도체 생산 공정에 머신러닝 딥러닝 등을 활용해 자동화를 구현하겠다는 목표다 이를 위해 미국 뉴욕주립대 일본 도쿄대는 해외 유명 대학교의 박사급 인재 영입에 나선데 이어 소프트웨어는 물론 영역의 전문가 모시기에 투자를 아끼지 않고 있다 삼성전자 관계자는 생산 공장 자동화를 위해 다양한 소프트웨어가 활용되다보니 관련 인력을 영입한 것 이라고 말했다 한편 부문 경영지원실은 최근 전사자원관리 전문가도 영입했다 코리아에서 글로벌 전략에 대해 자문한데 이어 두산그룹에서 드지털라이제이션 서비스를 맡아온 이남호씨를 상무로 선임했다 삼성전자는 최근 새로운 비즈니스의 등장과 융복합화 등 미래 경영환경의 변화를 지원할 수 있는 혁신 플랫폼을 마련하기 위해 최신 기술의 전문 솔루션 패키지를 개발한데 이어 관련 전문가도 영입했다 업계 관계자는 분기 반도체 업황 호황이 예상되면서 전문인력에 대한 수요는 더 늘어날 것으로 예상된다 며 해외 젊은 인재를 선점하려는 포석으로 풀이된다 고 분석했다 김성미 기자
36,2021-04-12,"삼성전자·SK하이닉스, 1분기 시총 1·2위...CCTV종목 선전도",연구소 분기 여 곳 시가총액 변동 현황 조사 시총 조 조로 네이버 삼성전자 화학 건설 운송 게임 강세 바이오 배터리 약세 이데일리 신민준 기자 올해 분기 삼성전자와 하이닉스가 시가총액 부동의 위를 기록했다 아울러 국내 주식시장의 시총은 조원 넘게 증가했고 시총 조 클럽에 가입한 곳도 곳 늘었다 업종별로는 화학 건설 운송 게임 업종 이른바 업종이 강세를 보였다 곳 중 곳 분기 시총 성적표 향상 기업분석 전문 한국 연구소는 년 분기 국내 주식시장 시가총액 변동 현황 분석 결과 상장사 여 곳의 시가총액은 올해 초 조 억원에서 월 말 조 억 원으로 조 억원 증가했다고 일 밝혔다 조사 대상 주식종목은 우선주를 제외한 곳이다 올해 초 월 일 와 월 말 일 시가총액과 주가 변동 현황 등을 비교했다 삼성전자 와 하이닉스 가 각각 조 억원 조 억원으로 시총 규모 위와 위를 차지했다 또 시총이 증가한 기업은 곳으로 조사 대상 주식종목의 에 달했다 곳 중 곳 꼴로 증가해 올해 분기 시총 성적표가 향상됐다는 의미다 시총 조 클럽 기업 수도 올해 초 곳에서 월 말 곳으로 곳 늘었다 분기에 시총 덩치가 가장 많이 커진 곳은 네이버 였다 이 주식종목은 올해 초 조 억원이던 시총이 월 말에는 조 억원으로 분기에만 조 억원 넘게 상승했다 분기 새 시총 외형이 나 커진 셈이다 네이버 주가가 올 월 일 기준 만 원에서 월 일 만 원으로 높아진 점이 영향을 미쳤다 이외에 카카오 조 억원 기아 조 억원 금융 조 억 원 이 개월 새 시총이 조원 넘게 커졌다 포스코케미칼 하이닉스 대한항공 포스코 등은 조원 넘게 시총이 올랐다 이중 대한항공은 주가는 떨어졌지만 주식 수가 크게 증가하면서 올해 초 조 억원에서 월 말 조 억원으로 시총 규모가 커졌다 시총 순위도 위에서 위로 위권대에 안착했다 반면 삼성전자는 올해 초 시총이 조 억원이었지만 월 말 조 억 원으로 조 억원 줄었다 화학 조 억 원 삼성바이오로직스 조 억원 바이오팜 조 억원 삼성물산 조 억원 셀트리온 조 억원 도 분기에 시총이 조원 넘게 쪼그라들었다 분기 시총 중 곳 순위 달라져 올해 초 시총 에 이름을 올린 곳 중 곳은 월 말에 탈락한 것으로 조사됐다 곳이 분기에 시총 대 기업에 새로 입성했다는 얘기다 분기에 시총 대 클럽에 가입한 곳 중 시총 순위가 가장 크게 오른 곳은 건설기계 장비 업체 두산밥캣 이다 두산밥캣은 올해 초 시총 위에서 월 말 위로 계단이나 올라섰다 두산밥캣의 올해 초 시총은 조 억원에서 월 말 조 억 원으로 조 억원 상승했다 한국항공우주 도 위에서 위로 계단이나 전진했다 반면 에이치엘비 는 올해 초만 해도 시총 위를 유지하다 월 말에는 위로 계단이나 밀려났다 제약 바이오 업체들의 시총 약세가 두드러졌다 씨젠 위 위 과 신풍제약 위 위 등의 순위가 뒤로 밀렸다 시총 상위 판세도 요동쳤다 곳 중 곳은 올 분기에 그나마 시총 순위를 지켰다 삼성전자 위 하이닉스 위 삼성 위 가 해당 주식종목들이다 이와 달리 곳 중 곳은 시총 순위가 뒷걸음쳤다 이중 현대모비스 는 올해 초 시총 순위 위에서 월 말에는 위로 에서 빠졌다 화학 위 위 과 삼성바이오로직스 위 위 셀트리온 위 위 도 시총 순위가 내려앉았다 기아 는 올해 초 위에서 월 말 위로 새 맴버로 신고했다 월 말 기준 시총 조 클럽에 가입한 곳 중 주가 상승으로 시총 증가율이 가장 크게 오른 곳은 게임업체 데브시스터즈 였다 이 곳의 분기 시총 증가율은 무려 에 달했다 오일선 소장은 올해 분기 주식시장은 화학 건설 해운 항공 등의 운송 게임 관련 업체 등을 아우르는 종목들이 크게 약진했다 며 반면 바이오 와 배터리 를 포함한 종목은 상대적으로 약세를 보이는 곳이 많았다 고 말했다 신민준
37,2021-04-12,4월 1~10일 수출 24.8% 증가…삼성전자 SK하이닉스 현대차 견인,스마트폰 등 무선기기 승용차 반도체 부산항 신선대 컨테이너 터미널 사진출처 연합뉴스 월 들어 지난 일부터 일까지 수출금액이 무선통신기기 승용차 반도체 등의 강세로 전년 대비 가량 증가했다 일 관세청에 따르면 이달 일 수출액 통관기준 잠정치 은 억 만달러로 집계됐다 전년 동기 대비 억 달러 증가했다 이 기간 조업일수는 일로 지난해 일 보다 일이 적었다 조업일수를 반영한 일평균 수출액은 늘었다 조업일수를 고려하지 않은 통계에선 전년 대비 무선통신기기 석유제품 승용차 반도체 가 증가했다 반면 컴퓨터 주변기기 수출액은 줄었다 수출 상대국별로는 베트남 중국 미국 유럽연합 일본 증가했지만 중동은 감소했다 같은 기간 수입액은 억 만달러로 전년 동기 대비 억 달러 늘었다 조업일수를 고려하지 않은 통계에서 석유제품 원유 승용차 기계류 등 수입금액이 많아졌지만 가스 와 반도체는 줄었다 수입 상대국별로는 미국 호주 중동 베트남 일본 등이 늘었다 중국은 감소했다 월 일 일 수출입실적 통관기준 잠정치 사진 관세청 김승한 매경닷컴 기자
