,날짜,기사제목,본문내용
16,2021-04-12,"바이든, 반도체 긴급 회의 직접 참석…삼성, 투자 결정 빨라지나",조 바이든 대통령 반도체 논의 서밋 화상으로 참석 삼성전자 이재용 부회장 대신 최시영 사장 참석 예정 반도체 동맹 강화 차원 보조금 지급 제안 예상 이데일리 배진솔 기자 조 바이든 미국 대통령이 일 화상으로 열리는 반도체 공급 부족 문제를 논의하기 위한 최고경영자 서밋 에 직접 참석한다 삼성전자에서는 최시영 삼성전자 파운드리사업부장 사장 이 참석할 것으로 전해진다 조 바이든 미국 대통령 사진 일 현지시각 조 바이든 미국 대통령은 화상으로 열리는 반도체 긴급대책회의 에 직접 참석할 예정이다 백악관은 이날 바이든 대통령의 다음날 일정을 공지하면서 바이든 대통령이 미국 일자리 계획 과 미국의 반도체 공급망 강화를 포함한 다른 주요 분야들을 논의하기 위한 반도체와 공급망 복원 화상 회의 에 잠시 참석한다 고 밝혔다 한국시각으로 일 오전 시께다 온라인 화상으로 진행되는 이번 회의에는 삼성전자 와 대만 구글 모회사 알파벳 커민스 델 테크놀로지 포드 글로벌 파운드리 인텔 메드트로닉 마이크론 노스럽 그러먼 피스톤그룹 스카이워터 테크놀로지 스텔란티스 등 개사가 참석한다 국내 기업 중 유일하게 참석 요청을 받은 삼성전자는 현재 미국 텍사스주 오스틴에 파운드리 반도체 위탁생산 공장을 운영하고 있다 이날 회의에는 수감 중인 이재용 부회장을 대신해 최시영 사장이 화상으로 참석할 것으로 알려졌다 당초 이번 회의는 제이크 설리번 미 국가안보보좌관과 브라이언 디스 국가경제위원회 위원장이 주재로 개최될 예정이었으나 전 세계적인 반도체 대란과 미중 대립 속 공급망 확충 전략 등의 무게를 감안해 그 의미가 확대된 것으로 보인다 미국은 이번 회의를 통해 주요 동맹 국가들을 반도체 동맹 을 한층 더 강화할 것으로 관측된다 바이든 정부는 공급망 재편을 위해 일본 한국 대만과 연계해 보조금을 지급하고 미국내 반도체 생산을 늘릴 제안서를 내밀 수도 있다는 분석이 나온다 삼성전자는 미국내 추가 공장 건설 문제를 협의 중이다 그간 미국 오스틴 정부와 현지 파운드리 공장의 추가 설비투자 계획을 놓고 세제혜택 규모에 대한 줄다리기를 벌여온 만큼 미국 정부의 획기적인 협상책이 나올 수도 있다 또 미국 정부는 반도체 공급대란 문제를 국가 대 국가 외교 안보 차원에서 대응해야 할 문제로 보고 공급망 검토를 지시하는 행정명령에 서명하는 등 적극적으로 나서고 있어 삼성전자에 대한 투자규모 확대 및 조기투자를 압박할 것으로 예측된다 김동원 증권 연구원은 이와 관련 백악관 반도체 긴급회의 이후 미 행정부는 세제혜택을 포함한 다양한 인센티브를 삼성전자에 제공해 미국 내 투자를 유도할 것으로 예상된다 며 이번 백악관 회의가 미국에 조원 규모의 비메모리 반도체 투자가 예상되는 삼성전자의 조기 투자 결정을 앞당기는 계기가 될 것 이라고 예상했다 배진솔
17,2021-04-12,"백악관 초대 받은 삼성…바이든, 얼마짜리 청구서 꺼낼까",머니투데이 오문영 기자 조 바이든 미국 대통령이 지난 월 일 현지시간 백악관 집무실에서 반도체 등의 미국 공급망을 논의하기 위해 의원들과 만난 자리에서 반도체 칩을 들고 발언하고 있다 뉴시스 백악관의 초대장을 받은 삼성전자의 셈법이 분주하다 전세계적인 반도체 공급 부족에 따른 수급 현황 파악이 회의 소집의 표면적인 이유지만 이 자리에서 미국 내 공장 증설이나 차량용 반도체 생산 요구를 받을 수 있어서다 일 업계와 외신에 따르면 백악관은 이날 오후 현지시간 한국시간 일 새벽 반도체 공급망 화상 회의를 연다 반도체 수급난으로 전 세계적으로 자동차와 가전 등 생산이 차질을 빚고 있는 가운데 미 당국자들과 기업인들이 해결책을 논의하고자 모이는 자리다 백악관이 공개한 개의 초청 기업 명단 가운데 개 기업은 반도체 수급에 어려움을 겪고 있는 미국 회사다 반도체 생산업체로는 삼성전자를 비롯해 대만 파운드리업체 네덜란드 차량용 반도체 업체 종합반도체 업체 인텔 등이 참석한다 다가온 바이든 청구서 삼성전자 화답에 이목 표면적인 회의 소집 배경은 수급 현황 파악과 해결책 논의이지만 업계는 미국 내 반도체 생산기지 유치를 위한 압박과 회유의 자리가 될 것이라 보고 있다 반도체 수급난이 발생한 직후 바이든 행정부는 자립화 카드를 꺼내들었다 그 이면에는 동아시아에 집중돼 있는 반도체 생산력으로 미국이 경제적 안보적으로 취약해졌다는 분석이 깔려있다 미국 주도의 반도체 동맹의 출발을 알리는 신호탄이 될 수 있다는 해석도 나온다 국가안보 보좌관이 회의를 주재하는 점에서 반도체 산업을 경제 이슈 차원을 넘어선 안보 문제로 보는 미국 정부의 시각이 묻어난다는 평가다 바이든 대통령도 상황의 심각함을 감안해 회의에 직접 참여하는 방안을 고려하고 있는 것으로 알려졌다 삼성전자가 미국 정부의 초청에 어떤 답을 내놓을지는 유독 주목받고 있다 회의에 참석하는 반도체 생산 업체들 중에 파운드리 반도체 위탁생산 투자를 당장에 진행할 수 있는 여력을 가진 업체는 삼성전자와 인텔 정도로 좁혀진다 삼성전자 외 두 기업은 미국 내 대규모 투자를 공식화한 상태다 지난 월 미국과 대만 정부는 고위급 경제회담에서 반도체 공급망 재구축에 합의하기도 했다 삼성도 미국 현지에서의 공장 증설을 검토하고 있지만 문제는 투자 시점과 혜택 규모에 대한 결정이 앞당겨질 수 있다는 데 있다 텍사스주와 뉴욕 애리조나 주정부와 협상을 진행하고 있는 상황에서 미국 정부가 현지 투자 진행 여부에 대한 확답을 요구한다면 입장이 난처해질 수 있다 최근 반도체 대란의 원인인 차량용 반도체를 공급해달라는 요구도 삼성전자 입장에서는 곤혹스럽다 삼성전자는 차량용 반도체를 거의 생산하고 있지 않다 스마트폰용에 비해 제조 품질관리가 훨씬 까다로운 반면 수익률은 적기 때문이다 주문제작 방식으로 일부 생산 중인 차량용 반도체는 인포테인먼트 자율주행용으로 수급난이 발생하고 있는 품목과는 다르다 조원 투자에 속도 낼까 대중국 관계는 부담 바이든 정부가 미국 내 시설 투자를 유인하기 위해 각종 인센티브를 제공하는 방안을 추진 중인 만큼 삼성전자에게 이번 회의가 기회로 작용할 수 있다는 분석도 나온다 미국 정부는 지난달 일 억달러 약 조원 를 반도체 산업 공장 건설과 연구개발에 지원하겠다는 계획을 발표했다 이와 별개로 미국 상원 지도부는 자국 반도체 사업을 지원하는 법안을 준비 중이다 바이든 대통령은 지난 일 척 슈머 상원 민주당 원내대표와 미치 매코널 상원 공화당 원내대표가 반도체 지원책과 관련된 법안을 발의할 것 이라 예고하기도 했다 분명히 미국은 삼성전자에게 매력적인 선택지 중에 하나다 미국에는 구글과 애플 등 반도체 최대 고객사가 있다 비용 절감 뿐만 아니라 고객 유치에도 많은 도움이 될 수 있다는 분석이다 안기현 한국반도체산업협회 상무는 결국 어느 정도의 세제 감면 등 혜택을 이끌어내느냐가 관건이 될 것 이라 말했다 다만 중국과의 관계는 변수로 꼽힌다 백악관 회의를 기점으로 미국 투자에 속도를 낸다면 중국과의 관계가 불편해질 수 있다는 우려가 업계에서 나온다 미국과 무역분쟁을 벌이고 있는 중국 입장에서 삼성전자의 행보를 단순히 산업성 측면에서만 바라보지 않을 것이란 설명이다 중국은 삼성전자 매출의 이상을 차지하는 주요 시장이기도 하다 샤오미와 오포 비보 등 삼성전자로부터 메모리반도체를 공급받는 스마트폰 업체들이 있다 산시상 시안과 쑤저우에서는 각각 낸드플래시 생산 공장과 반도체 후공정 패키징 공장을 운영하고 있기도 하다 김기남 삼성전자 부회장을 비롯해 반도체 사업본부 고위 임원들은 지난 주말에도 사무실에 나와 백악관 화상회의와 관련한 준비를 진행한 것으로 알려졌다 삼성전자에서는 수감 중인 이재용 부회장을 대신해 최시영 파운드리사업부장 사장 이 회의에 모습을 드러낼 것으로 보인다 삼성전자 오스틴 공장은 물론 이번에 증설을 검토 중인 것도 파운드리사업부 소관이다 오문영 기자
18,2021-04-12,"바이든도 오는 백악관 회의…삼성전자, 美 투자 속도 낼까(종합)",이미지출처 연합뉴스 아시아경제 정현진 기자 삼성전자가 미국 백악관 회의 참석을 계기로 현지 반도체 공장 신 증설 투자 결정에 속도를 낼 것이라는 전망이 나온다 조 바이든 미국 대통령이 회의에 잠시 참석하기로 하면서 반도체 관련 이슈에 대한 논의가 어디까지 이뤄질 지 관심이 쏠린다 삼성전자는 일 현지시간 오후 시 미국 백악관이 주최하는 반도체 관련 화상 회의에 한국 기업으로는 유일하게 참석할 예정이다 회의에는 현재 구속 상태인 이재용 부회장을 대신해 최시영 파운드리 사업부장 사장 의 참석이 유력한 것으로 전해진다 제이크 설리번 미 국가안보회의 보좌관과 브라이언 디스 미 국가경제위원회 위원장이 주재하는 이번 회의에는 세계 파운드리 반도체 위탁생산 위 업체 를 비롯해 인텔 글로벌파운드리 등 반도체 업체들과 포드 등 자동차 업체까지 총 개 기업이 참석한다 이 중 개사가 최근 반도체 부족으로 인해 생산과 서비스에 어려움을 겪고 있는 미국 자동차 기업이다 향후 반도체 부품 수급난이 예상되는 알파벳 델과 같은 업체와 방산업체 의료업체들도 참석한다 이 회의에는 바이든 대통령도 참석한다 백악관은 설리번 보좌관과 디스 위원장 지나 레이몬도 상무부 장관 등이 회의에 참석한다면서 바이든 대통령도 잠시 회의에 참여할 것이라고 밝혔다 이 회의에 참석한 바이든 대통령은 두시간 가량 뒤 반도체 이슈 등이 포함된 미국 일자리 계획 과 관련해 국회의원들과 논의를 하기 위해 만남을 갖기도 한다 업계에서는 반도체 품귀 현상을 계기로 반도체 제조시설 유치에 총력을 기울이고 있는 미국 정부가 이번 회의를 통해 공급을 원활하게 해달라 면서 자국 내 투자를 요구할 것으로 보고 있다 백악관이 이번 회의에서 미국 일자리 계획 과 반도체 등 주요 분야의 미국 공급망 강화를 논의하겠다고 밝힌 만큼 대규모 일자리 창출 등이 가능한 공장 설립 등을 압박할 가능성이 클 것으로 전망된다 이에 따라 삼성전자도 그동안 검토해왔던 미국 투자 속도를 낼 지 업계에서는 주목하고 있다 삼성전자는 현재 공장이 있는 텍사스 오스틴과 애리조나 뉴욕 등을 놓고 억달러 약 조원 규모의 반도체 공장 신 증설을 검토해왔다 첨단공정이 가능한 파운드리를 고려해온 만큼 세제 혜택과 같은 인센티브 여부에 따라 협의가 이뤄질 가능성도 있다 다만 미국과 중국이 반도체 패권을 놓고 치열하게 경쟁을 하고 있는 상황에 자칫 급하게 미국 투자 결정을 내리면 삼성전자의 중국 사업도 부담이 커질 수 있는 만큼 전략적 판단이 중요하다고 일각에서는 보고 있다 미국의 자국 투자 요구를 받아들일 경우 중국도 시안에 있는 삼성전자 공장에 추가 투자를 요구할 수 있다는 전망도 제기된다 국내 반도체 업계 관계자는 미국이 삼성전자에 무조건적으로 압박만 할 순 없을 것 이라면서 세제혜택과 같은 당근 을 주며 반도체 제조시설을 유치하려는 과정을 밟아나갈 수 있다 고 내다봤다 정현진 기자
19,2021-04-12,백악관 회의 참석하는 삼성전자…美 투자 속도 낼까,이미지출처 연합뉴스 아시아경제 정현진 기자 삼성전자가 미국 백악관 회의 참석을 계기로 현지 반도체 공장 신 증설 투자 결정에 속도를 낼 것이라는 전망이 나온다 삼성전자는 일 현지시간 미국 백악관이 주최하는 반도체 관련 화상 회의에 한국 기업으로는 유일하게 참석할 예정이다 회의에는 현재 구속 상태인 이재용 부회장을 대신해 최시영 파운드리 사업부장 사장 의 참석이 유력한 것으로 전해진다 제이크 설리번 미 국가안보회의 보좌관과 브라이언 디스 미 국가경제위원회 위원장이 주재하는 이번 회의에는 세계 파운드리 반도체 위탁생산 위 업체 를 비롯해 인텔 글로벌파운드리 등 반도체 업체들과 포드 등 자동차 업체까지 총 개 기업이 참석한다 이 중 개사가 최근 반도체 부족으로 인해 생산과 서비스에 어려움을 겪고 있는 미국 자동차 기업이다 향후 반도체 부품 수급난이 예상되는 알파벳 델과 같은 업체와 방산업체 의료업체들도 참석한다 업계에서는 반도체 품귀 현상을 계기로 반도체 제조시설 유치에 총력을 기울이고 있는 미국 정부가 이번 회의를 통해 공급을 원활하게 해달라 면서 자국 내 투자를 요구할 것으로 보고 있다 백악관이 이번 회의에서 미국 일자리 계획 과 반도체 등 주요 분야의 미국 공급망 강화를 논의하겠다고 밝힌 만큼 대규모 일자리 창출 등이 가능한 공장 설립 등을 압박할 가능성이 클 것으로 전망된다 이에 따라 삼성전자도 그동안 검토해왔던 미국 투자 속도를 낼 지 업계에서는 주목하고 있다 삼성전자는 현재 공장이 있는 텍사스 오스틴과 애리조나 뉴욕 등을 놓고 억달러 약 조원 규모의 반도체 공장 신 증설을 검토해왔다 다만 미국과 중국이 반도체 패권을 놓고 치열하게 경쟁을 하고 있는 상황에 자칫 급하게 미국 투자 결정을 내리면 삼성전자의 중국 사업도 부담이 커질 수 있는 만큼 전략적 판단이 중요하다고 일각에서는 보고 있다 국내 반도체 업계 관계자는 미국이 삼성전자에 무조건적으로 압박만 할 순 없을 것 이라면서 세제혜택과 같은 당근 을 주며 반도체 제조시설을 유치하려는 과정을 밟아나갈 수 있다 고 내다봤다 정현진 기자
20,2021-04-12,"백악관, 삼성에 美 투자 확대 요구할 듯…주말에도 대책회의",일 현지시간 반도체 긴급대책회의 국내기업 중 삼성전자 유일 초대받아 김기남 부회장 등 고위경영진 주말회의 삼성전자 미국 텍사스 오스틴 파운드리 공장 전경 삼성전자 제공 삼성전자가 일 현지시간 한국시간 일 새벽 미국 백악관이 주최하는 전 세계 반도체 공급 부족 관련 긴급 대책 회의에 국내 기업으로는 유일하게 참석한다 온라인 화상 회의 방식으로 열리는 이번 회의에는 삼성전자를 비롯해 대만 인텔 글로벌파운드리 등 전 세계 반도체 자동차 통신 기업 곳이 참석한다 삼성전자에선 이재용 부회장을 대신해 최시영 파운드리사업부장 사장 이 화상으로 회의에 참여할 것으로 알려졌다 김기남 부회장을 비롯한 삼성전자 고위경영진은 지난 주말에도 모여 이번 회의에 대한 대책을 논의한 것으로 전해졌다 제이크 설리번 미 국가안보보좌관이 주재하는 이번 회의는 글로벌 반도체 공급난에 대한 대응 방안과 함께 미국 내 반도체 공급망 체계를 강화할 목적으로 진행된다 이 때문에 업계에선 백악관이 삼성전자에 미 본토 투자 확대를 요구할 것으로 관측하고 있다 삼성전자는 현재 미국 텍사스 오스틴에 파운드리 공장을 운영하고 있다 삼성전자의 유일한 미국 내 반도체 공장이다 삼성전자는 이에 더해 억달러 약 조원 규모의 파운드리 공장을 추가로 짓기로 하고 후보지를 검토하고 있다 삼성전자는 백악관으로부터 신속한 투자 결정을 요구받는 것을 넘어 투자 규모 증액까지도 고려하고 있는 것으로 알려졌다 백악관이 직접 미 본토에서 생산하는 제품에 대해선 자국 기업에 우선 공급하도록 하는 요구안을 내놓을 수도 있다 노정동 한경닷컴 기자
21,2021-04-12,車반도체 압박과 투자 혜택 사이…백악관 회의 가는 삼성,머니투데이 오문영 기자 조 바이든 미국 대통령이 지난 월 일 현지시간 워싱턴 백악관에서 반도체 희토류 배터리 등 핵심 품목의 공급망을 확보하는 내용의 행정명령에 서명을 하기 전에 반도체 칩을 들고 연설을 하고 있다 뉴스 사진 로이터 삼성전자가 일 현지시간 미국 백악관이 주최하는 반도체 공급망 확충 회의에 참석한다 미국 현지에 반도체 공장 추가 증설을 검토 중인 삼성전자가 이번 회의를 구속력 있는 지원안을 이끌어내는 기회로 만들 수 있을지 주목된다 일 업계와 외신에 따르면 백악관은 이날 오후 반도체 공급망 화상 회의를 연다 반도체 생산업체로는 삼성전자를 비롯해 대만 파운드리업체 네덜란드 자동차 반도체 업체 미국 파운드리업체 글로벌파운드리와 스카이워터테크놀로지 종합반도체 업체 인텔 등이 참석한다 업계에서는 미국 정부가 회의를 통해 자국 내 투자 확대 등을 강력하게 요구할 것으로 본다 회의 구성부터 노골적이었다는 평가다 백악관이 공개한 개의 초청 기업 명단 가운데 개 기업이 반도체 수급에 어려움을 겪고 있는 미국 회사다 회의 주재도 제이크 설리번 국가안보회의 보좌관과 브라이언 디스 국가경제위원회 위원장이 맡았다 반도체를 전략물자로 보는 미국 정부의 시각이 드러나는 대목이다 특히 최근 반도체 대란의 원인인 차량용 반도체의 생산을 늘려달라는 요구가 나온다면 삼성전자의 입장이 난처해질 수 있다 삼성전자는 수익성 등을 고려해 차량용 반도체를 거의 생산하고 있지 않기 때문이다 주문제작 방식으로 일부 생산 중인 차량용 반도체는 인포테인먼트 자율주행용으로 수급난이 발생하고 있는 품목과는 다르다 일각에서는 삼성전자가 미국 현지에서의 공장 증설을 두고 텍사스주 등 주정부와 협상을 진행하고 있는 상황에서 이번 회의가 기회로 작용할 수 있다는 분석도 나온다 미국 정부가 자국 내 반도체 생산시설 투자에 혜택을 주는 방안을 추진 중이기 때문이다 미국 정부는 지난달 일 억달러 약 조원 를 반도체 생산시설 투자와 연구개발에 지원하는 계획을 발표했다 김기남 삼성전자 부회장을 비롯해 반도체 사업본부 고위 임원들은 지난 주말에도 사무실에 나와 백악관 화상회의를 준비한 것으로 알려졌다 삼성전자에서는 수감 중인 이재용 부회장을 대신해 최시영 파운드리사업부장 사장 이 백악관 회의에 모습을 드러낼 것으로 보인다 삼성전자 오스틴 공장은 물론 이번에 증설을 검토 중인 것도 파운드리사업부 소관이다 오문영 기자
22,2021-04-12,"삼성·SK ""재생에너지 100% 사용 목표""",공시 강화 탄소세 도입에 기업들 분주 탄소 금융시대 환경 책임 투명경영 을 촉구하는 금융권 움직임이 확산될 분위기를 보이자 국내 기업들도 분주해진 모습이다 삼성전자는 년 미국 중국 유럽 사업장의 전력 를 재생에너지로 전환한 데 이어 지난해 전환에 성공했다 국내를 비롯한 다른 지역에서도 재생에너지 사용을 확대하고 있다 주 와 텔레콤 하이닉스 등 그룹 개사는 지난해 말 에 가입했다 은 년까지 기업의 재생에너지 사용을 까지 끌어올린다는 내용을 담고 있다 전자는 년까지 탄소중립을 실천하는 탄소중립 을 선언했으며 화학은 전 세계 모든 사업장의 추진에 나섰다 포스코는 지난해 말 기후 관련 재무공시 협의체 권고안을 반영한 기후행동보고서를 발간했다 보고서에는 탄소중립 목표와 이행 계획이 담겨 있다 이동석 삼정 비즈니스 리더는 세계 무대에서 글로벌 기업들과 경쟁하려면 한국 회사들도 등 글로벌 트렌드 변화에 대응해야 한다 며 최근 기후 관련 리스크에 선제적으로 대응하려는 기업이 늘어나고 있다 고 말했다 등 기후 관련 공시는 기업에 부담이 되지만 와 공시를 따라야 세계 무대에서 사업할 수 있기 때문이다 탄소중립도 기업들이 해결해야 할 숙제다 용혜인 기본소득당 의원은 지난달 국회에 탄소세 법안까지 발의했다 김수연 광장 지속가능경영연구원 연구위원은 미국도 산업 악영향 등을 이유로 탄소세 도입을 주저하고 있다 며 제조업이 상당한 비중을 차지하는 국내에 도입되면 기업 부담이 커질 수밖에 없다 고 말했다 온실가스 배출 상위 개국 중 탄소세 도입 국가는 일본 캐나다 등 개국에 불과하다 정승환 재계 전문기자
