,날짜,기사제목,본문내용
8,2021-04-12,"삼성전자, iF 디자인 어워드 2021서 역대 최대 71개 수상",사진제공 삼성전자 삼성전자가 독일의 국제 디자인 공모전 디자인 어워드 에서 금상 개를 비롯해 총 개의 상을 받았다 독일 인터내셔널 포럼이 주관하는 행사로 제품 패키지 커뮤니케이션 콘셉트 인테리어 건축 서비스디자인 사용자 경험 사용자 인터페이스 등 개 부문의 디자인 차별성과 영향력 등을 종합적으로 평가한다 삼성전자는 금상을 받은 비스포크 큐브 에어와 비스포크 시티 컬러를 포함해 제품 부문에서 개 커뮤니케이션 부문에서 개 콘셉트 부문에서 개 서비스디자인 부문에서 개 패키지 부문에서 개의 상을 받았다 금상을 받은 비스포크 큐브 에어는 전면 디자인을 선택할 수 있는 공기청정기로 차별화된 무풍 청정 능력과 헤링본 스트라이프 패턴 등 교체 가능한 패널을 갖췄으며 비스포크 시티 컬러 또한 냉장고 인덕션 오븐 등에서 원하는 색상을 선택할 수 있도록 했다 사용자의 라이프스타일과 취향을 맞춰주는 비스포크 콘셉트는 냉장고를 시작으로 다양한 가전제품으로 확대 적용하며 비스포크 홈 제품들로 집안을 통일감 있으면서도 개성 있는 공간으로 구성할 수 있도록 했다 가전 스마트폰 등 전 분야에 걸쳐 디자인을 인정받으며 총 개 상으로 역대 최다 수상 기록을 갈아치우기도 했다 제품 부문에서 베젤을 최소화해 몰입감을 극대화한 인피니티 디자인의 트리플 레이저와 초단초점 기술을 적용한 프리미엄 가정용 프로젝터 더 프리미어 공간에 따라 직렬 병렬 별도 설치할 수 있고 실내에도 잘 어울리는 그랑데 세탁기 건조기 갤럭시 폴드 와 플립 등도 상을 받았다 제품 이외 부문에서도 똑똑하고 쉬운 사용성에 시각장애인을 고려한 점자 라벨과 사운드 디자인을 적용한 그랑데 업사이클링 개념을 도입한 에코 패키지 등 접근성과 환경을 고려한 디자인이 수상했다
9,2021-04-12,"삼성전자, iF 디자인 어워드 역대 최다 71개 수상",비스포크 큐브 에어 비스포크 시티 컬러 금상 이데일리 피용익 기자 삼성전자 는 독일의 국제 디자인 공모전 디자인 어워드 에서 금상 개를 비롯해 역대 최다 개의 상을 받았다고 일 밝혔다 년 독일 인터내셔널 포럼 주관으로 시작된 디자인 어워드는 제품 패키지 커뮤니케이션 콘셉트 인테리어 건축 서비스디자인 사용자 경험 사용자 인터페이스 등 총 개 부문에서 디자인 차별성과 영향력 등을 종합적으로 평가한다 삼성전자는 올해 금상을 수상한 비스포크 큐브 에어 와 비스포크 시티 컬러 를 포함해 제품 부문에서 개 커뮤니케이션 부문에서 개 콘셉트 부문에서 개 서비스디자인 부문에서 개 패키지 부문에서 개의 상을 받았다 금상을 수상한 비스포크 큐브 에어는 전면 디자인을 선택할 수 있는 공기청정기로 차별화된 무풍 청정 능력은 물론 헤링본 스트라이프 패턴 등 교체 가능한 패널을 갖춘 것이 특징이다 서울 베를린 스톡홀름 등 주요 도시에서 영감을 받은 색상을 제품에 적용한 비스포크 시티 컬러 또한 금상을 수상했다 사용자의 라이프스타일과 취향을 맞춰주는 비스포크 콘셉트는 냉장고를 시작으로 다양한 가전 제품에 확대돼 왔으며 비스포크 홈 제품들로 집안을 통일감 있으면서도 개성 있는 공간으로 구성할 수 있다 금상 수상작 외에도 제품 부문에서 베젤을 최소화해 몰입감을 극대화한 인피니티 디자인의 트리플 레이저와 초단초점 기술을 적용한 프리미엄 가정용 프로젝터 더 프리미어 공간에 따라 직렬 병렬 별도 설치할 수 있고 실내에도 잘 어울리는 그랑데 세탁기 건조기 폴더블 스마트폰 고유의 혁신적인 사용 경험을 제공하는 갤럭시 폴드 와 갤럭시 플립 등이 상을 받았다 제품 이외 부문에서도 똑똑하고 쉬운 사용성에 시각장애인을 고려한 점자 라벨과 사운드 디자인을 적용한 그랑데 업사이클링 개념을 도입한 에코 패키지 등 접근성과 환경을 고려한 디자인이 수상했다 삼성전자 디자인경영센터장 이돈태 부사장은 사회 변화에 따른 차별화된 경험과 의미있는 가치를 제공하는 것이 중요하다 다양한 시도와 새로운 인사이트를 통해 고객의 삶과 우리 사회에 기여하는 디자인을 제공하도록 노력하겠다 라고 말했다 한편 올해의 수상작은 디자인 어워드 홈페이지와 애플리케이션에 공개된다 디자인 어워드를 수상한 비스포크 큐브 에어 사진 삼성전자 피용익
10,2021-04-12,"삼성전자, 'iF 디자인 어워드'서 71개 역대 최다 수상",아시아경제 우수연 기자 삼성전자가 독일의 국제 디자인 공모전 디자인 어워드 에서 금상 개를 비롯해 총 개의 상을 받는 영예를 안았다 삼성전자는 올해 디자인 어워드 금상을 수상한 비스포크 큐브 에어 와 비스포크 시티 컬러 를 포함해 제품 부문에서 개 커뮤니케이션 부문에서 개 콘셉트 부문에서 개 서비스디자인 부문에서 개 패키지 부문에서 개의 상을 받았다고 일 밝혔다 디자인 어워드는 년 독일 인터내셔널 포럼 주관으로 시작된 상으로 제품 패키지 커뮤니케이션 콘셉트 인테리어 건축 서비스디자인 사용자 경험 사용자 인터페이스 등 총 개 부문에서 디자인 차별성과 영향력 등을 종합적으로 평가한다 디자인 어워드 금상을 수상한 비스포크 큐브 에어 사진 삼성전자 개인의 취향 라이프스타일 존중 맞춤형 가전 금상 개 수상 금상을 수상한 비스포크 큐브 에어 는 전면 디자인을 선택할 수 있는 공기 청정기로 차별화된 무풍 청정 능력은 물론 헤링본 스트라이프 패턴 등 교체 가능한 패널을 갖춘 것이 특징이다 서울 베를린 스톡홀름 등 주요 도시에서 영감을 받은 색상을 제품에 적용한 비스포크 시티 컬러 또한 금상을 수상했으며 냉장고 인덕션 오븐 등에서 원하는 색상을 선택할 수 있도록 했다 사용자의 라이프스타일과 취향을 맞춰주는 비스포크 콘셉트는 냉장고를 시작으로 다양한 가전 제품에 확대돼왔다 비스포크 홈 제품들은 집안을 통일감 있으면서도 개성 있는 공간으로 구성할 수 있게 한다 디자인 어워드 금상을 수상한 비스포크 시티 컬러 사진 삼성전자 제품 디자인부터 접근성 지속가능 패키지까지 역대 최다 수상 삼성전자는 이번 디자인 어워드 에서 가전 스마트폰 등 전 분야에 걸쳐 디자인을 인정받으며 총 개 상으로 역대 최다 수상을 기록했다 제품 부문에서 베젤을 최소화해 몰입감을 극대화한 인피니티 디자인의 트리플 레이저와 초단초점 기술을 적용한 프리미엄 가정용 프로젝터 더 프리미어 공간에 따라 직렬 병렬 별도 설치할 수 있는 그랑데 세탁기 건조기 폴더블 스마트폰 고유의 혁신적인 사용 경험을 제공하는 갤럭시 폴드 와 갤럭시 플립 등이 상을 받았다 제품 이외 부문에서도 똑똑하고 쉬운 사용성에 시각장애인을 고려한 점자 라벨과 사운드 디자인을 적용한 그랑데 업사이클링 개념을 도입한 에코 패키지 등 접근성과 환경을 고려한 디자인이 수상했다 이돈태 삼성전자 디자인경영센터장 부사장 은 사회 변화에 따른 차별화된 경험과 의미있는 가치를 제공하는 것이 중요하다 며 다양한 시도와 새로운 인사이트를 통해 고객의 삶과 우리 사회에 기여하는 디자인을 제공하도록 노력하겠다 고 말했다 우수연 기자
11,2021-04-12,삼성전자 'iF 디자인 어워드' 71개 싹쓸이,삼성전자가 독일의 국제 디자인 공모전 디자인 어워드 에서 금상 개를 비롯해 총 개의 상을 받았다 삼성전자는 공기청정기 비스포크 큐브 에어 와 비스포크 시티 컬러 로 올해 제품 부문 금상을 탔다 이들 상을 포함해 제품 부문에서 개 커뮤니케이션 부문 개 콘셉트 부문 개 서비스디자인 부문 개 패키지 부문 개의 상을 휩쓸었다 금상을 받은 비스포크 큐브 에어는 전면 디자인을 선택할 수 있는 공기청정기다 헤링본스트라이프 패턴 등 교체 가능한 패널을 갖춘 게 특징이다 서울 베를린 스톡홀름 등 주요 도시에서 영감을 받은 가전 색상인 비스포크 시티 컬러는 냉장고인덕션오븐 등에 적용할 수 있다 년 처음 열린 디자인 어워드 는 세계에서 가장 공신력 있는 디자인 공모전 중 하나로 꼽힌다 올해의 수상작은 디자인 어워드 홈페이지와 앱에 공개된다 이수빈 기자
12,2021-04-12,삼성전자 'iF디자인상' 싹쓸이,비스포크 큐브 에어 등 금상 개 총 개 수상 역대 최다 기록 삼성전자가 독일의 국제디자인공모전 디자인 어워드 에서 금상 개를 비롯해 역대 최다인 총 개의 상을 수상했다고 일 밝혔다 년 제정된 디자인 어워드 는 제품 패키지 커뮤니케이션 콘셉트 인테리어 건축 서비스디자인 사용자 경험 사용자 인터페이스 등 총 개 부문에서 디자인 차별성과 영향력 등을 종합적으로 평가해 선정한다 삼성전자는 올해 금상을 수상한 비스포크 큐브 에어 와 비스포크 시티 컬러 를 포함해 제품 부문에서 개 커뮤니케이션 부문에서 개 콘셉트 부문에서 개 서비스디자인 부문에서 개 패키지 부문에서 개의 상을 받았다 금상을 수상한 비스포크 큐브 에어 는 전면 디자인을 선택할 수 있는 공기청정기로 차별화된 무풍 청정 능력과 헤링본 스트라이프 패턴 등 교체 가능한 패널을 갖춘 것이 특징이다 서울 베를린 스톡홀름 등 주요 도시에서 영감을 받은 색상을 제품에 적용한 비스포크 시티 컬러 도 금상을 수상했다 금상 수상작 외에도 제품 부문에서는 베젤을 최소화해 몰입감을 높인 인피니티 디자인의 프리미엄 가정용 프로젝터 더 프리미어 그랑데 세탁기 건조기 갤럭시 폴드 와 갤럭시 플립 등이 상을 받았다 삼성전자 디자인경영센터장 이돈태 부사장은 다양한 시도와 새로운 인사이트를 통해 고객의 삶과 우리 사회에 기여하는 디자인을 제공하도록 노력하겠다 고 말했다 박재영 기자
13,2021-04-12,美 AMD 손잡은 삼성…'스마트폰AP 반전' 노린다,글로벌 시장 점유율 순위 하락 경쟁업체 대만 미디어텍 약진 그래픽 성능 높인 신형 하반기 공개 갤럭시에 탑재 삼성전자의 스마트폰 애플리케이션프로세서 사업에 경고등이 켜졌다 삼성전자가 납품을 시도하고 있는 중국 샤오미 오포 등은 자체 개발에 속도를 내고 있다 여기에 중저가 시장에선 경쟁 업체인 대만 미디어텍이 영향력을 키우고 있다 삼성전자는 미국 와 함께 개발 중인 프리미엄 를 하반기 출시해 분위기 반전에 나설 계획이다 일 시장조사업체 스트래티지애널리틱스 에 따르면 지난해 스마트폰 시장에서 삼성전자 점유율 매출 기준 은 였다 년 대비 점유율은 포인트 하락했고 순위 역시 한 단계 떨어진 위였다 는 스마트폰에서 데이터 통신 연산 등을 담당하는 핵심 반도체다 시장에선 퀄컴 미디어텍 등이 삼성전자와 경쟁하고 있다 지난해까지만 해도 삼성전자의 점유율이 상승할 것이란 전망이 우세했다 글로벌 시장에서 존재감이 뚜렷했던 중국 화웨이의 자회사 하이실리콘이 미국의 제재로 사실상 시장에서 퇴출됐기 때문이다 하지만 지금까지는 하이실리콘의 점유율은 삼성전자가 아니라 대만 미디어텍이 가져가고 있다는 분석이다 미디어텍의 시장 점유율은 년 에서 지난해 로 상승했다 퀄컴 칩보다 저렴하면서 성능은 크게 뒤지지 않는 세대 스마트폰용 중저가칩으로 중국 스마트폰 업체들을 공략한 결과다 시장조사업체 옴디아에 따르면 지난해 미디어텍 를 채택한 샤오미 스마트폰은 만 대로 년 대비 급증했다 삼성전자 사업을 담당하는 시스템 사업부는 자사 스마트폰 외에 중국 업체에 를 공급하는 방안을 추진하고 있다 지난해 월 세계 위권 업체 비보에 폰용 엑시노스 등을 납품하는 계약도 따냈다 하지만 세계 위 업체 중국 샤오미 위 오포의 문은 아직 열리지 않고 있다 최근 대만의 한 매체는 샤오미와 오포가 오히려 중국의 팹리스 반도체 설계 전문 업체 유니 와 손잡고 연말까지 자체 칩을 개발한다고 보도했다 삼성전자의 외부 판매 확대 전략에 경고등이 켜졌다는 평가가 나오는 이유다 삼성전자는 미국 와 협업해 개발 중인 신형 엑시노스 를 이르면 올 하반기 공개하고 반등을 노린다는 전략이다 삼성전자는 엑시노스 의 약점으로 꼽혔던 그래픽 성능을 향상시키기 위해 그래픽처리장치 설계에 강점이 있는 와 년 공동 개발 협약을 체결했다 와 함께 개발 중인 삼성전자의 신형 는 올 하반기 출시 예정인 갤럭시 폴드 가칭 등 삼성전자 플래그십 스마트폰에 채택될 가능성이 높다 황정수 기자
14,2021-04-12,[단독] 삼성·SK 中공장 초비상…美 반도체 핵심장비 中 수출 금지 추...,안보회의 산하 위원회 이어 메모리 핵심장비도 수출금지 품목 포함 권고 바이든 반도체회의 직접 챙겨 위기의 반도체 조 바이든 미국 행정부 산하 자문위원회가 중국의 반도체 굴기를 막기 위해 반도체 장비 대중 수출 봉쇄 대상을 차세대 최첨단 공정용 장비뿐만 아니라 현재 사용되고 있는 주력 장비로까지 확대하는 정책을 제안한 것으로 확인됐다 이에 따라 중국에 생산기지를 둔 국내 반도체 산업계에 적색 경고등이 켜졌다 규제가 현실화하면 당장 삼성전자 하이닉스가 중국에서 운영 중인 메모리 공장을 첨단화하는 데 지장이 생길 수 있다 일 반도체 업계에 따르면 바이든 정부는 극자외선 노광장비의 전 단계 기술인 액침불화아르곤 노광장비 등 심자외선 장비 중국 수출을 전면 금지하는 제재안을 구상하고 있다 이와 관련해 미국 국가안보회의 산하 인공지능 위원회는 지난달 초 연방의회에 제출한 보고서에서 반도체 산업에서 중국과 격차를 확대하기 위해 일본 네덜란드 정부 등과 협력해 장비의 중국 수출을 금지해야 한다 고 제안했다 미국은 이미 도널드 트럼프 정부에서 최첨단 시스템 반도체 생산을 위한 장비 중국 수출을 금지시켰다 장비는 나노미터 는 억분의 급 시스템 반도체 생산에 쓰이는 장비보다 기술력이 떨어진다 하지만 급 반도체를 생산하는 주력 첨단장비다 삼성전자와 하이닉스는 중국 공장에서 차원 적층 낸드플래시와 나노급 램 같은 메모리 제품을 양산하는 데 장비를 사용한다 미국이 에 머물렀던 중국 수출금지 제재를 까지 확대하는 카드를 꺼내들며 국내 반도체 업계 위기감은 커지고 있다 이와 관련해 한국반도체산업협회 는 최근 정부에 미국의 대중 규제 강화에 대한 대비책 마련을 계속 건의하고 있다 협회는 삼성전자 하이닉스의 중국 메모리 공장이 미국 정부 규제에서 예외 적용을 받을 수 있도록 한국 정부가 조치해달라는 의견을 낸 것으로 전해졌다 현재는 등 블랙리스트로 지정된 일부 중국 업체에 대해서만 장비 수출이 제한되고 있지만 미 중 관계가 더 악화되면 중국에 있는 반도체 업체 전체로 규제가 확산될 수 있다는 지적이다 박재근 한양대 교수는 미 중의 반도체 패권 경쟁이 심화하면서 삼성전자 시안공장과 하이닉스 우시공장 확장을 위해 투입되는 장비가 미국 허가를 받지 못하는 상황이 올 수 있다 며 기업 단독으로는 협상력에 한계가 있고 이를 풀어나갈 한국 정부의 외교통상 역량이 관건 이라고 말했다 한편 조 바이든 미국 대통령은 일 현지시간 삼성전자를 포함해 개 글로벌 기업을 대상으로 백악관이 진행하는 반도체 영상회의에 직접 참석해 인사말을 했다 와 의 배터리 분쟁을 해결한 바이든 대통령은 이날 미국의 일자리 계획과 반도체 공급망 확대 등을 언급했다 워싱턴 신헌철 특파원 서울 이종혁 기자 박재영 기자 반도체 세대 뒤처지게 할것 기업 중국공장 불똥튈라 반도체규제 한국도 사정권 화웨이로 시작한 중국 제재 바이든도 이어 받아 중국 시안 삼성전자 우시 공장 현지공장 차세대 투자 초비상 정부도 삼성에 투자 요구 총수부재 와중 힘겨운 줄타기 삼성전자 시안 반도체 공장 전경 사진 제공 삼성전자 도널드 트럼프 전 미국 대통령을 이어 올해 초 취임한 조 바이든 대통령 역시 중국의 반도체 굴기 를 용납하지 않겠다는 의지를 확고하게 드러내고 있다 바이든 정부는 최첨단 시스템반도체 장비 위주였던 제재를 메모리반도체까지 확대할 태세다 메모리 시장을 장악하고 있는 한국 반도체 업계에는 비상이 걸렸다 미국과 중국 사이에서 위험한 줄타기를 하다 큰 타격을 맞을 수 있어서다 업계에선 현 상황을 유연하게 헤쳐나갈 재계 관계의 리더십 실종이 아쉽다는 반응이 나온다 트럼프 전 행정부는 중국에 대한 기술 유출 위협을 주요 명분 삼아 반도체 관련 제재에 시동을 걸었다 년 트럼프 당시 대통령은 중국계 사모펀드 캐넌브리지의 미국 기업 래티스반도체 인수 승인 요청을 거부했다 이듬해에는 중국 메모리 기업 푸젠진화반도체 와 미국 기업의 거래를 끊었다 현재 푸젠진화는 사실상 램 생산을 접다시피 했다 년에는 미 상무부가 중국 스마트폰 제조사 화웨이를 블랙리스트에 올려 삼성전자 하이닉스에서 반도체를 공급받는 길도 막았다 국내 반도체 업계 한 관계자는 반도체 장비는 장비 회사 홀로 만들 수 없다 도 삼성전자 같은 고객사들과 수년에 걸쳐 협력하며 기술을 끌어올린 것 이라면서 중국이 수십조 원을 쏟아붓고 있지만 제재로 해외 장비 구입이 막힌 데다 자체 반도체 양산 역량도 부족한 형편인 만큼 기술 격차를 좁히기 쉽지 않다 고 설명했다 바이든 정부는 금지에 이어 심자외선 노광 장비를 중국에 수출하는 것도 막는 방안을 구상하고 있다 미 국가안보회의 산하 인공지능 위원회는 지난달 초 연방의회에 제출한 보고서에서 네덜란드 일본과 협력해 중국에 대한 불화아르곤 수출을 막아야 한다 고 제안했다 그러면서 이 같은 제재 정책이 미국 내 첨단 반도체 생산기지에 대한 투자 인센티브와 함께 실현되면 미국 정부는 세대 이상 중국에 앞선 반도체 기술을 유지할 수 있다 고 분석했다 노광 장비는 빛을 이용해 미세한 전자회로를 반도체 원판 웨이퍼 에 새기는 일종의 사진기 다 반도체는 회로가 미세할수록 성능과 생산성이 향상된다 미세한 회로를 새기려면 노광 장비가 쏘는 빛의 파장도 짧아야 한다 하이닉스 우시 캠퍼스 전경 사진 제공 하이닉스 제안대로 미국 네덜란드 일본이 공조해 장비의 중국 수출 금지 정책을 실현하면 중국에 공장을 둔 국내 업계에 불똥이 튈 수 있다는 우려가 많다 삼성전자는 중국 산시성 시안에 개 공장을 짓고 세대 낸드를 양산 중이다 하이닉스 역시 장쑤성 우시에 램 공장 두 곳을 갖추고 급 램을 생산한다 삼성전자 시안 공장과 하이닉스 우시 공장 모두 노광 장비를 사용하고 있으며 올해 각 공장 증설 마무리 과정에서 장비를 추가 반입할 계획이다 익명을 요구한 정부 관계자는 앞서 미국은 특정 중국 기업을 블랙리스트에 올리고 이들이 첨단 반도체 장비 부품을 공급받지 못하는 제재를 주로 펼쳤으나 첨단 반도체 장비의 중국 수출을 전면 제한할 경우 한국 기업의 중국 공장이 제재 대상이 될 가능성을 배제할 수 없다 고 말했다 삼성전자와 하이닉스 등 한국 기업들은 미국의 제재 강화 기조에 따라 향후 중국 사업장 추가 투자도 불투명한 형국이다 삼성전자는 중국 정부로부터 추가 투자 요구도 받는 것으로 알려졌다 하이닉스는 자회사 하이닉스 시스템 와 중국 자본 우시산업집단의 합작으로 파운드리 사업도 시작했는데 미국 제재가 본격화하면 공장을 첨단화하는 데 제한을 받을 가능성이 있다 반도체 업계 한 관계자는 삼성전자 하이닉스 경영진은 중국 제재의 불똥이 어디로 튈지 몰라 답답해하면서 상황을 예의 주시하는 것으로 안다 고 전했다 특히 국내 반도체 업계는 국내 반도체 소재 부품 장비 기업들의 중국 사업도 타격을 받을 가능성이 있다고 본다 이들은 주로 삼성전자와 하이닉스 중국 공장에 제품을 공급한다 재계 일각에서는 미국과 중국 사이의 패권 다툼 틈바구니에서 한국 반도체 산업의 키를 쥘 리더가 없다는 점을 우려하는 목소리도 나온다 미국과 중국 내 폭넓은 네트워크를 보유한 이재용 삼성전자 부회장은 국정농단 재판에서 실형이 확정돼 수감 중이다 다만 반도체 공급난을 감안하면 바이든 행정부가 제재의 칼날을 삼성전자 하이닉스의 중국 내 공장에까지 들이대기는 어려울 수 있다는 시각도 있다 이종혁 기자 박재영 기자
15,2021-04-12,압박수위 확 높인 바이든…고민 깊어진 삼성,백악관 반도체 대책회의 바이든 시간 쪼개 회의 참석 투자요청에 삼성대응 주목 위기의 반도체 와 간 배터리 분쟁을 해결하며 존재감을 과시한 조 바이든 미국 대통령이 여세를 몰아 일 새벽 한국시간 백악관에서 열린 반도체 영상회의에 직접 참석했다 미국 내 반도체 공급망 강화 등을 강조해온 바이든 대통령은 이날 참석한 기업을 대상으로 반도체 공급난 해소를 위한 미국 정부 노력을 설명했다 회의에는 최시영 삼성전자 파운드리 사업부장 사장 을 비롯해 대만 구글 모회사 알파벳 델테크놀로지 포드 글로벌파운드리 인텔 메드트로닉 마이크론 노스럽그러먼 등 개사 관계자들이 참석한 것으로 알려졌다 삼성전자는 이번 회의를 계기로 강도를 높여갈 미국 정부의 추가 투자 압박에 대비해야 하는 상황이다 구글 아마존 등 미국 내에 메모리 반도체 고객사를 다수 확보하고 있는 데다 파운드리 반도체 위탁생산 생산시설까지 갖추고 있어 미국 정부 요청을 거절하기 어려운 처지다 삼성전자는 미국 현지에 억달러 약 조 억원 규모 파운드리 공장을 추가 건설하기로 하고 텍사스 애리조나 등 주정부와 협의하고 있는데 이날 회의를 계기로 투자 결정 시기가 앞당겨질 수 있다는 관측이 제기된다 백악관이 추가 주문을 내놓을 수 있다는 예상도 나온다 현시점에서 미국 정부가 가장 원하는 것이 차량용 반도체 공급난 해소인 만큼 추가로 건설되는 파운드리 공장에서 차량용 시스템 반도체를 생산해달라는 요청이 있을 수 있다는 지적이다 업계 관계자는 미국 정부 입장에서는 자국 내 자동차 업체 일자리 감소를 막으면서 파운드리 신규 공장 설립을 통한 일자리 창출도 기대할 수 있다 며 반면 삼성전자는 대규모 투자에 더해 정보기술 과 전자에 비해 수익성이 낮은 차량용 반도체 생산을 늘려야 하는 이중고에 처할 수 있다 고 말했다 노현 기자
