,날짜,기사제목,본문내용
0,2021-04-11,100년 가전공식 바꿨다…'비슷포크' 쏟아져도 삼성이 빛나는 이유,원조는 다르다 삼성전자 비스포크의 자신감 디자인은 베낄 수 있어도 물류 기술 혁신은 모방 못해 반제품 제조해 패널 본체 투트랙 제조 삼성이 유일 디지털 프린팅으로 구현 경험의 차별화 줄 것 삼성전자는 맞춤형 가전 비스포크 의 디자인과 내부 옵션까지 고를 수 있도록 선택의 폭을 넓힐 방침이다 삼성전자 제공 과거 냉장고 세탁기 에어컨 등은 백색가전으로 불렸다 청결한 이미지를 강조하기 위해 흰색으로 출시된 제품이 많았다 이후 메탈 블랙 등과 같은 소재 및 색상이 나왔지만 제품 생김새는 대동소이했다 그런데 최근 년 새 가전매장 풍경이 확 달라졌다 알록달록한 색상이 넘쳐난다 다양한 색을 선택할 수 있는 삼성전자 비스포크 등장 이후 가전도 인테리어의 일부 라는 인식이 확산되며 나타난 변화다 요즘 소비자 사이에선 비스포크와 비슷한 디자인으로 쏟아져 나온 가전을 비슷포크 로 부르기도 한다 기능도 맞춤형으로 맞춤형 가전을 선도해온 삼성전자의 비스포크가 진화하고 있다 일 업계에 따르면 삼성전자는 디자인뿐 아니라 기능에도 소비자 취향을 반영하는 방식으로 비스포크를 한 단계 업그레이드할 방침이다 회사 관계자는 생활습관이나 가치관에 따라 기능을 고를 수 있는 신제품을 준비 중 이라며 디자인에 내부 옵션까지 포함하면 수천 가지 조합이 가능하다 고 설명했다 비스포크는 지난해 가전업계에서 가장 히트한 제품라인으로 꼽힌다 년 월 비스포크 냉장고를 첫 출시한 뒤 제품군을 인덕션 식기세척기 등으로 넓혔다 이들 제품의 지난해 월 기준 누적 출하량은 만 대를 넘어섰다 이날 기준 인테리어 전문 앱 오늘의 집 에서 역대 가장 많이 판매된 가전 위가 모두 비스포크 냉장고다 삼성전자는 소비자 선택의 폭을 더 넓히기로 했다 외부 디자인과 내부까지 맞춤형으로 고를 수 있는 비스포크 냉장고 신제품 출시를 준비 중이다 육류를 좋아하는 소비자는 숙성 에이징 칸과 기능을 선택하고 채식주의자는 채소 보관이 편리한 신선 독립칸을 구성할 수 있다 냉동실 얼음도 각얼음뿐 아니라 취향에 따라 위스키용 구형 얼음 자잘한 얼음 등으로 선택할 수 있다 삼성전자는 냉장고 외 다른 가전에도 다양한 기능의 옵션을 도입할 방침이다 생활가전 소품종 대량생산 공식 깨 가전산업은 소품종 대량생산 방식을 년 이상 고수해왔다 상품 기획 단계에 다음 시즌에 유행할 디자인과 색상을 예측한 뒤 완제품을 제조해 놓고 마케팅과 판촉 활동을 했다 가장 효율적인 방식이었다 하지만 소비자 취향이 세분화하면서 대량생산만으로는 다양한 수요를 충족시키는 게 어려워졌다 삼성전자가 나만의 제품 을 원하는 소비자가 많다는 데 주목해 비스포크를 년 기획한 배경이다 이런 사업 모델이 가능하려면 다품종 소량생산체제가 필요했다 맞춤형 가전 이라는 콘셉트에 맞게 소비자의 주문을 받아 제품을 생산하면서도 적정한 가격대를 맞춰야 했다 이를 위해 고안한 게 투 트랙 제조 방식이다 반제품을 준비해놓고 소비자 주문에 따라 본체와 패널을 각각 다른 곳에서 동시에 제작하는 게 비스포크 제조의 핵심이다 이후 물류창고에서 분 만에 완제품을 조립한 뒤 소비자에게 배송한다 맞춤형 주문인데도 가격이 크게 비싸지 않고 주 안에 배송이 이뤄지는 비결이다 위훈 삼성전자 생활가전사업부 상무는 이 같은 제조 방식이 가능한 가전회사는 세계에서 삼성전자가 유일하다 며 디자인뿐 아니라 무엇이든 맞춤형으로 제조할 수 있는 이유 라고 설명했다 디지털 프린팅으로 색 무한 확장 삼성전자는 최근 디지털 프린팅 방식을 통해 맞춤형 패널 생산에 들어가는 시간과 비용을 줄였다 이전까지는 가전에 색을 입히려면 안료를 섞은 잉크를 미리 제작해 인쇄해야 했다 필요한 색이 가지라면 가지의 잉크가 필요했다 디지털 프린팅은 가지의 색상을 고해상도 점으로 촘촘히 인쇄해 다양한 색상을 표현하는 기술이다 색상코드만 있으면 무한정 많은 수의 색을 표현할 수 있다 최근 가지의 냉장고 패널 색상을 공개한 것도 이 기술 덕이었다 삼성전자는 올해 세탁기 전자레인지 등 전 품목으로 비스포크를 확대하고 가전 매출 중 비스포크 비중을 로 끌어올릴 방침이다 위 상무는 현재 만 가지의 소비자 취향을 분석 중 이라며 보이는 차별화뿐 아니라 사용 경험의 차별화까지 이뤄내겠다 고 말했다 이수빈 기자
1,2021-04-11,지난해 삼성전자 빼고 투자 감소…올해도 韓 투자 '빨간불',사진 게티이미지뱅크 주요 기업 개사 중 절반 이상이 올해 투자 계획이 없거나 투자를 축소할 생각이라는 조사 결과가 나왔다 지난해 대 기업 중 삼성전자를 제외한 나머지 기업은 투자 규모가 줄어드는 등 지난해에 이어 올해도 국내 투자에 빨간불 이 켜졌다는 평가가 나온다 일 전국경제인연합회 산하 한국경제연구원 한경연 이 여론조사기관 모노리서치에 의뢰해 매출액 대 기업을 대상으로 올해 투자계획을 조사한 결과 조사에 응한 개사 중 가 올해 투자계획이 없거나 투자를 축소할 것이라고 답했다 이중 투자 계획이 정해지지 않았다 투자 계획이 없다 작년보다 투자를 줄일 것 이라는 응답 순으로 집계됐다 이들 중 절반은 투자 위축 이유로 코로나 재확산 등 경제 불확실성을 꼽았다 작년보다 투자를 늘릴 것 이라는 기업은 에 그쳤고 작년 수준의 투자를 하겠다고 답한 기업도 였다 한경연은 올해도 대 기업 중 절반 이상이 투자를 줄일 가능성이 높다고 전망했다 한경연이 매출액 대 기업의 재무제표를 분석한 결과에 따르면 지난해 전년 대비 투자를 늘린 기업은 개사 였다 투자가 감소한 기업은 개사 로 집계됐다 또 지난해 총 투자액은 조 억원으로 전년보다 증가했지만 삼성전자를 제외한 개사의 투자 규모는 오히려 감소한 것으로 나타났다 한경연은 또 국내 투자 환경에 대한 만족도를 조사한 결과 점 만점에 점에 그쳐 기업들이 대체로 국내 투자 환경을 부정적으로 평가했다고 말했다 추광호 한경연 경제정책실장은 최근 수출 산업생산 등이 회복 조짐을 보이고 있지만 기업들은 여전히 국내 투자를 공격적으로 확대하지 못하는 상황 이라며 기업 투자 활성화를 위한 제도적 뒷받침이 그 어느 때보다 중요하다 고 밝혔다 신현보 한경닷컴 기자
2,2021-04-11,코스피 주간 개인 순매수 1위 ‘삼성전자’,이데일리 박정수 기자 박정수
3,2021-04-11,코스피 주간 기관 순매도 1위 ‘삼성전자’,이데일리 박정수 기자 박정수
4,2021-04-11,"LGU+ 직원들도 이제 삼성 갤럭시폰, 아이폰 모두 쓴다",머니투데이 박효주 기자 전자 전략 스마트폰 벨벳 사진 머니 전자가 휴대폰 사업에서 손을 떼면서 계열사 유플러스 직원들이 업무용 전화로 폰이 아닌 다른 제조사 스마트폰을 사용할 수 있게 될 전망이다 일 업계에 따르면 유플러스 노사는 최근 임단협에서 전자 외 스마트폰을 업무용으로 사용할 수 있도록 하는 방안을 협의 중이다 그동안 유플러스 직원이 폰을 의무적으로 사용해야 했던 것은 아니지만 회사의 통신비 지원을 받으려면 폰을 사용해야만 했다 더욱이 업무용 모바일 시스템은 안드로이드용으로만 개발돼 있었다 유플러스 관계자는 전자외 다른 제조사 폰 사용에 대한 노조의 요구가 있었다 며 현재 협의 중인 사항이며 아직 결정된 것은 없다 라고 말했다 전자의 휴대폰 사업 종료로 사실상 선택지가 없기 때문에 별 문제 없이 안이 통과될 것으로 보인다 이렇게되면 하반기부터는 전자 직원들도 삼성전자의 갤럭시와 애플 아이폰을 업무용으로 사용할 수 있게된다 유플러스는 안드로이드 기반 업무 앱을 아이폰운영체제 에서도 사용할 수 있도록 개발할 예정이다 일각에서는 가전과 등 주력 제품의 최대 경쟁 상대인 삼성전자의 갤럭시 스마트폰보다는 그룹의 고객사인 애플 아이폰을 선호하는 분위기도 감지된다 실제 디스플레이 이노텍 등 계열사는 애플에 디스플레이와 카메라 모듈을 공급하고 있으며 이들 회사에서는 아이폰 사용자가 적지 않은 것으로 알려졌다 하지만 삼성전자가 국내 스마트폰 시장의 가량 점유하며 유플러스와 긴밀한 관계를 맺어온 만큼 직원들의 선택에 별다른 제약이 없을 것이라는 게 대체적인 분위기이다 한 업계 관계자는 전자의 사업철수가 결정된 이상 삼성전자나 애플 모두 업무용 단말기로 사용하게될 전망 이라면서 선택폭이 늘어난 만큼 직원들도 긍정적인 반응을 보인다 고 말했다 박효주 기자
5,2021-04-11,"백악관 불려가는 삼성전자, 어떤 '청구서' 받게 될까 [황정수의 반도체...",일 미국 시간 백악관 반도체 회의 미국기업 중심 곳 초청 받아 한국기업 중 유일하게 삼성전자 참석 기업에 대한 반도체의 원활한 공급 미국 내 반도체공장 건설 압박 예상 미국의 압박에 난처해진 삼성 주요 시장인 중국 눈치도 봐야 중국도 삼성에 추가 투자 요청하면 무시할 수 없는 사면초가 상황 몰려 한국 정부는 늑장대응 반도체기업 지원 강화해야 목소리 커져 삼성전자가 일 오후 미국 현지시간 한국 시간으론 일 늦은 밤이나 일 새벽 백악관이 주최하는 반도체 대란 관련 긴급 화상 회의에 참석한다 서밋 으로 이름 붙여진 이 회의는 제이크 설리번 미국 국가안보보좌관과 브라이언 디스 미국 국가경제위원회 위원장이 주재한다 반도체를 국가 안보와 직결되는 전략 물자로 보는 미국 정부의 시각이 담겨 있는 것이다 삼성전자에 미국 기업들에 반도체 잘 공급해달라 미국이 초청한 기업 명단을 보면 백악관의 노골적인 의도가 보인다 지난 일 백악관은 개 초청 기업 명단을 공개했다 이 중 개 기업이 반도체가 부족하거나 제품을 생산할 때 꼭 필요한 미국 업체들이다 구글 모회사 알파벳 통신사 차량용 엔진업체 커민스 와 차 부품 전문 피스톤그룹 전문 델 과 자동차 업체 포드 와 의료기기 전문 메드트로닉 방산업체 노스럽 그러먼 이다 반도체 수요 업체 중에 유일한 외국 업체는 네덜란드에 본사를 둔 자동차업체 스텔란티스 피아트크라이슬러와 푸조시트로엥의 합작사 다 나머지는 반도체 생산업체들로 채워졌다 한국의 삼성전자 대만 파운드리업체 네덜란드 자동차 반도체 전문업체 미국 파운드리업체 글로벌파운드리와 스카이워터테크놀로지 종합반도체 업체 인텔과 메모리반도체 전문 마이크론이다 반도체 품귀 사태가 심화되면서 미국 정부가 삼성전자를 포함한 세계적인 반도체기업을 대상으로 미국 기업에 대한 반도체 공급을 원활하게 해달라 고 요구하는 자리라는 게 전문가들의 분석이다 조 바이든 대통령의 메이드 인 아메리카 공약에 맞춰 미국에 반도체 공장을 많이 지어야한다 는 압박도 받을 것으로 전망된다 미국 공장 건설 서둘러 결정해야 할 수도 한국 기업으로서 유일하게 참석하는 삼성전자는 백악관으로부터 외면할 수 없는 청구서 를 받게 될 전망이다 일단 미국 내 반도체 공장 건설 에 결정을 해야하는 시간이 앞당겨질 수 있다 삼성전자는 현재 미국 텍사스주나 애리조나주 뉴욕주 중 한 곳에 파운드리 공장을 짓는 방안을 추진 중이다 투자 규모만 최소 억달러 약 조원 다 현재 각 지방정부와 세제 등 인센티브를 놓고 치열한 샅바싸움을 벌이는 단계인데 백악관이 나서면 삼성전자가 만족스럽지 못한 조건에도 서둘러 투자 결정을 내려야하는 상황이 올 수 있다 백악관이 회의에 참석하는 포드 등을 위해 삼성전자에 차량용 반도체 생산을 늘려달라는 직접적인 요구를 할 경우 삼성전자의 입장은 난처해질 수 있다 삼성전자는 수익성 등을 고려해 파운드리공장에서 차량용 반도체를 거의 생산하지 않고 있어서다 자칫 미국에 지으려는 최첨단 파운드리공장에 수익성이 떨어지는 차량용 반도체 생산라인을 억지로 마련해야할 수 있다 지난 월 삼성전자가 경기 평택에 짓고 있는 반도체 공장 부지를 이재용 삼성전자 부회장 등이 점검하고 있는 모습 한경 반도체업계 관계자는 삼성전자가 당초 미국 공장을 추가로 건설하기로 한 건 미국 정부의 압박과 경쟁업체 대만 의 미국 공장 신설 결정 등의 영향 이라며 경기 평택을 중심으로 파운드리 경쟁력을 키우려는 삼성전자의 전략에 엇박자가 날 수 있다 고 분석했다 기회 요인도 있다 미국 정부가 자국 반도체 생산시설 신축 등에 인센티브를 주는 방안을 추진 중이라서다 미국 정부가 억달러를 반도체 생산시설 투자와 연구개발 에 지원하는 계획을 지난달 일 발표했다 삼성전자 입장에선 공장을 짓기 전 최대한 많은 것을 얻어내야 하는 상황이다 중국과의 관계 껄끄러워질 수 있어 삼성전자가 미국 손을 들어주는 모습을 보이면 주요 고객사는 물론 핵심 생산시설이 있는 중국과의 관계가 껄끄러워질 것이란 우려도 나온다 중국엔 샤오미 오포 비보 등 삼성전자 메모리반도체를 쓰는 스마트폰업체들이 있다 중국 시안에 최신 낸드플래시 공장을 가동 중이다 현재 짓고 있는 공장은 증설투자가 마무리됐고 올 하반기부터 본격 가동될 전망이다 년 삼성전자 시안 반도체 공장을 방문한 리커창 중국 총리 연합뉴스 중국 역시 미국처럼 자국내 반도체 공급망 추가 확충을 삼성전자에 요구할 가능성도 작지 않다 반도체업체의 한 관계자는 주요 시장과 생산시설이 있는 중국의 요청도 거절하기 어려울 것 이라며 이러지도 저러지도 못하는 상황으로 내몰릴 수 있다 고 분석했다 삼성전자의 경영진들은 우선 백악관의 요구에 어떻게 대응해야 할지 고심하고 있다 백악관 회의엔 최시영 삼성전자 파운드리사업부장 사장 의 참석이 유력한 것으로 알려졌다 현재 가동 중인 미국 오스틴 공장이 파운드리시설이고 추가 투자를 고민 중인 공장도 파운드리 라인이란 이유에서다 이제서야 기업 얘기 듣기 시작한 한국 정부 기업이 알아서 할 일 이라며 뒷 짐 지고 있던 정부는 최근에서야 기업들의 목소리에 귀기울이기 시작했다 지난 일 오전 서울 소공동 웨스틴조선호텔에서 정부와 반도체산업협회 회장단의 간담회가 열렸다 성윤모 산업통상자원부 장관과 이정배 협회장 삼성전자 메모리사업부장 이석희 하이닉스 사장 등 주요 기업 경영진이 마주 앉았다 주무부처 장관과 반도체 기업인들의 대면은 연초 반도체 대란이 본격화한 지 석 달 만이다 지난 일 성윤모 산업통상자원부 장관이 주재한 반도체협회 회장단 간담회 연합뉴스 행사 후 공개된 협회 명의의 대 정부 건의문엔 반도체 패권 전쟁에 내몰린 기업들의 절박함이 묻어났다 협회는 반도체산업지원특별법 제정을 통한 투자 인센티브 확대 등 신속하고 실효성 있는 지원을 요청했다 이날 크게 네 가지를 정부에 요청했다 우선 국내 반도체 제조시설 구축 확대를 위해 전폭 지원해달라고 했다 간담회의 주요 화두도 반도체 시설투자에 대한 인센티브 방안이었다 참석자들은 정부에 연구개발 및 제조설비 투자비용에 대해 까지 세액공제가 필요하다 며 양산용 제조설비 투자비용도 세액공제 대상 범위에 포함돼야 한다 고 말했다 산업부는 총력지원 의사를 밝혔다 성 장관은 업계의 건의사항을 반영해 종합정책을 수립하고 곧 발표할 것 이라고 말했다 다만 반도체산업지원특별법 제정 세제지원 등 업계의 건의 사항이 정책에 충분히 반영될지는 미지수다 세제 지원은 기획재정부 수도권 반도체학과 신설은 교육부 등이 주무부처인 만큼 범정부 차원의 협의가 필요하기 때문이다 벌써부터 정치권과 정부 일각에선 반도체지원특별법 제정에 요구에 대해 일부 기업에 특혜를 주는 것 이라는 반대 움직임도 나타나고 있다 황정수 기자
6,2021-04-11,"삼성·TSMC, 내일 바이든 참모들과 회의…백악관이 밝힌 '호출' 이유",머니투데이 권다희 기자 조 바이든 대통령의 경제 안보 보좌관들이 일 현지시간 삼성전자 등 전세계 주요 반도체 기업 및 완성차 업체들과 화상 회의를 갖는다 백악관은 이 회의에서 전세계 반도체 부족 문제 등을 논의한다고 밝혔다 미국의 반도체 주도권 강화를 밝혀 온 바이든 행정부의 기조 하에 이뤄지는 회의다 워싱턴 뉴스 우동명 기자 조 바이든 미국 대통령이 일 현지시간 워싱턴 백악관에서 카멀라 해리스 부통령이 배석한 가운데 초대형 인프라 투자와 재원 마련을 위한 증세의 필요성을 강조하는 연설을 하고 있다 뉴스 반도체 만드는 삼성 인텔 반도체 부족한 포드와 한자리 블룸버그 통신에 따르면 백악관 관계자는 일 기자들에게 제이크 설리번 국가안보보좌관과 브라이언 디스 국가경제위원회 위원장 주재로 일 반도체 자동차 테크 기업 임원들과 화상회의를 연다고 밝혔다 지나 러만도 미 상무장관도 이 회의에 참석한다 백악관이 공개한 참석 기업은 총 곳이다 삼성전자 인텔 마이크론 글로벌파운드리 스카이워터테크놀로지 등 반도체 기업과 제너럴모터스 포드자동차 스텔란티스 피아트크라이슬러 푸조시트로엥 합병사 미 트럭 업체 파카 알파벳 구글 모기업 델 미 엔진 업체 커민스 미 방산업체 노스럽그러먼 메드트로닉 피스톤 그룹이다 반도체를 만드는 글로벌 기업들과 반도체 품귀로 생산에 어려움을 겪어 온 업체들이 한자리에 모인다 백악관 관계자는 이번 회의 의제에 자동차 산업의 청정 에너지 전환 일자리 창출 미국 경제 경쟁력 강화 등이 포함될 것이라 전했다 이번 회의가 지난달 일 바이든 대통령이 공개한 조 달러 규모의 인프라 투자 및 공급망 확충 문제를 재계와 논의하는 자리가 될 것이라는 게 블룸버그 통신의 설명이다 바이든 행정부가 미국 내 일자리 창출에 방점을 두고 있으며 반도체 등 공급망 문제를 국가안보 관점에서 보고 있다는 시각도 재확인했다 설리번 보좌관은 같은 날 성명에서 바이든 대통령은 국내와 외교 정책이 서로 고립된 상황 을 끝내는 것에 깊이 전념하고 있다 며 반도체 부족은 바이든 정부에게 있어 경제 및 국가안보의 긴급한 우선순위를 보여주는 완벽한 예 라고 설명했다 또 그는 반도체 부족으로 공장이 가동을 쉬게 되며 미국 노동자들과 가족들의 삶이 영향 받고 있다 고 했다 반도체 부족이 국가안보를 취약하게 만들 것이란 점도 강조했다 디스 위원장도 팬데믹이 경제적 취약성과 강력하며 신뢰할 수 있는 공급망의 중요성을 드러냈다고 밝혔다 그러면서 이번 회의는 중요한 공급망을 강화하고 세기 미국 경제를 이끌기 위해 전략적으로 자리를 잡아야 할 긴급한 필요를 드러낸다 며 우리는 핵심 이해관계자들과 이 노력에 대해 협력하기 바란다 고 했다 사진 바이든 정부 미국 내 반도체 생산 일자리 강조 바이든 대통령과 그의 참모들은 대선 기간부터 미국의 외교정책이 미국 중산층을 염두해야 한다는 시각을 거듭 밝혀 왔다 외교 산업 정책이 미국 내 일자리나 미국 내 제조업 기반 확충에 기여하게끔 추진돼야 한다는 의미로 해석되는 메시지다 지난해 팬데믹으로 미국 완성차 업체들이 국외 기업에서 반도체를 조달 받지 못하며 생산에 차질이 빚어지자 정부 차원의 공급망 점검에도 착수했다 바이든 행정부는 지난 월부터 일간 반도체 배터리 등에 대한 공급망 검토를 진행 중인데 예단할 수 없지만 리쇼어링 해외 생산시설의 국내이전 이나 해외 기업들의 미국 내 생산을 장려하는 방향으로 결론이 나올 수 있다고 관측된다 이 외에도 바이든 정부는 미 의회에 반도체 연구개발 자금을 지원하는 법안을 통과시켜 줄 것을 요청한 상태다 조 억달러 규모 인프라 투자안 중에도 억달러 규모의 반도체 산업 및 연구 지원을 포함 자국 산업을 육성하기 위한 인센티브 등이 포함됐다 백악관의 이번 회의 역시 바이든 정부가 추진해 온 이 같은 조치들의 연장선상에서 열리는 것으로 해석된다 특히 삼성전자는 텍사스 오스틴 등 미국 지역 몇 곳을 후보로 두고 공장 증 신설을 검토 중이라 이에 대한 유인책 이 나올 수 있다는 관측도 있다 블룸버그도 이 소식을 보도하며 삼성 인텔 가 모두 미국에 공장을 지을 계획을 발표한 기업이라고 덧붙였다 월스트리트저널 은 백악관이 이번 회의를 앞서 바이든 대통령이 공개한 조 억달러 규모 인프라 투자안을 받아들이도록 하는 플랫폼으로 삼고 싶어 한다고 해석했다 공화당 및 미 재계 일각은 인프라 투자 재원 마련을 위한 법인세 인상 등에 반대하고 있는데 이 자리를 통해 인프라 투자의 필요성을 부각시키려는 의도가 있다는 의미다 권다희 기자
