,날짜,기사제목,본문내용
0,2021-05-23,코로나19에 대형 트럭 판매 늘었다…현대차 31% 증가,아시아경제 이창환 기자 올해 들어 중대형 트럭 판매가 크게 늘어난 것으로 나타났다 일 업계에 따르면 올해 월 현대차의 중대형 트럭 판매는 대로 작년 동기 대비 증가했다 차종별로 보면 대형인 엑시언트는 대 준대형 파비스는 대 판매됐다 중형인 메가트럭과 마이티는 각각 대와 대 팔렸다 년 말 출시된 파비스의 올해 판매량은 작년 같은 기간 대 의 배에 달했다 을 실을 수 있는 파비스 수요의 대부분은 택배 등 중장거리 물류 운송용이다 마이티 와 엑시언트 메가트럭 등 다른 중대형 트럭도 잘 팔렸다 포터와 같은 소형 트럭을 제외한 현대차의 중대형 트럭 판매는 경기 악화로 인해 년까지 부진했다 그러나 코로나 로 비대면 시대가 본격화하면서 물류량이 늘어나 중대형 트럭의 판매도 작년부터 올해까지 꾸준하게 늘어나고 있는 것으로 업계에서는 보고 있다 노후 트럭 교체 지원금 상향도 호재로 작용한 것으로 보인다 정부는 작년 월 발표한 특정경유자동차 등의 저공해 조치 및 보조금 지급 등에 관한 규정 일부 개정안에서 도로용 종 건설기계의 조기 폐차 지원금 상한액을 기존 만원에서 만원으로 상향 조정한 바 있다 이창환 기자
1,2021-05-23,"현대차, 초·중학생 대상 '미래 자동차 학교' 참여학교 모집",현대차 미래 자동차 학교 사진제공 현대차 미래 자동차 학교 서울경제 현대차 가 다음달 일까지 중학교 자유학기제 특화 진로교육 및 초등학교 창의적 체험활동 프로그램인 현대차와 함께 꿈을 키우는 미래 자동차 학교 참여 학교를 모집한다고 일 밝혔다 미래 자동차 학교는 청소년의 진로 탐색에 도움을 주기 위해 현대차가 년 교육부와 업무 협약을 맺고 개발한 교육 프로그램으로 미래 자동차 기술을 이해하고 산업 내 다양한 직업을 탐색할 수 있는 수업으로 구성된다 현대차는 년 개 년 개 년 개 년 개 년 개 중학교에서 운영했으며 작년부터 초등학교용 프로그램을 개발해 확대 운영했다 참여 초교는 작년 개교에서 올해 개교로 늘릴 계획이다 수업은 차시에 걸쳐 진행되는 중등 정규 프로그램 차시로 구성된 중등 단기 프로그램 초등학교 학년을 대상으로 차시에 걸쳐 진행되는 체험학습으로 운영된다 참여 학교에는 신종 코로나바이러스 감염증 코로나 상황 이후 디지털로 전환된 교육 여건에 적합한 온라인 교사 연수와 온라인 수업 가이드가 지원된다 참여를 희망하는 학교는 미래 자동차 학교 초 중등 교사 홈페이지에서 신청하면 된다 현대차 관계자는 청소년이 자동차 산업을 이해하고 진로 탐색하는데 유용한 프로그램인 만큼 많은 관심과 참여를 기대한다 며 지속해서 미래의 주역인 성장 세대와 적극적으로 소통하는 브랜드가 되겠다 고 말했다 변수연 기자
2,2021-05-23,"현대차, 초·중 '미래 자동차 학교' 2학기 참가학교 모집",친환경 모빌리티 등 수업 월 일까지 접수 파이낸셜뉴스 현대자동차가 일부터 월 일까지 중학교 자유학기제 특화 진로교육 및 초등학교 창의적 체험활동 프로그램 현대차와 함께 꿈을 키우는 미래 자동차 학교 미래 자동차 학교 년 학기 참여 학교를 모집한다 미래 자동차 학교 는 청소년들의 진로 탐색에 도움을 주기 위해 현대차가 년 민간기업 최초로 교육부와 업무협약을 체결하고 개발한 교육 프로그램으로 미래 자동차 기술을 이해하고 산업 내 다양한 직업을 탐색할 수 있는 수업으로 구성된다 년 개 년 개 년 개 년 개 년 개 중학교에서 미래 자동차 학교 를 운영하며 자동차의 공학적 원리에 대한 쉽고 재미있는 수업과 모빌리티 관련 체계적인 커리큘럼으로 교육계로부터 꾸준한 호평을 받아왔다 현대자동차가 월 일부터 월 일 금 까지 중학교 자유학기제 특화 진로교육 및 초등학교 창의적 체험활동 프로그램 현대차와 함께 꿈을 키우는 미래 자동차 학교 년 학기 참여 학교를 모집한다 또 년부터는 초등학교 창의적 체험활동 프로그램을 개발 확대 운영했으며 지난해 개교에서 올해는 개교로 확장해 현대차가 구상하는 미래 모빌리티 비전을 적극적으로 공유할 계획이다 수업은 중학생을 대상으로 모빌리티 도시에 활력을 더하다 모빌리티 나의 가치를 이루다 모빌리티 모든 경계를 허물다를 주제로 총 차시에 걸쳐 진행되는 중등 정규 프로그램 차시로 구성된 중등 단기 프로그램으로 진행된다 이와 함께 초등학교 학년 학년을 대상으로 친환경 모빌리티 전기 수소 자동차의 특징과 원리 나만의 클레이 모델 만들기 등을 주제로 총 차시에 걸쳐 체험학습 방식으로 진행된다 참여 학교에는 코로나 상황 이후 디지털로 전환된 교육여건에 적합한 온라인 교사 연수와 온라인 수업 가이드가 지원된다 참여를 희망하는 중학교는 미래 자동차 학교 홈페이지에서 월 일부터 월 일까지 신청할 수 있다 현대차 관계자는 청소년들이 자동차 산업을 이해하고 진로 탐색하는데 유용한 프로그램인 만큼 많은 관심과 참여를 기대한다 라며 지속적으로 미래의 주역인 성장세대와 적극적으로 소통하는 브랜드가 되겠다 고 전했다 김병덕 기자
3,2021-05-23,"""車 좋아하는 초등·중학생 찾습니다""..현대차, 미래차 학교 진행",머니투데이 이강준 기자 사진제공 현대차 현대차가 오는 일부터 다음달 일까지 중학교 자유학기제 특화 진로교육 및 초등학교 창의적 체험활동 프로그램 현대차와 함께 꿈을 키우는 미래 자동차 학교 년 학기 참여 학교를 모집한다고 일 밝혔다 미래 자동차 학교 는 청소년들의 진로 탐색에 도움을 주기 위해 현대차가 년 민간기업 최초로 교육부와 업무협약을 체결하고 개발한 교육 프로그램이다 미래 자동차 기술을 이해하고 산업 내 다양한 직업을 탐색할 수 있는 수업으로 구성되며 년과 년 교육부에서 주관하는 자유학기제 우수 사례 공모전 에서 최고상인 부총리 겸 교육부 장관상 을 년 연속 수상했고 년 진로교육 유공자 교육부장관 표창 을 받기도 했다 현대차는 년 개 년 개 년 개 년 개 년 개 중학교에서 미래 자동차 학교 를 운영하며 자동차의 공학적 원리에 대한 쉽고 재미있는 수업과 모빌리티 관련 체계적인 커리큘럼으로 교육계로부터 꾸준한 호평을 받았다 지난해부터는 초등학교 창의적 체험활동 프로그램을 개발 확대 운영했으며 미래 자동차 학교 에 참여하고자 하는 초등학교의 신청이 지속적으로 증가해 초등학교는 지난해 개교에서 올해 개교로 확장할 계획이다 수업은 중학생을 대상으로 모빌리티 도시에 활력을 더하다 모빌리티 나의 가치를 이루다 모빌리티 모든 경계를 허물다를 주제로 차에 걸쳐 진행되는 중등 정규 프로그램과 차로 구성된 중등 단기 프로그램으로 진행된다 이와 함께 초등학교 학년 학년을 대상으로 친환경 모빌리티 전기 수소 자동차의 특징과 원리 나만의 클레이 모델 만들기 등을 주제로 총 차에 걸쳐 체험학습 방식으로 진행되며 참여 학교에는 코로나 상황 이후 디지털로 전환된 교육여건에 적합한 온라인 교사 연수와 온라인 수업 가이드가 지원된다 참여를 희망하는 중학교는 미래 자동차 학교 중등 교사 홈페이지 초등학교는 미래 자동차 학교 초등 교사 홈페이지에서 일부터 다음달 일까지 신청할 수 있다 현대차 관계자는 청소년들이 자동차 산업을 이해하고 진로 탐색하는데 유용한 프로그램인 만큼 많은 관심과 참여를 기대한다 며 지속적으로 미래의 주역인 성장세대와 적극적으로 소통하는 브랜드가 되겠다 고 말했다 이강준 기자
4,2021-05-23,현대차 '2021년 2학기 미래 자동차 학교' 모집,현대차 년 학기 미래 자동차 학교 모집 아시아경제 이창환 기자 현대자동차가 오는 일부터 다음달 일까지 중학교 자유학기제 특화 진로교육 및 초등학교 창의적 체험활동 프로그램인 현대차와 함께 꿈을 키우는 미래 자동차 학교 이하 미래 자동차 학교 년 학기 참여 학교를 모집한다고 일 밝혔다 미래 자동차 학교 는 청소년들의 진로 탐색에 도움을 주기 위해 현대자동차가 년 민간기업 최초로 교육부와 업무협약을 체결하고 개발한 교육 프로그램이다 미래 자동차 기술을 이해하고 산업 내 다양한 직업을 탐색할 수 있는 수업으로 구성된다 현대차는 년 개 년 개 년 개 년 개 년 개 중학교에서 미래 자동차 학교 를 운영하며 자동차의 공학적 원리에 대한 쉽고 재미있는 수업과 모빌리티 관련 체계적인 커리큘럼으로 교육계로부터 꾸준한 호평을 받아왔다 더욱 많은 성장세대에게 교육 기회를 제공하기 위해 년부터는 초등학교 창의적 체험활동 프로그램을 개발 확대 운영했다 미래 자동차 학교 에 참여하고자 하는 초등학교의 신청이 지속적으로 증가함에 따라 초등학교는 지난해 개 교에서 올해는 개 교로 확장해 미래의 주역인 청소년들에게 현대자동차가 구상하는 미래 모빌리티 비전을 적극적으로 공유할 계획이다 수업은 중학생을 대상으로 모빌리티 도시에 활력을 더하다 모빌리티 나의 가치를 이루다 모빌리티 모든 경계를 허물다를 주제로 총 차시에 걸쳐 진행되는 중등 정규 프로그램 차시로 구성된 중등 단기 프로그램으로 진행된다 이와 함께 초등학교 학년 학년을 대상으로 친환경 모빌리티 전기 수소 자동차의 특징과 원리 나만의 클레이 모델 만들기 등을 주제로 총 차시에 걸쳐 체험학습 방식으로 진행되며 참여 학교에는 코로나 상황 이후 디지털로 전환된 교육여건에 적합한 온라인 교사 연수와 온라인 수업 가이드가 지원된다 현대차 관계자는 청소년들이 자동차 산업을 이해하고 진로 탐색하는데 유용한 프로그램인 만큼 많은 관심과 참여를 기대한다 며 지속적으로 미래의 주역인 성장세대와 적극적으로 소통하는 브랜드가 되겠다 고 했다 이창환 기자
5,2021-05-23,"""모빌리티 인재 키워요""‥현대차, `미래 자동차 학교` 모집",모빌리티 기술 연계 컨텐츠 학습 통한 진로 탐색 오는 일부터 월 일까지 결과 월 일 이데일리 송승현 기자 현대자동차 가 오는 일부터 월 일까지 중학교 자유학기제 특화 진로교육 및 초등학교 창의적 체험활동 프로그램 현대차와 함께 꿈을 키우는 미래 자동차 학교 미래 자동차 학교 년 학기 참여 학교를 모집한다고 일 밝혔다 미래 자동차 학교 는 청소년들의 진로 탐색에 도움을 주기 위해 현대차가 지난 년 민간기업 최초로 교육부와 업무협약을 체결하고 개발한 교육 프로그램이다 미래 자동차 기술을 이해하고 산업 내 다양한 직업을 탐색할 수 있는 수업으로 구성된다 현대차는 년 개 년 개 년 개 년 개 년 개 중학교에서 미래 자동차 학교 를 운영했다 이를 통해 자동차의 공학적 원리에 대한 쉽고 재미있는 수업과 모빌리티 관련 체계적인 커리큘럼으로 교육계로부터 꾸준한 호평을 받아왔다 또한 더욱 많은 성장세대에게 교육 기회를 제공하기 위해 년부터는 초등학교 창의적 체험활동 프로그램을 개발 및 확대 운영했다 이에 따라 미래 자동차 학교 에 참여하고자 하는 초등학교의 신청이 지속적으로 증가하면서 초등학교는 지난해 개에서 올해는 개로 확장해 미래의 주역인 청소년들에게 현대차가 구상하는 미래 모빌리티 비전을 적극적으로 공유할 계획이다 수업은 중학생을 대상으로 모빌리티 도시에 활력을 더하다 모빌리티 나의 가치를 이루다 모빌리티 모든 경계를 허물다를 주제로 총 차시에 걸쳐 진행되는 중등 정규 프로그램 차시로 구성된 중등 단기 프로그램으로 진행된다 아울러 초등학교 학년을 대상으로 친환경 모빌리티 전기 수소 자동차의 특징과 원리 나만의 클레이 모델 만들기 등을 주제로 총 차시에 걸쳐 체험학습 방식으로 진행된다 참여 학교에는 코로나 상황 이후 디지털로 전환된 교육여건에 적합한 온라인 교사 연수와 온라인 수업 가이드가 지원된다 참여를 희망하는 중학교는 미래 자동차 학교 중등 교사 홈페이지 초등학교는 미래 자동차 학교 초등 교사 홈페이지에서 오는 일부터 월 일까지 신청할 수 있다 현대자동차 관계자는 청소년들이 자동차 산업을 이해하고 진로 탐색하는데 유용한 프로그램인 만큼 많은 관심과 참여를 기대한다 며 지속적으로 미래의 주역인 성장세대와 적극적으로 소통하는 브랜드가 되겠다 고 전했다 송승현
