,날짜,기사제목,본문내용
0,2021-05-27,"""소상공인 맞춤 서비스로 'U+ 팬덤' 다질 것"" [fn이사람]",우리회사패키지 개발한 임장혁 유플러스 그룹장 중소상공인 시장에서 연내 억원 수주를 목표로 하고 있다 일 파이낸셜뉴스와 만난 임장혁 유플러스 기업기반사업그룹장 사진 이 밝힌 포부다 유플러스는 우리회사패키지를 앞세워 시장을 공략하고 있다 우리회사패키지는 기업 전용 인터넷과 인터넷전화를 기본으로 스마트오피스를 위한 솔루션까지 저렴하게 이용할 수 있는 서비스다 임 그룹장은 기업고객의 관점에서 회사를 처음 운영하려면 기본적으로 인터넷과 인터넷전화 와이파이 등 유무선 통신서비스가 필요하다 며 회사 규모가 커지고 경영관리 측면에서 업무를 시작하게 되면 메일부터 전자결재 회계프로그램 팩스 등 다양한 솔루션 도입도 요구된다 고 설명했다 유플러스는 기업고객의 다양한 요구를 충족하기 위해 원스톱 서비스인 우리회사패키지를 기획했다 그는 기업 운영에 필수적인 통신서비스와 솔루션을 결합해 제공함으로써 고객에게 더욱 합리적인 요금으로 서비스를 제공하고 상담부터 가입 장애처리까지 원스톱으로 제공하기 위해 패키지 상품 출시를 기획했다 면서 비용부담 완화와 편의 제고 등을 통해 기업고객도 유플러스의 찐팬 으로 만들기 위한 전략이라 할 수 있다 고 말했다 우리회사패키지가 영역을 확장하려는 국내 시장은 통신서비스와 솔루션 시장으로 구성돼 있다 특히 솔루션 시장의 경우 다수의 전문 솔루션사와 치열한 경쟁이 벌어질 것으로 예상된다 임 그룹장은 유플러스가 보유한 통신 운영 노하우와 고객관리 경험 등을 통해 고객사에 안정적 서비스를 제공할 수 있다 며 이를 통해 시장에서 사업 기회를 넓혀 나갈 수 있을 것 이라고 강조했다 우리회사패키지의 장점은 기업고객이 회사를 운영하는 데 꼭 필요한 통신과 솔루션을 결합해 제공하면서 회사 운영비 부담을 줄일 수 있다는 데 있다 그는 고정비 부담이 큰 중소기업은 매월 지출되는 비용을 절감할 수 있을 것으로 기대하고 있다 며 일반적으로 패키지 상품이라고 하면 고정적 서비스가 정해져 있는 반면 우리회사패키지는 원하는 솔루션을 골라 선택할 수 있어 효율적 운영이 가능하다 고 밝혔다 유플러스는 우리회사패키지 서비스의 개선도 준비하고 있다 가령 우리회사패키지에 회사 운영의 중심인 메일 전자결재 등을 지원하는 웍스 서비스의 다국어 기능을 추가하면 해외지사를 보유한 고객을 대상으로 더 많은 영업기회를 확보할 수 있을 것으로 기대된다 그는 현재 기업고객이 선택할 수 있는 솔루션 종 외에 상품 라인업에 솔루션을 추가하는 방안을 검토하고 있다 며 패키지를 구성하고 있는 솔루션들의 기능 개선을 통해 패키지 경쟁력을 강화할 계획 이라고 말했다 유플러스는 우리회사패키지의 경쟁력을 앞세워 국내 시장에서 입지를 다져나가겠다는 전략이다 임 그룹장은 우리회사패키지는 통신만 사용하던 고객에게는 솔루션을 솔루션만 사용하는 고객에게는 통신상품을 판매해 전체 시장에서 입지를 넓혀갈 수 있을 것으로 기대한다 며 향후에는 고객의 요구에 맞는 업종별 맞춤 패키지나 외부의 경쟁력 있는 솔루션을 추가 발굴해 지속적으로 상품을 성장시킬 수 있는 토대를 확보해 나갈 것 이라고 했다 서영준 기자
1,2021-05-27,"[FN이사람] 임장혁 LGU+ 기업기반사업그룹장 ""연내 SME 시장서...",임장혁 유플러스 기업기반사업그룹장 파이낸셜뉴스 중소상공인 시장에서 연내 억원 수주를 목표로 하고 있다 일 파이낸셜뉴스와 만난 임장혁 유플러스 기업기반사업그룹장이 밝힌 포부다 유플러스는 우리회사패키지를 앞세워 시장을 공략하고 있다 우리회사패키지는 기업 전용 인터넷과 인터넷 전화를 기본으로 스마트 오피스를 위한 솔루션까지 저렴하게 이용할 수 있는 서비스다 임 그룹장은 기업 고객의 관점에서 회사를 처음 운영하려면 기본적으로 인터넷과 인터넷전화 와이파이 등 유무선 통신 서비스가 필요하다 며 회사 규모가 커지고 경영관리 측면에서 업무를 시작하게 되면 메일부터 전자결재 회계 프로그램 팩스 등의 다양한 솔루션의 도입도 요구된다 고 설명했다 유플러스는 기업 고객의 다양한 요구를 충족하기 위해 원스톱 서비스인 우리회사패키지를 기획했다 그는 기업 운영에 필수적인 통신 서비스와 솔루션을 결합해 제공함으로써 고객에게 보다 합리적인 요금으로 서비스를 제공하고 상담부터 가입 장애처리까지 원스톱으로 제공하기 위해 패키지 상품 출시를 기획했다 면서 비용 부담 완화와 편의 제고 등을 통해 기업고객도 유플러스의 찐팬으로 만들기 위한 전략이라 할 수 있다 고 말했다 우리회사패키지가 영역을 확장하려는 국내 시장은 통신 서비스와 솔루션 시장으로 구성돼 있다 특히 솔루션 시장의 경우 다수의 전문 솔루션사와 치열한 경쟁이 예상되고 있다 임 그룹장은 유플러스가 보유한 통신 운영 노하우와 고객관리 경험 등을 통해 고객사에 안정적인 서비스를 제공할 수 있다 며 이를 통해 시 장에서의 사업 기회를 넓혀 나갈 수 있을 것 이라고 강조했다 우리회사패키지의 장점은 기업 고객이 회사를 운영함에 있어 꼭 필요한 통신과 솔루션을 결합해 제공하면서 회사 운영비 부담을 줄일 수 있다는데 있다 그는 고정비에 대한 부담이 큰 중소 기업의 경우 매월 지출되는 비용을 절감할 수 있을 것으로 기대하고 있다 며 일반적으로 패키지 상품이라고 하면 고정적인 서비스가 정해져 있는 반면 우리회사패키지는 원하는 솔루션을 골라 선택할 수 있어 효율적인 운영이 가능하다 고 밝혔다 유플러스는 우리회사패키지 서비스의 개선도 준비하고 있다 가령 우리회사패키지에 회사 운영의 중심인 메일 전자결재 등을 지원하는 웍스 서비스의 다국어 기능을 추가하면 해외 지사를 보유한 고객을 대상으로 보다 많은 영업기회를 확보할 수 있을 것으로 기대된다 그는 현재 기업고객이 선택할 수 있는 솔루션 종 외에 추가적인 솔루션을 상품 라인업에 추가하는 방안을 검토하고 있다 며 패키지를 구성하고 있는 솔루션들의 기능 개선을 통해 패키지 경쟁력을 강화할 계획 이라고 말했다 유플러스는 우리회사패키지의 경쟁력을 앞세워 국내 시장에서 입지를 다져나가겠다는 전략이다 임 그룹장은 우리회사패키지는 통신만 사용하던 고객에게는 솔루션을 솔루션만 사용하는 고객에게는 통신 상품을 판매해 전체 시장에서의 입지를 넓혀갈 수 있을 것이라 기대한다 며 향후에는 고객 요구에 맞는 업종별 맞춤 패키지나 외부의 경쟁력 있는 솔루션을 추가 발굴해 지속적으로 상품을 성장시킬 수 있는 토대를 확보해 나갈 것 이라고 했다 서영준 기자
2,2021-05-27,"LGU+, 공공·민간에 양자암호통신 시범 인프라 구축",파이낸셜뉴스 유플러스는 서울대학교 크립토랩 드림시큐리티로 구성된 유플러스 컨소시엄이 과학기술정보통신부 주관 한국지능정보사회진흥원 이 발주한 양자암호 관련 과제를 수주했다고 일 밝혔다 유플러스를 주축으로 구성된 컨소시엄이 공공 민간 부문 양자암호통신 시범 인프라 구축에 나선다 유플러스 직원들이 일 양자내성암호 기술을 검증하고 있다 유플러스 제공 유플러스 컨소시엄은 지난해 의료 산업 부문에 양자암호기술을 적용하는 실증에 이어 올해 과제 수주를 통해 공공 민간 부문으로 실증 범위를 확대할 수 있게 됐다 공공부문에서 컨소시엄은 충남도청과 공무원교육원 사이 구간에 양자내성암호 전용 회선을 구축할 방침이다 충남 홍성에 위치한 도청과 공주에 위치한 공무원교육원 사이 거리는 에 달한다 주민등록번호나 운전면허증 계좌번호 등 민감한 개인정보는 데이터베이스에 저장시 암호화가 필수로 요구된다 컨소시엄은 충남도청 업무에서 생성되는 도민의 민감 정보에 대한 데이터베이스 암호화 시 양자내성암호를 활용할 계획이다 양자내성암호는 암호키 교환 등 보안의 주요 핵심요소에 적용할 수 있어 확장성이 높고 수백 이상의 장거리 전송이 가능하며 별도의 장비 없이 소프트웨어만으로도 구현이 가능하다 이를 통해 공무원교육원 내 교육생의 개인정보 및 교육 데이터 보안이 강화될 것으로 기대된다 민간부문에서는 엔터테인먼트사와 발전소에 각각 양자내성암호 전용회선을 구축한다 양자내성암호통신과 새로운 인증보안 기술을 융합해 안전한 비대면 서비스를 확산하겠다는 것이 목표다 컨소시엄은 엔터테인먼트사의 전용회선 구간에 양자내성암호 기술을 적용해 회사가 보유한 지적재산권이나 창작물 등 정보 보안을 강화한다 양자암호 기반의 차세대 인증 플랫폼을 개발해 공연 티켓 예매 인증에 활용함으로써 분야에도 양자암호 기술도 선보일 계획이다 고도의 보안이 요구되는 발전시설인 당진사무소와 서울사무소 구간에도 양자내성암호 회선을 구축해 사이버 공격에 의한 대규모 정전 등을 사전에 차단할 방침이다 양자암호 기술이 적용된 안면인식출입시스템을 개발해 통제 구역에 대한 보안을 고도화할 계획이다 유플러스는 정부의 뉴딜 과제 수행을 통해 양자내성암호의 활용 범위를 확대하고 있다 앞서 광통신장비 와 소형 디바이스에도 적용가능한 형 보안토큰 에 양자내성암호를 적용한데 이어 애플리케이션으로도 범위를 넓히고 있다 이를 통해 양자컴퓨팅시대에도 유효한 전 계층 보안체계를 만들겠다는 전략이다 임장혁 유플러스 기반사업그룹장은 공공 민간부문 시범 사업을 통해 양자내성암호 기술력을 높여갈 계획 이라며 암호키교환 등 알고리즘을 한층 더 업그레이드해 보편적이고 활용도가 높은 양자보안 인프라를 늘려 나갈 것 이라고 말했다 서영준 기자
3,2021-05-27,"LGU+, 도청·발전소에 ‘양자암호통신 시범 인프라’ 구축",컨소시엄 정부 발주 과제 수주 충남도청 공무원교육원 구간 전용선 구축 엔터테인먼트 에너지 기업에도 양자암호 기술 적용 유플러스 직원들이 양자내성암호 기술을 검증하는 모습 유플러스 제공 헤럴드경제 박세정 기자 유플러스를 주축으로 구성된 컨소시엄이 공공 민간 부문에 양자암호통신 시범 인프라 를 구축한다 유플러스와 서울대학교 크립토랩 드림시큐리티로 구성된 유플러스 컨소시엄 은 과학기술정보통신부 주관하고 한국지능정보사회진흥원 이 발주한 양자암호 관련 과제를 수주했다고 일 밝혔다 양자 암호 통신은 빛 양자 입자인 광자를 이용해 정보를 전달 보안을 강화한 기술이다 컨소시엄은 우선 공공부문에서 충남도청과 공무원교육원 사이 구간에 양자내성암호 전용 회선을 구축할 방침이다 충남 홍성에 위치한 도청과 공주에 위치한 공무원교육원 사이 거리는 에 달한다 주민등록번호나 운전면허증 계좌번호 등 민감한 개인정보는 데이터베이스에 저장 시 암호화가 필수로 요구된다 컨소시엄은 충남도청 업무에서 생성되는 도민의 민감 정보에 대한 데이터베이스 암호화 시 양자내성암호를 활용할 계획이다 양자내성암호는 암호키 교환 등 보안의 주요 핵심요소에 적용할 수 있어 확장성이 높고 수백 이상의 장거리 전송이 가능하다 별도의 장비 없이 소프트웨어만으로도 구현할 수 있다 이를 통해 공무원교육원 내 교육생의 개인정보 및 교육 데이터 보안이 강화될 것으로 컨소시엄은 기대했다 이와함께 민간부문에서는 엔터테인먼트사와 발전소에 각각 양자내성암호 전용회선을 구축한다 양자내성암호통신과 새로운 인증보안 기술을 융합해 안전한 비대면 서비스를 확산하겠다는 것이 목표다 컨소시엄은 엔터테인먼트사의 전용회선 구간에 양자내성암호 기술을 적용 회사가 보유한 지적재산권이나 창작물 등 정보 보안을 강화한다 양자암호 기반의 차세대 인증 플랫폼을 개발해 공연 티켓 예매 인증에 활용함으로써 개인고객 분야에도 양자암호 기술을 선보일 계획이다 이외에 발전시설인 당진사무소와 서울사무소 구간에도 양자내성암호 회선을 구축해 사이버 공격에 의한 대규모 정전 등을 사전에 차단할 방침이다 양자암호 기술이 적용된 안면인식출입시스템을 개발해 통제 구역에 대한 보안도 높인다 임장혁 유플러스 기반사업그룹장은 공공 민간부문 시범 사업을 통해 양자내성암호 기술력을 높여갈 계획 이라며 암호키교환 등 알고리즘을 한층 더 업그레이드해 보편적이고 활용도가 높은 양자보안 인프라를 늘려 나갈 것 이라고 말했다
4,2021-05-27,"LGU+, 충남도청·엔터사 등에 '양자암호통신 인프라' 깐다",머니투데이 김수현 기자 양자내성암호 인증보안 융합해 보안성 강화 충남도청 공무원교육원 구간 전용회선 구축 유플러스를 주축으로 구성된 컨소시엄이 공공 민간 부문 양자암호통신 시범 인프라 구축에 나선다고 일 밝혔다 사진은 유플러스 직원들이 양자내성암호 기술을 검증하는 모습 사진 유플러스 유플러스가 주도하는 컨소시엄이 공공 민간 부문에 양자암호통신 시범 인프라 를 구축한다 유플러스와 서울대학교 크립토랩 드림시큐리티로 구성된 유플러스 컨소시엄 은 과학기술정보통신부가 주관하고 한국지능정보사회진흥원 이 발주한 양자암호 관련 과제를 수주했다고 일 밝혔다 컨소시엄은 지난해 의료 산업 부문에 양자암호기술을 적용하는 실증에 이어 공공 민간 부문으로 실증 범위를 확대할 수 있게 됐다 컨소시엄은 충남도청과 공무원교육원 사이 구간에 양자내성암호 전용 회선을 구축한다 충남 홍성의 도청과 공주의 공무원교육원 사이 거리는 에 달한다 컨소시엄은 충남도청 업무에서 생성되는 도민의 민감 정보 데이터베이스를 암호화할 때 양자내성암호를 활용할 계획이다 양자내성암호는 암호키 교환 등 보안의 주요 핵심요소에 적용할 수 있어 확장성이 높고 수백 이상의 장거리 전송이 가능하다 별도 장비 없이 소프트웨어만으로도 구현할 수 있다 민간부문에선 엔터테인먼트사와 발전소에 각각 양자내성암호 전용회선을 구축한다 양자내성암호통신과 새로운 인증보안 기술을 융합해 안전한 비대면 서비스를 확산하겠다는 것이 목표다 컨소시엄은 엔터테인먼트사의 전용회선 구간에 양자내성암호 기술을 적용 회사가 보유한 지적재산권이나 창작물 등 정보 보안을 강화한다 양자암호 기반의 차세대 인증 플랫폼을 개발해 공연 티켓 예매 인증에 활용함으로써 분야에도 양자암호 기술도 선보일 계획이다 고도의 보안이 요구되는 발전시설인 당진사무소와 서울사무소 구간에도 양자내성암호 회선을 구축해 사이버 공격에 의한 대규모 정전 등을 사전에 차단할 방침이다 양자암호 기술이 적용된 안면인식출입시스템을 개발해 통제 구역에 대한 보안을 고도화한다 임장혁 유플러스 기반사업그룹장은 공공 민간부문 시범 사업을 통해 양자내성암호 기술력을 높여갈 계획 이라며 암호키교환 등 알고리즘을 한층 더 업그레이드해 보편적이고 활용도가 높은 양자보안 인프라를 늘려 나갈 것 이라고 말했다 김수현 기자
