,날짜,기사제목,본문내용
0,2021-05-11,셀트리온 '렉키로나' 범아랍권 진출,사우디 등 주요국 허가 접수 완료 셀트리온이 개발한 코로나 항체치료제 렉키로나 사진 가 파키스탄에 이어 범아랍권에 진출한다 일 업계에 따르면 셀트리온은 최근 사우디아라비아 아랍에미리트 요르단 이라크 모로코 등 주요 범아랍권 각 국 규제 당국에 렉키로나의 사용 허가 접수를 완료했다 셀트리온은 중동지역의 사용 허가 절차에 속도를 내 범아랍권 국가의 코로나 확산 방지를 위해 앞장설 계획이다 앞서 셀트리온은 지역 내 첫 공급 계약으로 파키스탄 국영 기업에 만 바이알의 렉키로나를 순차적으로 공급하는 계약 내용을 발표한 바 있다 셀트리온은 올해 월 초 식품의약품안전처로부터 렉키로나의 조건부 품목허가를 받은 이래 글로벌 허가 절차를 지속적으로 진행해 왔다 특히 유럽의약품청 은 롤링리뷰를 통해 렉키로나의 안전성과 유효성 등에 대한 평가를 진행하고 있으며 지난 월 말에는 코로나 치료제 사용이 시급한 유럽 국가가 렉키로나의 품목 허가 전 도입이 가능하도록 사용 권고 의견을 제시하기도 했다 또한 지난 일 유럽연합 집행위원회에서 월까지 개의 코로나 치료제의 판매를 승인하고 이와 별도로 월까지 가장 유망한 코로나 치료제 종을 선별해 연말까지 유럽 각국 정부를 위한 공동조달계약을 체결할 계획이라고 밝혀 셀트리온그룹이 현재 진행중인 유럽 허가 및 공급 논의가 더욱 가속화될 것으로 보고 있다 셀트리온 관계자는 중동 내 주요 국가들에 렉키로나의 사용 허가 제출을 완료하고 아시아 북아프리카 등 범아랍권 국가들에서도 허가 절차에 속도를 내고 있다 며 항체 치료제의 제한된 생산량을 고려해 조기진단 및 조기치료를 통해 중증 혹은 사망 환자 예방이 가능한 의료 인프라를 갖춘 국가들을 우선해 렉키로나를 공급해 나갈 예정이다 고 밝혔다 홍석근 기자
1,2021-05-11,"셀트리온, 렉키로나 중동 주요 국가에 사용허가 신청",코로나 항체 치료제 셀트리온은 범아랍권 국가의 규제당국에 코로나 항체 치료제인 렉키로나의 사용 허가를 신청했다고 일 밝혔다 사우디아라비아 아랍에미리트 요르단 이라크 모로코 등 중동 내 주요 국가에서 접수를 마쳤다 회사는 범아랍권 지역의 코로나 확산 방지를 위한 사용 허가 절차에 속도를 높이겠다는 방침이다 전날에는 파키스탄 국영기업에 렉키로나 만 바이알을 판매하는 계약 체결 소식을 알렸다 셀트리온은 지난 월 국내 식품의약품안전처로부터 렉키로나의 조건부 품목허가를 받았다 이후 글로벌 허가 절차를 진행해왔다 유럽의약품청 은 순차심사 롤링 리뷰 를 통해 안전성 및 유효성 등에 대한 평가를 진행하고 있다 지난 월 말에는 품목허가 전 도입이 가능하도록 사용 권고 의견을 제시했다 셀트리온 관계자는 중동 주요 국가들에 렉키로나의 사용허가 제출을 완료하고 아시아와 북아프리카 등 범아랍권 국가들에서도 허가 절차에 속도를 내고 있다 며 항체 치료제의 제한된 생산량을 고려해 조기진단 및 조기치료를 통해 중증 혹은 사망 환자 예방이 가능한 의료 인프라를 갖춘 국가들을 우선해 렉키로나를 공급해 나갈 예정 이라고 말했다 박인혁 기자
2,2021-05-11,"셀트리온, 코로나19 치료제 '렉키로나' 주요 범아랍권 국가 사용 허...",아랍에미리트 요르단 이라크 모로코 등 유럽 허가 및 공급 논의도 가속화 전망 코로나 항체치료제 렉키로나 사진 제공 셀트리온 서울경제 셀트리온 은 코로나 항체 치료제 렉키로나 에 대한 범아랍권 수출에 나섰다 셀트리온은 일 사우디아라비아 아랍에미리트 요르단 이라크 모로코 등 범아랍권 각 국 규제 당국에 렉키로나 사용 허가 접수를 완료했다고 밝혔다 최근 파키스탄 국영 기업에 만 바이알 수출 계약을 체결한 데 이어 글로벌 각국으로 진출 지역을 확대하고 있는 것이다 렉키로나는 지난 월 국내 식품의약품안전처로부터 조건부 품목허가를 받은 첫 국산 코로나 치료제다 현재 유럽의약품청 은 롤링리뷰 를 통해 렉키로나의 안전성과 유효성 등에 대한 평가를 진행하고 있다 지난 월 말에는 코로나 치료제 사용이 시급한 유럽 국가는 렉키로나의 품목 허가 전 도입이 가능하도록 사용 권고 의견을 제시하기도 했다 회사 관계자는 중동 내 주요 국가들에 렉키로나의 사용 허가 제출을 완료하고 아시아 북아프리카 등 범아랍권 국가들에서도 허가 절차에 속도를 내고 있다 며 중증 혹은 사망 환자 예방이 가능한 의료 인프라를 갖춘 국가들에 우선적으로 공급할 계획 이라고 말했다 이주원 기자
3,2021-05-11,"셀트리온, 코로나19 치료제 아랍권 사용허가 절차 본격화",머니투데이 김도윤 기자 셀트리온은 코로나 항체 치료제 렉키로나 의 범아랍권 주요 국가에 대한 사용 허가 절차가 본격화했다고 일 밝혔다 셀트리온은 최근 사우디아라비아 아랍에미리트 요르단 이라크 모로코 등 주요 범아랍권 나라의 규제 당국에 렉키로나 사용 허가 접수를 완료했다 셀트리온은 중동 지역의 렉키로나 사용 허가 절차에 속도를 내 범아랍권 국가의 코로나 확산 방지를 위해 앞장선다는 계획이다 최근 해당 지역 첫 공급 계약으로 파키스탄 국영 기업에 렉키로나 만바이알을 순차적으로 공급하는 계약 내용을 발표한 바 있다 셀트리온은 지난 월 식품의약품안전처 식약처 로부터 렉키로나의 조건부 품목허가를 받은 뒤 글로벌 허가 절차를 지속적으로 진행하고 있다 특히 유럽의약품청 은 롤링리뷰 를 통해 렉키로나의 안전성과 유효성 등에 대한 평가를 진행 중이다 지난 월 말 코로나 치료제 사용이 시급한 유럽 국가는 렉키로나의 품목 허가 전 도입이 가능하도록 사용 권고 의견을 제시했다 또 지난 일 유럽연합 집행위원회 는 오는 월까지 개의 코로나 치료제 판매를 승인하고 이와 별도로 오는 월까지 가장 유망한 코로나 치료제 종을 선별해 연말까지 유럽 각국 정부를 위한 공동조달계약을 체결할 계획이라고 밝혔다 셀트리온그룹이 현재 진행 중인 유럽 허가 및 공급 논의가 더욱 가속화될 것으로 예상된다 셀트리온 관계자는 중동 주요 국가에 렉키로나의 사용 허가 제출을 완료하고 아시아 북아프리카 등 범아랍권 국가에서도 허가 절차에 속도를 내고 있다 며 코로나 조기 진단 및 치료를 통해 중증 혹은 사망 환자 예방이 가능한 의료 인프라를 갖춘 국가를 우선적으로 렉키로나를 공급할 예정 이라고 말했다 김도윤 기자
4,2021-05-11,셀트리온 '렉키로나' 중동지역 진출 본격화,코로나 항체 치료제 파키스탄 만 바이알 순차적으로 공급 개시 사우디 이라크 등도 셀트리온 코로나 항체치료제 렉키로나 가 중동 지역 진출을 본격화한다 일 셀트리온은 최근 사우디아라비아 아랍에미리트 요르단 이라크 모로코 등 주요 범아랍권 각 국 규제 당국에 렉키로나의 사용 허가 접수를 완료했다 며 우선 파키스탄부터 만 바이알을 순차적으로 공급한다 고 밝혔다 셀트리온은 월 초 식품의약품안전처로부터 렉키로나의 조건부 품목허가를 받은 이래 해외 허가에 속도를 내고 있다 특히 유럽의약품청 은 롤링리뷰 를 통해 렉키로나의 안전성 유효성 등에 대한 평가를 진행하고 있다 일례로 지난 월 유럽 국가를 대상으로 품목 허가 전 도입이 가능하도록 사용 권고 의견을 낸 적 있다 렉키로나 유럽 허가와 공급 논의는 더 속도를 낼 전망이다 지난 일 유럽연합집행위원회 는 오는 월까지 개의 코로나 치료제의 판매를 승인하기로 했다 이와 별도로 오는 월까지 코로나 치료제 종을 선별 유럽 각국 정부를 위한 공동조달계약을 올 연말 내로 체결할 계획이라고 밝혔다 셀트리온 관계자는 중동 내 주요 국가들에 렉키로나의 사용 허가 제출을 완료하고 아시아 북아프리카 등 범아랍권 국가들에서도 허가 절차에 속도를 내고 있다 며 항체 치료제의 제한된 생산량을 고려해 중증 혹은 사망 환자 예방이 가능한 의료 인프라를 갖춘 국가들에 먼저 렉키로나를 공급해 나갈 예정 이라고 말했다 김시균 기자
5,2021-05-11,"셀트리온, 코로나19 치료제 사우디 등에 허가 신청",사우디아라비아 요르단 등 신청 완료 이데일리 노희준 기자 셀트리온 은 사우디아라비아 요르단 등 범아랍권 주요 국가에 코로나 항체 치료제 렉키로나의 사용 허가를 접수했다고 일 밝혔다 셀트리온은 최근 사우디아라비아 아랍에미리트 요르단 이라크 모로코 등의 각국 규제 당국에 렉키로나의 사용 허가 접수를 마쳤다 셀트리온은 전날 범아랍권 지역 내 첫 공급 계약으로 파키스탄 국영 기업에 만 바이알의 렉키로나를 순차적으로 공급하는 계약 내용을 발표했다 셀트리온은 올해 월 초 식품의약품안전처로부터 렉키로나의 조건부 품목허가를 받은 이래 글로벌 허가 절차를 지속적으로 진행하고 있다 특히 유럽식약청 은 롤링리뷰 순차심사 를 통해 렉키로나의 안전성과 유효성 등에 대한 평가를 진행하고 있다 는 지난 월 말에는 코로나 치료제 사용이 시급한 유럽 국가가 렉키로나의 품목 허가 전 도입을 할 수 있도록 사용 권고 의견을 제시하기도 했다 유럽연합 집행위원회 는 최근 월까지 개의 코로나 치료제를 승인하고 월까지 유망한 코로나 치료제 종을 선별해 연말까지 유럽 각국을 위한 공동조달계약을 체결할 계획이라고 밝혔다 셀트리온 관계자는 중동 내 주요 국가들에 렉키로나의 사용 허가 제출을 완료하고 아시아 북아프리카 등 범아랍권 국가들에서도 허가 절차에 속도를 내고 있다 고 말했다 셀트리온은 항체 치료제의 제한된 생산량을 고려 조기진단 및 조기치료를 통해 중증 혹은 사망 환자 예방이 가능한 의료 인프라를 갖춘 국가를 우선해 렉키로나를 공급할 계획이다 노희준
6,2021-05-11,"셀트리온 코로나19 치료제, 중동지역 진출 본격 채비",사우디 이라크 등 범아랍권 주요국에 사용허가 접수 아시아경제 김지희 기자 셀트리온은 코로나 항체치료제 렉키로나의 범아랍권 주요국 사용 허가 절차가 본격화했다고 일 밝혔다 셀트리온은 최근 사우디아라비아 아랍에미리트 요르단 이라크 모로코 등 주요 범아랍권 국가의 규제 당국에 렉키로나의 사용 허가 접수를 완료했다 중동지역의 사용 허가 절차에 속도를 높여 범아랍권 국가의 코로나 확산 방지에 앞장선다는 계획이다 지역 내 첫 공급 계약으로 파키스탄 국영 기업에 만 바이알의 렉키로나를 순차 공급하는 계약 내용도 발표했다 셀트리온은 올해 월 초 식품의약품안전처로부터 렉키로나의 조건부 품목허가를 받은 바 있다 현재 유럽의약품청 이 롤링리뷰를 통해 렉키로나의 안전성과 유효성 등에 대한 평가를 진행하고 있으며 지난 월에는 코로나 치료제 사용이 시급한 유럽 국가가 렉키로나의 품목 허가 전 도입이 가능토록 사용 권고 의견을 제시하기도 했다 셀트리온은 지난 일 유럽연합 집행위원회가 오는 월까지 코로나 치료제 개의 판매를 승인하고 월까지 가장 유망한 코로나 치료제 종을 선별해 연말까지 유럽 각국 정부를 위한 공동조달계약을 체결할 계획이라고 밝힌 만큼 현재 진행중인 유럽 허가 및 공급 논의가 더욱 가속화될 것으로 보고 있다 셀트리온 관계자는 중동 내 주요 국가들에 렉키로나의 사용 허가 제출을 완료하고 아시아 북아프리카 등 범아랍권 국가들에서도 허가 절차에 속도를 내고 있다 며 항체 치료제의 제한된 생산량을 고려해 조기진단 및 조기치료를 통해 중증 혹은 사망 환자 예방이 가능한 의료 인프라를 갖춘 국가들을 우선해 렉키로나를 공급해 나갈 예정 이라고 밝혔다 김지희 기자
