,날짜,기사제목,본문내용
0,2021-05-14,"셀트리온 “렉키로나, 뉴욕·나이지리아·인도 변이 중화능 확인”",코로나 항체치료제 세포실험 결과 브라질 변이주는 중화능 감소 코로나 항체치료제 렉키로나 사진 제공 셀트리온 셀트리온은 세포실험 결과 코로나 항체치료제인 렉키로나 가 뉴욕 나이지리아 인도 변이 바이러스에 대해서도 중화능이 있음을 확인했다고 일 밝혔다 질병관리청 국립보건연구원은 각각의 변이주를 항체와 혼합해 숙주 세포에 감염시킨 후에 항체가 바이러스를 저해하는 정도를 실험했다 그 결과 렉키로나가 뉴욕 및 나이지리아 변이주에 대해 강한 중화 능력을 발휘함을 확인했다 다만 브라질 변이주에 대해서는 중화능력이 감소됐음을 확인했다 회사는 동물시험 절차를 거쳐 브라질 변이주에 대한 렉키로나의 실제 임상적 치료 효과를 확인할 방침이다 셀트리온은 질병관리청의 실험과 별개로 최근 해외 연구 기관에 의뢰해 모방바이러스 슈도바이러스 실험을 실시했다 슈도바이러스는 실제 세포주를 모방해서 만든 바이러스를 의미한다 그 결과 회사는 인도 변이주에 대한 렉키로나의 중화능을 확인했다 셀트리온은 국내에서 발견된 변이주 중 및 영국 브라질 캘리포니아 변이에 대해서는 렉키로나의 중화능을 확인했다 회사 관계자는 추가 변이가 계속 발생할 수 있는 만큼 상황을 계속 주시하고 있다 며 새로 발생되는 변이에 렉키로나가 중화능을 보이는지 계속 시험할 것 이라고 말했다 박인혁 기자
1,2021-05-14,"셀트리온 ""항체치료제 뉴욕·나이지리아·인도 변이 효과…브라질 변이 효...",아시아경제 서소정 기자 셀트리온의 코로나 항체치료제 렉키로나 가 뉴욕 나이지리아 인도 변이 바이러스에는 효과를 보였지만 브라질 변이 바이러스에는 효과가 떨어지는 것으로 확인됐다 셀트리온은 질병관리청 국립보건연구원에서 최근 확산하고 있는 변이주에 대한 렉키로나의 중화능력을 시험한 결과 이같이 나타났다고 일 밝혔다 변이주를 항체와 혼합해 숙주 세포에 감염시킨 후 항체가 바이러스를 저해하는 정도를 확인한 결과 렉키로나는 뉴욕과 나이지리아 변이주에서 중화 능력을 보였다 또 최근 셀트리온이 해외 연구기관에 의뢰해 실시한 슈도 바이러스 유사 바이러스 시험 결과 인도 변이주에 대해서도 렉키로나는 억제력을 나타냈다 다만 질병관리청에서 실시한 시험 결과 브라질 변이주에는 중화능력이 감소했다 이에 셀트리온은 브라질 변이주에 대해 동물실험 절차를 거쳐 렉키로나의 실제 임상적 치료 효능을 다시 확인할 방침이다 브리질 변이주와 공통점이 많은 남아프리카 공화국 변이 바이러스에도 중화능력이 감소한 것으로 확인됐다 셀트리온 관계자는 최근 산발적으로 유행하고 있는 남아공 영국 브라질 뉴욕 나이지리아 인도 등 다양한 변이에 충분한 효력을 발휘할 것으로 보지만 추가 변이가 계속 발생할 수 있는 만큼 상황을 계속 모니터링하고 있다 면서 새로 발생되는 변이에 렉키로나가 중화능을 보이는지 계속 시험해 나갈 것 이라고 말했다 서소정 기자
2,2021-05-14,"셀트리온 ""렉키로나 인도·뉴욕 변이 중화능 확인""",머니투데이 김도윤 기자 셀트리온의 코로나 항체치료제 렉키로나 사진제공 셀트리온 셀트리온은 코로나 항체치료제 렉키로나 가 뉴욕 나이지리아 인도 변이 바이러스에서 중화능을 확인했다고 일 밝혔다 질병관리청 국립보건연구원은 최근 뉴욕 및 나이지리아 변이주를 비롯해 브라질 변이주 를 항체와 혼합해 숙주 세포에 감염시킨 뒤 항체가 바이러스를 저해하는 정도를 테스트하는 방식으로 렉키로나의 중화능력을 시험했다 이 시험에서 렉키로나는 뉴욕 및 나이지리아 변이주에서 이전 변이와 마찬가지로 강한 중화능력을 보였다 또 최근 셀트리온이 해외 연구기관에 의뢰해 실시한 슈도바이러스 시험 결과 인도 변이주에 대해서도 렉키로나가 중화능을 보인 것으로 확인됐다 다만 질병관리청에서 실시한 시험에서 브라질 변이주 에 대해선 중화능력이 감소했다고 확인했다 이에 셀트리온은 브라질 변이주에 대해 동물시험 절차를 걸쳐 렉키로나의 실제 임상적 치료능력을 다시 확인할 방침이다 셀트리온은 브라질 변이주 와 공통점이 많은 남아공 변이주에 대해 세포 수준에선 렉키로나의 중화능력이 감소했지만 동물시험에서 인체 치료 용량과 동등한 양의 항체를 주입 시 효과적으로 바이러스를 감소시키는 것을 확인해 국제 학술지에 결과를 제출한 바 있다 렉키로나는 이 외에 국내에서 발견된 변이주중 이미 종 및 영국 브라질 캘리포니아 변이에 대해 우수한 중화능을 보이는 것으로 확인된 바 있다 셀트리온 관계자는 렉키로나가 최근 산발적으로 유행하고 있는 남아공 영국 브라질 뉴욕 나이지리아 인도 등 다양한 변이에 충분한 효력을 발휘할 것으로 본다 며 다만 추가 변이가 계속 발생할 수 있는 만큼 상황을 계속 모니터링하고 있다 고 말했다 이어 새로 발생되는 변이에 렉키로나가 중화능을 보이는지 계속 시험하겠다 고 덧붙였다 김도윤 기자
3,2021-05-14,"셀트리온 ""렉키로나, 뉴욕·나이지리아·인도변이에도 효과""",해외 연구기관 의뢰해 실시한 시험 결과 브라질 변이에는 중화능력 감소 셀트리온 코로나 치료제 렉키로나주 사진 제공 셀트리온 서울경제 셀트리온 은 자사의 신종 코로나바이러스 감염증 코로나 항체치료제 렉키로나가 뉴욕 나이지리아 인도 변이 바이러스에서 중화능력을 확인했다고 일 밝혔다 질병관리청 국립보건연구원은 최근 렉키로나의 중화능력 시험을 진행한 결과 렉키로나가 뉴욕 및 나이지리아 변이주에서 이전 변이와 마찬가지로 강한 중화능력을 보인 것을 확인했다 또 셀트리온이 해외 연구기관에 의뢰해 실시한 슈도바이러스 시험 결과 인도 변이주에 대해서도 렉키로나가 중화능을 보인 것으로 확인돼 충분한 치료 효과를 보일 것으로 판단했다 다만 질병관리청에서 실시한 시험에서 브라질 변이주에는 중화능력이 감소됐음을 확인했다 이에 셀트리온은 브라질 변이주에 대해 동물시험 절차를 걸쳐 렉키로나의 실제 임상적 치료능력을 다시 확인할 방침이다 셀트리온은 브라질 변이주와 공통점이 많은 남아공 변이주에서도 세포 수준에서는 렉키로나의 중화능력이 감소했지만 최근 실시한 동물시험에서는 인체 치료용량과 동등한 양의 항체를 주입 시 효과적으로 바이러스를 감소시키는 것을 확인해 국제 학술지에 그 결과를 제출한 바 있다 이외에도 렉키로나는 국내에서 발견된 변이주중 이미 종 및 영국 브라질 캘리포니아 변이에 대해서는 우수한 중화능력을 보이는 것으로 확인했다 셀트리온 관계자는 렉키로나가 최근 산발적으로 유행하고 있는 남아공 영국 브라질 뉴욕 나이지리아 인도 등 다양한 변이에 충분한 효력을 발휘할 것으로 보지만 추가 변이가 계속 발생할 수 있는 만큼 상황을 계속 모니터링하고 있다 면서 새로 발생되는 변이에 렉키로나가 중화능력을 보이는지 계속 시험해 나갈 것 이라고 말했다 김성원 기자
4,2021-05-14,"셀트리온 '렉키로나' , 뉴욕·나이지리아·인도 변이 바이러스에도 중화...",파이낸셜뉴스 셀트리온의 코로나 항체치료제 렉키로나가 뉴욕 나이지리아 인도 변이 바이러스에서 중화능을 확인했다 이에 향후 코로나 변이 바이러스 감염 환자의 치료제로의 가능성이 확인됐다 일 셀트리온에 따르면 질병관리청 국립보건연구원은 최근 뉴욕 및 나이지리아 변이주를 비롯해 브라질 변이주 를 항체와 혼합해 숙주 세포에 감염시킨 후 항체가 바이러스를 저해하는 정도를 테스트하는 방식으로 렉키로나의 중화능력 시험을 진행했다 이번 시험 결과에서는 렉키로나가 뉴욕 및 나이지리아 변이주에서 이전 변이와 마찬가지로 강한 중화능력을 보였다 또 최근 셀트리온이 해외 연구기관에 의뢰해 실시한 슈도바이러스 시험 결과 인도 변이주에 대해서도 렉키로나가 중화능을 보인 것으로 확인돼 충분한 치료 효과를 보일 것으로 판단했다 다만 질병관리청에서 실시한 시험에서 브라질 변이주 에는 중화능력이 감소됐음을 확인했다 이에 셀트리온은 브라질 변이주에 대해 동물시험 절차를 걸쳐 렉키로나의 실제 임상적 치료능을 다시 확인할 방침이다 셀트리온은 브라질 변이주 와 공통점이 많은 남아공 변이주에서도 세포 수준에서는 렉키로나의 중화능력이 감소했지만 최근 실시한 동물시험에서는 인체 치료용량과 동등한 양의 항체를 주입 시 효과적으로 바이러스를 감소시키는 것을 확인해 국제 학술지에 그 결과를 제출한 바 있다 이외에도 렉키로나는 국내에서 발견된 변이주중 이미 종 및 영국 브라질 캘리포니아 변이에 대해서는 우수한 중화능을 보이는 것으로 확인된 바 있다 셀트리온 관계자는 렉키로나가 최근 산발적으로 유행하고 있는 남아공 영국 브라질 뉴욕 나이지리아 인도 등 다양한 변이에 충분한 효력을 발휘할 것으로 보지만 추가 변이가 계속 발생할 수 있는 만큼 상황을 계속 모니터링하고 있다 면서 새로 발생되는 변이에 렉키로나가 중화능을 보이는지 계속 시험해 나갈 것 이라고 전했다 홍석근 기자
5,2021-05-14,"셀트리온 렉키로나, 뉴욕·나이지리아·인도 변이에 효과",브라질 변이에는 중화능력 감소 치료능 확인 방침 이데일리 왕해나 기자 셀트리온 의 코로나 항체치료제 렉키로나가 뉴욕 나이지리아 인도 변이 바이러스에서 중화능을 확인했다고 일 밝혔다 셀트리온 렉키로나주 사진 셀트리온 질병관리청 국립보건연구원은 최근 뉴욕 및 나이지리아 변이주를 비롯해 브라질 변이주를 항체와 혼합해 숙주 세포에 감염시킨 후 항체가 바이러스를 저해하는 정도를 테스트하는 방식으로 렉키로나의 중화능력 시험을 진행했다 이번 시험 결과에서는 렉키로나가 뉴욕 및 나이지리아 변이주에서 이전 변이와 마찬가지로 강한 중화능력을 보였다 또 최근 셀트리온이 해외 연구기관에 의뢰해 실시한 슈도바이러스 시험 결과 인도 변이주에 대해서도 렉키로나가 중화능을 보인 것으로 확인돼 충분한 치료 효과를 보일 것으로 판단했다 다만 질병관리청에서 실시한 시험에서 브라질 변이주에는 중화능력이 감소됐음을 확인했다 이에 셀트리온은 브라질 변이주에 대해 동물시험 절차를 걸쳐 렉키로나의 실제 임상적 치료능을 다시 확인할 방침이다 셀트리온은 브라질 변이주와 공통점이 많은 남아공 변이주에서도 세포 수준에서는 렉키로나의 중화능력이 감소했지만 최근 실시한 동물시험에서는 인체 치료용량과 동등한 양의 항체를 주입 시 효과적으로 바이러스를 감소시키는 것을 확인해 국제 학술지에 그 결과를 제출한 바 있다 이외에도 렉키로나는 국내에서 발견된 변이주중 이미 종 및 영국 브라질 캘리포니아 변이에 대해서는 우수한 중화능을 보이는 것으로 확인된 바 있다 셀트리온 관계자는 렉키로나가 최근 산발적으로 유행하고 있는 남아공 영국 브라질 뉴욕 나이지리아 인도 등 다양한 변이에 충분한 효력을 발휘할 것으로 보지만 추가 변이가 계속 발생할 수 있는 만큼 상황을 계속 모니터링하고 있다 면서 새로 발생되는 변이에 렉키로나가 중화능을 보이는지 계속 시험해 나갈 것 이라고 말했다 왕해나
6,2021-05-14,"정부 ""셀트리온 치료제 성과 인정…임상참여자 감사""",머니투데이 김도윤 기자 권준욱 중앙방역대책본부 제 부본부장은 일 우리나라 개발 업체 셀트리온 에서 코로나 항체치료제 렉키로나 개발에 분명한 성과를 본 것은 사실 이라며 계속 등장하는 변이들에 대해서도 대다수의 경우 비록 세포 수준이지만 효능을 확인하고 있다 고 말했다 권 제 부본부장은 이 치료제 개발을 위해 해당 개발자는 물론 고생하셨다 며 그렇지만 자발적으로 임상시험에 참여해준 확진자분들 연구 의료진과 의료기관이 없었다면 항체치료제 임상 연구가 진행되기 매우 어려웠을 것이라는 점에서 더더욱 감사의 말씀을 드린다 고 말했다 권 제 부본부장은 코로나 백신 개발에도 많은 참여와 협조가 필요하다고 당부했다 권 제 부본부장은 백신 개발을 위한 대규모 임상시험을 앞둔 현재 코로나에 걸렸던 기확진자분들의 회복 후 현재 혈액이 필요하다 며 이미 국방부 의무사령부 국립대병원 중 하나인 충남대병원이 협조해주고 있다 고 말했다 이어 그리고 무엇보다 이 기관들을 통해 자발적으로 혈액 제공에 응해주고 계신 확진자분들께 깊이 감사드린다 고 덧붙였다 김도윤 기자
7,2021-05-14,"방역당국 ""셀트리온 렉키로나 3026명에 투여""",머니투데이 김도윤 기자 중앙방역대책본부는 셀트리온의 코로나 항체치료제 렉키로나 를 현재까지 개 병원 명 환자에게 투여했다고 일 밝혔다 베클루리주 렘데시비르 는 현재까지 개 병원 명의 환자에게 투여됐다 이외 혈장치료제의 경우 임상시험 목적 외 치료목적으로 건이 식품의약품안전처 식약처 로부터 승인받아 사용 중이다 김도윤 기자
8,2021-05-14,"""셀트리온 코로나19 치료제, 뉴욕·영국 변이에 효과""",머니투데이 김도윤 기자 중앙방역대책본부는 미국 뉴욕 영국 나이지리아 코로나 변이 바이러스에 대한 국내 항체치료제 셀트리온의 렉키로나 의 효능 검사를 실시한 결과 효능이 일부 감소하지만 여전히 중화능이 있다고 확인했다고 일 밝혔다 다만 브라질 변이 바이러스 는 중화능이 현저히 감소하는 것을 확인했다고 덧붙였다 김도윤 기자
