time,title,context
2021-05-14,파운드 확대 선언 SK하이닉스…증설 M&A,하이닉스 파운드 생산능력 두배 확대 추진 파운드 등 시스템반도체 비중 전체 매출 불 우시 공장 증설 청주 설비 이전 공간 활용 가능성 키파운드리 해외 파운드 설 모회사 활용 듯 이데일리 신민준 기 하이닉스 파운드 반도체 수탁생산 확대 선언 관심 반도체업계 생산 공장 증설 파운드 인수합병 등 다양한 가능성 제기 박정호 하이닉스 부회장 일 오후 경기 평택시 삼성전자 평택단지 라 건설 현장 마련 야외무대 반도체 전략 보고 참석 투 계획 발표 연합뉴스 파운드 확 사업포트폴리오 다양화 하이닉스 일 파운드 생산능력 두 배 확대 박정호 하이닉스 대표이사 부회장 이날 삼성전자 평택캠퍼스 반도체 전략 행사 대비 파운드 생산능력 배 확대 방안 검토 며 국내 설비증설 등 다양한 전략적 방안 검토 말 하이닉스 파운드 확대 추진 이유 메모리 반도체 사업 매출 비중 절대적 때문 하이닉스 시스템 반도체 파운드 등 비메모리사업 비중 전체 매출 수준 불과 파운드 사업 확대 포트폴리오 다양화 안정적 수익 창줄하 얘 하이닉스 자회사 하이닉스시스템아이씨 를 파운드 사업 하이닉스시스템 충북 청주 생산 공장 파운드 설비 중국 우시 공장 하이닉스시스템 인치 미리미터 웨이퍼 공정 운영 품귀현상 차량용 반도체 정보기술 기 전력 반도체 디스플레이 구동칩 등 생산 하이닉스시스템 의 생산능력 인치 웨이퍼 기준 월 만장 수준 인치 파운드 하이닉스시스템 운영 하이닉스 파운드 확대 방안 두 가지 요약 증설 중국 우시 공장 설비 장비 이전 하이닉스시스템 의 유후 공간 활용 증설 방안 중국 우시 공장 증설 가능성 제기 하이닉스 내년 초 우시 공장 파운드 설비 이전 후 중국 시장 본격적 공략 것 때문 중국 하이실리콘 등 글로벌 팹리스 반도체 전문 설계기업 들 만큼 입지 장점 활용 수 파운드리 생산 공장 선정 때 팹리스 패키징 등 후공정업체들 키파운드리 수 가능성 거론 키파운드리 년 설립 반도체 모체 년 하이닉스반도체 이후 년 매그나칩반도체 키파운드리 작년 월 하이닉스 지분 새마을금고 주 를 투자 매그너스 사모펀드 하이닉스 당시 억원 투자 키파운드리 하이닉스시스템 인치 웨이퍼 공정 기반 충북 청주 생산 공장 생산 능력 월 장 비슷 인텔 낸드플래시 사업부 약 조원 인수 하이닉스로서 키파운드리 인수 경우 파운드 수 때 자금 부담 수 인치 웨이퍼 공정 기반 해외 파운드 수 가능성 텔레콤 지배구조 개편 인적분할 하이닉스 모회사 투자전문회사 신설회사 를 이용해 국내외 파운드리 를 시도 것 하이닉스 그룹 지주회사 주 의 손자회사 지위 때문 현행 공정거래법상 지주회사 손자회사 를 경우 지분 를 보유 투자전문회사 활용 경영권 지분 정도 확보 때문 비용 부담 수 하이닉스 관계자 파운드 사업 확대 다양 방안 고려 중 이 결정 것 아무것 말 신민준
2021-05-14,"SK하이닉스, 증설 열쇠 '키파운드리 인수",파운드 생산력 배 확대 유력 방안 인치 특화 파운드리업체 인수땐 월생산 만장 억 투 추 부담 청주 공장 활용 생산라인 증설 가능성 거론 박정호 하이닉스 부회장 일 파운드 반도체 수탁생산 생산능력 두 배 확대 선언 중소형 파운드리업체 인수합병 가능성 유력 시나리오 하이닉스 지난해 약 억원 투자 키파운드리 를 완전 인수 방안 거론 회사 측도 증설 방안 중 하나 검토 하이닉스 일 반도체업계 하이닉스 파운드 생산능력 두 배 확대 방안 추진 중 하이닉스 자회사 하이닉스시스템 이하 시스템 를 생산능력 월 장 웨이퍼 투입량 기준 규모 파운드 사업 하이닉스 국내 파운드 생태계 강화 반도체 공급 부족 대응 인치 웨이퍼 생산능력 확대 계획 유력 현실적 방안 키파운드리 완전 수 키파운드리 인치 웨이퍼 기반 파운드리업체 년 설립 반도체 모체 년 하이닉스반도체 년 매그나칩반도체 지난해 월 하이닉스 지분 새마을금고 주 를 매그너스 사모펀드 하이닉스 당시 억원 투자 인수해 재무적 부담 키파운드리 하이닉스 만한 조건 것 업계 평가 시스템 동 한 인치 웨이퍼 기반 업체 이상 전통 공정 디스플레이구동칩 이미지센서 등 생산 생산능력 월 장 시스템 비슷 수준 생산시설 하이닉스 청주 공장 인근 지난해 월 매그너스 의 키파운드리 수 총액 억 만달러 약 억원 하이닉스 출자액 억원 을 때 완전 수 필요 자금 억 억원 안팎 예상 올해 인텔 낸드플래시 사업부 수 대금 억달러 중 억달러 약 조 억원 를 마련 하이닉스로선 그 재무적 부담 카드 분석 일각 세계 위 파운드리업체 하이텍 수 것 전망 하이텍 시가총액 일 종 기준 조 억원 경영권 프리미엄 등 감안 조원 자금 필요 것 예상 하이닉스 과거 하이텍 억원 매물 때 인수전 참여 업계 하이텍 영업이익률 이상 그룹 주력 계열사 점 매각 가능성 제 얘 지분 투 기옥시아 상장 재추진 대 국내 설비 증설 가능성 청주 공장 인치 파운드 라인 조성 것 공장 시스템 중국 우시 설비 여유 하이닉스 관계자 다양한 증설 방안 검토 중 확정 거 말 한편 하이닉스 년 약 조원 지분 투자 세계 위 낸드플래시업체 일본 기옥시아 상장 속도 전망 기옥시아 대주주 베인캐피털 유지 스기모토 대표 이날 아사히신문 차례 연기 상장 추진 것 이 상장 이전 매각 것 말 업계 기옥시아 상장 이후 하이닉스 투자금 회수 것 전망 회사 측은 중장기 관점 투자 며 지분 매각설 부인 황정수 기 도쿄 정영효 특파원
2021-05-14,"SK하이닉스, 파운드 증설 3가지 시나리오",청주공장 설비투자 확대 국내외업체 가능성 고객사 신규업체 공동투자 아시아경제 우수연 기 하이닉스 파운드 생산 능력 두 배 확대 계획 구체적 증설 방안 관심 국내 증설 국내외 업체 인수합병 신규 파운드 업체 설립 등 다양한 전략적 방안들 거론 가운데 업계 국내 공장 증설 국내 파운드 업체 수 가능성 무게 박정호 하이닉스 부회장 일 삼성전자 평택캠퍼스 반도체 전략 발표 보고대회 글로벌 반도체 수급 불안정 대비하기 국내 증설 두 배 수준 인치 파운드 생산 능력 확보 검토 하이닉스 년 이천 청주 공장 조원 년 이후 년 용 클러스터 조원 투 계획도 발표 경기 이천 하이닉스 본사 이미지출처 연합뉴스 이번 파운드 생산 능력 확대 문제 차량용 반도체 공급 문제 해결 의지 이 국내 공급망 안정화 국내 팹리스 업체 생산 개발 차원 그룹 중시 사회적 가치 초점 하이닉스 방식 설비 투자 것인가 방법 국내 공장 설비 투자 방법 하이닉스 청주 공장 생산 설비 중국 우시 공장 이전 인치 수요 현지 공장 생산 능력 차원 이번 정책 방향 하이닉스 국내 팹리스 협력 강화 국내 고객사 생산 공장 추가 필요 청주 공장 증설 후보군 수 국내 해외 반도체 업체 인수 방법 경우 키파운드리 하이텍 등 국내 파운드 업체 네덜란드 반도체 기업 등 해외 업체들 후보군 국내 팹리스 협력 강화 기조 감안 해외 업체 수 가능성 하이닉스 키옥시아 지분투자 인텔 낸드사업 수 등 를 단행 그룹 지배구조 개편 작업 전문 박정호 부회장 하이닉스 대표이사 임명 점 의 사전 작업 해석도 업계 일각 고객사들 공동 투자 신규 파운드 업체 설립 시나리오 제기 일본 차량용 반도체 업체 르네사스 경우 도요타 닛산 캐논 등 주요 고객사가 출자 설립 민관 펀드 대주주 회사 운영 국내 대기업들 하나 뜻 투자하 현실적 어려움 것 시각 지배적 우수연 기자
2021-05-14,SK하이닉스 파운드 2배 확대 증설 고민 DB하이텍,머니투데이 심재현 기 하이텍 부천공장 하이텍 하이닉스 파운드 반도체 위탁생산 사업 격 확대 발표 긴장한 곳 하이텍 거 일 반도체업계 인사 전날 발표 하이닉스 파운드 비전 시장 영향 분석 하이닉스 전날 정부 주최 반도체 전략 행사 인치 파운드 사업 중심 생산능력 확대 인사 하이닉스 발표 년 동안 하이텍 증설 고민 며 선택 순간 말 하이텍 국내 유일 순수 파운드 외부 팹리스업체 설계 시스템반도체 전문적 위탁생산 업체 전세계 파운드 시장 위 기업 국내 삼성전자 다음 주력 공정 인치 인치 웨이퍼 공정 지 오래 삼성전자 인치 장비 이미지센서 전력반도체 디스플레이구동칩 등 생산 인치 공정 생산성 인치 공정 곳 차 산업혁명 바람 이미지센서 등 시장 수요 급증 주목 하이텍 년 월 개월 수준 가동률 하이닉스 파운드 사업 속도 인치 공정 시장 하이텍 하이닉스 지난달 진행 분기 실적 콘퍼런스콜 전화회의 대규모 투자 필요 인치 웨이퍼 기반 파운드 계획 그동안 파운드 사업 미온적 하이닉스 본격적 시장 확대 전략 하이텍 입장 상당한 부담 수 양사 파운드 생산능력 웨이퍼 기준 하이텍 월 만장 하이닉스 파운드 부문 자회사 하이닉스시스템 만장 수준 것 추산 시장 리 증설 필요 얘 이유 하이텍 증설 가능성 년 실적 흑자 데 이 년 파운드 호황 시작 제기 지난해 미국 주도 중국 파운드리업체 제재 현실화한 것 하이텍 증설 가능성 뒷받침 제재 중국 내 수요 하이텍 시장 하이텍 증설 자금 여력 충분 년 파운드 사업 진출 뒤 매년 억 억원 규모 적자 때 조 억원 부채 지난해 차입금 단기차입금 장기차입금 유동성장기차입금 기준 억원 지난해 차입금의존도 지난해 유동비율 유동비율 를 유동성 풍부 것 평가 현금성 자산 미처분이익잉여금 억원 과 잉여현금흐름 억원 은 편 부채 규모 증설 필요 것 추산 조원 것 무리 분석 김남호 그룹 회장 김준기 전 회장 장남 사진제공 그룹 하이텍 신중론 유지 파운드 시장 수요 유 자신하기 이유 첫 손 증설 결정해 생산라인 건설 장비 도입 양산하기 최소 년 호황기 투자비 것 지 우려 소품종 대량생산 수익성 인치 공정 인치 공정 다품종 소량생산 대규모 투자가 매출 수익성 증 상대적 수월 점 고민거리 업계 관계자 반도체 산업 고 기술화 투 규모 조단 확대 반면 시장 변동성 때문 투자 결정하기 며 하이텍 증설 자금 문제 미래 성장 방향 관점 고민 것 이 말 하이텍 관계자 시장 시스템반도체 사업 특성상 주요 고객 그동안 아날로그반도체 분야 기술력 고객 신뢰관계 때 영향 적 심재현 기자
2021-05-14,"신성이엔지, SK하이닉스 48억원 규모 시스템 실링 공사 계약",이데일리 신중섭 기 신성이엔지 하이닉스 억 만원 규모 시스템 실링 공사 계약 체결 일 공시 이 지난해 연결 기준 매출액 대비 해당 계약기간 올해 월 일 신중섭
2021-05-14,"신성이엔지, SK하이닉스 49억 규모 시스템 천정 공사 계약",아시아경제 박지환 기 신성이엔지 하이닉스 억원 규모 시스템 천정 공사 계약 체결 일 공시 지난해 연결 기준 매출액 대비 해당 박지환 기자
2021-05-14,"반도체 대장주 삼성전자·SK하이닉스, 4거래 만 반등",반도체 공급부족 여파 주춤 대 상승 게티이미지뱅크 국내 증시 대장주인 삼성전자 하이닉스 거래 만 반등했다 일 오전 시 분 현재 삼성전자 하이닉스 전 거래 원 원 원 원 거래 삼성전자 거래 연속 하락세 만원대 만원 반면 하이닉스 만원대 만원 하락 반도체 관련 종목 주가 하락세 것 정보기술 제품 수요 부진 우려 공매도 몰리면서다 반도체 공급부족 쇼티지 장기화 기 수요 예상 수 우려 발목 삼성전자 일 공매 거래대금 억원 기록 이 일 억원 이틀 연속 공매 것 대금 종목 집계 전날 공매 거래대금 억원 반면 기간 하이닉스 공매 거래대금 억원 억원 억원 집계 류은혁 한경닷컴 기자
2021-05-14,특징주 반도체 510조 투 삼전·하이닉스 주 상승,머니투데이 김소연 기 정부 반도체 기업들 년 조원 투자 시스템 반도체 경쟁력 내용 반도체 성장전략 을 반도체 빅 강세 일 오전 시 분 삼성전자 전일대비 원 상승 원 기록 중 하이닉스 원 원 정부 전날 반도체 기업 세제지원 등 골자 반도체 전략 발표 정부 반도체 시설투자 연구개발 투자비 세액공제율 확대 조원 이상 반도체 등 설비투자 특별자금 을 신설해 우대금리 설비투자 지원 내용 기업들 정부 지원책 화답 삼성전자 하이닉스 년 년 조원 이상 투자하 연간 투자액 조원 삼성전자 반도체 비전 을 달성 당초 예정 목표 조원 조원 조원 투자하 하이닉스 이천 청주 공장 년 조원 년 완공 용 반도체 클러스터 별도 조원 투자 계획 김소연 기자
