time,title,context
2021-05-13,"SK하이닉스 파운드 생산능력 2배로""…M&A 가능성",머니투데이 오문영 기 박정호 하이닉스 대표이사 부회장 뉴스 하이닉스 파운드 반도체 위탁생산 생산능력 배 확대 계획 파운드 분야 대규모 인수합병 를 단행 것 전망 업계 박정호 하이닉스 대표이사 부회장 일 삼성전자 평택캠퍼스 반도체 전략 보고대회 참석 파운드 생산능력 배 확대 방안 검토 국내 설비증설 인수합병 등 다양한 전략적 방안 검토 예정 하이닉스 관계자 인치 파운드 사업 투자 국내 팹리스 시스템 반도체 설계기업 들 개발 양산 글로벌 시장 진출 지원 면 글로벌 기업들 모바 가전 차량 등 반도체 제품 공급 범위 수 것 말 업계 하이닉스 등 구체적 투 계획 발표 것 승부사 박 부회장 주도 하이닉스 비메모리 분야 공격적 지 업계 주목 하이닉스 각자대표이사 취임 박정호 부회장 년 텔레콤 하이닉스 수 진두지휘 년 일본 키옥시아 당시 도시바메모리 투 지난해 인텔 낸드사업 인수계약 등 하이닉스 투자 관여 바 박 부회장 파운드 분야 단초 제공 분석 박 부회장 월 일 서울 삼성동 코엑스 월드 쇼 기자들 파운드리 투자 국내 팹리스들에 파운드 세계 위 대 수준 서비스 제공 이 기업 기술개발 수 언급 지난달 말 하이닉스 분기 실적발표 노종원 부사장 인치 파운드리 투자하 박 부회장 계획 구체화하기 하이닉스 전형적 메모리 반도체 기업 시스템 반도체 파운드 등 비메모리 사업 비중 전체 매출 수준 불과 자회사 하이닉스시스템 중국 파운드 사업 운영 중 청주 사업장 파운드 설비 공간 보유 오문영 기자
2021-05-13,SK하이닉스 “파운드리 생산능력 2배 확대 것”…대형 M&A 가능성,박정호 하이닉스 대표이사 부회장 하이닉스 제공 헤럴드경제 양대근 기 하이닉스 일 정부 삼성전자 평택캠퍼스 발표 반도체 전략 환영 뜻 이날 하이닉스 박정호 대표이사 부회장 대비 파운드 생산능력 배 확대 방안 검토 발표 박 부회장 국내 설비증설 인수합병 등 다양한 전략적 방안 검토 입장 표명 하이닉스 관계자 당사 인치 파운드 사업 투자 국내 팹리스 시스템 반도체 설계기업 들 개발 양산 글로벌 시장 진출 지원 이 글로벌 기업들 모바 가전 차량 등 반도체 제품 공급 범위 수 기대효과 강조 하이닉스 각자대표이사 취임 박정호 부회장 년 텔레콤 하이닉스 수 진두지휘한 바 등 구체적 투 계획 발표 것 분위기 업계 박 부회장 년 일본 키옥시아 당시 도시바메모리 투 지난해 인텔 낸드사업 인수계약 등 하이닉스 투자 관여 바 박 부회장 지난달 일 서울 삼성동 코엑스 월드 쇼 파운드리 투자 며 국내 팹리스들에 파운드 세계 위 대 수준 서비스 제공 이 기업 기술개발 수 언급 지난달 하이닉스 분기 실적발표 노종원 부사장 도 인치 파운드리 투자하 바 하이닉스 시스템 반도체 파운드 등 비메모리 사업 비중 전체 매출 수준 불과 상황 자회사 하이닉스시스템 중국 파운드 사업 운영 중 청주 사업장 파운드 설비 공간 것
2021-05-13,"SK하이닉스, 파운드 2배 확대""…M&A 발표 임박",일 정부 주최 반도체 전략 행사 박정호 부회장 현재 대비 파운드 생산능력 배 확대 국내 설비증설 등 전략적 방안 검토 중 이데일리 배진솔 기 하이닉스 파운드 반도체 위탁생산 분야 사업 확대 국내 설비증설 인수합병 등 전략적 방향 검토 전 세계적 파운드 공급 부족사태 해결 국내 팹리스 반도체 설계기업 기업들 지원 시스템 반도체 생태계 활성화 의지 풀이 박정호 하이닉스 대표이사 부회장 일 정부 주최 삼성전자 평택캠퍼스 반도체 전략 행사 대비 파운드리생산능력 배 확대 방안 검토 며 국내 설비증설 등 다양한 전략적 방안 검토 입장 표명 하이닉스 관계자 인치 파운드 사업 투자 국내 팹리스들 개발 양산 글로벌 시장 진출 지원 며 글로벌 기업들 모바 가전 차량 등 반도체 제품 공급 범위 수 강조 파운드리 반도체 제품 설계 팹리스로부터 설계도 반도체 반도체 생산 전문기업 전세계적 반도체 수요 폭증 파운드 업계 급증 주문 소화 만큼 공급 능력 부족한 상황 이 하이닉스 공급 안정화 의지 표 것 국내 팹리스 기업들 지원 시스템 반도체 생태계 활성 의지 박 부회장 지난달 일 서울 삼성동 코엑스 월드 쇼 기자들 파운드리 투자 박 부회장 이 국내 팹리스 업체들 사이 대 기술 수준 파운드 서비스 요청 며 여기 공감 삼성 파운드리 저희 투자 생각 이 강조 바 이 지난달 일 분기 실적발표 컨퍼런스콜 전화 회의 파운드 투자 의지 노종원 경영지원담당 부사장 은 인치 파운드 사업 미래 전망 긍정적 수급상황 문제 자동차 반도체 대형 반도체 업체 책임감 투 가능성 시사 이번 행사 인치 파운드 생산능력 배 확대 라 목표 구체 하이닉스 나 공격적 지분 수 것 전망 박 부회장 의 승부사 라 수식 만큼 하이닉스 투자 관여 년 일본 키오시아 당시 도시바메모리 투자 지난해 인텔 낸드사업부 인수계약 등 결정 업계 관계자 박 부회장 파운드 분야 단초 만큼 구체적 투 계획 발표 것 기대 업계 만연 말 한편 하이닉스 전형적 메모리 반도체 기업 시스템 반도체 파운드 등 비메모리 사업 비중 전체 매출 불과 자회사 하이닉스시스템 중국 파운드 사업 운영 중 청주 사업장 파운드 설비 공간 배진솔
2021-05-13,반도체 전략 삼성 171조 투 하이닉스 파운드 2배,지금 장기 비전 투 밑그림 삼성전자 시스템반도체 기존 조 조 추 등 조 투 하이닉스 파운드 적극 검토 비메모리 생태계 상생 지원 문재 대통령 일 경기 평택시 삼성전자 평택단지 라 건설현장 마련 야외무대 반도체 전략 보고 참석 모두발언 파이낸셜뉴스 한국 반도체 산업 거대 분수령 위 대격변 지금 장기 비전 투자 밑그림 때 김기남 삼성전자 부회장 일 정부 발표 조원 규모 반도체 전략 대부분 삼성전자 하이닉스 투자계획 뼈대 살 시너지 극대화 방향 완성 경기도 충청도 반도체 벨트 삼성전자 하이닉스 주력 공장 이 협력업체 포함 삼성전자 시스템반도체 분야 조원 투 하이닉스 파운드 위탁생산 역량 두배 것 이날 발표 핵심 삼성 시스템반도체 조 투 반도체 전략 발표 행사 삼성전자 평택캠퍼스에서 삼성전자 하이닉스 네패스 리벨리온 등 개 기업 투 계획 발표 삼성전자 이재용 삼성전자 부회장 시스템반도체 비전 달성 투자계획 수정 삼성전자 비전 발표 당시 수립 조원 투자계획 조원 추가 년 조원 투자 삼성전자 산업영역 전례 반도체 부족 사태 각국 정부 미래 산업 핵심 반도체 공급망 유치 경쟁 상황 이 시스템반도체 투 확대 반도체 위상 한층 데 것 이 설명 삼성전자 이날 평택 라 신규라 착공 공식화 이례적 생산품목 외부 년 하반기 완공 의 클린룸 규모 축구장 개 연면적 로 현존 최첨단 기술 적용 팹이다 규모 거대 만큼 최대 조원 투자 단행 것 회사 극자 기술 적용 나노 램 나노 로직 제품 양산 것 이 언급 이날 행사 부회장 한국 선두 메모리 분야 추격 면 수성 수 초격차 리 삼성 선제적 투자 강조 현재 지하 터파 완료 상부 골조 공사 진행 중 연내 외관 공사 일정 내년 장비 반입 각종 테스트 뒤 년 칩 생산 시작 전망 하이닉스 파운드 배 하이닉스 그룹 내 박정호 부회장 주도 파운드 업체 수 지분 투자 추진 중 것 박 부회장 이날 대비 파운드리 배 확대 방안 검토 며 국내 설비증설 인수합병 등 다양한 전략적 방안 논의 하이닉스 시스템반도체 파운드 등 비메모리 사업 비중 전체 매출 수준 불과 자회사 하이닉스시스템 중국 파운드 사업 운영 중 청주 사업장 파운드 설비 공간 확보 상태 국내 반도체 생태계 발전 상생협력 지원 투 확대 삼성전자 생태계 육성 팹리스 대상 지적자산 호혜 제공 시제품 생산 지원 협력사 기술교육 등 다양한 상생 활동 확대 공급망 핵심 소재 장비 업체 우수 인재 육성 학계 협력 강화 예정 하이닉스 국내 비메모리 업체들 지원 공급 생태계 안정화하 데 방침 하이닉스 차량용 반도체 등 극심한 부족 인치 파운드 사업 투자 국내 팹리스 반도체 설계기업 들 개발 양산 글로벌 시장 진출 지원 계획 김경민 기자
2021-05-13,"삼성전자·SK하이닉스, 시설투자 세제지원 2배 확대…文정부, 반도체 전",세제지원 기준 핵심전략기술 추 시설투자 세액공제 인치 투자 조 지원 차량용 반도체 국산화 화학물질 처리 등 환경규제 완화 법인세 인상 원전 정부 엇박자 정책 산업계 탄소중립 호소 정부 삼성전자 하이닉스 등 대기업 반도체 시설투자 세액공제율 이상 리 대기업 연구개발 투자 공제율 최대 포인트 상향 중견 중소기업 공제율 감안 최대 시설투자 최대 증가분 포함 세액공제 확대 정부 차량용 반도체 산업 육성 인치 파운드 증설 등 조원 이상 반도체 등 설비투자 특별자금 을 지원 계획 반도체 업계 요구 환경규제 완화 화학물질 취급시설 허가 신속처리 패스트트랙 도입 등 추진 전세계적 차량용 반도체 수급난 발생 글로벌 반도체 산업 생태계 미국 중심 재편 바 행정부 본격화 문재 정부 출범 후 금기시 대기업 세제지원 카드 등장 전문가들 다행 라 반응 정부 일 내용 반도체 전략 발표 정부 년 조원 이상 민간투자 반도체 산업 초격차 유 목표 초격차 권오현 전 삼성전자 회장 출간 책 제목 비교 불가한 절대적 기술 우위 수 차이 격 의 의미 삼성전자 반도체 공장 내부 모습 반도체 등 핵심전략기술 신설 대기업 시설투자 세액공제 배 정부 이번 대책 기업들 유동자산 투자 최소 이상 세액 공제 제공 통합 투자세액공제 제도 핵심전략기술 지원 항목 신설 핵신전략기술 기업 시설투자 연구개발 투자 일반 기술 신성장 원천기술 등 현행 제도 세제 혜택 반도체업계 제조설비 투자비용 최대 를 세액공제해 건의 바 현행 조세특례제한법 정부 기업 연구 인력 개발비 사업시설 투 비용 일정 비율 공제율 을 곱 금액 세금 감면 디지털 뉴딜 등 산업 기반 신성장 원천기술 관련 투자 일반 투자 기본 공제율 적용 여기 핵심전략기술 신설 세제 인센티브 확대 산업부 관계자 핵심전략기술 반도체 포함 향후 추 대상산업 검토 방침 이 예 일반 기술 시설투자 대기업 기준 공제율 신성장 원천기술 투자 경우 대기업 투 비용 최대 중견기업 중소기업 세액공제 수 직전 년 평균 투자액 초과 금액 의 추 공제 혜택 제공 반도체 투 세액공제율 기준표 기획재정부 핵심전략기술 적용 경우 대기업 시설투자 세액공제율 로 증가 중견기업 중소기업 공제 수 초 투자액 추 공제혜택 제공 투자 세액공제율 최대 상향 그간 일반 투자 대기업 기준 공제율 신성장 원천기술 투자 경우 대기업 중견기업 투 비용 최대 추 공제율 포함 중소기업 최대 세액공제 수 핵심전략기술 분야 경우 대기업 중견기업 최대 중소기업 최대 세액공제 수 이번 지원방안 경기 용인 반도체 클러스터 조성 하이닉스 평택 시스템 반도체 공장 삼성전자 현행 제도 세제지원 이상 것 현행 투자세액공제 제도 반도체 산업 신성장 원천기술 분류 대기업 지원 의 투자세액 공제 제공 이번 지원방안 세법 개정 경우 세액공제율 이상 대기업 이 파격적 세금 지원 방안 것 문재 정부 출범 후 처음 반도체 업계 관계자 그간 정부 특정 대기업 지원 수 반도체 등 선입견 기업 정책 지원 중견 중소기업 집중 며 전 세계적 반도체 경쟁 정부 심각성 인지한 것 이번 대책 중소기업 비교 상대적 세제 혜택 삼성전자 하이닉스 등 대기업 정부 정책 지원 제공 점 의미 조익노 산업통상자원부 반도체디스플레이 과장 이번 대책 반도체 수출액 작년 기준 억 달러 년 억 달러 생산 조원 조원 이상 증가 것 예상 며 이 만명 고용창출 효과 것 정책 실효성 속도감 추진 수 운영 관리 인치 반도체 조원 투입 수요기업 매칭 투 수급난 차량용 반도체 관련해 최첨단 선단 공정 비롯 인치 파운드 반도체 위탁생산 공정 투자계획 발표 차량용 반도체 인치 웨이퍼 공장 생산 인치 웨이퍼 공장 인치 웨이퍼 공장 비교해 구식 설비 반도체 기업들 옛날 방식 시설 리 결정 공장 수 반도체 장비 대부분 단종된 상태 장비 일 만만치 이 정부 인치 파운드 생산공정 육성 장비 국산화 추진 이 정부 인치 기반 파운드 증설 소 부 장 첨단 패키징 기업 신규투자 촉진 금융 프로그램 지원 등 반도체 업계 투 프로젝트 구체화 대 년 조원 의 설비투자 특별자금 지원 이 지난달 개 기업 약 조원 이상 투 의향 정부 투 의향 기업 중 선정 투자자금 지원 방침 년 거치 년 분할상환 금리 우대 감면 방침 정부 기업들 투자 활성화 수요기업들 협력 강화 예 실리콘 대비 전력 내구성 효율성 보유 신소재 실리콘카바이드 기반 차세대 차량용 전력 반도체 생산 기업 수요 대기업 연계 투 지원 방침 이 중소 파운드 업체들 투자 격 추진 수 사업재편 정책금융 특례 제공 계획 반도체학 교수 중견 반도체 업체들 입장 일시적 차량용 반도체 수급 부족 해결 구형 기술 인치 생산설비 증설 데 부담 며 완성차 업체들 국내 업체 차량용 반도체 사용 수요 확인 투 결정 수 법인세 상향 탄소중립 발목 정부 엇박자 정책 발목 일각 법인세율 상향 규제 등 정부 반 대기업 정서 필요 지적 수급 문제 땜질식 처방 것 기업들 투 등 활력 수 장기전략 필요 것 대표적 법인세율 인상 정부 탄소중립 정책 정부 문재 대통령의 법인세 인상 공약 년 법인세 최고세율 지방세 포함 시 로 개 경제협력개발기구 회원국 중 년 동안 년 대비 년 법인세 최고세율 지방세 포함 을 한국 포함 개국 개국 법인세 개국 유 한국의 법인세 최고세율 년 평균 지금 평균 정부 탄소중립 정책 기업들 투자환경 악화 대통령 지난해 월 국회 시정연설 년 탄소중립 목표 넷제로 선언 넷제로 온실가스 배출량 제거량 상쇄 순배출량 상태 말 기업들 탄소중립 정부 하소연 상황 최태원 대한상공회의소 회장 일 문승욱 산업통상자원부 장관 자리 탄소중립 생각 기업들 것 현실 이 코 이후 경제 사람 걱정 말 업계 정부 추진 탄소중립 대한상공회의소 회장 산업부 장관 직접적 언급 점 이례적 평가 문제 정부 원전 에너지 정책 연결 정부 원전 정책 추진 상황 석탄 전력 공급 불안 전기료 인상 등 부작용 초래 수 이유 온실가스 배출 탄소 에너지원 원자력 비중 정부 년 탄소중립 목표 달성 것 지적 정동욱 중앙대 에너지시스템공학부 교수 원전 재생 에너지 병행 경제적 타격 최소 전력 수급 안정성 유지 탄소중립 목표 달성 수 면 실현 가능 탄소중립 정책 필요 말 세종 박성우 기자
2021-05-13,반도체 베팅한 개미 울상…삼성전자·SK하이닉스 중 최저점 株포트라,삼성전자 고점 대비 하이닉스 하락 하반기 실적 개 주 반등 전망 헤럴드경제 김현경 기 반도체 투톱 이 시가총액 위 삼성전자 하이닉스 주가 올해 최저점 추락 이 종목 집중적 개인투자자들 손실 고점 개 안팎 손실 금융투자업계 하반기 이후 반도체주가 기지개 것 일 한국거래소 개인 올해 이달 일 삼성전자 억 주 조 억 만원 순매수했다 주당 평균 원 매수 주가 일 시초 기준 원 평균 매입 대비 원 하락 이날 장 초반 연저점 원 월 일 연고점 원 개인 주당 원 의 손실 삼성전자 이 두 번 삼성전자 우선주 삼성전자우 도 평균 입가 주가 기록 개인 올해 삼성전자우 평균 원 매수 일 주가 원 원 수준 연고점 원 대비 원 하이닉스 삼성전자 다음 주가 마찬가지 연저점 하락 고전 면치 개인 하이닉스 평균 원 매입 주가 원 원 월 일 연고점 원 투자자 주당 원 의 손해 셈 시점 하반기 대비 비수기 비메모리 공급 부족 우려 주가 힘 하반기 실적 개선 주가 반등할 수 전문가들 조언 김경민 하나금융투 수석연구위원 삼성전자 파운드리 매출 년 상저하 예상 면 상반기 하반기 대비 전통적 비수 라 말 월 미국 오스틴 한파 여파 삼성전자 상반기 매출 증가세 평소 제한 하반기 이하 선단 공정 증설분 매출 것 설명 수석연구위원 삼성전자 주가 답답 국면 상반기 대비 매출 증 본격화 하반기 분기 것 으 이원식 한국투자증권 연구원 하드웨어업체들 매출액 증가 정보기술 세트 수요 둔화 리스크 해소 주 반등 것 이 세트업체들 낮 재고 재고 축적 수요 것 부품업체들 낮 재고 추가적 가격 인상 야기 수 것 이 설명
2021-05-13,반도체 베팅 개미 ‘울상’ 삼성전자·SK하이닉스 최저점,삼성전자 고점 대비 하이닉스 하락 하반기 실적개선 기대 반등 전망 반도체 투톱 시가총액 위 삼성전자 하이닉스 주가 올해 최저점 추락 이 종목 집중적 개 투자자들 손실 고점 개 안팎 손실 금융투자업계 하반기 이후 반도체주가 기지개 것 일 한국거래소 개인 올해 이달 일 삼성전자 억 주 조 억 만원 순매수했다 주당 평균 원 매수 주가 일 시초 기준 원 평균매입 대비 원 하락 이날 장 초반 연저점 원 월 일 연고점 원 개인 주당 원 의 손실 삼성전자 이 두 번 삼성전자 우선주 삼성전자우 도 평균매입가 주가 기록 개인 올해 삼성전자우 평균 원 매수 일 주가 원 원 수준 연고점 원 대비 원 하이닉스 삼성전자 다음 주가 마찬가지 연저점 하락 고전 면치 개인 하이닉스 평균 원 매입 주가 원 원 월 일 연고점 원 투자자 주당 원 의 손해 셈 시점 하반기 대비 비수기 비메모리 공급 부족 우려 주가 힘 하반기 실적 개선 주가 반등할 수 전문가들 조언 김경민 하나금융투 수석연구위원 삼성전자 파운드리 매출 년 상저하 예상 면 상반기 하반기 대비 전통적 비수 라 말 월 미국 오스틴 한파 여파 삼성전자 상반기 매출 증가세 평소 제한 하반기 이하 선단 공정 증설분 매출 것 설명 수석연구위원 삼성전자 주가 답답 국면 상반기 대비 매출 증 본격화 하반기 분기 것 으 이원식 한국투자증권 연구원 하드웨어 업체들 매출액 증가 정보기술 세트 수요 둔화 리스크 해소 주 반등 것 이 세트 업체들 낮 재고 재고 축적 수요 것 업체들 낮 재고 추가적 가격 인상 야기 수 것 이 설명 김현경 기자
2021-05-13,삼성전자 8만원 붕괴 SK하이닉스 중 최저점,국내 반도체 투톱 연 휘청 서울경제 일 장 초반부 국내 시가총액 위 삼성전자 원 선 중 최저점 순수 반도체 업체 하이닉스 도 이날 오전 시 분 기준 삼성전자 전 대비 하락 원 거래 이날 개장 직후 원 어제 이 중 최저점 기록 시각 하이닉스 하락 원 것 중 이날 장 초반 하이닉스 중 저점 원 전 발표 미국 월 소비자물가지수 전년 대비 급등 글로벌 금융시장 투 심리 위축 상태 축 우려 간밤 미국 다우존스산업평균지수 전일 포인트 하락 만 거래 스탠더드앤드푸어스 은 포인트 나스닥 포인트 폭락한 만 종료 메모리 반도체 슈퍼 사이클 도래 전망 수요 감소 공급 확대 우려 외국 투자자 중심 반도체 매물 대량 지난해 비대 수요 반도체 주요 수요처 스마트폰 등 세트 제품 수요 폭발 이 사용 한 년 만큼 하반기 이 수요 둔화 수 걱정 지난달 중순 이후 중국 대 스마트폰 업체 오포 비보 샤오미 의 오더컷 주문 감소 산업 내 오더컷 본격화 수 불안 불 황민성 삼성증권 연구원 투자가 입장 수요 불확실성 우려 며 쇼티지 영향 무엇 지난해 코 영향 예상치 호황기 제품 수요 둔화 가능성 부각 말 이달 전일 외국인 삼성전자 조 억 원 하이닉스 억 원 를 팔아치웠다 이승배 기자
