,날짜,기사제목,본문내용
0,2021-05-30,"CJ제일제당, B2B 브랜드 '크레잇' 선보여",제일제당이 기업 간 거래 식품 사업 강화에 나선다 항공기 기내식 기업체 급식 편의점 도시락 등 상품군을 확대한다 이를 위해 크레잇 이라는 기업 고객용 브랜드를 새로 선보였다 제일제당은 일 사업담당 을 본부 로 승격한다고 밝혔다 단순히 주문받은 상품을 공급하던 데서 벗어나 고품질 맞춤형 솔루션을 제안하겠다는 게 이번 조직 개편의 목표다 이를 위해 제일제당은 연구개발 생산 조직과 사업본부의 협업을 강화하기로 했다 충북 진천 공장에 기업 고객을 위한 전용 생산라인을 구축하고 인력도 확충했다 신규 브랜드인 크레잇 은 새로운 먹거리를 창조한다 는 의미다 미래 식품 생태계를 구축해가겠다는 의지를 담았다 지난해 월 취임한 최은석 제일제당 대표가 그룹 식품사업부문장을 겸직하고 대표 직속으로 식품전략기획실을 신설했다 최 대표는 사업의 패러다임을 전환하겠다 고 말했다 박종관 기자
1,2021-05-30,"CJ제일제당, B2B 강화…""고객사의 고객까지 만족시킨다""",사업 본부 승격 신규 브랜드 크레잇 론칭 고품질 고객 맞춤형 솔루션 제공 제일제당 최은석 대표가 프리미엄 전문 브랜드 크레잇 을 소개하고 있다 제일제당 제공 제일제당이 기업간 거래 사업을 강화한다 제일제당은 기존 사업담당을 본부 로 승격 확대하고 신규 브랜드 크레잇 을 론칭했다고 일 밝혔다 앞서 지난 일에는 서울 중구 인재원에서 사업 비전선포식 을 가졌다 최은석 제일제당 대표는 이 자리에서 고객사와 고객사의 최종 소비자까지 만족시키는 제품을 바탕으로 급식 외식 배달식을 아우르는 식품사업의 새로운 지평을 열어갈 것 이라며 사업의 패러다임을 전환하겠다 고 말했다 사업 강화의 핵심은 높아진 고객 눈높이에 맞는 진화된 제품 개발 및 서비스 다 국내 가공식품 시장도 성장세가 지속돼 현재 조원에서 오는 년에는 조원 이상으로 확대될 전망이다 하지만 국내 시장은 여전히 가성비 중심의 한정된 제품 위주로 구성돼 있다 제일제당은 단순한 제품 공급을 넘어 고객사의 고객 까지 만족시키기 위한 고품질 고객 맞춤형 솔루션 으로 시장의 패러다임을 바꾸고 윈윈하는 사례를 만든다는 목표다 이를 위해 제일제당은 연구개발 셰프 생산 등 회사가 보유한 전 밸류체인과 사업본부와의 유기적인 협업 기능을 강화하기로 했다 또 고객사의 특장점과 메뉴 소비자 트렌드 등을 분석해 콘셉트나 메뉴 아이디어를 제안하는 맞춤형 솔루션 상품 및 서비스의 공동 개발을 통한 고객사 전용 상품 출시 등을 선보일 계획이다 조직 개편을 통해 더욱 빠른 의사결정과 부서간 시너지 창출도 가능해졌다 충북 진천공장에 전용 생산라인과 인력도 확충하며 사업 확장을 위한 채비도 마쳤다 제일제당은은 프리미엄 전문 브랜드 크레잇 도 론칭했다 크레잇은 새로운 먹거리를 창조한다 는 의미로 미래 식품 생태계를 만들어가겠다는 의지가 담겨 있다 제일제당은 크레잇 브랜드로 외식 급식업체 항공사 도시락 카페 사업자 등 업체에 밥 면 등 원밀 형 제품 수제 고기 토핑 등 간편식 솔루션 반조리 조리 가정간편식 편의점 공동개발 제품 샌드위치와 같은 스낵형 원밀 등을 제공할 예정이다 제일제당 관계자는 국내 식문화 트렌드를 선도하는 대표 기업으로서 시장뿐만 아니라 시장에서도 차별화와 혁신을 주도할 것 이라면서 외식 급식 등 다양한 플랫폼의 고객사 만족과 시장 패러다임 전환을 위해 최선을 다하겠다 고 말했다 이정은 기자
2,2021-05-30,"""외식시장 커진다""...B2B 힘주는 CJ제일제당",조직 본부로 승격 신규 브랜드 크레잇 론칭 식자재서 반조리 원밀 등 외식 급식업체 맞춤솔루션 제공 급식 외식 배달식 아우르는 식품사업 새로운 지평 열겠다 서울경제 제일제당이 기업간 거래 사업을 강화하기 위해 조직을 본부로 승격하고 신규브랜드 크레잇 을 론칭한다 제일제당의 기존 사업이 설탕과 밀가루 식용류 등 식자재에 제한돼 있었다면 신규브랜드 크레잇은 카페에서 팬매되는 샌드위치 식당에서 판매되는 국과 찌개 등 외식시장 간편식을 담당한다 신종 코로나바이러스감염증 코로나 정국에서 가정간편식 시장을 선도해 온 제일제당이 코로나 백신 접종에 속도가 붙는 등 포스트 코로나 진입이 거론되자 다시 사람이 몰리기 시작하는 외식 시장 를 새로운 성장동력으로 키우려는 전략이라는 분석이 나온다 지난 일 온오프라인으로 열린 제일제당 사업 비전선포식에서 쇼호스트들이 새롭게 론칭한 프리미엄 전문 브랜드 크레잇의 제품들을 설명하고 있다 사진 제공 제일제당 제일제당은 일 사업담당 을 본부로 승격 확대 개편하고 신규 브랜드 크레잇을 론칭했다고 밝혔다 이와 관련 지난 일에는 서울 중구 인재원에서 업계 주요 인사들이 온 오프라인으로 참여하는 사업 비전 선포식 을 열었다 최은석 제일제당 대표는 선포식에서 고객사와 고객사의 최종 소비자까지 만족시키는 제품을 바탕으로 급식 외식 배달식을 아우르는 식품 사업의 새로운 지평을 열어갈 것 이라면서 사업의 패러다임을 전환 하겠다 고 밝혔다 최은석 제일제당 대표가 지난 일 온오프라인으로 개최된 사업 비전 선포식에서 프리미엄 전문 브랜드 크레잇과 제일제당 사업의 비전에 대해 소개하고 있다 사진 제공 제일제당 지금까지 제일제당의 는 식자재 중심이었다 백설 설탕과 밀가루 식용류 등의 매출은 전체 매출의 를 담당해왔다 반면 만두 등 시장에서 히트를 친 제일제당의 간편식 부문은 시장에서 성장이 더뎠다 제일제당이 조직을 확대한 것은 커가는 외식 간편식 시장 규모에 맞춰 부문을 키우겠다는 판단에서다 포스트 코로나 시대에서는 억눌려 있던 외식 수요가 폭발할 것으로 전망되기 때문이다 국내 가공식품 시장은 년 조 억 원에서 년 조 억 원으로 성장했다 년 코로나 여파로 조 억원으로 주춤했만 년에는 조 원 이상으로 확대될 것으로 전망된다 이에 제일제당의 신규 브랜드 크레잇은 외식 급식업체 항공사 도시락 카페 사업자 등 업체에 밥 면 등 원밀 형 제품 수제 고기 토핑 등 간편식 솔루션 반조리 조리 편의점 공동개발 제품 샌드위치와 같은 스낵형 원밀 등을 제공할 예정이다 제일제당 관계자는 단순 제품 공급을 넘어 고객사의 고객 까지 만족시키기 위한 고품질 고객 맞춤형 솔루션 으로 시장 패러다임을 전환하고 윈윈 사례를 만들어가겠다는 목표 라고 설명했다 이를 위해 제일제당은 셰프 생산 등 회사가 보유한 전 밸류체인과 사업본부 와의 유기적인 협업 기능을 강화한다 또 고객사의 특장점과 메뉴 소비자 트렌드 등을 분석해 콘셉트나 메뉴 아이디어를 제안하는 맞춤형 솔루션 상품 및 서비스의 공동 개발을 통한 고객사 전용 상품 출시 등 미래형 서비스 를 적극 선보일 계획이다 진천공장에 전용 생산라인과 인력도 확충하며 사업 확장을 위한 채비도 마쳤다 제일제당 관계자는 국내 식문화 트렌드를 선도하는 대표 기업으로서 시장뿐 아니라 시장에서도 차별화와 혁신을 주도할 것 이라면서 외식 급식 등 다양한 플랫폼의 고객사 만족과 시장 패러다임 전환을 위해 최선을 다하겠다 고 말했다 박형윤 기자
3,2021-05-30,CJ제일제당 B2B사업 강화…프리미엄 브랜드 크레잇 출시,본부 셰프 협업 외식업체 항공사 카페 공급 제일제당이 기업 간 거래 사업을 강화하기 위해 관련 사업 조직 규모를 확대 개편하고 브랜드를 새롭게 선보였다 제일제당은 기존 사업담당 을 본부 로 승격해 확대 개편하고 새로운 브랜드 크레잇 을 출시한다고 일 밝혔다 최은석 제일제당 대표 사진 는 고객사와 고객사의 최종 소비자까지 만족시키는 제품을 바탕으로 급식 외식 배달식을 아우르는 식품 사업의 새로운 지평을 열어갈 것 이라며 사업의 패러다임을 전환하겠다 고 말했다 제일제당은 확대 개편된 사업본부와 연구개발 셰프 생산 등 회사가 보유한 전 밸류체인과의 유기적인 협업 기능을 강화할 계획이다 고객사의 특장점과 메뉴 소비자 트렌드 등을 분석해 콘셉트나 메뉴 아이디어를 제안하는 맞춤형 솔루션 상품과 서비스 공동 개발을 통한 고객사 전용 상품 출시 등 미래형 서비스를 적극 선보일 계획이다 트렌드 분석 기반의 메뉴 솔루션을 제공하기 위해 프리미엄 전문 브랜드 크레잇도 출시했다 크레잇은 새로운 먹거리를 창조한다 는 의미로 미래 식품 생태계를 만들어가겠다는 의지를 담았다 제일제당은 크레잇 브랜드로 외식 급식업체 항공사 도시락 카페 사업자 등 업체에 밥 면 등 원밀 형 제품 수제 고기 토핑 등 간편식 솔루션 반조리 조리 가정간편식 등을 제공할 예정이다 제일제당은 외식 급식 등 다양한 플랫폼의 고객사를 만족시키고 시장 패러다임을 전환하기 위해 최선을 다하겠다 고 전했다 강민호 기자
4,2021-05-30,"CJ제일제당, B2B 사업 강화…새 브랜드 '크레잇' 선보여",사업 담당 을 본부 로 승격 및 확대 개편 전문브랜드 크레잇 내놔 비전 선포식도 개최 최은석 제일제당 대표가 지난 일 온오프라인으로 개최된 사업 비전 선포식에서 프리미엄 전문 브랜드 크레잇과 제일제당 사업의 비전에 대해 소개하고 있다 아시아경제 임혜선 기자 제일제당이 기업간 거래 사업을 강화한다 이를 위해 사업 조직의 위상을 높이고 규모를 확대하는 한편 브랜드도 새롭게 선보였다 제일제당은 기존 사업담당 을 본부 로 승격 확대 개편하고 신규 브랜드 크레잇 을 내놨다고 일 밝혔다 이와 관련 지난 일에는 서울 중구 인재원에서 업계 주요 인사들이 온 오프라인으로 참여하는 사업 비전 선포식 을 열었다 최은석 제일제당 대표는 선포식에서 고객사와고객사의 최종 소비자까지 만족시키는 제품을 바탕으로 급식 외식 배달식을 아우르는 식품 사업의 새로운 지평을 열어갈 것 이라면서 사업의 패러다임을 전환하겠다 고 밝혔다 이번 사업 강화의 핵심은 높아진 고객 눈높이에 맞는 진화된 제품 개발 및 서비스 에 있다 트렌드는 빠르게 변화하고 소비자들의 기대 수준도 높아졌다 국내 가공식품 시장도 성장세가 지속돼 현재 조원 규모에서 년에는 조 이상으로 확대될 것으로 전망된다 하지만 시장은 여전히 가성비 중심의 한정된 제품 위주로 구성되어 있다 제일제당은 단순 제품 공급을 넘어 고객사의 고객까지 만족시키기 위한 고품질 고객 맞춤형 솔루션 으로 시장 패러다임을 전환하고 윈윈 사례를 만들어가겠다는 목표다 이를 위해 제일제당은 연구개발 셰프 생산 등 회사가 보유한 전 밸류체인과 사업본부와의 유기적인 협업 기능을 강화한다 또한 고객사의 특장점과 메뉴 소비자 트렌드 등을 분석해 콘셉트나 메뉴 아이디어를 제안하는 맞춤형 솔루션 상품 및 서비스의 공동 개발을 통한 고객사 전용 상품 출시 등 미래형 서비스를 적극 선보일 계획이다 조직 개편을 통해 보다 빠른 의사결정과 부서간 시너지 창출이 가능해지면서 제일제당 사업 진화가 가속화될 것으로 보인다 진천공장에 전용 생산라인과 인력도 확충하며 사업 확장을 위한 채비도 마쳤다 빠르고 정확한 트렌드 분석 기반의 메뉴 솔루션을 제공하기 위해 프리미엄 전문 브랜드 크레잇 도 선보였다 크레잇은 새로운 먹거리를 창조한다 는 의미로 미래 식품 생태계를 만들어가겠다는 의지가 담겨있다 제일제당은 크레잇 브랜드로 외식 급식업체 항공사 도시락 카페 사업자 등 업체에게 밥 면 등 원밀 형 제품 수제 고기 토핑 등 간편식 솔루션 반조리 조리 가정간편식 편의점 공동개발 제품 샌드위치와 같은 스낵형 원밀 등을 제공할 예정이다 임혜선 기자
5,2021-05-30,"CJ제일제당 B2B 브랜드 '크레잇'...""급식·외식·배달식 새지평""",머니투데이 지영호 기자 최은석 제일제당 대표가 지난 일 온오프라인으로 개최된 사업 비전 선포식에서 프리미엄 전문 브랜드 크레잇과 제일제당 사업의 비전에 대해 소개하고 있다 제일제당은 기존 기업간 거래 사업담당을 본부로 승격하고 신규 브랜드 크레잇 을 선보인다고 일 밝혔다 최은석 제일제당 대표는 지난 일 서울 중구 인재원에서 가진 사업 비전 선포식 에서 고객사와 고객사의 최종 소비자까지 만족시키는 제품을 바탕으로 급식 외식 배달식을 아우르는 식품 사업의 새로운 지평을 열어갈 것 이라면서 사업의 패러다임을 전환하겠다 고 밝혔다 국내 가공식품 시장은 현재 조원 규모로 년에는 조원 이상 확대될 것으로 전망된다 하지만 시장은 여전히 가성비 중심의 한정된 제품 위주로 구성돼 있다 제일제당은 사업 강화의 핵심이 높아진 고객 눈높이에 맞는 진화된 제품 개발과 서비스에 있다고 강조했다 이를 위해 고객사의 특장점과 메뉴 소비자 트렌드 등을 분석해 아이디어를 제안하는 맞춤형 솔루션 상품 서비스의 공동 개발을 통한 고객사 전용 상품 출시 등 미래형 서비스를 선보일 계획이다 제일제당은 이번 조직 개편으로 보다 빠른 의사결정과 부서간 시너지 창출이 가능해질 것으로 기대했다 진천공장에 전용 생산라인과 인력을 확충해 사업 확장을 위한 채비도 마쳤다 신규 브랜드 크레잇 은 빠르고 정확한 트렌드 분석 기반의 메뉴 솔루션을 제시하는 프리미엄 전문 브랜드다 새로운 먹거리를 창조한다 는 의미로 미래 식품 생태계를 만들어가겠다는 의지를 담았다 제일제당은 크레잇 브랜드로 외식 급식업체 항공사 도시락 카페 사업자 등 업체에게 밥 면 등 원밀 형 제품 수제고기 토핑 등 간편식 솔루션 여러 조리형태의 편의점 공동개발 제품 샌드위치와 같은 스낵형 원밀 등을 공급할 예정이다 제일제당 관계자는 국내 식문화 트렌드를 선도하는 대표 기업으로서 시장뿐 아니라 시장에서도 차별화와 혁신을 주도할 것 이라면서 외식 급식 등 다양한 플랫폼의 고객사 만족과 시장 패러다임 전환에 힘쓰겠다 고 말했다 지영호 기자
6,2021-05-30,"CJ제일제당, B2B 식품사업 강화..신규 브랜드 '크레잇' 출범",이데일리 김범준 기자 제일제당이 기업간 거래 사업을 강화한다 조직 개편을 통해 사업 조직 규모를 확대하고 브랜드도 새롭게 선보인다 최은석 제일제당 대표가 지난 일 서울 중구 인재원에서 열린 사업 비전 선포식 에서 프리미엄 전문 브랜드 크레잇 과 사업 비전에 대해 소개하고 있다 사진 제일제당 제공 제일제당은 기존 사업담당 을 사업본부 로 승격 및 확대 개편하고 프리미엄 전문 신규 브랜드 크레잇 을 출범시켰다고 일 밝혔다 이번 사업 강화의 핵심은 높아진 고객 눈높이에 맞는 진화된 제품 개발 및 서비스 에 있다 국내 가공식품 성장세 지속으로 현재 조원 규모인 시장이 오는 년에는 조 이상으로 확대될 것으로 전망되면서다 앞서 최은석 제일제당 대표는 지난 일 서울 중구 인재원에서 열린 사업 비전 선포식 에서 고객사와 고객사의 최종 소비자까지 만족시키는 제품을 바탕으로 급식 외식 배달식을 아우르는 식품 사업의 새로운 지평을 열어갈 것 이라면서 사업의 패러다임을 전환하겠다 고 강조한 바 있다 제일제당은 이번 조직 개편을 통해 보다 빠른 의사결정과 부서간 시너지 창출이 가능해지면서 사업 진화가 가속화될 것으로 보고 있다 진천공장에 전용 생산라인과 인력도 확충했다 새 브랜드 크레잇 은 새로운 먹거리를 창조한다 는 의미로 미래 식품 생태계를 만들어가겠다는 의지를 담았다 이를 바탕으로 제일제당은 단순 제품 공급을 넘어 고객사의 고객 까지 만족시키기 위한 고품질 고객 맞춤형 솔루션 으로 시장 패러다임을 전환하고 윈윈 사례를 만들어간다는 방침이다 제일제당은 연구 개발 과 생산 등 보유한 전 밸류체인과 사업본부의 유기적인 협업 기능을 강화한다 또 고객사의 특장점과 소비자 트렌드 등을 분석해 콘셉트 메뉴 아이디어를 제안하는 맞춤형 솔루션 상품 및 서비스의 공동 개발을 통한 고객사 전용 상품 출시 등 미래형 서비스 를 적극 선보일 계획이다 또 크레잇 브랜드로 외식 급식업체 항공사 도시락 카페 사업자 등 업체에게 밥 면 등 원밀 형 제품 수제 고기 토핑 등 간편식 솔루션 반조리 조리 가정간편식 편의점 공동개발 제품 샌드위치 등 스낵형 원밀 등을 제공할 예정이다 제일제당 관계자는 시장뿐 아니라 시장에서도 차별화와 혁신을 주도할 것 이라면서 외식 급식 등 다양한 플랫폼의 고객사 만족과 시장 패러다임 전환을 위해 최선을 다하겠다 고 말했다 김범준
7,2021-05-30,"CJ제일제당, B2B사업 강화... 전문브랜드 '크레잇' 론칭",제일제당 최은석 대표가 지난 일 온 오프라인으로 개최된 사업 비전 선포식에서 프리미엄 전문 브랜드 크레잇과 제일제당 사업의 비전에 대해 소개하고 있다 사진 제일제당 파이낸셜뉴스 제일제당이 기업간 거래 사업 강화에 나선다 제일제당은 기존 사업담당 을 본부 로 승격 확대 개편하고 신규 브랜드 크레잇 을 론칭했다고 일 밝혔다 이와 관련 지난 일에는 서울 중구 인재원에서 사업 비전 선포식 을 열었다 최은석 제일제당 대표는 선포식에서 고객사와 고객사의 최종 소비자까지 만족시키는 제품을 바탕으로 급식 외식 배달식을 아우르는 식품 사업의 새로운 지평을 열어갈 것 이라면서 사업의 패러다임을 전환 하겠다 고 말했다 이번 사업 강화의 핵심은 높아진 고객 눈높이에 맞는 진화된 제품 개발 및 서비스 에 있다 국내 가공식품 시장도 성장세가 지속돼 현재 조원 규모에서 년에는 조 이상으로 확대될 것으로 전망된다 하지만 시장은 여전히 가성비 중심의 한정된 제품 위주로 구성돼 있다 제일제당은 단순 제품 공급을 넘어 고객사의 고객 까지 만족시키기 위한 고품질 고객 맞춤형 솔루션 으로 시장 패러다임을 전환하고 윈윈 사례를 만들어가겠다는 목표다 이를 위해 제일제당은 셰프 생산 등 회사가 보유한 전 밸류체인과 사업본부 와의 유기적인 협업 기능을 강화한다 또 고객사의 특장점과 메뉴 소비자 트렌드 등을 분석해 콘셉트나 메뉴 아이디어를 제안하는 맞춤형 솔루션 상품 및 서비스의 공동 개발을 통한 고객사 전용 상품 출시 등을 선보일 계획이다 조직 개편을 통해 보다 빠른 의사결정과 부서간 시너지 창출도 가능해졌다 충북 진천공장에 전용 생산라인과 인력도 확충하며 사업 확장을 위한 채비도 마쳤다 프리미엄 전문 브랜드 크레잇 도 론칭했다 크레잇은 새로운 먹거리를 창조한다 는 의미로 미래 식품 생태계를 만들어가겠다는 의지가 담겨있다 제일제당은 크레잇 브랜드로 외식 급식업체 항공사 도시락 카페 사업자 등 업체에게 밥 면 등 원밀 형 제품 수제 고기 토핑 등 간편식 솔루션 반조리 조리 편의점 공동개발 제품 샌드위치와 같은 스낵형 원밀 등을 제공할 예정이다 제일제당 관계자는 국내 식문화 트렌드를 선도하는 대표 기업으로서 시장뿐 아니라 시장에서도 차별화와 혁신을 주도할 것 이라면서 외식 급식 등 다양한 플랫폼의 고객사 만족과 시장 패러다임 전환을 위해 최선을 다하겠다 고 말했다 지난 일 온 오프라인으로 열린 제일제당 사업 비전선포식에서 쇼호스트들이 새롭게 론칭한 프리미엄 전문 브랜드 크레잇 제품들을 소개하고 있다 사진 제일제당 이정은 기자
