time,title,context
2021-05-25,하이트진로 이탈리아 명품 '메짜코로나' 와인 출시,하이트진 대표 김인규 이탈리아 메짜코로 디노떼 레드 블렌드 와인 출시 일 년 개 포 생산자 조합 설립 년 전통 와이너리 메짜코로나 이탈리아 동북부 트렌티노 알토 아디제 지방 돌로미테 산맥 위치 돌로미테 세계 향기로운 화이트 와인 생산지 유명 트렌티노 지역 토착 품종 테롤데고 세계 최대 생산자 품종 제조 최초 와인 생산 세계적 경진대회 문두스 비니 이탈리아 최고 생산자 선정 바 메짜코로나 테롤데 마르제미노 메를 를 블렌딩해 레드 와인 레드 커런트 블랙베리 등 풍부 과즙 코코아 향 조화 균형감 것 특징 메짜코로나 현대백화점 목동점 천호점 판교점 현대 프리미엄 아울렛 송도점 신세계백화점 본점 롯데마트 등 판매 예정
2021-05-25,하이트진로 금메달 와인 메짜코로 디노떼 레드 블렌드 출시,제공 하이트진 하이트진 대표 김인규 이탈리아 최대 와이너리 메짜코로나 와인 메짜코로 디노떼 레드 블렌드 를 출시 일 메짜코로나 년 개 포도생산자 조합 설립 년 전통 와이너리이다 이탈리아 동북부 트렌티노 알토 아디제 지방 돌로미테 산맥 돌로미테 세계 향기로운 화이트 와인 생산지 유명 와이너리 트렌티노 지역 토착 품종 테롤데 의 세계 최대 생산자 테롤데고 최초 와인 생산 메짜코로나 테롤데 마르제미노 메를 를 블렌딩해 레드와인 레드 커런트 블랙베리 등 풍부 과즙 코코아향 조화 베를린 와인 트로피 금메달 수상 인터내셔날 와인 챌린지 점 획득 메짜코로나 현대백화점 목동점 천호점 판교점 현대 프리미엄 아울렛 송도점 신세계백화점 본점 롯데마트 등 판매 예정 유태영 상무 국내 소개 포 품종 와인애호가들 경험 제공 메짜코로나 출시 며 앞 전통 와이너리 고품질 와인 합리적 가격 수 노력 말 최기성 매경닷컴 기자
2021-05-25,하이트진로 '메짜코로 디노떼 레드 블렌드' 출시,아시아경제 임혜선 기 하이트진로 메짜코로 디노떼 레드 블렌드 를 출시 일 메짜코로나 년 개 포도생산자 조합 설립 년 전통 와이너리이다 이탈리아 동북부 트렌티노 알토 아디제 지방 돌로미테 산맥 위치 돌로미테 세계 향기로운 화이트 와인 생산지 유명 와이너리 트렌티노 지역 토착 품종 테롤데 의 세계 최대 생산자 세계적 와인경진대회 문두스 이탈리아 최고 생산자 로 선정 바 메짜코로나 테롤데 마르제미노 메를 를 블렌딩해 레드와인 레드 커런트 블랙베리 등 풍부 과즙 코코아향 조화 균형감 것 특징 베를린 와인 트로피 금메달 수상 인터내셔날 와인 챌린지 점 획득 메짜코로나 현대백화점 현대 프리미엄 아울렛 송도점 신세계백화점 본점 롯데마트 등 판매 예정 임혜선 기자
2021-05-25,하이트진로 이태 최대 와이너리 ‘메짜코로 디노떼 레드 블렌드’,이데일리 전재욱 기 하이트진로 이탈리아 최대 와이너리 메짜코로 의 메짜코로 디노떼 레드 블렌드 를 출시 일 메짜코로나 년 개 포도생산자 조합 설립 년 전통 와이너리이다 이탈리아 동북부 트렌티노 알토 아디제 지방 돌로미테 산맥 위치 돌로미테 세계 향기로운 화이트 와인 생산지 유명 와이너리 트렌티노 지역 토착 품종 테롤데 의 세계 최대 생산자 테롤데고 최초 와인 생산 세계적 와인경진대회 문두스 이탈리아 최고 생산자 로 선정 바 메짜코로나 테롤데 마르제미노 메를 를 블렌딩해 레드와인 레드 커런트 블랙베리 등 풍부 과즙 코코아향 조화 균형감 것 특징 베를린 와인 트로피 금메달 수상 인터내셔날 와인 챌린지 점 획득 메짜코로나 현대백화점 목동점 천호점 판교점 현대 프리미엄 아울렛 송도점 신세계백화점 본점 롯데마트 등 판매 예정 전재욱
2021-05-25,하이트진로 이탈리아 최대 와이너리 메짜코로 와인 출시,메짜코로 디노떼 레드 블렌드 파이낸셜뉴스 하이트진로 이탈리아 최대 와이너리 메짜코로나 메짜코로 디노떼 레드 블렌드 를 출시 일 메짜코로나 년 개 포도생산자 조합 설립 년 전통 와이너리이다 이탈리아 동북부 트렌티노 알토 아디제 지방 돌로미테 산맥 위치 돌로미테 세계 향기로운 화이트 와인 생산지 유명 와이너리 트렌티노 지역 토착 품종 테롤데 의 세계 최대 생산자 테롤데고 최초 와인 생산 세계적 와인경진대회 문두스 이탈리아 최고 생산자 로 선정 바 메짜코로나 테롤데 마르제미노 메를 를 블렌딩해 레드와인 레드 커런트 블랙베리 등 풍부 과즙 코코아향 조화 균형감 것 특징 베를린 와인 트로피 금메달 수상 인터내셔날 와인 챌린지 점 획득 메짜코로나 현대백화점 목동점 천호점 판교점 현대 프리미엄 아울렛 송도점 신세계백화점 본점 롯데마트 등 판매 예정 하이트진 유태영 상무 국내 소개 포 품종 와인애호가들 경험 선사 출시 며 앞 전통 와이너리 고품질 와인 합리적 가격 수 노력 조지민 기자
