time,title,context
2021-04-30,하이트진로 캐리터샵 '두껍상회' 전주 이동 운영,하이트진 대표 김인규 주류 캐릭터샵 두껍 상회 의 전국순회 다섯 번 지점 전주점 을 오픈 일 진로 고객들 브랜드 경험 제공 보답 차원 기획 이벤트 지난해 서울 이 올해 부산 대구 광주 순 전국 순회 인기 전주 다음 달 일 문 월 일 전주 객리단길 전주시 완산구 다가동 운영 계획 전주국제영화제 고객 것 전주점 우리 문화 전주 고유 분위기 외관 인테리어 차별화 한옥 모티브 기와 전통 창호 문 외관 적용 전통 가구 문양 도자 활용 내부 인테리어 한복 입 두꺼비 캐릭터 눈 쏘맥잔 진 한방울잔 두꺼비 키링 등 대표 인기 굿즈 여 종이 판매 이전 개 지점 굿즈 판매 데이터 근거 인기 제품만 베스트셀링 존 마련 이외 소맥 자격증 발급 이벤트 럭키박스 판매 등 다양한 거리 준비 시 시 시간 동안 운영 미성년자 출입 제한 일 마감 광주점 방문 연인원 만여 명 기록 성황리 운영 접근성 동명동 진행 방문자 대 초중반 소맥 자격증 발급 프로모션 등 인기 결과
2021-04-30,하이트진로 ‘두껍상회’ 전주 상륙…전국순회 다섯번,한옥 모티브 외관 내부 전통미 극대화 전주 두껍상회 외관 하이트진 제공 헤럴드경제 신소연 기 하이트진로 두껍상회 이번 전주 상륙 하이트진로 국내 최초 주류 캐릭터샵 두껍상회 의 전국순회 다섯번 지점 전주점 을 오픈 일 다음달 일 월 일 운영 전주 두껍상회 전주 지역 핫플레이스 객리단길 전주시 완산구 다가동 자리 전주점 우리 문화 전주 고유 분위기 외관 인테리어 차별 한옥 모티브 기와 전통 창호문 외관 적용 전통 가구 문양 도자 활용 내부 인테리어 전통미 극대화 한복 입 두꺼비 캐릭터 눈 전주 두껍상회에서 쏘맥잔 진 한방울잔 두꺼비 키링 등 하이트진로 대표 인기 굿즈 여종 판매 예정 이전 개 지점 굿즈 판매 데이터 근거 인기 제품만 베스트셀링 도 마련 이외 소맥 자격증 발급 이벤트 럭키박스 판매 등 다양한 거리 준비 시 시 시간 동안 운영 미성년자 출입 제한 하이트진 마케팅실 오성택 상무 소주 원조 진로 청정라거 테라 사랑 지방 고객들 두껍상회 전국 순회 브랜드 경험 전달 소통 기회 마련 며 진로 테라 전국민 사랑 브랜드 자리매김 소비자 니즈 반영한 마케팅 활동 지속적 말
2021-04-30,하이트진로 ‘두껍상회’ 전주 상륙,두껍상회 전주점 외관 아시아경제 이승진 기 하이트진로 두껍상회 이번 전주 고객들 하이트진로 국내 최초 주류 캐릭터숍 두껍상회 의 전국순회 다섯번 지점 전주점 을 오픈 일 지난해 서울 시작 올해 부산 대구 광주 순 전국 순회 이번 전주 두껍상회 월 일 문 월 일 전주 지역 핫플레이스 객리단길 전주시 완산구 다가동 운영 계획 운영기간 동안 전주국제영화제 개최 고객들 전주 두껍상회 것 전주점 우리 문화 전주 고유 분위기 외관 인테리어 차별 한옥 모티브 기와 전통 창호문 외관 적용 전통 가구 문양 도자 활용 내부 인테리어 전통미 극대화 한복 입 두꺼비 캐릭터 눈 전주 두껍상회에서 쏘맥잔 진 한방울잔 두꺼비 키링 등 하이트진로 대표 인기 굿즈 여종 판매 예정 이전 개 지점 굿즈 판매 데이터 근거 인기 제품만 베스트셀링 도 마련 이외 소맥 자격증 발급 이벤트 럭키박스 판매 등 다양한 거리 준비 시 시 시간 동안 운영 미성년자 출입 제한 월 일 종료 광주 두껍상회는 방문객수 만여명 기록 광주에서 접근성 동명동 진행한데 대다수 방문자 대 초중반 소맥자격증 발급 프로모션 등 인기 입소문 것 분석 오성택 하이트진 마케팅실 상무 소주 원조 진로 청정라거 테라 사랑 지방 고객들 두껍상회 전국 순회 브랜드 경험 전달 소통 기회 마련 며 진로 테라 전국민 사랑 브랜드 자리매김 소비자 니즈 반영한 마케팅 활동 지속적 말 이승진 기자
2021-04-30,‘청정라거-테라’ 必환경경영 하이트진로,재활용 분리배출 활성화 친환경지수 테스트 이벤트 진행 하이트진로 환경 경영 시동 하이트진로 글로벌 재활용 컨설팅업체 테라사이클 페트 등 용기 재활용 분리배출 활성화 업무협약 체결 출시 주년 청정라거 테라 청정 콘셉트 강조 브랜드 본질 가치 중점 소비자 경험 제공 하이트진로 이 리테 요기요 등 청정리사이클 캠페인 진행 중 일반 소비자들 리사이클 활동 참여 자원순환 식 증대 생활화 유도 하이트진로 요기요 본격적 캠페인 시작 일 친환경 지수 테스트 이벤트 를 요기요 앱 진행 중 사전 퀴즈 이벤트 참여자 일 시작 캠페인 신청 절차 내 문자 발송 참여 예정 오성택 하이트진 마케팅실 상무 하이트진로 테라 포함 제품 생산 소비 전 과정 사회 환경 책 모습 수 노력 것 이 테 출시 주년 올해 다채로운 브랜드 경험 제공 테라 브랜드 선호도 국내 맥주 시장 위 탈환 원년 말 한편 하이트진로 그간 테 진 등 종 제품 환경성적표지 인증 획득 등 친환경 경영활동 년 경기도 주관해 미세먼지 정화 효과 나무 약 그루 관리 숲 속 공장 조성사업 참여 신소연 기자
2021-04-30,하이트진로 ‘청정라거-테라’ 필환경 시동,청정리사이클 캠페인 진행 하이트진 제공 헤럴드경제 신소연 기 하이트진로 환경 경영 시동 하이트진로 글로벌 재활용 컨설팅업체 테라사이클 페트 등 용기 재활용 분리배출 활성화 업무협약 체결 출시 주년 청정라거 테라 청정 콘셉트 강조 브랜드 본질 가치 중점 소비자 경험 제공 하이트진로 이 리테 요기요 등 청정리사이클 캠페인 진행 중 일반 소비자들 리사이클 활동 참여 자원순환 식 증대 생활화 유도 하이트진로 요기요 본격적 캠페인 시작 일 친환경 지수 테스트 이벤트 를 요기요 앱 진행 중 사전 퀴즈 이벤트 참여자 일 시작 캠페인 신청 절차 내 문자 발송 참여 예정 오성택 하이트진 마케팅실 상무 하이트진로 테라 포함 제품 생산 소비 전 과정 사회 환경 책 모습 수 노력 것 이 테 출시 주년 올해 다채로운 브랜드 경험 제공 테라 브랜드 선호도 국내 맥주 시장 위 탈환 원년 말 한편 하이트진로 그간 테 진 등 종 제품 환경성적표지 인증 획득 등 친환경 경영활동 년 경기도 주관해 미세먼지 정화 효과 나무 약 그루 관리 숲 속 공장 조성사업 참여
2021-04-30,하이트진로 청정라거 ‘테라’ 친환경 경영 박차,테라사이클 업무 협약 재활용 활성화 캠페인 진행 종 제품 환경성적표지 인증 획득 경기 주관 숲 속 공장 조성사업 참여 이데일리 김무연 기 하이트진로 환경 시대 다양 친환경 활동 글로벌 재활용 컨설팅 전문기업 협약 체결 뿐 맥주 소주 제품 환경성적표인증 획득 등 환경 보호 노력 오성택 하이트진 마케팅실 상무 왼쪽 진영호 리테 상품개발본부장 상무 업무 협약 기념 촬영 하이트진 하이트진로 지난달 글로벌 재활용 컨설팅 전문기업 테라사이클 페트 등 용기 체계적 재활용 분리배출 활성화 업무협약 체결 일 출시 주년 테 의 청정 콘셉트 강조 브랜드 본질 가치 중점 소비자 경험 제공 테라사이클 손 설명 하이트진로 지난달 일 리테일 업무협약 일 매장 캠페인 활동 시작 캠페인 참여 비 프렌드 를 선발 병 페트 등 제품 용기 일회용품 리 배출 수거 미션 부 이달 초 요기요 재활용 분리배출 독려 프로그램 청정 리사이클 캠페인 시작 일 지구 날 캠페인 참여 테 크루 시즌 명 을 모집 개 시즌 월 캠페인 지속 예정 시즌별 선발 테 크루 플라스틱 배달 용기 등 재활용 가능 제품 용기 수거 리 배출 미션 부 미션 수행 대항전 진행 수거 재활용품 업사이클링 굿즈 제작 참가자 제공 계획 하이트진로 제품 제작 부문 친환경 행보 하이트진로 지난해 월 테라 진 등 종 제품 환경성적표 인증 획득 소비자들 환경성 제품 구매 독려 기업들 자발적 환경개선 활동 참여 유도 취지 년 경기도 주관 숲 속 공장 조성사업 참여 경기 내 사업장 개사가 참여해 미세먼지 정화 효과 나무 약 그루 사업장 주변 유휴부 등 관리 사업 하이트진로 년 월 이천공장 주변 미세먼지 정화 우수 수목 식재 미세먼지 줄 공기정화 활동 계획 오성택 하이트진 마케팅실 상무 하이트진로 테라 포함 제품 생산 소비 전 과정 사회 환경 책 모습 수 노력 것 이 테 출시 주년 올해 다채로운 브랜드 경험 제공 브랜드 선호도 국내 맥주 시장 위 탈환 원년 말 김무연
2021-04-30,전주 '두껍상회' 하이트진로 5호점 전주점 개점,이데일리 김범준 기 하이트진로 국내 최초 주류 캐릭터샵 두껍상회 의 전국 순회 다섯번 지점 전주점 을 개점 일 전주시 완산구 객리단길 문 전주 두껍상회 모습 하이트진 제공 이번 전주 두껍상회 다음달 일 문 월 일 전주 지역 핫플레이스 로 객리단길 전주시 완산구 다가동 운영 계획 운영기간 동안 전주국제영화제 개최 소비자들 발길 전망 전주점 우리 문화 전주 고유 분위기 외관 인테리어 차별 한옥 모티브 기와 전통 창호문 외관 적용 전통 가구 도자 문양 활용 내부 인테리어 전통미 극대화 한복 입 두꺼비 캐릭터 눈 전주 두껍상회에서 쏘맥잔 진 한방울잔 두꺼비 키링 등 하이트진로 대표 인기 굿즈 여종 판매 예정 이전 개 지점 굿즈 판매 데이터 근거 인기 제품 베스트셀링 도 마련 이 소맥 자격증 발급 이벤트 럭키박스 판매 등 다양한 거리 준비 오성택 하이트진 마케팅실 상무 진로 테라 전국민 사랑 브랜드 자리매김 소비자 니즈 반영한 마케팅 활동 지속적 것 이 말 한편 팝업스토 두껍상회 진로 애용 소비자들 브랜드 경험 선사 차원 기획 지난해 서울 시작 올해 부산 대구 광주 전주 순 전국 순회 인기 이날 종료 호점 광주 두껍상회 누적 방문객수 만여명 기록 하이트진로 코 방역지침 준수 안전 팝업스토 운영 방안 시행 김범준
2021-04-30,하이트진 '두껍상회' 전주 상륙,머니투데이 박미주 기 다가동 객리단길 다음달 일 월 일 운영 한옥 전통미 극대화 전주 두껍상회 외관 하이트진 하이트진로 두껍상회 이번 북 전주시 상륙 하이트진로 주류 캐릭터샵 두껍상회 전국순회 다섯번 지점 전주점 을 일 지난해 서울 비롯 올해 부산 대구 광주 순 전국 순회 전주 두껍상회 다음달 일 문 월 일 전주 지역 핫플레이스 객리단길 전주시 완산구 다가동 운영 운영기간 전주국제영화제 개최 전주점 우리 문화 전주 고유 분위기 외관 인테리어 차별 한옥 모티브 기와 전통 창호문 외관 적용 전통 가구 문양 도자 활용 내부 인테리어 전통미 극대화 한복 입 두꺼비 캐릭터 눈 전주 두껍상회에서 쏘맥잔 진 한방울잔 두꺼비 키링 등 하이트진로 굿즈 기획상품 여종 판매 이전 개 지점 굿즈 판매 데이터 근거 인기 제품 베스트셀링 도 마련 소맥 자격증 발급 럭키박스 판매 등 준비 낮 시 저녁 시 시간 동안 운영 미성년자 출입 제한 이날 종료 광주 두껍상회 방문객수 만여명 기록 광주에서 접근성 동명동 진행 데 대다수 방문자 대 초중반 소맥자격증 발급 프로모션 등 인기 입소문 것 하이트진로 분석 오성택 하이트진 마케팅실 상무 소주 원조 진 청정라거 테 를 사랑 지방 고객들 두껍상회 전국 순회 브랜드 경험 전달 소통 기회 마련 며 소비자 니즈 반영한 마케팅 활동 지속적 말 하이트진로 코 방역지침 수 안전 팝업스토 운영방안 마련 스마트 웨이팅 시스템 도입 대 인원 대기시간 최소화 비대 체온 체크 체크인 병행 중 정기적 매장 방역 시행 박미주 기자
2021-04-30,하이트진로 '두껍상회' 전주점 오픈,전주 두껍상회 외관 파이낸셜뉴스 하이트진로 두껍상회 이번 전주 고객 하이트진로 국내 최초 주류 캐릭터샵 두껍상회 의 전국순회 다섯번 지점 전주점 을 오픈 일 지난해 서울 비롯 올해 부산 대구 광주 순 전국 순회 인기 이번 전주 두껍상회 다음달 일 문 월 일 전주 지역 핫플레이스 객리단길 전주시 완산구 다가동 운영 계획 운영기간 동안 전주국제영화제 개최 고객들 전주 두껍상회 것 전주점 우리 문화 전주 고유 분위기 외관 인테리어 차별 한옥 모티브 기와 전통 창호문 외관 적용 전통 가구 문양 도자 활용 내부 인테리어 전통미 극대화 무엇 두꺼비 캐릭터 한복 입 모습 눈 전주 두껍상회에서 쏘맥잔 진 한방울잔 두꺼비 키링 등 대표 인기 굿즈 여종 판매 예정 인기 제품만 베스트셀링 도 마련 이외 소맥 자격증 발급 이벤트 럭키박스 판매 등 다양한 거리 준비 시 시 시간 동안 운영 미성년자 출입 제한 이날 종료 광주 두껍상회는 방문객수 만여명 기록 광주에서 접근성 동명동 진행한데 소맥자격증 발급 프로모션 등 인기 입소문 것 분석 하이트진 마케팅실 오성택 상무 진로 테라 전국민 사랑 브랜드 자리매김 소비자 니즈 반영한 마케팅 활동 지속적 말 이정 기자
