time,title,context
2021-04-23,삼성전자 시스템에어컨 美 냉동공조협회 퍼포먼스 어워드' 수상,제공 삼성전자 삼성전자 올해 미국 냉동공조협회 수 퍼포먼스 어워드 를 수상 삼성전자 대형 시스템에어컨 중소형 시스템에어컨 중소형 냉방 전용 시스템에어컨 등 개 제품군 상 일 퍼포먼스 어워드는 제품군 무작위 선정 시스템에어컨 제품들 국제 공 시험소 진행 성능평가 토대 수상업체 선정 년 진행 엄격 사후관리 시험 기준 통과 수 상이 소비자들 신뢰 것 년 출범 단체 전 세계 약 개 에어컨 제조업체 가입 중소형 냉난방 시스템에어컨 맥스 히트 도 가혹 환경 사용 수 한랭지 특화 제품 겨울철 기온 미국 북부 지역 가정 상업시설 겨냥 제품 중소형 냉방 전용 시스템 에어컨 대표 모델 도 로우 앰비언트 외부 온도 도 냉방할 수 네트워크 장비 발생 지속적 냉방 필요 서버룸 등 특수 환경 적합한 제품 삼성전자 이 다양 환경 목적 시스템에어컨 년 미국 시장 매출 성장 지속 최영준 삼성전자 생활가전사업부 상무 시스템에어컨 지속적 연구개발 을 바탕 공신력 의 퍼포먼스 어워드 수상 면 향후 미국 외 다양한 국가 진출 시스템에어컨 비즈니스 확대 것 이 말 이상규 매경닷컴 기자
2021-04-23,삼성전자 美 냉동공조협회 퍼포먼스 어워드' 수상,대형 중소형 시스템에어컨 등 개 제품군 수상 서울경제 삼성전자 올해 미국 냉동공조협회 수 퍼포먼스 어워드 를 수상 기술력 자랑 일 삼성전자 대형 시스템에어컨 중소형 시스템에어컨 중소형 냉방 전용 시스템에어컨 등 개 제품군 삼성전자 퍼포먼스 어워드 수 퍼포먼스 어워드는 제품군 무작위 선정 시스템에어컨 제품들 국제 공 시험소 진행 성능평가 토대 수상업체 선정 년 진행 엄격 사후관리 시험 기준 통과 수 상인 수상기업 수상제품 소비자들 신뢰 것 년 출범 단체 전 세계 약 개 에어컨 제조업체 가입 삼성전자 대형 냉난방 시스템에어컨 온도 범위 온도 제 가능 다양 실내 연결 수 호환성 것 특징 중소형 냉난방 시스템에어컨 맥스 히트 의 가혹 환경 사용 수 한랭지 특화 제품 겨울철 기온 미국 북부 지역 가정 상업시설 겨냥 중소형 냉방 전용 시스템 에어컨 대표 모델 로우 앰비언트 외부 온도 냉방할 수 제품 네트워크 장비 발생 지속적 냉방 필요 서버룸 등 특수 환경 적합 삼성전자 이 다양 환경 목적 시스템에어컨 년 미국 시장 매출 성장 지속 최영준 삼성전자 생활가전사업부 상무 시스템에어컨 지속적 연구개발 을 바탕 공신력 의 퍼포먼스 어워드 수상 면 향후 미국 외 다양한 국가 진출 시스템에어컨 비즈니스 확대 것 이 말 이수민 기자
2021-04-23,삼성 시스템에어컨 美 퍼포먼스 어워드' 수상,미국 냉동공조협회 퍼포먼스 어워드 수상 삼성전자 대형 냉난방 시스템에어컨 파이낸셜뉴스 삼성전자 올해 미국 냉동공조협회 수 퍼포먼스 어워드 를 수상 일 삼성전자 대형 시스템에어컨 중소형 시스템에어컨 중소형 냉방 전용 시스템에어컨 등 개 제품군 상 퍼포먼스 어워드는 제품군 무작위 선정 시스템에어컨 제품들 국제 공 시험소 진행 성능평가 토대 수상업체 선정 년 진행 엄격 사후관리 시험 기준 통과 수상 수 년 출범 단체 전 세계 약 개 에어컨 제조업체 가입 삼성전자 대형 냉난방 시스템에어컨 도 온도 범위 온도 제 가능 다양 실내 연결 수 호환성 것 특징 중소형 냉난방 시스템에어컨 맥스 히트 의 가혹 환경 사용 수 한랭지 특화 제품 겨울철 기온 미국 북부 지역 가정 상업시설 겨냥 제품 중소형 냉방 전용 시스템 에어컨 대표 모델 로우 앰비언트 외부 온도 도 냉방할 수 제품 네트워크 장비 발생 지속적 냉방 필요 서버룸 등 특수 환경 적합한 제품 최영준 삼성전자 생활가전사업부 상무 시스템에어컨 지속적 연구개발 을 바탕 공신력 의 퍼포먼스 어워드 수상 며 향후 미국 외 다양한 국가 진출 시스템에어컨 비지니스 확대 것 이 말 김경민 기자
2021-04-23,삼성 시스템에어컨 3종 美 냉동공조협회 퍼포먼스 어워드' 수상,성능평가 사후관리 시험기준 통 등 소비자 신뢰 이데일리 배진솔 기 삼성전자 올해 미국 냉동공조협회 수 퍼포먼스 어워드 를 수상 미국 냉동공조협회 로부터 퍼포먼스 어워드 수상 삼성 시스템에어컨 퍼포먼스 어워드는 제품군 무작위 선정 시스템에어컨 제품들 국제 공 시험소 진행 성능평가 토대 수상업체 선정 삼성전자 삼성전자 대형 시스템에어컨 중소형 시스템에어컨 중소형 냉방 전용 시스템에어컨 등 개 제품군 미국 의 퍼포먼스 어워드 수상 일 퍼포먼스 어워드는 제품군 무작위 선정 시스템에어컨 제품들 국제 공 시험소 진행 성능평가 토대 수상업체 선정 년 진행 엄격 사후관리 시험 기준 통과 수 상이 소비자들 신뢰 것 년 출범 단체 전 세계 약 개 에어컨 제조업체 가입 삼성전자 대형 냉난방 시스템에어컨 영하 영상 온도 범위 온도 제 가능 다양 실내 연결 수 호환성 것 특징 중소형 냉난방 시스템에어컨 맥스 히트 영하 의 가혹 환경 사용 수 한랭지 특화 제품 겨울철 기온 미국 북부 지역 가정 상업시설 겨냥 제품 중소형 냉방 전용 시스템 에어컨 대표 모델 로우 앰비언트 외부 온도 냉방할 수 제품 네트워크 장비 발생 지속적 냉방 필요 서버룸 등 특수 환경 적합한 제품 삼성전자 이 다양 환경 목적 시스템에어컨 년 미국 시장 매출 성장 지속 최영준 삼성전자 생활가전사업부 상무 시스템에어컨 지속적 연구개발 을 바탕 공신력 의 퍼포먼스 어워드 수상 면 향후 미국 외 다양한 국가 진출 시스템에어컨 비즈니스 확대 것 이 말 삼성전자 미국 퍼포먼스 어워드 수상 시스템 에어컨 삼성전자 배진솔
2021-04-23,삼성 시스템에어컨 美 냉동공조협회 어워드 수상,머니투데이 심재현 기 미국 냉동공조협회 로부터 퍼포먼스 어워드 수상 삼성전자 시스템에어컨 사진제공 삼성전자 삼성전자 올해 미국 냉동공조협회 수 퍼포먼스 어워드 를 수상 일 삼성전자 대형 시스템에어컨 중소형 시스템에어컨 중소형 냉방 전용 시스템에어컨 등 개 제품군 상 퍼포먼스 어워드는 제품군 무작위 선정 시스템에어컨 제품들 국제공인시험소 진행 성능평가 토대 수상업체 선정 년 진행 엄격 사후관리 시험 기준 통과 수 상 점 소비자들 신뢰 년 출범 단체 전 세계 약 개 에어컨 제조업체 회원사 삼성전자 대형 냉난방 시스템에어컨 영하 영상 온도 제 수 다양 실내 연결 수 호환성 중소형 냉난방 시스템에어컨 맥스 히트 영하 의 가혹 환경 사용 수 한랭지 특화 제품 겨울철 기온 미국 북부 지역 가정 상업시설 적합 중소형 냉방 전용 시스템 에어컨 대표 모델 로우 앰비언트 외부 온도 냉방할 수 제품 네트워크 장비 발생 지속적 냉방 필요 서버룸 등 특수 환경 적합한 제품 삼성전자 다양한 환경 목적 시스템에어컨 년 미국 시장 매출 성장 지속 최영준 삼성전자 생활가전사업부 상무 시스템에어컨 지속적 연구개발 바탕 공신력 의 퍼포먼스 어워드 수상 며 앞 미국 외 다양 국가 진출 시스템에어컨 비즈니스 확대 것 이 말 심재현 기자
2021-04-23,삼성 시스템에어컨 美냉동공조협회 어워드 수상,삼성 시스템에어컨 제품 아시아경제 김혜원 기 삼성전자 올해 미국 냉동공조협회 수 퍼포먼스 어워드 를 수상 삼성전자 일 대형 시스템에어컨 중소형 시스템에어컨 중소형 냉방 전용 시스템에어컨 등 개 제품군 상 퍼포먼스 어워드는 제품군 무작위 선정 시스템에어컨 제품 국제 공 시험소 진행 성능평가 토대 수상업체 선정 년 진행 엄격 사후관리 시험 기준 통과 수 상 소비자들 신뢰 것 년 출범 단체 전 세계 약 개 에어컨 제조업체 가입 삼성전자 대형 냉난방 시스템에어컨 범위 온도 제 가능 다양 실내 연결 수 호환성 것 특징 중소형 냉난방 시스템에어컨 맥스 히트 의 가혹 환경 사용 수 한랭지 특화 제품 겨울철 기온 미국 북부 지역 가정 상업시설 겨냥 제품 중소형 냉방 전용 시스템 에어컨 대표 모델 로우 앰비언트 외부 온도 냉방할 수 제품 네트워크 장비 발생 지속적 냉방 필요 서버룸 등 특수 환경 적합 삼성전자 이 다양 환경 목적 시스템에어컨 년 미국 시장 매출 성장 지속 최영준 삼성전자 생활가전사업부 상무 시스템에어컨 지속적 연구개발 을 바탕 공신력 의 퍼포먼스 어워드 수상 면 향후 미국 외 다양한 국가 진출 시스템에어컨 사업 확대 것 이 말 김혜원 기자
2021-04-23,삼성바이오에피스 시밀러 3종 1분기 유럽 매출 2320억…6. 3%↓,머니투데이 김근희 기 기저효과 매출감소 삼성바이오에피스 신사옥 삼성바이오에피스 삼성바이오에피스 자가면역질환 치료용 바이오시밀러 바이오의약품 복제약 종 분기 유럽 매출 억 만달러 약 억원 로 전년 동기 대비 감소 일 삼성바이오에피스 바이오시밀러 유럽 지역 판매 바이오젠 분기 실적발표 베네팔리 임랄디 플릭사비 의 제품 매출 억 만달러 전년 동기 대비 감소 삼성바이오에피스 관계자 지난해 분기 코 로 유럽 병원 도매상 물량 확보 선주문 이 일시적 매출 상승 며 기저효과 것 역성장한 것 라 설명 삼성바이오에피스 자가면역질환 바이오시밀러 종 유럽 안정적 성장 베네팔리 시장점유율 기록 계속 위 유지 임랄디 플릭사비 이상 시장점유율 기록 유럽 종 제품 처방 누적 환자 수 만명 삼성바이오에피스는 처방 실적 기반 글로벌 시장 저변 확대 데이터 경쟁력 확보 삼성바이오에피스 관계자 앞 유럽 자가면역질환 치료제 시장 다양 제품 포트폴리오 활용 고품질 바이오의약품 환자들 제공 수 노력 것 이 말 김근희 기자
2021-04-23,[특징주]SK하이닉스 2.6 하락 13 붕괴 삼성전자 약세,아시아경제 박지환 기 하이닉스 장 반 하락 만원 아래 일 오전 시 분 기준 하이닉스 전 거래 대비 원 원 거래 하이닉스 종가기준 아래 것 월 일 기록 원 이후 약 두달 만 삼성전자 약세 미국 시장 인텔 예상 실적 발표 후 시간 하락 자본이득세 인상 소식 등 필라델피아 반도체 지수 것 영향 분석 전 필라델피아 반도체지수 전 거래 대비 하락 박지환 기자
2021-04-23,특징주 -2 삼성전자·SK하이닉스 ‘뚝’,서울경제 삼성전자 하이닉스 일 장 초반 약세 인텔 당초 시장 예상 실적 주가 하락 자본이득세 인상 방안 등 필라델피아 반도체 지수 것 영향 모습 이날 오전 시 분 하이닉스 전 거래 대비 하락 원 거래 삼성전자 의 낙폭 중 한편 전 필라델피아 반도체지수 전장 대비 하락 바 정부 자본이득세 인상 가능성 언급 인텔 분기 실적 시장 컨센서스 것 주가 정규장 이완기 기자
2021-04-23,1분기 세계 스마트폰 출하량 3억4000만대…삼성 7700만대 1위,삼성 플래그십 중저가 라 탄탄 세계 위 대 사업자 성장세 위 사업자 추격 년 분기 세계 스마트폰 출하량 스트래티지애널리틱스 발표 갈무리 이데일리 이 호 기 삼성전자 년 분기 세계 스마트폰 시장 출하량 기준 선두 일 현지시각 발표 스트래티지애널리틱스 조사 분기 글로벌 스마트폰 출하량 억 만대 중 만대 를 전년동기 대비 증가 삼성전자 플래그십 최고급 라인업 갤럭시 시리즈 중저가대 시리즈 호조 결과 출하량 위 애플 만대 를 점유 세대 통신 지원 아이폰 시리즈 전년동기 대비 성장 출하량 위 샤오미 만대 를 기록 분기 연속 위 전년동기 대비 성장세 눈 덩치 중국 인도 확고 지위 유 가운데 유럽 라인아메리카 아프리카 지역 확장 결실 것 분석 뒤 오포 비보 점유율 비중 로 성장세 분기 상위 개 사업자 전체 출하량 점유율 전년동기 성장 글로벌 반도체 공급 부족 관련해 상위 개 브랜드 중 분기 영향 몇 분기 동안 소규모 공급업체 우려 사항 것 이 예상 이 호
2021-04-23,분양뉴스 삼성반도체 정문 앞 상업용 빌딩 센트,삼성계열사 세메스 층 전체 사용 장기 임대계약 보 억 월 대 대형 병원 년 장기 임대 고덕국제신도시 최대 중심상권 형성 센트 상업시설 앞 삼성반도체 전경 평택 고덕국제신도시 삼성반도체 정문 앞 횡단보도 대 연면적 지하 층 지상 층 신축 빌딩 센트 상업시설 공급 층 근린생활시설 층 대형병원 층 업무시설 구성 중 층 층 전체 삼성계열사 반도체 장비회사 세메스 장기 임대계약 체결 입주 고덕국제신도시 상업시설들 삼성효과 를 중 삼성 출퇴근 동선 집결지 삼성전자 정문 출입구 횡단보도 연결 상업시설 센트리마 최대 수혜지로 급부상하 삼성반도체 비메모리부분 조원 투자 미래성장성 지역 최대 랜드마크 중심상권 것 부동산센터
2021-04-23,기아 1·4분기 실적 컨센서스 하회 삼성,파이낸셜뉴스 삼성증권 일 기아 올해 분기 실적 컨세서스 하회 투자의견 매수 목표주가 만원 유 기아 전날 분기 경영실적 발표 매출 조 억원 영업이익 조 억원 기록 매출 전년 동기 대비 증가 영업이익 임은영 삼성증권 연구원 기아 분기 실적 영업이익 컨센서스 하회 며 기아 이달 월 실적 자신감 회복 근거 전망 이 평가 연구원 기아 분기 초 수요 대응 필요 생산대수 만대 생산 예상 대수 만대 차질 상황 이 설명 연구원 차량용 반도체 부족 월 생산 차질 예상 월 완화 분기 정상화 초과생산 예상 말 강구귀 기자
2021-04-23,기아 1Q 영업益 컨세서스 하회…4월 실적 회복 근거 삼성,이데일리 양희동 기 삼성증권 일 기아 의 올해 분기 실적 컨세서스 하회 이달 가동률 상승 분석 투자의견 매수 목표주가 만원 유 기아 현재 주가 일 종 기준 원 상승여력 기아 전날 분기 경영실적 발표 매출 조 억원 영업이익 조 억원 기록 매출 전년 동기 대비 증가 영업이익 수익성 개선 것 임은영 삼성증권 연구원 기아 분기 실적 영업이익 컨센서스 하회 며 기아 이달 월 실적 자신감 회복 근거 전망 이 평가 기아 제조업 실적 서프라이즈 필요조건 가동률 상승 연구원 기아 분기 초 수요 대응 필요 생산대수 만대 생산 예상 대수 만대 차질 상황 이 월 만대 수준 생산 판매 인센티브 축소 확인 초과수요 유지 자신감 회복 분석 기아 중국 제외 글로벌 도매판매 만대 매출액 증 등 믹스 향상 비중 포인트 로 지속 상승 원 환율 원 감소 내수 만원 수출 달러 등 기아 전분기 대비 매출총이익률 하락 가동률 생산 대 전분기 대비 감소 연구원 누우엔진 리콜 분기 반영 예정 피스톤 오일링 누수문제 북미차량 쏘울 셀토스 대 라 엔진 교체 수리 대응 가능 비용 미미 전망 이 말 이 차량용 반도체 부족 월 생산 차질 예상 월 완화 분기 정상화 초과생산 예상 며 미국시장 기준 일 재고 인센티브 하락 지속 초 수요 근거 분기 인센티브 대당 쏘렌토 카니발 판매호조 추 하락 예상 양희동
2021-04-23,삼성표 플러스 돌풍…출시 일주일 2백 다운로드,머니투데이 박효주 기 모바일 무료 영상 콘텐츠 제공 삼성 플러스 앱 화 삼성전자 삼성전자 모바 온라인동영상서비스 앱 삼성 플러스 출시 주일만 다운로드 기록 폭발적 인기 무료 데 다양 콘텐츠 수 장점 부각 것 일 관련업계 일 출시 삼성 플러스 앱 다운로드 만건 돌파 출시 일주일 기록 다운로드 수 고무적 삼성 플러스 삼성스마트 제공 서비스 인터넷 연결 로 영화 예능 뉴스 스포츠 어린이 등 다양한 콘텐츠 무료 수 채널형 비디오 서비스 년 출시 이후 월 기준 개국 이용 삼성 플러스 모바 앱 생방송 추천 마 등 개 탭 구성 개 채널 스트리밍 방식 언제 시청 가능 수 무료 제공 생방송 뉴스 시리즈 엔터테인먼트 스포츠 영화 음악 어린이 등 장르별 인기 콘텐츠 실시간 수 추천 선별 방송 채널 영화 등 콘텐츠 시청 채널 제공 마 플러스 사용자 등록 채널 시청 예약 채널 시청 중 채널 목록 등 편성표 형태 사용자환경 으 채널선택 시청 용이한 것 장점 이 이용자들 무료 생각 콘텐츠 태블릿 이용 서비스 등 호평 제공 콘텐츠 경험 모바일 확대 것 기 경계 서비스 제공 자사 생태계 사용자 유인 목적 풀이 삼성 플러스 모바 앱 지난해 월 미국 처음 한국 포함 영국 독 인도 등 일 동시 출시 삼성전자 지속해서 서비스 국가 확대 채널 확대 계획 삼성 플러스 서비스 안드로이드 이상 기 대부분 이용 가능 구글 플레이스토어 갤럭시스토어 수 이원진 삼성전자 무선사업부 서비스 팀 부사장 삼성 플러스 모바 앱 다양 콘텐츠 편리 시청 수 플랫폼 이 지속적 콘텐츠 확 갤럭시 사용자 즐거움 것 이 말 박효주 기자
2021-04-23,특징주 -2 삼성전자·SK하이닉스 ‘뚝’,서울경제 삼성전자 하이닉스 일 장 초반 약세 인텔 당초 시장 예상 실적 주가 하락 자본이득세 인상 방안 등 필라델피아 반도체 지수 것 영향 모습 이날 오전 시 분 하이닉스 전 거래 대비 하락 원 거래 삼성전자 의 낙폭 중 한편 전 필라델피아 반도체지수 전장 대비 하락 바 정부 자본이득세 인상 가능성 언급 인텔 분기 실적 시장 컨센서스 것 주가 정규장 이완기 기자
2021-04-23,1분기 세계 스마트폰 출하량 3억4000만대…삼성 7700만대 1위,삼성 플래그십 중저가 라 탄탄 세계 위 대 사업자 성장세 위 사업자 추격 년 분기 세계 스마트폰 출하량 스트래티지애널리틱스 발표 갈무리 이데일리 이 호 기 삼성전자 년 분기 세계 스마트폰 시장 출하량 기준 선두 일 현지시각 발표 스트래티지애널리틱스 조사 분기 글로벌 스마트폰 출하량 억 만대 중 만대 를 전년동기 대비 증가 삼성전자 플래그십 최고급 라인업 갤럭시 시리즈 중저가대 시리즈 호조 결과 출하량 위 애플 만대 를 점유 세대 통신 지원 아이폰 시리즈 전년동기 대비 성장 출하량 위 샤오미 만대 를 기록 분기 연속 위 전년동기 대비 성장세 눈 덩치 중국 인도 확고 지위 유 가운데 유럽 라인아메리카 아프리카 지역 확장 결실 것 분석 뒤 오포 비보 점유율 비중 로 성장세 분기 상위 개 사업자 전체 출하량 점유율 전년동기 성장 글로벌 반도체 공급 부족 관련해 상위 개 브랜드 중 분기 영향 몇 분기 동안 소규모 공급업체 우려 사항 것 이 예상 이 호
2021-04-23,분양뉴스 삼성반도체 정문 앞 상업용 빌딩 센트,삼성계열사 세메스 층 전체 사용 장기 임대계약 보 억 월 대 대형 병원 년 장기 임대 고덕국제신도시 최대 중심상권 형성 센트 상업시설 앞 삼성반도체 전경 평택 고덕국제신도시 삼성반도체 정문 앞 횡단보도 대 연면적 지하 층 지상 층 신축 빌딩 센트 상업시설 공급 층 근린생활시설 층 대형병원 층 업무시설 구성 중 층 층 전체 삼성계열사 반도체 장비회사 세메스 장기 임대계약 체결 입주 고덕국제신도시 상업시설들 삼성효과 를 중 삼성 출퇴근 동선 집결지 삼성전자 정문 출입구 횡단보도 연결 상업시설 센트리마 최대 수혜지로 급부상하 삼성반도체 비메모리부분 조원 투자 미래성장성 지역 최대 랜드마크 중심상권 것 부동산센터
2021-04-23,기아 1·4분기 실적 컨센서스 하회 삼성,파이낸셜뉴스 삼성증권 일 기아 올해 분기 실적 컨세서스 하회 투자의견 매수 목표주가 만원 유 기아 전날 분기 경영실적 발표 매출 조 억원 영업이익 조 억원 기록 매출 전년 동기 대비 증가 영업이익 임은영 삼성증권 연구원 기아 분기 실적 영업이익 컨센서스 하회 며 기아 이달 월 실적 자신감 회복 근거 전망 이 평가 연구원 기아 분기 초 수요 대응 필요 생산대수 만대 생산 예상 대수 만대 차질 상황 이 설명 연구원 차량용 반도체 부족 월 생산 차질 예상 월 완화 분기 정상화 초과생산 예상 말 강구귀 기자
2021-04-23,기아 1Q 영업益 컨세서스 하회…4월 실적 회복 근거 삼성,이데일리 양희동 기 삼성증권 일 기아 의 올해 분기 실적 컨세서스 하회 이달 가동률 상승 분석 투자의견 매수 목표주가 만원 유 기아 현재 주가 일 종 기준 원 상승여력 기아 전날 분기 경영실적 발표 매출 조 억원 영업이익 조 억원 기록 매출 전년 동기 대비 증가 영업이익 수익성 개선 것 임은영 삼성증권 연구원 기아 분기 실적 영업이익 컨센서스 하회 며 기아 이달 월 실적 자신감 회복 근거 전망 이 평가 기아 제조업 실적 서프라이즈 필요조건 가동률 상승 연구원 기아 분기 초 수요 대응 필요 생산대수 만대 생산 예상 대수 만대 차질 상황 이 월 만대 수준 생산 판매 인센티브 축소 확인 초과수요 유지 자신감 회복 분석 기아 중국 제외 글로벌 도매판매 만대 매출액 증 등 믹스 향상 비중 포인트 로 지속 상승 원 환율 원 감소 내수 만원 수출 달러 등 기아 전분기 대비 매출총이익률 하락 가동률 생산 대 전분기 대비 감소 연구원 누우엔진 리콜 분기 반영 예정 피스톤 오일링 누수문제 북미차량 쏘울 셀토스 대 라 엔진 교체 수리 대응 가능 비용 미미 전망 이 말 이 차량용 반도체 부족 월 생산 차질 예상 월 완화 분기 정상화 초과생산 예상 며 미국시장 기준 일 재고 인센티브 하락 지속 초 수요 근거 분기 인센티브 대당 쏘렌토 카니발 판매호조 추 하락 예상 양희동
2021-04-23,삼성표 플러스 돌풍…출시 일주일 2백 다운로드,머니투데이 박효주 기 모바일 무료 영상 콘텐츠 제공 삼성 플러스 앱 화 삼성전자 삼성전자 모바 온라인동영상서비스 앱 삼성 플러스 출시 주일만 다운로드 기록 폭발적 인기 무료 데 다양 콘텐츠 수 장점 부각 것 일 관련업계 일 출시 삼성 플러스 앱 다운로드 만건 돌파 출시 일주일 기록 다운로드 수 고무적 삼성 플러스 삼성스마트 제공 서비스 인터넷 연결 로 영화 예능 뉴스 스포츠 어린이 등 다양한 콘텐츠 무료 수 채널형 비디오 서비스 년 출시 이후 월 기준 개국 이용 삼성 플러스 모바 앱 생방송 추천 마 등 개 탭 구성 개 채널 스트리밍 방식 언제 시청 가능 수 무료 제공 생방송 뉴스 시리즈 엔터테인먼트 스포츠 영화 음악 어린이 등 장르별 인기 콘텐츠 실시간 수 추천 선별 방송 채널 영화 등 콘텐츠 시청 채널 제공 마 플러스 사용자 등록 채널 시청 예약 채널 시청 중 채널 목록 등 편성표 형태 사용자환경 으 채널선택 시청 용이한 것 장점 이 이용자들 무료 생각 콘텐츠 태블릿 이용 서비스 등 호평 제공 콘텐츠 경험 모바일 확대 것 기 경계 서비스 제공 자사 생태계 사용자 유인 목적 풀이 삼성 플러스 모바 앱 지난해 월 미국 처음 한국 포함 영국 독 인도 등 일 동시 출시 삼성전자 지속해서 서비스 국가 확대 채널 확대 계획 삼성 플러스 서비스 안드로이드 이상 기 대부분 이용 가능 구글 플레이스토어 갤럭시스토어 수 이원진 삼성전자 무선사업부 서비스 팀 부사장 삼성 플러스 모바 앱 다양 콘텐츠 편리 시청 수 플랫폼 이 지속적 콘텐츠 확 갤럭시 사용자 즐거움 것 이 말 박효주 기자
