time,title,context
2021-04-23,김기남 삼성전자 부회장 자사주 1만주 매입…총 21만주 보유,아시아경제 박소연 기 삼성전자 김기남 부회장 회사 주식 만주 장내 매수 일 공시 반도체 부문 대표이사 김기남 부회장 일 억 만원 투자 보통주 만주 주당 원 를 부회장 보유 자사 주식 만주 금액 이날 종 원 기준 억원 상당 박소연 기자
2021-04-23,삼성전자 시스템 에어컨 美 냉동공조협회 어워드 수상,삼성전자 회사 시스템 에어컨 제품 올해 미국 냉동공조협회 수 퍼포먼스 어워드 수상 일 시스템 에어컨 대형 건물 등 공급 기업간거래 제품 삼성전자 대형 시스템 에어컨 중소형 시스템 에어컨 중소형 냉방 전용 시스템 에어컨 등 개 제품군 상 퍼포먼스 어워드는 제품군 무작위 선정 시스템 에어컨 제품들 국제 공 시험소 진행 성능평가 선정 삼성전자 관계자 퍼포먼스 어워드 년 진행 엄격 사후관리 시험 기준 통과 수 상이 소비자들 신뢰 것 설명 이번 상 삼성전자 대형 냉난방 시스템 에어컨 영하 도 영상 도 섭씨 온도 범위 제 가능 다양 실내 연결 수 중소형 냉난방 시스템 에어컨 맥스 히트 영하 도 환경 사용 수 한랭지 특화 제품 겨울철 기온 미국 북부 지역 가정 상업시설 겨냥 중소형 냉방 전용 시스템 에어컨 대표 모델 영하 도 로우 앰비언트 외부 온도 영하 도 냉방할 수 제품 네트워크 장비 발생 지속적 냉방 필요 서버룸 등 특수 환경 적합 최영준 삼성전자 생활가전사업부 상무 시스템에어컨 지속적 연구개발 을 바탕 공신력 의 퍼포먼스 어워드 수상 면 향후 미국 외 다양한 국가 진출 시스템에어컨 비즈니스 확대 것 이 말 이종혁 기자
2021-04-23,삼성 시스템에어컨 3종 美 냉동공조협회 퍼포먼스 어워드' 수상,성능평가 사후관리 시험기준 통 등 소비자 신뢰 이데일리 배진솔 기 삼성전자 올해 미국 냉동공조협회 수 퍼포먼스 어워드 를 수상 미국 냉동공조협회 로부터 퍼포먼스 어워드 수상 삼성 시스템에어컨 퍼포먼스 어워드는 제품군 무작위 선정 시스템에어컨 제품들 국제 공 시험소 진행 성능평가 토대 수상업체 선정 삼성전자 삼성전자 대형 시스템에어컨 중소형 시스템에어컨 중소형 냉방 전용 시스템에어컨 등 개 제품군 미국 의 퍼포먼스 어워드 수상 일 퍼포먼스 어워드는 제품군 무작위 선정 시스템에어컨 제품들 국제 공 시험소 진행 성능평가 토대 수상업체 선정 년 진행 엄격 사후관리 시험 기준 통과 수 상이 소비자들 신뢰 것 년 출범 단체 전 세계 약 개 에어컨 제조업체 가입 삼성전자 대형 냉난방 시스템에어컨 영하 영상 온도 범위 온도 제 가능 다양 실내 연결 수 호환성 것 특징 중소형 냉난방 시스템에어컨 맥스 히트 영하 의 가혹 환경 사용 수 한랭지 특화 제품 겨울철 기온 미국 북부 지역 가정 상업시설 겨냥 제품 중소형 냉방 전용 시스템 에어컨 대표 모델 로우 앰비언트 외부 온도 냉방할 수 제품 네트워크 장비 발생 지속적 냉방 필요 서버룸 등 특수 환경 적합한 제품 삼성전자 이 다양 환경 목적 시스템에어컨 년 미국 시장 매출 성장 지속 최영준 삼성전자 생활가전사업부 상무 시스템에어컨 지속적 연구개발 을 바탕 공신력 의 퍼포먼스 어워드 수상 면 향후 미국 외 다양한 국가 진출 시스템에어컨 비즈니스 확대 것 이 말 삼성전자 미국 퍼포먼스 어워드 수상 시스템 에어컨 삼성전자 배진솔
2021-04-23,삼성 시스템에어컨 美 냉동공조협회 어워드 수상,머니투데이 심재현 기 미국 냉동공조협회 로부터 퍼포먼스 어워드 수상 삼성전자 시스템에어컨 사진제공 삼성전자 삼성전자 올해 미국 냉동공조협회 수 퍼포먼스 어워드 를 수상 일 삼성전자 대형 시스템에어컨 중소형 시스템에어컨 중소형 냉방 전용 시스템에어컨 등 개 제품군 상 퍼포먼스 어워드는 제품군 무작위 선정 시스템에어컨 제품들 국제공인시험소 진행 성능평가 토대 수상업체 선정 년 진행 엄격 사후관리 시험 기준 통과 수 상 점 소비자들 신뢰 년 출범 단체 전 세계 약 개 에어컨 제조업체 회원사 삼성전자 대형 냉난방 시스템에어컨 영하 영상 온도 제 수 다양 실내 연결 수 호환성 중소형 냉난방 시스템에어컨 맥스 히트 영하 의 가혹 환경 사용 수 한랭지 특화 제품 겨울철 기온 미국 북부 지역 가정 상업시설 적합 중소형 냉방 전용 시스템 에어컨 대표 모델 로우 앰비언트 외부 온도 냉방할 수 제품 네트워크 장비 발생 지속적 냉방 필요 서버룸 등 특수 환경 적합한 제품 삼성전자 다양한 환경 목적 시스템에어컨 년 미국 시장 매출 성장 지속 최영준 삼성전자 생활가전사업부 상무 시스템에어컨 지속적 연구개발 바탕 공신력 의 퍼포먼스 어워드 수상 며 앞 미국 외 다양 국가 진출 시스템에어컨 비즈니스 확대 것 이 말 심재현 기자
2021-04-23,삼성 시스템에어컨 美냉동공조협회 어워드 수상,삼성 시스템에어컨 제품 아시아경제 김혜원 기 삼성전자 올해 미국 냉동공조협회 수 퍼포먼스 어워드 를 수상 삼성전자 일 대형 시스템에어컨 중소형 시스템에어컨 중소형 냉방 전용 시스템에어컨 등 개 제품군 상 퍼포먼스 어워드는 제품군 무작위 선정 시스템에어컨 제품 국제 공 시험소 진행 성능평가 토대 수상업체 선정 년 진행 엄격 사후관리 시험 기준 통과 수 상 소비자들 신뢰 것 년 출범 단체 전 세계 약 개 에어컨 제조업체 가입 삼성전자 대형 냉난방 시스템에어컨 범위 온도 제 가능 다양 실내 연결 수 호환성 것 특징 중소형 냉난방 시스템에어컨 맥스 히트 의 가혹 환경 사용 수 한랭지 특화 제품 겨울철 기온 미국 북부 지역 가정 상업시설 겨냥 제품 중소형 냉방 전용 시스템 에어컨 대표 모델 로우 앰비언트 외부 온도 냉방할 수 제품 네트워크 장비 발생 지속적 냉방 필요 서버룸 등 특수 환경 적합 삼성전자 이 다양 환경 목적 시스템에어컨 년 미국 시장 매출 성장 지속 최영준 삼성전자 생활가전사업부 상무 시스템에어컨 지속적 연구개발 을 바탕 공신력 의 퍼포먼스 어워드 수상 면 향후 미국 외 다양한 국가 진출 시스템에어컨 사업 확대 것 이 말 김혜원 기자
2021-04-23,삼성전자 대 한 도전 미국서 김치냉장고 출시,베스트바 로우스서 판매 냉장고시장 위 글로벌 김치열풍 가운데 삼성전자 미국 기점 해외 김치냉장고 시장 개척 일 업계 삼성전자 베스트바 로우스 등 미국 대형 유통업체 자사 김치냉장고 제품 판매 시작 그동안 교민들 대상 한 유통채널 소규모 수출 현지 유통업체 미국 소비자 겨냥 판매 시작 것 이번 처음 미국 포함 삼성전자 해외 김치냉장고 정식 출시 것 이번 최초 면역력 강화 효과적 것 김치 코 예방 증상 완화 연구 수출 관세청 분기 김치 수출액 달러 지난해 기간 증가 삼성전자 김치냉장고 김치 보관 외 다목적 활용 국내 소비자들 사용패턴 주목 김치냉장고 국내 다양 식재료 보관 세컨드 냉장고 로 자리매김 보급률 삼성전자 김치냉장고 다용도 냉장고 활용 트렌드 반영해 변질 뿌리채소 열대과일 바나나 모드 보관 곡류 와인 최적 보관 모드 육류 생선 살얼음 상태 신선 보관 육류 생선 모드 육류 숙성 알고리즘 적용 풍미 참맛 육류 모드 등 가지 보관 기능 제품 탑재 재택근무 확대 등 대용량 음식 보관 필요성 점 착안 중간 벽 식재료 박스째 보관 수 와이드 상칸 문 쪽 생수통 수납가능 빅도 가드 음식 냄새 보관 수 메탈쿨링 밀폐존 등 저장기능 강화 삼성전자 다양 부가기능 강조 판매 확대 계획 삼성전자 미국 출시 김치냉장고 제품명 김치 냉장고 로 밖 냉장고 문 위아래 뚜껑형 제품 미국 소비자들 친숙 수납공간 스탠딩형 제품 출시 시장 확대 속도 방침 삼성전자 강화 부가기능 기존 미국 시장 냉장고 인지도 적극 활용해 현지 시장 공략 전략 지난해 월 기준 미국 시장 삼성전자 냉장고 분기 연속 점유율 위 미국 기점 국가 추 진출 검토 박재영 기자
2021-04-23,수척 이재용 삼성전자 부회장 사면론,재계 종교계 일반 단체 요청 한미 정상회담 백신 스와프 기 박범계 법무부 장관 검토 바 파이낸셜뉴스 문재 대통령 지난해 월 일 서울 세종 대한상공회의소 코 대응 경제계 간담회 참석 이재용 삼성전자 부회장 악수 이재용 삼성전자 부회장 요청 확산 삼성전자 부회장 사 건 재계 종교계 기타 단체 등 다음달 한미정상회담 삼성전자 미국 반도체 투자 백신 스와프 부회장 사면론 불 오늘 일 경제계 한국경영자총협회 대한상공회의소 중소기업중앙회 한국무역협회 한국중견기업연합회 등 경제 단체 다음주 부회장 건의서 작성 정부 정식 건의 건의서 우리 경제 글로벌 반도체 시장 경쟁 심화 상황 부회장 부재 한국 경제 부정적 영향 며 대통령 검토 요청 내용 이 대한불교조계종 개 교구 본사 주지들 일 부회장 선처 호소 탄원서 정부 제출 문재 대통령 박병석 국회의장 정세균 당시 국무총리 등 탄원서 부회장 한번 기회 주시길 내용 오규석 부산 기장군수 월 이 이달 일 부회장 사면 요청 호소문 청 뿐 국내 최대 노인단체 대한노인회 코 백신 확보 등 수 특별사면 건의 청와대 국민청원 게시판 올해 건 부회장 건의 정부 여당 신중 입장 관련 박범계 법무부 장관 부회장 가석방 사면 검토 바 이재용 삼성전자 부회장 월 일 오후 서울 서초구 서울고등법원 국정논단 관련 파기환송심 선고 공판 출석 뉴시스 문재 삼성전자 박범계 이재용 한미정상회담 이재용부회장 문재인백신 이재용사 백신스와프 홍창기 기자
2021-04-23,"제이티, 삼성전자 42. 5억원 테스트핸들러 공급계약",이데일리 이은정 기 제이티 삼성전자 억 만원 규모 테스트핸드 공급 계약 일 공시 계약금 지난해 매출액 해당 계약기간 이달 일 일 이은정
2021-04-23,삼성전자 '비스포크 냉장고 색상 등 선택…맞춤형 냉장고 시대,삼성전자 비스포크 냉장고 사진제공 삼성전자 아시아경제 정현진 기 삼성전자 라이프스타일 공간 타입 컬러 소재 기능 선택 수 비스포크 냉장고 를 본격적 맞춤형 냉장고 시대 년형 비스포크 냉장고 옐로우 그리너리 등 가지 제주 에디션 컬러 가지 패널 소비자 색상 선택 수 제품 글로벌 페인트 기업 벤자민 무 협업 컬러 가지 맞춤형 색상 프리즘 를 도입해 소비자 선택 폭 쇼케이스 내부 센터 를 적용해 취향 물 얼음 수 냉장칸 내 멀티 팬트리 단계 온도 설정 수 냉장고 우측 아래칸 단계 온도 변경 가능 맞춤보관실 식재료 신선 보관 수 삼성전자 오프라인 비스포크 냉장고 체험 수 공간 등 마련 하이엔드 편집숍 챕터원 현대백화점 식품 전문 온라인 서비스 현대식품관 투홈 등 브랜드 이색 콜라보레이션 진행 여기 비스포크 냉장고 수 온라인 이벤트 조 비스포크 도 운영 이벤트 비스포크 사용자 사용 소비자 누구 참여 수 삼성 디지털프라자 가지 컬러 패널 나 냉장고 조합 체험 수 비스포크 아틀리에 도 운영 삼성전자 관계자 비스포크 냉장고 신드롬 맞춤형 가전 문화 앞 삼성전자 냉장고 소비자 중심 가전 시대 선도 우리 삶 풍요 가치 말 정현진 기자
2021-04-23,"삼성전자 네오 8K', 퀀텀 최고 수준 명암비·",삼성전자 네오 사진제공 삼성전자 아시아경제 정현진 기 삼성전자 올해 프리미엄 신제품 네오 를 바탕 중심 세계 판매 위 라 기록 년 유 목표 네오 기존 소 대비 분 퀀텀 빛 세밀 컨트롤하 네오 퀀텀 매트릭스 프로 기술 업계 최고 수준 명암비 블랙 디테일 구현 제품 저해상 영상 의 해상도 개선 네오 퀀텀 프로세서 컨텐츠 화질 최적화 세밀 표현 특징 영상 속 사물 소리 무빙 사운드 프로 스피커 사운드 바 사운드 출력 심포니 로 풍성 입체적 사운드 제공 여기 인피니티 스크린 은 화면 테두리 베젤 불과 화 속 영상 집중 수 홈 엔터테인먼트 특화 기능 네오 의 특징 중 화면 최대 개 분리 수 멀티뷰 기능 카메라 연결 운동 영상 내 모습 운동 수 화면 밀림 줄 의 프리싱크 프리미엄 프로 의 게임 모션 구현 모션 터보 기술 적용 고사양 게임 플레이 가능 인풋 랙 최단 시간 단축해 게임 지연 수 대 화 비율 조정해 게임 수 번 액정 잔상 걱정 정현진 기자
2021-04-23,"'8만전자 지쳤다'…기관, 삼성전자 삼성 계열사 환승 株포트",전고점 돌파 코스피 만원 삼성전자 기관 삼성바이오 물산 집중 매수 헤럴드경제 박이담 기 기관투자자들 삼성전자 내다팔고 삼성바이오로직스 삼성물산 등 그룹계열사 집중 매수 삼성전자 주가 개월 만원 선 정체 삼성그룹 프리미엄 안정적 실적 담보 바이오 차전지 건설 등 포트폴리오 편입 분석 일 한국거래소 기관 이달 삼성전자 시장 조 억원 순매도했다 두 번 순매도한 하이닉스 억원 의 배 수치 반도체 초호황 슈퍼바이클 수혜 주가상승 기대감 시장 존재 뚜렷 대형주 부진 장세 삼성전자 매도 것 분석 금융투자업계 삼성전자 전망 메모리반도체 가격상승 분기 실적 상승 모멘텀 것 전망 삼성전자 시가총액 비중 이익 비중 조정 수 분석 이 기관 삼성전자 제외 계열사들 러브콜 을 이달 기관 순매수한 상위 개 기업 중 개 삼성그룹 계열사 삼성바이오로직스 억원 순매수했고 삼성물산 삼성 도 각각 억원 억원 자금 투입 기관 수세 이 기업 주가 양호한 이 삼성바이오로직스 지난달 만원 선 주가 오름세 만원 선 것 중 달반 사 삼성바이오로직스 앞 공장 가동률 증가 실적 증가 것 전망 이동건 신한금융투 연구원 올해 삼성바이오로직스 공장 가동률 지난해 개선 데 하반기 공장 가동 시작 것 이 올해 영업이익 전년 증가 억원 것 이 분석 신함금융투자 삼성바이오로직스 목표주가 만원 제시 삼성물산 주가 월 이후 사업부문 회복세 주가 탄력 전망 김수현 신한금융투 연구원 건설 부문 분기 신규 수주 조원 달 원자재 가격 상승 상사 실적 데 코 타격 패션 부문 성장세 것 이 실적 모멘텀 펀더멘털 관점 지금 투 판단 설명 삼성 두 기업 상대적 주가상승폭 호재 조철희 한국투자증권 연구원 삼성 최근 미국 전기차 스타트업 리비안 과 차전지 공급계약 하반기 미국 공장 증설 투 결정 예상 면 하반기 매출액 본격적 것 이 전망 한국투자증권 삼성 목표주가 만원 제시
2021-04-23,기관 ‘삼성포트폴리오’ 조정 삼성전자 계열사 환승,개월 횡보 기관 조 순매 코스피 상승 반도체 호황 안먹혀 기관 삼성바이오 물산 집중 매수 기관 투자자들 삼성전자 내 삼성바이오로직스 삼성물산 등 그룹 계열사 집중 매수 삼성전자 주가 개월 만원 선 정체 삼성그룹 프리미엄 안정적 실적 담보 바이오 차전지 건설 등 포트폴리오 편입 분석 일 한국거래소 기관 이달 삼성전자 시장 조 억원 순매도했다 두번 순매도한 하이닉스 억원 의 네배 수치 반도체 초호황 슈퍼바이클 수혜 주 상승 기대감 시장 존재 뚜렷 대형주 부진 장세 속 삼성전자 매도 것 분석 금융투자업계 삼성전자 전망 메모리반도체 가격 상승 분기 실적 상승 모멘텀 것 전망 삼성전자 시가총액 비중 이익 비중 조정 수 분석 이 기관 삼성전자 제외 계열사들 러브콜 이달 기관 순매수한 상위 개 기업 중 개 삼성그룹 계열사 삼성바이오로직스 억원 순매수했고 삼성물산 삼성 도 각각 억원 억원 자금 투입 기관 수세 이 기업 주가 이 삼성바이오로직스 지난달 만원선 주가 오름세 만원선 것 중 한달 반 사 삼성바이오로직스 앞 공장 가동률 증가 실적 증가 것 전망 이동건 신한금융투 연구원 올해 삼성바이오로직스 공장 가동률 지난해 개선 데 하반기 공장 가동 시작 것 이 올해 영업이익 전년 증가 억원 것 이 분석 신함금융투자 삼성바이오로직스 목표주가 만원 제시 삼성물산 주가 월 이후 사업부문 회복세 주가 탄력 전망 김수현 신한금융투 연구원 건설부문 분기 신규 수주 조원 달 원자재 가격 상승 상사 실적 데 코 타격 패션 부문 성장세 것 이 실적 모멘텀 펀더멘털 관점 지금 투 판단 설명 삼성 두 기업 상대적 주 상승 폭 호재 조철희 한국투자증권 연구원 삼성 최근 미국 전기차 스타트업 리비안 차전지 공급 계약 하반기 미국 공장 증설 투 결정 예상 면 하반기 매출액 본격적 것 이 전망 한국투자증권 삼성 목표주가 만원 제시 박이담 기자
2021-04-23,사법 굴레 삼성…'잃어버린 10년 우려,이미지출처 연합뉴스 아시아경제 정현진 기 올해 글로벌 반도체 선두 기업 패권 본격화한 가운데 수년째 사법 굴레 삼성전자만 경쟁우위 이재용 삼성전자 부회장 월 국정농단 사건 파기환송심 징역형 구속 수감 데 시작 삼성물산 부당합병 회계부정 의혹 재판 프로포폴 상습 투약 의혹 사법 리스크 발목 투 등 주요 경영상 의사결정 일 서울중앙지법 형사합 부 재판장 박정제 부장판사 자본시장법 상 부정거래행위 시세조종 업무상 배 등 혐의 재판 부회장 삼성 관계 명 첫 공판 진행 검찰 년 삼성물산 제일모직 합병 부회장 경영권 승계 지배력 강화 것 혐의 제기 변호인 측은 당시 합병 경영상 판단 주주들 이익 반박 이날 재판 과정 신경전 검찰 변호인단 증거신청 절차 참고자료 제출 부분 지적하자 변호인단 검찰 프레젠테이션한 모두진술 공소장 내용 다수 지적 다음 공판 내용 증 심문 증거 개시 문제 양측 시간 충돌해 다음달 일 공판 치열 법리 것 예상 재판 재판 마무리 년여 시간 국정농단 사건 사안 복잡 상당한 시간 소요 것 법조계 여기 부회장 프로포폴 불법 투약 의혹 관련해서 추 기소 여부 재계 삼성 사법 리스크 장기화 년 이 평가 목소리 부회장 사면론 힘 한국경영자총협회 등 개 경제단체 다음주 부회장 사면 정부 정식 건의 손경식 경총 회장 부총리 경제단체장 간담회 등 사면론 운 주무부처 장관 박범계 법무부 장관 가석방 등 검토 적 선 그 재계 종교계 정치권 등 여론 부회장 월 일 법정 구속수감 이달 일부 수감 일 업계 관계자 부회장 구속 수감 중 의사결정 것 한계 면 조건부 지정학적 반도체 위기 지속 수 말 정현진 기자
2021-04-23,실적 격차 벌어졌다…뛰어가 인텔·TSMC 삼성,글로벌 반도체 업계 파전 영업익 증 위 등극 인텔 소송비용 제외땐 선방 지난해 이 도 삼성 위 아시아경제 우수연 기 년 슈퍼사이클 당시 글로벌 반도체 업계 위 삼성전자 슈퍼 사이클 시작 분기 경쟁력 리 위 인텔 격차 것 확인 년 위 분기 전년 증가 영업이익 위 자리 것 대비 일 현지시간 인텔 올해 분기 매출 전년비 감소 억달러 영업이익 이상 억 만달러 기록 순이익 감소 억달러 집계 매출 전년 비슷 특허소송 비용 충당금 일회성 비용 이익 것 인텔 설명 발표 삼성전자 분기 잠정 실적 반도체 부문 추정 영업이익 감안 사 원화 환산 영업이익 비교 올해 분기 조 억원 억대만달러 로 영업이익 다음 인텔 조 억원 억 만달러 마지막 삼성 조 억원 추정 으 매출액 기준 종합반도체기업 인텔 삼성전자 우위 실제 수익성 영업이익 성장세 점 주목 필요 분기 기준 영업이익률 인텔 삼성 대 추정 년 슈퍼사이클 당시 삼성 매출액 영업이익 동반 위 기록 호황 년 영업이익 조 억원 억대만달러 로 삼성 조 억원 의 절반 년 양사 영업이익 조원 규모 비슷 년 삼성 시작 올해 분기 인텔 삼성 영업이익 위 달성 파운드 사업 영위 수익성 측면 을 것 기간 삼성 미국 오스틴 공장 가동 중단 손실 떠안아야 인텔 저가 수주 영향 실적 주춤 실적 자신감 바탕 년 조원 공격적 투 계획 인텔 수익성 개선 파운드 재진출 선언 대규모 투 계획 발표 반면 삼성 설비투자 인수합병 계획 지연 이 격차 수 우 우수연 기자
2021-04-23,실적 격차 벌어졌다…뛰어가 인텔·TSMC 삼성,글로벌 반도체 업계 파전 영업익 증 위 등극 인텔 소송비용 제외땐 선방 지난해 이 도 삼성 위 아시아경제 우수연 기 년 슈퍼사이클 당시 글로벌 반도체 업계 위 삼성전자 슈퍼 사이클 시작 분기 경쟁력 리 위 인텔 격차 것 확인 년 위 분기 전년 증가 영업이익 위 자리 것 대비 일 현지시간 인텔 올해 분기 매출 전년비 감소 억달러 영업이익 이상 억 만달러 기록 순이익 감소 억달러 집계 매출 전년 비슷 특허소송 비용 충당금 일회성 비용 이익 것 인텔 설명 발표 삼성전자 분기 잠정 실적 반도체 부문 추정 영업이익 감안 사 원화 환산 영업이익 비교 올해 분기 조 억원 억대만달러 로 영업이익 다음 인텔 조 억원 억 만달러 마지막 삼성 조 억원 추정 으 매출액 기준 종합반도체기업 인텔 삼성전자 우위 실제 수익성 영업이익 성장세 점 주목 필요 분기 기준 영업이익률 인텔 삼성 대 추정 년 슈퍼사이클 당시 삼성 매출액 영업이익 동반 위 기록 호황 년 영업이익 조 억원 억대만달러 로 삼성 조 억원 의 절반 년 양사 영업이익 조원 규모 비슷 년 삼성 시작 올해 분기 인텔 삼성 영업이익 위 달성 파운드 사업 영위 수익성 측면 을 것 기간 삼성 미국 오스틴 공장 가동 중단 손실 떠안아야 인텔 저가 수주 영향 실적 주춤 실적 자신감 바탕 년 조원 공격적 투 계획 인텔 수익성 개선 파운드 재진출 선언 대규모 투 계획 발표 반면 삼성 설비투자 인수합병 계획 지연 이 격차 수 우 우수연 기자
2021-04-23,삼성 시스템에어컨 美 냉동공조협회 어워드 수상,시스템 에어컨 개 제품군 수상 국제기관 성능평가 년 엄격 사후관리 시험 기준 통 미국 냉동공조협회 로부터 퍼포먼스 어워드 수상 삼성 시스템에어컨 제품 삼성전자 제공 헤럴드경제 정세희 기 삼성전자 올해 미국 냉동공조협회 수 퍼포먼스 어워드 를 수상 일 삼성전자 대형 시스템에어컨 중소형 시스템에어컨 중소형 냉방 전용 시스템에어컨 등 개 제품군 상 퍼포먼스 어워드는 제품군 무작위 선정 시스템에어컨 제품들 국제 공 시험소 진행 성능평가 토대 수상업체 선정 년 진행 엄격 사후관리 시험 기준 통과 수 상이 소비자들 신뢰 것 년 출범 단체 전 세계 약 개 에어컨 제조업체 가입 삼성전자 대형 냉난방 시스템에어컨 온도 범위 온도 제 가능 다양 실내 연결 수 호환성 것 특징 중소형 냉난방 시스템에어컨 맥스 히트 의 가혹 환경 사용 수 한랭지 특화 제품 겨울철 기온 미국 북부 지역 가정 상업시설 겨냥 제품 중소형 냉방 전용 시스템 에어컨 대표 모델 로우 앰비언트 외부 온도 냉방할 수 제품 네트워크 장비 발생 지속적 냉방 필요 서버룸 등 특수 환경 적합 삼성전자 이 다양 환경 목적 시스템에어컨 년 미국 시장 매출 성장 지속 최영준 삼성전자 생활가전사업부 상무 시스템에어컨 지속적 연구개발 을 바탕 공신력 의 퍼포먼스 어워드 수상 면 향후 미국 외 다양한 국가 진출 시스템에어컨 비즈니스 확대 것 이 말
