time,title,context
 2021.03.04 13:54,"""네이버 0.1주 삽니다""…소수점",류영준 카카오페이 대표 만원이상 고 분할매수 금융위 안전거래제도 고민 커피 잔 값 국내 주식 거래 수 소수점 거래 관심 전문가들 소수점 거래 소액 우량주 접근 수 이야기 일 한국핀테크산업협회장 류영준 카카오페이 대표 이날 국내 주식 소수점 토론회 소수점 거래 필요성 주장 토론회 이광재 더불어민주당 국회의원 당 유동수 맹성규 의원 공동 개최 류 대표 기조발제 개인투자자들 자산가 포트폴리오 투자가 때문 국내 주식 소수점 매매 대안 제시 말 국내 주식 소수점 거래 형평성 수 설명 소수점 거래 국내 주식 주 주 등 금액 단위 수 것 말 카카오페이증권 등 국내 핀테크 증권업체 관심 사안 해외 주식 대상 소수점 거래 류 대표 가격적 진입 장벽 소수점 거래 개인투자자들 시장 참여 확대 자투리 투자 문화 형성 수 것 이 이날 토론회 국내 주식 소수점 거래 필요 제 개 등 논의 이효섭 자본시장연구원 금융산업실장 국내 주식 소수점 것 도입 주식 의결권 공유 가능 여부 소수 단위 주식 예탁 가능 여부 실시간 소수점 것 청산 관리 여부 소수점 거래 거래량 감당 수 여부 등 장애물 지적 설명 실장 이 대안책 제시 예 주식 의결권 증권사 주 바탕 지분증권 개 발행 해결 가능 이 미국처럼 소수점 주식 투자자 배당 의결권 대리행사 서비스 수 이날 토론회 정부 측은 국내 주식 소수점 거래 고민 사항 해결 변제호 금융위원회 자본시장과장 정부 편리 안전 투자자들 거래 수 지 방법 말 신유경 기자
 2021.03.04 11:46,네이버 멤버십 회원 티빙 방송 무료 본다…CJ 협업 첫 결실,네이버플러스 연간 멤버십 이용시 월 원 티빙 방송 무제한 시청 가능 네이버 멤버십 네이버 제공 네이버 네이버플러스 멤버십 회원들 대상 티빙 방송 무제한 이용권 을 출시 일 앞 네이버 멤버십 회원 티빙 티빙 방송 무제한 이용권 을 콘텐츠 혜택 선택 최신 주문형비디오 를 무제한 수 해당 서비스 수 티빙 최신 드라마 예능 프로그램 포함 약 만여 개 인기작 철인황후 싱어 윤스테 등 티빙 제공 의 최신 콘텐츠 시청 가능 네이버 월 출시 네이버플러스 연간 멤버십 원 을 활용 경우 월 원 혜택 수 네이버 관계자 평소 쇼핑 온라인 동영상 서비스 를 사용자 네이버플러스 멤버십 매력 체감할 수 것 이 티빙 방송 무제한 이용권 은 네이버플러스 멤버십 내 처음 추가 제휴사 서비스 지분 교환 한 콘텐츠 분야 첫 협력 한성숙 네이버 대표 티빙과 협력 네이버플러스 멤버십 회원 수 콘텐츠 혜택 수준 한층 리 며 앞 네이버플러스 멤버십 적립 혜택 특장점 중심 다양 시너지 효과 수 분야 협력 혜택 고도화 지속 것 이 말 조아 한경닷컴 기자
 2021.03.04 11:29,네이버-CJ 혈맹 시너지 첫발…네이버 멤버십 티빙 얹었다 상보,머니투데이 이진욱 기 네이버 혈맹 관계 물꼬 티빙 드라마 예능 프로그램 등 만여 개 이용 한성숙 네이버 대표 지난해 지분 맞교환한 네이버와 혈맹 관계 첫 물꼬 네이버멤버십 서비스 혜택 의 동영상스트리밍서비스 티빙 을 것 네이버 네이버플러스 멤버십 회원 온라인동영상서비스 티빙 방송 무제한 이용권 혜택 제공 일 이날 네이버 멤버십 가입자 티빙 방송 무제한 이용권 을 콘텐츠 혜택 선택 최신 방송 를 무제한 수 월정액 영화 오리지널 콘텐츠 제외 멤버십 수 티빙 최신 드라마 예능 프로그램 포함 약 만여 개 철인황후 싱어 윤스테 등 티빙 제공 의 최신 콘텐츠 수 업계 티빙 네이버멤버십 혜택 포함 것 네이버 첫 협업 사례 평가 네이버 지난해 월 스튜디오 드래곤 각각 억원 대한통운 억원 규모 지분 교환 당시 네이버 티빙 지분투자 참여 네이버 티빙 멤버십 결합상품 방식 협력 진행 바 네이버플러스멤버십 이번 협업 네이버 디지털 콘텐츠 이용 네이버쇼핑 이용자들 멤버십 유입 수 쿠팡 자사 로켓 와우 멤버십 서비스 쿠팡플레이 추가 것 견제 효과 수 업계 티빙 등 계열 방송 채널 의 콘텐츠 수 지난해 월 으로부터 분사 전날 스튜디오 합류 몸집 티빙 동시시청 인원 제한 화질 월 기준 프리미엄 월 원 스탠다드 원 베이직 원 이용권 판매 네이버 멤버십 전용 서비스 출시 기념 이달 일 내달 일 강력한 적립 이벤트 도 실시 멤버십 신규 가입자 중 티빙 서비스 를 혜택 선택 회원 를 최대 만원 네이버페 포인트 수 한성숙 네이버 대표 티빙과 협력 네이버플러스 멤버십 회원 수 콘텐츠 혜택 수준 한층 리 며 앞 네이버플러스 멤버십 협력 혜택 고도화 지속 것 이 이진욱 기자
 2021.03.04 10:30,네이버-CJ 콘텐츠 협업 “月 3900원 멤버십 티빙 본다”,네이버플러스 멤버십 티빙 방송 무제한 이용권 추 아마존프라 쿠팡플레 등 커머스 결합 시너지 파이낸셜뉴스 네이버플러스 멤버십 가입자 온라인 동영상 서비스 티빙 보유 최신 방송 주문형 비디오 를 무제한 수 네이버 월 출시 네이버플러스 연간 멤버십 원 을 활용 월 원 수준 드라마 예능 등 약 만여 개 콘텐츠 무제한 수 것 지난해 월 억원 혈맹 을 네이버 그룹 전자상거래 커머스 를 결합 콘텐츠 구독경제 협업 주목 네이버플러스 멤버십 이미지 네이버 제공 네이버 네이버플러스 멤버십 회원 사용 수 티빙 방송 무제한 이용권 을 출시 일 이 기존 멤버십 콘텐츠 혜택 웹툰 시리즈 쿠키 개 시리즈온 영화 편 무료쿠폰 콘텐츠 체험팩 티빙 서비스 추가 네이버플러스 멤버십 회원 추 요금 티빙 방송 무제한 이용권 혜택 수 일정액 추가 티빙 상품 업그레이드 이용 수 네이버플러스 멤버십 원 추가시 티빙 베이직 이용권 원 추가시 스탠다드 이용권 원 추가시 프리미엄 이용권 전환 수 네이버 측은 티빙 방송 무제한 이용권 멤버십 고도화 외부 협력 가능성 네이버플러스 멤버십 처음 추가 제휴사 서비스 라 평소 쇼핑 를 사용자 네이버플러스 멤버십 매력 체감할 수 것 이 설명 네이버 네이버플러스 멤버십 출시 초 멤버십 회원 사용자 가치 제공 목표 외부제휴 가능성 바 네이버 한성숙 대표 티빙 협력 네이버플러스 멤버십 회원 수 콘텐츠 혜택 수준 한층 리 며 앞 네이버플러스 멤버십 적립 혜택 특장점 중심 다양 시너지 효과 수 분야 협력 혜택 고도화 지속 것 이 강조 티빙 네이버플러스멤버십 김미희 기자
 2021.03.04 10:10,"디닥넥, 네이버 쇼핑라이브 8만8000뷰 돌파 대 자세교정용품",컴퓨터 를 오랫동안 사용 사람 최근 재택근무 활성화 목 자세 건강 적신호 문제 목 상태 시간 점 경우 거북목 시작 목 디스크 수 이 자세교정용품 띠라렉 디닥넥 눈길 월 일 오후 시 분간 진행 디닥넥 네이버 쇼핑 라이브 방송 동시 접속자 뷰 돌파 네이버 쇼핑 라이브 일 내 시청자수 위 월 일 기준 를 기록 대세 자리매김 방송 중 자세교정용품 띠라렉 디닥넥 자석 클립 단계 조절 다이얼 이지클로저 을 착용자 턱 수평 이동 목 자세 자세 교정해 제품 띠라렉 디닥넥 월 롯데홈쇼핑 첫 방송 완판 네이버 쇼핑 영역 생활 건강 부문 위 기록 등 수험생 부모님 친구 선물 주목 브랜드 관계자 최근 회사 출근 일 사람들 재택근무 안전 업무 이행 사람 재택근무 자세 오랫동안 업무 집중 수 점 건강 문제 수 자세 일상생활 것 중요 라 이때 스트레칭 보호대 착용 등 자세 교정 방법 도움 수 라 띠라렉 디닥넥 자세한 정보 디닥넥 홈페이지 확인 가능 디지털콘텐츠국 최은화
 2021.03.04 10:00,"띠라렉 디닥넥, 홈쇼핑 완판 이 네이버 쇼핑라이브 히트",스마트폰뿐 컴퓨터 를 오랫동안 사용 사람 최근 재택근무 활성화 목 자세 건강 적신호 문제 화면 집중 자세 화면 목 상태 시간 점 경우 거북목 시작 경우 목 디스크 수 이 자세교정용품 띠라렉 디닥넥 월 일 오후 시 분간 네이버 쇼핑라이브 방송 진행 주목 이번 디닥넥 네이버 쇼핑 라이브 방송 동시 접속자 뷰 돌파 네이버 쇼핑 라이브 일 내 시청자수 위 월 일 기준 를 기록 대 자세교정용품 확인 방송 중 자세교정용품 띠라렉 디닥넥 자석 클립 단계 조절 다이얼 이지클로저 을 착용자 턱 수평 이동 목 자세 자세 교정 제품 브랜드 관계자 최근 회사 출근 일 사람들 재택근무 안전 업무 이행 사람 재택근무 자세 오랫동안 업무 집중 수 점 건강 문제 수 자세 일상생활 것 중요 라 이때 스트레칭 보호대 착용 등 자세 교정 방법 도움 수 한편 띠라렉 디닥넥 월 롯데홈쇼핑 첫방송 완판 네이버 쇼핑 영역 생활 건강 부문 위 기록 등 수험생 부모님 친구 선물 주목 제품 띠라렉 디닥넥 자세한 정보 디닥넥 홈페이지 확인 가능 한경닷컴 뉴스룸
 2021.03.04 08:41,카카오 이베 수 감당 가능…네이버·쿠팡 강구 것,현대차 카카오뱅크 카카오페이 란 모멘텀 이베 수 모멘텀까지 추 이데일리 이슬기 기 현대차증권 카카오 의 보유 순현금 등 감안 이베이코리아 수 감당 가능 인수시 네이버 쿠팡에 위협적 경쟁자 수 것 평가 김현용 현대차증권 연구원 일 보고서 카카오 작년말 현재 보유 순현금 약 조원 자사주 시 조원 를 포함시 조 억원 최대 조원 시장 추정 이베이코리아 수 감당 가능 수준 이 카카오톡 압도적 플랫폼 우위 측면 인수시 네이버 쿠팡에 위협적 경쟁자 수 것 이 투자의견 매수 목표주가 만원 유 일 투자은행 업계 국내 전자상거래 시장 톱 이베이코리아 매각 주관사 모건스탠리 골드만삭스 이달 중순 예비입찰 일정 잠재 수 후보자들 통보 투자설명서 를 수령 거 카카오 뿐 칼라 파트너스 등 대형 사모펀드들이 것 확인 을 수령 뿐 이 진짜 인수전 참가 지 여부 수 그래픽 이동훈 기 카카오 실제 인수 유통업계 파장 판단 연구원 카카오 인수전 참여 네이버 쿠팡 강구 파장 전망 이 카카오 경우 이베이코리아 인수시 연간 거래액 조원 규모 쿠팡 소폭 상회 네이버 수준 가능 평가 인수의향자 예상 외 흥행 예상 것 문제 연구원 인수의향자 곳 예상 외 흥행 예상 점 가격 측면 부담 요인 작용 가능성 상존 말 인수 현금 인수시 것 설명 연구원 수 이후 지분스왑 활용 전략적 제휴 자사주 재원 것 불가피하 며 카카오 경영진 사업부문별 순위 결정 딜 진행 여부 판가름 것 이 카카오 모멘텀 하나 판단 연구원 올해 카카오뱅크 조원 카카오페이 조원 의 기업공개 월 출범 카카오엔터 년 상장 가능 전망 이 이번 이베이코리아 인수전 참여도 결과 추가적 주 상승여력 이벤트 점 긍정적 이 설명 이슬기
 2021.03.04 08:40,"한투증권 ""네이버, 라인·Z홀딩스 경영 통합 긍정적 목표주가 43만",한국투자증권 일 네이버 일본 자회사 라 과 야후재팬 운영 홀딩스 의 경영 통합 실적 것 예상 판단 투자의견 매수 를 목표주가 만원 유 홀딩스 라인 경영 통합 이후 향후 년 조원 이상 투자 여명 인공지능 기술자 확보 년 매출 조 억원 영업이익 조 억원 달성 방침 정호윤 한국투자증권 연구원 일본 오프라 홍보 광고 전체 광고 시장 이상 면 홀딩스 광고사업부 핵심 전략 인터넷 광고 오프라 광고 확장 데이터 인공지능 을 활용 광고효율성 것 이 말 홀딩스 메신저 특성 활용 오프라 상거래 시장 커머스 생태계 구축 예정 네이버 전자상거래 성공모델 스마트 스토어 도입 핀테크 부문 내년 월 페이페이 라인페이 통합 작업 진행 예정 연구원 일본 디지털화 진행 국가 신종 코로나바이러스 감염증 코 을 계기 디지털화 면 홀딩스 성장 여력 설명 김소희 기자
 2021.03.04 08:12,"네이버, 라인·야후재팬 협업 스마트스토어…시너지 다수-이베스트",머니투데이 구단비 기 네이버 로고 이베스트투자증권 일 네이버 라 야후재팬과 협업 시너지 다수 평가 투자의견 매수 유지 목표주가 만원 상향 성종화 이베스트투자증권 연구원 일 라 야후재팬 경영 통합 완료 며 홀딩스 시가총액 일 조 억원 하루 만 조 억원 설명 홀딩스 가치 평 방식 일본 주식시장 홀딩스 시가총액 지분율 곱 방식 별 산출 상당한 수준 네이버 목표주가 상승요인 발생 며 동사 목표주가 기존 만원 만원 상향 성 연구원 국내 네이버 포털 검색 경쟁력 스마트스토어 중심 커머스 경쟁력 네이버페이 중심 결제 경쟁력 등 생태계 경쟁력 막강 며 일본 라 야후재팬 검색 경쟁력 결제 경쟁력 활용 스마트스토어 모델 도입 수 것 이 설명 이 야후재팬 검색 경쟁력 네이버 스마트스토어 기술 노하우 접목 점 감안 일본시장 스마트스토어 성공 가능성 판단 며 라 야후재팬 한국형 스마트스토어 모델 도입 올해 상반기 중 예정 이 구단비 기자
