time,title,context
2021-03-24,"바이오일레븐 '드시모네', 24일 네이버 쇼핑 라이브 론칭",머니투데이 김건우 기 프로바이오틱스 전문 기업 바이오일레븐 프리미엄 프로바이오틱스 브랜드 드시모네 일 오후 시 네이버 쇼핑 라이브 소비자들 이번 방송 네이버 라이브 커머스 최초 드시모네 브랜드 자리 바이오일레븐 이날 하루 오후 시 시간 동안 네이버 쇼핑 라이브 실시간 방송 드시모네 제품 구매 고객 더블 할 경품 증정 이벤트 실시 이날 네이버 쇼핑 라이브 드시모네 제품 구입 고객 할 혜택 드시모네 스마트스토어 소식 동 시 추 할인 제공 구매고객 전원 휴대 간편한 포켓형 손 소독제 바유 핸드 세니타이저 겔 제공 라이브 방송 중 제품 구매 고객 드시모네 체험팩 랜덤 증정 이 구매 댓글 인증 고객 중 명 추첨 고함량 프로바이오틱스 프리바이오틱스 섭취 수 설계 드시모네 듀얼스틱 장케 를 제공 바이오일레븐 이번 드시모네 네이버 쇼핑 라이브 론칭 기념 방송 중 구매 고객 대상 추첨 실시 오브제 컬렉션 스타일러 등 다이슨 에어랩 스타일러 볼륨 앤 쉐이프 등 만원 상당 백화점 상품권 등 을 경품 제공 자세한 내용 실시간 방송 확인 수 이날 방송 드시모네 공식 인스타그램 페이스북 드시모네에 무엇 이벤트 페이지 고객들 사전 접수 질문 답변 공개 바이오일레븐 드시모네 궁금점 댓글 고객들 중 명 추첨 뿌링클 치킨 콜라 리터 기프티콘 증정 당첨자 발표일 일 바이오일레븐 관계자 이번 드시모네 네이버 쇼핑 라이브 론칭 기념 식약처로부터 국내 최초 유일 장 면역 기능성 인정 드시모네 가성비 구성 가격 준비 며 앞 고객들 실시간 소통 수 다양한 채널 친근 흥미로운 콘텐츠 것 이 말 한편 바이오일레븐 프리미엄 프로바이오틱스 브랜드 드시모네 장 건강 유익 종 유익균 이상적 배합 드시모네 포뮬러 를 원료 드시모네 포뮬러 편 이상 등재 논문 세계적 우수성 안전성 검증 김건우 기자
2021-03-24,[단독]CJ·대한항공·신세계 연결 네이버 멤버십 ‘패밀리’,네이버 년 패밀리 멤버십 도입 예정 일정 인원 멤버십 혜택 공유 수 멤버십 포인트 생태계 초연결 전략 잰걸음 전 국민 수 포인트 동맹 추진 이데일리 이 호 기 네이버 패밀리 멤버십 을 준비 넷플릭스처럼 가족 구성원 네이버플러스 멤버십 혜택 공유 수 방향 검토 중 올해 포인트 제휴처 리 콘텐츠 강화 등 멤버십 생태계 뒤 년 도입 예정 일 업계 네이버 일정 인원 멤버십 혜택 공유 수 패밀리 멤버십 일 네이버 마련 애널리스트 데이 년 패밀리 멤버십 것 이 언급 것 파악 도입 최소 개 분기 이상 시간 구체적 방안 것 네이버 패밀리 멤버십 도입 전 포인트 생태계 확대 잰걸음 분위기 회사 네이버쇼핑 월 만원 미만 구매 사용자들 네이버플러스 멤버십 가입 후 결제한 금액 가입 전 약 증가 최대 적립금 등 각종 혜택 효과 풀이 멤버십 포인트 적립 사용 확대 중소상공 혜택 네이버쇼핑 플랫폼 성장 도모 수 네이버쇼핑 담당 이윤숙 포레스트 대표 애널리스트데이 올해 스마트스토어 거래액 규모 조 거래액 예상 수 것 멤버십 효과 말 네이버 대한항공 신세계 등 국내 유수 기업들 공격적 파트너십 체결 중 초 연결 전략 네이버플러스 멤버십 사용성 전 국민 수 포인트 동맹 을 추진 콘텐츠 강화 전략 가시화 일 티빙 주문형비디오 무제한 이용권 추가 네이버플러스 멤버십 첫 제휴사 혜택 콘텐츠 분야 업계 네이버 네이버플러스 멤버십 최대 강점 적립 혜택 을 중심 대한항공 스카이패스 마 리 신세계 포인트 연동 것 일 네이버페 포인트 플래닛 캐쉬백 상호 호환 시작 관측 힘 이윤숙 대표 네이버플러스 멤버십 다양한 서비스 결합 가능 면 네이버플러스 멤버십 로레알 아모레 협력 신세계 이마트 항공사 여행사 등 고유 멤버십 결합 국내 수 생태계 것 이 공격적 확장 전략 예 한성숙 네이버 대표 애널리스트 데이 멤버십 미래 수 발언 대표 이마트 논의 네이버플러스 멤버십 혜택 오프라인 온라인 연결 다양한 소비자 경험 제공 수 방안 구상 이 호
2021-03-24,"네이버, 5억달러 규모 외화 ‘ESG 채권’ 발행",이데일리 노재웅 기 네이버 억달러 약 억원 규모 년 만기 외화 채권 지속가능 채권 을 연간 금리 발행 일 국내 인터넷 기업 가운데 환경 사회 지배구조 채권 발행 것 네이버 최초 채권 사회적 책 투자 목적 발행 특수목적 채권 친환경 사업 분야 활용 녹색 채권 사회 문제 해결 사용 사회적 채권 두 가지 목적 결합 포괄적 사용 수 지속가능 채권 등 구분 네이버 일 이틀간 개 기관 명 이상 글로벌 기관투자자 대상 투자자 로드쇼 개최 네이버 계획 홍보 이 일 진행 수요예측 모집금액 이상 억달러 약 조 억원 규모 자금 네이버 측은 설명 이 네이버 가산금리 로 축소 데 성공 이 한국 민간기업 발행 년 만기 외화채 사상 가산금리 네이버 이번 지속가능 채권 조달 자금 친환경 프로젝트 사회공헌 프로젝트 중심 경영 강화 활용 예정 친환경 분야 것 축 중 세종 저 데이터센터 분당 저 사옥 에너지 절감 재생 에너지 사용 등 최첨단 친환경 기술 적용 주요 대한통운 탄소 절감 수 친환경 물류 일괄 대행 서비스 친환경 택배박스 제작 추진 중 사회공헌 분야 디지털 활용능력 리터러시 강화 위 대응 지원 중소사업자 창작자 스타트업 상생 양성평등 저소득층 고용 등 중심 진행 예정 박상진 네이버 경영 네이버 다양한 노력들 글로벌 투자자들 투명 적극적 국내 대표 친환경 인터넷 기업 위상 제 것 말 노재웅
2021-03-24,"소프트뱅크벤처스-네이버, 글로벌 스타트업 1800억 투입",시리즈 단계 글로벌 스타트업 투 예정 테크놀로지벤처스 펄어비스 크래프톤 넥슨 자 파이낸셜뉴스 소프트뱅크벤처스 글로벌 인공지능 기술 기업 집중 투자하 약 억 원 억 달러 규모 신규 펀드 퓨처이노베이션펀드 를 조성 일 주요 출자자 네이버 소프트뱅크 테크놀로지벤처스 펄어비스 크래프톤 넥슨이다 연내 차 클로징 펀드 규모 확대 예정 소프트뱅크벤처스 기술 활용 시장 혁신 딥테크 엔터프라이즈 모빌리티 헬스케어 등 분야 글로벌 스타트업 집중 투자 방침 소프트뱅크벤처스 이준표 소프트뱅크벤처스 대표 이번 펀드 시대 글로벌 선 기업들 발굴 계획 이 소프트뱅크 네트워크 활용 글로벌 무대 남 꿈 창업가들 성장 강조 한편 이번 펀드 결성 소프트뱅크벤처스 총 운용자산 약 조 억원 소프트뱅크벤처스 펄어비스 김미희 기자
2021-03-24,"네이버, 포털 쇼핑플랫폼 진화…소상공 판로개척",리빌드 코리아 대구 수제 롱보드 크래프트 네이버 광고 한 장면 제공 네이버 네이버 검색 포털 사업 쇼핑 과감 전환 시도 지난해 사업 부문 광고 비즈니스 플랫폼 정보기술 플랫폼 콘텐츠 서비스 구분 기존 매출 구분 방식 방식 적용 중장기 사업 방향 서치 플랫폼 커머스 핀테크 콘텐츠 클라우드 올해 서치 플랫폼 매출 비중 이하 가능성 네이버 쇼핑 부문 기존 유통업체 협력 역할 흡수 영역 직접적 상품 매입 판매 강점 검색 연계 기존 유통업체들 네이버 물건 수 식 여기 입점하려 기업들 기존 온라인 쇼핑몰 절반 낮 수수료 때문 네이버쇼핑 입점 네이버 쇼핑 중소상공인 상생 도모 중소상공인 장기적 사업 성장 창업 초 사업 안정화 집중 창업 후 초 개월 동안 결제 수수료 매출 연동 수수료 등 집중적 지원 중소상공인 사업 안착하도록 년 프로젝트 꽃 을 중소기업 상생 도모 데이터 기반 구성한 지원 프로그램 이커머스 업계 경쟁적 운영 신규 사업자 지원 프로그램 기준 전망 한성숙 대표 네이버 집중적 수수료 지원책 포함 스타트 올인원 프로그램 발표 이커머스 플랫폼 신규 판매자 수수료 지원 혜택 경쟁적 제공 네이버 수수료 지원 규모 평가 스타트 올인원 신규 온라인 창업자 년 결제 수수료 무료 매출 연동 수수료 개월 무료 제공 경쟁 업체 유사한 정책 비교 때 지원 기간 규모 면 네이버 스타트 올인원 수수료 지원 혜택 판매자 제공 지원 기간 업체 신규 입점한 셀러 지원 프로그램 운영 이커머스 업체 중 티몬 신규 파트너 판매 수수료 정책 지난해 월 신규 파트너사 적용 최대 일 판매 수수료 지원 번가 신규 입점 셀러 대 특별 혜택 프로그램 결제 수수료 포함 고정 수수료 기존 최대 지원책 지원 기간 일 동안 위메프 신규 파트너사 지원 프로그램 도 판매 수수료 개월 지원 쿠팡 지난해 패션 마켓 을 오픈 패션 카테고리 신규 셀러 한해 판매 수수료 지원 프로모션 지원 기간 일 네이버 스타트 올인원 신규 온라인 창업자 결제 수수료 매출 연동 수수료 지원 기간 개월 개월 지원 규모 네이버 스타트 올인원 결제 수수료 개월 네이버 쇼핑 검색 연동 때 판매 수수료 매출 연동 수수료 개월 동안 각각 전액 지원 티몬 위메프 신규 입점 셀러 대상 결제 수수료 제외 판매 수수료 지원 번 결제 수수료 포함 고정 수수료 를 지원 전액 일부 금액 지원 기존 수수료율 를 최대 로 쿠팡 패션 마켓 지원 수수료 결제 수수료 판매 수수료 글로벌 이커머스 업체 신규 판매자 대상 수수료 지원 정책 비교해 네이버 신규 사업자 규모 지원 수 세계 최대 이커머스 플랫폼 중 하나 이베 올해 월 신규 입점 판매자 대상 상품 등록 수수료 무료 프로모션 진행 이베 플랫폼 상품 등록 때 발생 등록 수수료 를 달 동안 지원 프로모션 네이버 스타트 올인원 지원 기간 규모 한성숙 네이버 대표 상생 도모 년 프로젝트 꽃 경험 바탕 창업 초 개월 집중 며 프로그램 초 사업자 지원 플랫폼 이정표 수 운영 말 이동 기자
