time,title,context
2021-05-12,네이버·카카오 등 빅테크 내년 감독분담금,이달 중 금융위 설치법 개정안 입법예고 이데일리 김인경 기 네이버 카카오 등 빅테크들 내년 금융감독원 감독 분담금 일 금융권 금융위원회 이달 중 금감원 감독 분담금 대상 업권 네이버파이낸셜 카카오페이 등 포함 전자금융사업자 부가가치통신망 업자 포함 내용 금융위 설치법 개정안 입법 예 금융위 관계자 전자금융업권 금융감독 수요 감독 분담금 내 자연 변화 라 설명 현행 감독분담금 기준 년 후 개정 이 빅테크 업체 등 분담금 금융영역 신규 감독검사 대상 만큼 개정안 준비 상태 금융위 관계자 감독분담금 감독서비스 내 수수료 성격 이 분담금 납부 필요 지적들 설명 개정안 이달 입법예고 규제심사 법제처 심사 등 내년 공포 예정 금감원 한국핀테크산업협회 감독 분담금 규모 협상 벌 것 금감원 예산안 한 필요 비용 후 중 발행 분담금 한국은행 출연료 기타 수입 수수료 운영 외 수입 등 제외 부분 감독 분담금 금융회사들 금감원 감독 분담금 총액 이 은행 비은행 금융투자사 보험사 등 업권별 분배 이 금융회사 총부채 영업수익 보험료 수입 등 분담 요율 곱 금융회사 돈 올해 금감원 감독분담금 억원 예산 억원 의 수준 김인경
2021-05-12,"루헨스, 13일 라이프필터 ‘네이버 쇼핑라이브’ 진행",루헨스 제공 파이낸셜뉴스 환경가전 전문 기업 원봉 라이프케어 브랜드 루헨스 라이프필터 주요 상품 파격적 혜택 제공 네이버 쇼핑라이브 일 진행 일 루헨스 일 오전 시 루헨스 네이버 스마트스토어 루헨스몰 진행 물물교환 루헨스 를 주제 네이버 쇼핑라이브 진행 각종 수전 체결 사용 가능 루헨스 라이프필터 종 쇼핑라이브 한정 세트 구성 소개 루헨스 최초 라이브 쇼핑 만큼 할 혜택 파격적 루헨스 정수필터 샤워기 비타민 샤워기 주방정수필터 핸디 코브라타입 세면대정수필터 품 경우 최대 할인 동일 원 판매 리필필터 구매 고객 네이버 쇼핑라이브 한정 주방 욕실 녹물타파 세트 구성 공개 예정 루헨스 라이브쇼핑 참여 고객 대상 특별 혜택 마련 방송 중 댓글이벤트 신세계상품권 만원권 제공 방송시 구매 완료 고객 중 명 추첨 신세계상품권 만원권 매 증정 루헨스 관계자 여름 사용량 증대 생활필터 구매 고객 증가 루헨스 라이프 터 제품 소개 고객 혜택 제공 라이브 커머스 방송 준비 라 지출 월 루헨스 라이브 쇼핑 생활필터 상품 실속 구매 기회 되길 말 최용준 기자
2021-05-12,네이버 ‘초대규모 AI’ 공개… ‘NAVER NOW’ 25일 개최,개 발표 세션 구성 네이버 초대규모 의 기술력 비전 공유 행사 당 공식 페이지 네이버 생중계 예정 이데일리 김현아 기 네이버 대표이사 한성숙 일 온라인 개최 네이버 초대규모 모델 공개 업계 트렌드 초대규모 기술 분야 선도 네이버 성과 비전 공유 예정 네이버 기술 서비스 조직 클로바 의 정석근 대표 키노트 기술 패러다임 제시 초대규모 설명 선도하기 노력 다양한 협력 계획 발표 작년 하반기 슈퍼컴퓨터 도입 이후 진행 상황 성 계획 등 공유 개 스피치 세션 개 테크 세션 네이버 초대규모 의 구체적 기능 기대 역할 주요 기반 기술 소개 자리 예정 스피치 세션 모두 로 활용 수 다양한 가능성 공유 뿐 글로벌 리더십 확보 연구 생태계 조성 계획 사용 네이버 학계 설계 윤리 준칙 현실 적용 방식 공유 예정 테크 세션 방대 양 한국어 데이터 학습 과정 검색 인공지능 비 를 비롯한 서비스 적용 원리 등 확인 수 양해각서 를 체결 서울대학교 비롯 다양 학교 기관 협력 진행 앞 연구 방향 국내 생태계 조성 기술 공유 계획도 수 이번 행사 일 시 시 분 온라인 진행 공식 페이지 네이버 를 생중계 행사 공식 페이지 네이버 클로바 채용 협력 문의 수 창구 운영 예정 정석근 네이버 클로바 대표 이번 행사 분야 기술 트렌드 모두 능력 네이버 초대규모 를 소개 자리 라 이 활용 다양 서비스 업계 관계자들 최고 수준 기술 개발 인프라 성장 글로벌 도전 국내외 연구자들 의미 시간 것 이 말 김현
2021-05-12,“나닮 아바타 서울 누빈다”…메타버스 강자 네이버,현실 가상 혼합 메타버스 세계 열풍 대장주격 로블록스 시가총액 조원 돌파 네이버 서비스 기술 바탕 국내 메타버스 강자 도약 제페토 네이버랩스 등 미래 성장 동력 확보 네이버랩스 서울시 모델링 네이버 제공 헤럴드경제 김민지 기 현실 가상 혼합 세계 뜻 메타버스 관심 메타버스 대장주격 미국 게임플랫폼 로블록스 시가총액 조원 국내 네이버 서비스 기술 바탕 메타버스 세계 가상세계 증강현실 아바타 서비스 제페토 현실 세계 가상 세계 구현 디지털트윈 대표적 네이버제트 제페토 인공지능 기술 활용 이용자 사진 기반 아바타 아바타 현실 가상세계 이용자 대리 활동 자신 아바타 아이템 사용자들 소통 수 전세계 제페토 가입자 억 명 달 사용자 중 이상 해외 사용자 이상 네이버제트 제페토 블랙핑크 멤버들 아바타 네이버제트 제공 제페토 글로벌 세대 공략 강화 빅히트엔터테인먼트 엔터테인먼트 엔터테인먼트 등 주요 엔터테인먼트 기업들 투 유치 일 블록체 기반 사용자 제작 게임 샌드박스 네이버제트 협업 대체불가능 토큰 서비스 공동 전개 네이버랩스 기술력 기반 현실 가상세계 구현 디지털트윈 도 메타버스 서비스 중 디지털 트윈 차원 공간 고정밀 매핑 정확 측위 기술 데이터 처리 자동화 기술 등 필요 네이버랩스 해당 분야 우위 방대 데이터 안정적 제공 수 네이버클라우드와 협력 경쟁력 네이버랩스 서울시 모델링 로드레이아웃 네이버 제공 네이버랩스 지난해 항공사진 인공지능 기술 활용 서울시 전역 차원 모델 구축 일 인천시 주관 네이버랩스 참여 확장현실 메타버스 인천 프로젝트 과학기술정보통신부 한국전파진흥협회 추진 메타버스 프로젝트 공모사업 선정 네이버랩스는 프로젝트 공간정보 구축 계획 이 네이버클라우드 스마트시티 사업 등 네이버랩스 주요 기술 활용 차원 공간 기술 수요 공간 디지털화 트렌드 폭 증가 추세 한편 메타버스 각 유형 서로 유형 진화 분석 이승환 소프트웨어정책연구소 책임연구원 로그 메타버스 인간 공간 시간 혁명 메타버스 가지 유형 독립적 발전 상호작용 융 복합 형태 진화 중 이 다양 유형 대응 네이버에 유리 수 업계 관계자 코 장기화 가상세계 플랫폼 컨퍼런스 입학식 진행 등 메타버스 사용성 확대 정부 차원 디지털트윈 사업 적극적 추진 며 다양한 메타버스 영역 기반 기술 사용성 확보 네이버 성장 가능성 말
2021-05-12,"'문피아' 네이버 韓 웹툰·웹소설, 세계",서울경제 나 안팎 카카오 글로벌 지식재산권 확보 전쟁 벌 네이버 국내 최대 규모 웹소설 플랫폼 업체 문피아 수 눈앞 북미 지역 위 웹소설 플랫폼 왓패드 수 네이버 문피아까 경쟁 우위 것 것 관련 업계 분석 일 투자은행 정보기술 업계 네이버 문피아 경영권 수 최대주주 사모펀드 운용사 파트너스 개별 협상 벌 수 대상 파트너스 산 캐피탈 컨소시엄 문피아 창업자 김환철 대표 보유 지분 이번 거래 정통한 관계자 네이버 사실상 우선협상 대상자 선정 매매계약 체결 세부 사안 조정 중 이 말 업계 문피아 기업가치 를 억 원 이상 추정 지난해 회사 연결 기준 매출액 억 원 당기순이익 억 원 기록 네이버 카카오 국내외 시장 선점 경쟁적 인수합병 을 진행 네이버 왓패드 인수하자 카카오 레디시 파스 장군멍군 상황 이번 네이버 카카오 문피아 수 경쟁 승리 마지막 고지 가격 비롯 조건 네이버 우선권 협상 벌 것 네이버 확정 사안 면 신중 모습 문피아 무협 소설 비롯 다양 장르 웹소설 연재 월간 기록 독보적 평균 페이지 뷰 억 회 방문자 수 명 등록 작 수 여 명 네이버 카카오 문피아 등록 회 인기 소설들 기반 잠재력 주목 문피아 를 활용해 드라마 영화 애니메이션 굿즈 등 다양한 콘텐츠 사업 영역 확장 인기 전지적 독자 시점 은 억 뷰 기록 등 폭발적 인기 몰이 네이버 웹툰 론칭하 웹 콘텐츠 싹쓸 약점 보완 네이버 카카오 세 이날 카카오엔터테인먼트 북미 웹툰 플랫폼 파스 웹소설 플랫폼 래디시 인수 네이버 이날 북미 최대 웹소설 플랫폼 왓패드 수 마무리 네이버 카카오 웹소설 웹툰 확보 공 것 두 장르 원소스 멀티유즈 의 핵심 때문 웹소설 영화 드라마 등 영상화 작업 시나리오 작업 수 누구 소설 수 창조적 콘텐츠들 지속적 생산 업계 관계자 웹소설 웹툰 게임 영상화 콘텐츠 창작 연계망 기초 이야기 를 것 웹소설 다음 단계 시각화 웹툰 이 웹소설 웹툰 기반 제작 영화 드라마 등 인기 관심 말 업계 네이버 카카오 이번 수 각각 약점 보완 것 평가 네이버 웹툰 북미 비롯 글로벌 시장 유의미한 성과 네이버 웹툰 개 언어 여 개국 월이용자 명 확보 중 북미 명 지난해 국내외 억 원 거래액 달성 네이버 웹툰 올해 거래액 조 원 겨냥 웹소설 분야 존재감 네이버 웹소설 강점 문피아 수 이유 네이버 월이용자 명 보유 왓패드 인수 세계 최대 웹툰 웹소설 플랫폼 도약 시도 카카오 카카오페이지 국내 웹소설 시장 을 카카오재팬 웹툰 플랫폼 픽코마 일본 성공 카카오 웹툰 웹소설 영미권에서 기 북미 터전 파스 래디시 수 약점 보완 전략 파스 래디시 규모 면 네이버 인수 왓패드 성장세 실제 래디시 지난해 명 매출 억 원 반면 왓패드 지난해 매출 달러 약 억 원 로 배 파스 래디시 지난해 매출 전년 대비 정도 속도 성장 북미 진출 네이버웹툰 카카오엔터 상장 네이버 카카오 미국 증시 기업공개 도 쿠팡 뉴욕 증시 상장 억 약 조 원 의 거금 조달 데 성공하자 네이버 카카오 콘텐츠 자회사 미국 상장 염두 박상진 네이버 최고재무책임자 이진수 카카오엔터테인먼트 대표 지난달 블룸버그통신과 인터뷰 미국 증시 상장 가능성 검토 바 업계 관계자 네이버 카카오 콘텐츠 계열사 투자 미국 투자은행 영업 을 면 월스트리트 웹툰 웹소설 분위기 라 관련 업계 네이버 카카오 현지 스타트업 수 사업 확장 현지 상승 이유 북미 시장 가능성 인정 현지 투자 후 미국 증시 상장해 궁극적 대규모 자금 수혈 전략 것 한성숙 네이버 대표 김준구 네이버웹툰 대표 앨런 라우 왓패드 창업자 북미 테크 콘퍼런스 콜리전 콘퍼런스 등장 네이버 웹툰 왓패드 소개 것 맥락 해석 당시 대표 네이버 웹툰 왓패드 전 세계 스토리텔링 창작자 사용자 플랫폼 이 글로벌 세대들 디지털 기반 콘텐츠 관심 콘텐츠 비즈니스 것 전망 강조 조윤희 기 임세원 기 윤민혁 기자
2021-05-12,"""웹툰·웹소설 글로벌 공략 네이버·카카오 이유 인수전",머니투데이 윤지혜 기 네이버 왓패드 수 마무리 카카오 파스 래디시 동시 수 네이버 카카오 북미 웹툰 웹소설 콘텐츠 시장 각 네이버 카카오 세계 최대 콘텐츠 시장 북미 본격적 네이버 웹소설 플랫폼 왓패드 수 마무리 가운데 카카오엔터테인먼트 북미 웹툰 웹소설 플랫폼 영토 확장 카카오엔터테인먼트 북미 웹소설 사업 대 초반 대표 주목 일 네이버 카카오엔터테인먼트 북미 웹툰 웹소설 플랫폼 수 발표 네이버 한국 미국 등지 경쟁당국 승인 왓패드 수 절차 마무리 네이버 초 억 한화 약 억원 왓패드 지분 를 인수키 바 네이버 네이버웹툰 왓패드 억 만명 월간 사용자 창작자 만명 창작물 억개 보유 콘텐츠 플랫폼 재탄생 네이버 네이버웹툰 수익화 모델 지식재산권 사업 노하우 왓패드 적용 사업모델 고도 예정 웹툰 웹소설 를 활용 원 소스 멀티 유즈 본격적 웹툰 웹소설 바탕 올해 개 영화 드라마 애니메이션 제작 등 다양한 영상화 프로젝트 진행 방침 네이버 콘텐츠 기술 개발 자동 채색 펜선따 로 창작자 작업 효율 인공지능 기반 툰레이더 로 웹툰 불법 복제 유통 방지 네이버웹툰 올해 소프트웨어 개발 엔지니어 부문 채용 시작 올해 세자릿수 개발자 채용 왓패드 개발 마케팅 콘텐츠 등 관련 직원 증원 계획 한성숙 네이버 대표 이번 수 웹툰 왓패드 간 시너지 것 며 네이버 웹툰 왓패드 세대 열광 스토리텔링 플랫폼 기반 글로벌 엔터테인먼트 시장 중요 플레이어 성장 것 이 말 네이버 추격 카카오 북미 웹툰 웹소설 플랫폼 동시 수 카카오엔터테인먼트 파스 래디시 인수 카카오엔터테인먼트 네이버 질세라 카카오엔터테인먼트 북미 웹툰 플랫폼 파스미디어 지분 를 확보한데 이 이달 중 공개매수 웹소설 플랫폼 래디시 를 인수키 파스 래디시 이번 투 과정 억원 억원 기업가치 인정 카카오엔터테인먼트 두 플랫폼 중심 북미 시장 격 진출 글로벌 영향력 강화 방침 파스 년 미국 설립 북미 최초 웹툰 플랫폼 만개 콘텐츠 유통 중 지난해 월 파스 최대주주 카카오엔터테인먼트 북미 진출 지분 를 확보 이진수 카카오엔터테인먼트 대표 지난해 파스 작품 공급 후 거래액 뚜렷 성장 것 북미 시장에대한 자신감 말 래디시 년 미국 뉴욕 설립 웹소설 플랫폼 자체 제작 콘텐츠 래디시 오리지널 인기 지난해 매출 전년 대비 배 이상 증가 억원 기록 왓패드 무료 연재 작품 중심 반면 래디시 매출 유료 콘텐츠 래디시 오리지널 정도 확고 이용자층 보유 평가 카카오엔터테인먼트 글로벌 콘텐츠 사업 년생 이승윤 래디시 대표 김창원 파스 대표 왼쪽 카카오엔터테인먼트 김창원 파스 대표 이승윤 래디시 대표 현재 독립 경영 체제 유 카카오엔터테인먼트 글로벌전략담당 을 북미 경험 바탕 카카오엔터테인먼트 글로벌 사업 전반 관여 예정 점 년생 대표 카카오엔터테인먼트 글로벌 웹소설 사업 점 대표 년 한국인 최초 옥스퍼드대학 토론클럽 옥스퍼드유니언 회장 선출 언론 조명 대학 졸업 후 미디어 스타트업 바 을 창업 미디어 스타트업 확장성 한계 웹소설 눈 대표 한국 기업 최초 구글 인수 테터앤컴퍼 공동대표 출신 이후 구글 일 파스미디어 창업 이진수 카카오엔터테인먼트 대표 미국 확고 리더십 구축 대표 대표 미국은 글로벌 사업 핵심적 역할 것 이 말 이 이번 수 카카오엔터테인먼트 글로벌 콘텐츠 기업 진화 계기 라 글로벌 플랫폼 네트워크 확장 박차 계획 이 강조 윤지혜 기자
