time,title,context
2021-05-18,"[특징주]선익시스템, 현대차·이통3사·네이버·카카오 ‘메타버스’ 동맹",파이낸셜뉴스 현대차 통신 네이버 카카오 등 국내 자동차 통신사 인터넷 기업 등 주요 협회들 참여 메타버스 생태계 조성 소식 선익시스템 강세 메타버스 접속 수 기 주목 제조장비 생산 선익시스템 부각 것 일 오전 시 분 선익시스템 전 거래 대비 원 원 것 중 이날 과학기술정보통신부 경기 판교 문화융합센터 메타버스 얼라이언스 이하 얼라이언스 출범식 개최 얼라이언스 현대차 등 이통 네이버랩스 카카오엔터 등 참여 등 방송사 롯데월드 분당서울대병원 등 명단 이름 유관기관 협회 정보통신산업진흥원 한국전파진흥협회 한국가상증강현실산업협회 등 개 단체 참여 얼라이언스 참여 기업 영역 확장 메타버스 산업 기술 동향 공유 포럼 운영 메타버스 시장 윤리적 문화적 이슈 검토 법제 정비 법제 자문그룹 발족 계획 기업 협업 메타버스 플랫폼 발굴 기획 프로젝트 그룹 운영 선익시스템 메타버스 관련주 중 대장주 디스플레이 증착 장비 제조업체 주요 매출처 삼성디스플레이 덕산네오룩스 두산솔루스 등 초 산업통상자원부 소부장 으뜸기업 으 선정 년 동안 정부 기술개발지원 예정 김민기 기자
2021-05-18,현대차·이통3사·네이버·카카오 ‘메타버스’ 동맹,메타버스 얼라이언스 격 출범 자동차 통신사 인터넷기업 방송사 참여 기술 공유 포럼 법제 자문 그룹 운영 기업 메타버스 공동 플랫폼 발굴 기획 초점 현대차 억원 투자 구축 가상현실 기반 버추얼 개발 프로세스 세계 최대 품평장 디지털 디자인팀 직원들 공간 회의하 모습 현대차 제공 헤럴드경제 정태 기 현대차 통신 네이버 카카오 등 국내 자동차 통신사 인터넷 기업 등 주요 협회들 참여 메타버스 생태계 조성 메타버스 미래 핵심 성장 동력 급부상 가운데 국내 대표 기업들 프로젝트 발굴 초대형 시장 주목 과학기술정보통신부 일 경기 판교 문화융합센터 메타버스 얼라이언스 이하 얼라이언스 출범식 개최 메타버스 현실 세계 의미 유니버스 가공 추상 의미 메타 의 합성어 차원 가상세계 뜻 관련 기사 면 얼라이언스 현대차 등 이통 네이버랩스 카카오엔터 등 참여 여기 등 방송사 롯데월드 분당서울대병원 등 명단 이름 유관기관 협회 정보통신산업진흥원 한국전파진흥협회 한국가상증강현실산업협회 등 개 단체 참여 텔레콤 혼합 현실 플랫폼 점프스튜디오 댄서 리아킴 공연 텔레콤 제공 얼라이언스 참여 기업 영역 확장 메타버스 산업 기술 동향 공유 포럼 운영 메타버스 시장 윤리적 문화적 이슈 검토 법제 정비 법제 자문그룹 발족 계획 기업 협업 메타버스 플랫폼 발굴 기획 프로젝트 그룹 운영 민간 중심 얼라이언스 활동 추진 예정 정부 다양한 지원 방안 모색 이날 과기정통부 현실 가상 메타버스 생태계 활성화 다양 기업 참여 데이터 축적 활용 서비스 개발 개방형 메타버스 플랫폼 구축 지원 역점 현재 기업들 메타버스 관련 기술 시장 투 이번 얼라이언스 시너지 효과 창출 이목 집중 실제 현대차 억원 세계 최대 가상현실 품평장 구축 가상 공간 자동차 디자인 수행 텔레콤 혼합현실 기반 점프 플랫폼 운영 중 올해 사용자 확보 목표 북미 앱마켓까지 진출 네이버 메타버스 플랫폼 제페토 전 세계 사용자 억명 기반 글로벌 확장 가속화 네이버 년 신규 입사 입문 프로그램 증강현실 서비스 제페토 활용 진행 네이버 신입사원 아바타 이용 네이버 사옥 방문 모습 네이버 제공 출범식 현재 문화융합센터 메타버스 전문기업 개발자 육성 지원 인프라 활용 메타버스 허브 도 문 가상융합경제 대 주력 산업 제조 의료 건설 교육 유통 국방 등 가상융합서비스 제작 테스트 지원 메타버스 서비스 테스트 시연 상용화 지원 세대 가상융합서비스 오픈랩 가상영상 실감음향 스튜디오 운영
2021-05-18,동 문 옷가게 '풀필먼트'···네이버×브랜디×산업은행,디지털 혁신 플랫폼 공동 투 소상공 판매 글로벌 진출 물류센터 자동화 지원 한성숙 왼쪽 네이버 대표 서정민 브랜디 대표 이동걸 산업은행 회장 일 서울 중구 브랜디 동 문 풀필먼트 센터 동 문 패션 디지털화 글로벌 진출 업무 협약 을 체결 뒤 기념 촬영 제공 네이버 서울경제 네이버 브랜디 산업은행 동 문 패션 산업 디지털 혁신 동 문 패션 중소상공 들 안정적 상품 판매 수 풀필먼트 시스템 구축 이 글로벌 진출 지원 패션 크로스보 커머스 전자상거래 확장 모색 전략 네이버 브랜디 일 서울 중구 브랜디 동 문 풀필먼트 센터 동 문 패션 산업 디지털 혁신 플랫폼 풀필먼트 시스템 구축 전략적 제휴 체결 일 이날 네이버 산업은행 국내 혁신 스타트업 지속성장 공동 투 지원 업무 협약 을 체결 호 투 기업 브랜디 선정 네이버 산업은행 지난해 월 월 브랜디 억 원 투자 바 이번 업무협약 동 문 패션 시장 물류 디지털 전환 공동 투 지원 네이버 동 문 패션 들 물류 고민 판매 마케팅 집중 수 동 문 물류 스타트업 제휴 강화 산업은행 관련 운영 자금 투자 지원 들 다양 풀필먼트 수요 해결 수 관련 금융 지원 강화 커머스 시장 진입 장벽 계획 협력 체계 바탕 네이버 브랜디 동 문 풀필먼트 시스템 대대적 확대 데이터 수요예측 기술 등 고도화해 동 문 스마트 물류 근간 강화 브랜디 국내 최초 동 문 패션시장 거점 마련 평 규모 풀필먼트 센터 올해 여 평 규모 확장 여기 동 문 기반 풀필먼트 통합 관리 시스템 을 적용해 커머스 플랫폼들 데이터 연동 물류 자동화 시스템 강화 이 월 건 물동량 이상 목표 네이버 브랜디 동 문 패션 들 스마트스토어 플랫폼 입점 일본 등 글로벌 시장 판 개척 지원 동 문 패션 들 상품 일본 스마트스토어 연결 야후재팬 라 기반 일본 소비자 판매 것 브랜디 관계자 네이버 브랜디 추진 동 문 풀필먼트 시스템 정착 주문 상품 정확 출고일 발송일 확인 수 며 이 신뢰도 중요 글로벌 판매 핵심적 요소 글로벌 커머스 시장 주문 처리 가능 첫 단계 것 이 설명 이 브랜디 동 문 패션 들 디지털 혁신 지원 커머스 운영 체계 브랜드 성장 수 적극적 지원 패션 창업 서비스 헬피 대상자 인플루언서 쇼핑몰 운영자 일반 예비 창업자 확장 도소매 상인 연결 플랫폼 셀피 를 연내 정식 계획 이윤숙 네이버 포레스트 대표 네이버 브랜디 협업 기존 동 문 판매자들 물류 고민 부담 상품 기획 판매 집중 성장 지원 목적 시작 며 동 문 패션 들 다양한 개성 네이버 스마트스토어 소비자 글로벌 진출로 수 노력 말 서정민 브랜디 대표 소상공 들 커머스 플랫폼 진입 장벽 동 문 생태계 활성화 수 동 문 맞춤형 풀필먼트 시스템 확대 고도화 전력 며 네이버 한국의 동 문 패션 클러스터 패션 글로벌 경쟁력 해외 소비자들 경험 수 판 개척 노력 백주원 기자
2021-05-18,“동대문 글로벌화” 비전 브랜디 네이버,동대문산업 디지털 혁신 플랫폼 풀필먼트 시스템 구축 네이버 스마트스토어 입점 글로벌 판 개척 지원 브랜디 동 문 풀필먼트시스템 확대해 윈 윈 추구 이데일리 윤정훈 기 커머스 플랫폼 기업 브랜디 네이버 동 문 패션 산업 디지털 혁신 플랫폼 풀필먼트 시스템 구축 전략적 제휴 일 체결 이윤숙 좌 네이버 포레스트 대표 서정민 브랜디 대표 동 문 디지털 혁신 플랫폼 풀필먼트 시스템 구축 전략적 제휴 체결 브랜디 이번 제휴 동 문 패션 도소매 소상공 들 디지털 트랜스포메이션 확대 동 문 패션 경쟁력 강화 글로벌 시장 판로 개척 수 지원 추진 네이버 동 문 패션 소상공 들 스마트스토어 플랫폼 입점 일본 시장 등 글로벌 시장 판 개척 사업 확장 지원 동 문 패션 소상공인 사업 브랜드 성장 수 브랜드 인큐베이팅 진행 예정 네이버 브랜디 추진 동 문 풀필먼트 시스템 구축 정착 도매상 재고 상품 디지털 관리 수 이 기반 주문 상품 정확 출고일 발송 확인 가능 이 신뢰도 중요 글로벌 판매 핵심적 요소 글로벌 이커머스 시장 주문 처리 가능 첫 단계 완성 것 수 이후 네이버 활동 동 문 패션 판매자들 감각적 상품들 일본 스마트스토어 연결 야후재팬 라 기반 일본 소비자 판매 수 계획 브랜디 네이버 이번 협력 동 문 풀필먼트 시스템 대대적 확대 데이터 수요예측 기술 등 고도화 동 문 패션 글로벌 진출로 확대 수 동 문 스마트 물류 근간 강화 브랜디 국내 최초 동 문 패션시장 거점 오픈 평 규모 차 풀필먼트센터 올해 차 풀필먼트 센터 구축 여평 규모 확장 여기 국내 최초 개발 동 문 기반 풀필먼트 통합 관리 시스템 를 적용해 이커머스 플랫폼 데이터 연동 물류 자동화 등 시스템 고도화 월 만건 물동량 이상 동 문 도소매 소상공 들 이용 가능 규모 확대 브랜디 네이버 진행 전략적 제휴 도소매 소상공 들 디지털 트랜스포메이션 이커머스 운영 체계 브랜드 성장 수 적극적 지원 브랜디 패션창업 서비스 헬피 도 대상자 인플루언서 쇼핑몰 운영자 일반 예비창업자 확장 여기 도 소매 상인 연결 플랫폼 셀피 를 연내 정식 론칭해 동 문 도매상 들 이커머스 진입 수 기반 구축 브랜디 지난해 월 네이버로부터 억원 규모 단독 투자 것 이 월 산업은행 억원 투자 유치해 누적 투자액 억원 달성 서정민 브랜디 대표 소상공 들 이커머스 플랫폼 진입 장벽 동 문 생태계 활성화 수 동 문 맞춤형 풀필먼트 시스템 확대 고도화 전력 며 네이버 한국의 동 문 패션 클러스터 패션 글로벌 경쟁력 해외 소비자들 경험 수 판 개척 노력 말 윤정훈
2021-05-18,동 문 옷가게 풀필먼트를…브랜디·네이버 맞손,네이버 억 투 브랜디 네이버 동 문 패션 글로벌 진출 가속화 일본 스마트스토어 연결 야후재팬 라 기반 일본 소비자 판매 이데일리 김현아 기 네이버 포레스트 이윤숙 대표 좌 브랜디 서정민 대표 우 동 문 디지털 혁신 플랫폼 풀필먼트 시스템 구축 전략적 제휴 체결 지난해 월 네이버 로부터 억원 규모 단독 투자 브랜디 네이버 동 문 패션 글로벌 진출 가속 브랜디 네이버 이 월 산업은행 억원 투자 유치해 누적 투자액 억원 달성 바 브랜디 대표 서정민 네이버 동 문 패션 산업 디지털 혁신 플랫폼 풀필먼트 시스템 구축 전략적 제휴 일 체결 동 문 패션 도소매 소상공 들 디지털 트랜스포메이션 확대 글로벌 시장 판로 개척 수 지원 추진 네이버 동 문 패션 소상공 들 스마트스토어 플랫폼 입점 일본 시장 등 글로벌 시장 판 개척 사업 확장 지원 동 문 패션 소상공 들 사업 브랜드 성장 수 브랜드 인큐베이팅 진행 예정 네이버 브랜디 추진 동 문 풀필먼트 시스템 구축 정착 도매상 재고 상품 디지털 관리 수 이 기반 주문 상품 정확 출고일 발송 확인 가능 신뢰도 중요 글로벌 판매 핵심적 요소 글로벌 이커머스 시장 주문 처리 가능 첫 단계 완성 것 수 야후재팬 라 기반 일본 소비자 판매 이후 네이버 활동 동 문 패션 판매자들 감각적 상품들 일본 스마트스토어 연결 야후재팬 라 기반 일본 소비자 판매 수 계획 브랜디 네이버 이번 협력 동 문 풀필먼트 시스템 대대적 확대 데이터 수요예측 기술 등 고도화 동 문 패션 글로벌 진출로 확대 수 동 문 스마트 물류 근간 강화 동 문 패션시장 풀필먼트센터 오픈 브랜디 국내 최초 동 문 패션시장 거점 오픈 평 규모 차 풀필먼트센터 올해 차 풀필먼트 센터 구축 여평 규모 확장 여기 동 문 기반 풀필먼트 통합 관리 시스템 를 적용해 이커머스 플랫폼 데이터 연동 물류 자동화 등 시스템 고도화 월 만건 물동량 이상 동 문 도소매 소상공 들 이용 가능 규모 확대 브랜디 도소매 소상공 들 디지털 트랜스포메이션 이커머스 운영 체계 브랜드 성장 수 적극적 지원 브랜디 패션창업 서비스 헬피 도 대상자 인플루언서 쇼핑몰 운영자 일반 예비창업자 확장 도 소매 상인 연결 플랫폼 셀피 를 연내 정식 론칭해 동 문 도매상 들 이커머스 진입 수 기반 구축 브랜디 서정민 대표 소상공 들 이커머스 플랫폼 진입 장벽 동 문 생태계 활성화 수 동 문 맞춤형 풀필먼트 시스템 확대 고도화 전력 네이버 패션 글로벌 경쟁력 해외 소비자들 경험 수 판 개척 노력 네이버 포레스트 이윤숙 대표 네이버 브랜디 협업 기존 동 문 판매자들 물류 고민 부담 상품 기획 판매 집중 성장 지원 목적 시작 동 문 패션 들 다양한 개성 네이버 스마트스토어 소비자 글로벌 진출로 수 노력 말 김현
2021-05-18,"아기 물티슈 베베숲, 18일 네이버 쇼핑라이브 진행",미아방지 에디션 최대 혜택 서울경제 영유아 브랜드 베베숲 일 오전 시 시간동안 미아방지 캠페인 기념 네이버 쇼핑 라이브 진행 베베숲 경찰청 년 진행 미아방지 캠페인 은 베베숲 사회공헌 활동인 프로젝트 의 일환 마련 것 미아 발생 시 방법 아이 수 지문 등 사전등록제 의 참여 독려 이번 라이브 방송 미아방지 에디션 메인 라이브 한정 타임세일 경품 증정 이벤트 샘플 키트 구매 인증 이벤트 등 가지 다채로운 혜택들 예정 방송 미아방지 캠페인 적용 제품 센시티브 물티슈 프리미어 물티슈 최대 할인 가격 수 라이브 시간 동안 전 라 휴대 슬림 물티슈 대상 한정수량 타임세일 진행 카밍 물티슈 팩 구매 고객 전원 카밍 휴대 물티슈 박스 증정 야외활동 필수품 모 기피제 버그프리 도 하나 구매 시 하나 추 증정 이벤트 진행 라이브 단독 혜택 미아방지 에디션 종 핸드워시 손소독제 버그프리 등 구성 세이프 키트 를 한정수량 원 수 방송 중 구매 인증 하트 달성 시 추첨 푸짐 경품 증정 예정 베베숲 홍승재 미아발생 것 수 월 가정 달 사전 지문 등록 을 적극적 참여 독려 미아방지 캠페인 기념 라이브 준비 면 소중 우리 아이들 전 시작 캠페인 동참해주시길 혜택 이벤트들 라이브 시청 한편 아기 물티슈 전문 기업 베베숲 전세계 최대 규모 전문 리서치 기업 칸타월드 패널 년 아기 물티슈 국내 판매 위 공식 인증 데 이 닐슨 코리아 년 물티슈 시장데이터 분석 결과 아기 물티슈 시장 점유율 위 등 년 연속 국내 판매 위 자리 대한민국 부모님들 한 사랑 년 아기피부연구소 안전 제품 연구 개발해 베베숲 제품력 안전성 바탕 각종 소비자 브랜드 선호도 조사 위 아기 물티슈 시장 신뢰도 김동호기자
