time,title,context
2021-02-09,전병성 기업은행 디지털그룹 부행장 올해 네이버 등 빅테크 연계···,은행 플랫폼 전쟁 끝 기업은행 디지털 금융 궁극적 목적 편리 고객 서비스 구현 전병성 기업은행 디지털그룹 부행장 모습 제공 기업은행 서울경제 전병성 기업은행 디지털그룹 부행장 올해 네이버 빅테크 핀테크 연계 금융 유통 교육 문화 등 분야 다양 융복합 상품 서비스 것 이 전 부행장 서울경제와 인터뷰 궁극적 고객 편리 금융 을 제공 것 이 말 디지털 정보기술 기업들 밀집 판교 테크노밸리 구 디지털단지 담당 본부장 역임 디지털 기업 특성 전 부행장 혁신 기업 융복합 강조 전 부행장은 기업은행 디지털 혁신 기술 아이디어 보유 핀테크 협업 기반 퍼스트 랩 을 운영 며 이 토대 인공지능 부동산 자동 심사 서비스 개발해 심사 시간 분 분 소개 그 올해 퍼스트 랩 고객 동 광고성 문자메시지 발송 제한 문자메시지 사전 검증 시스템 등 다양한 금융 혁신 사업 추진 계획 이 말 전 부행장 핀테크 포함 외부 연계 강화 오픈 응용프로그램인터페이스 플랫폼 고도화 진행 며 은행 다양한 금융 기능 개방 네이버 등 제휴 온오프라 연계 서비스 융복합 서비스 상품 출시 것 이 예 이 내부 소통 원활해 전 부행장 디지털 를 대외적 완성 것 중요 내부 환경 중요 며 직급 자유 직원들 소통 수 환경 조성 계획 이 말 그 디지털 혁신 가속화 직원들 상상력 아이디어 자유 소통 때 것 이 환경 조성 올해 금융시장 선도 디지털 를 구현 수 것 이 이태규 기자
2021-02-09,네이버·카카오페이 쇼핑 때 온라인 소액 후불결제 가능,금융위 혁신 금융서비스 지원 후불결제 한 만원 유력 상반기 안 네이버페이 카카오페이 등 만원 정도 외상 물건 구입 수 금융위원회 일 저 차 디지털금융 협의회 네이버 카카오 등 빅테크 대형 정보기술 업체 제공 온라인 쇼핑 플랫폼 소액후불결제 허용 결정 도규상 금융위 부위원장 핀테크 플랫폼들 디지털금융 혁신 사업 수 과감 규제 개선 주문해 며 플랫폼 소액후불결제 등 혁신적 금융 서비스 출시 수 적극 지원 말 지금 네이버 등 물건 때 선불 방식 허용 현금 안 소비 방식 정부 지난해 월 디지털금융 종합혁신방안 네이버페 등 만원 소액후불결제 가능 발표 신용카드업계 반발 진행 소액 빅테크들 신용카드업 진출 물꼬 것 때문 카드사들 신용평가 외상 거래 허용해서 주장 금융위 쇼핑 플랫폼 후불결제 수 두 가지 방안 내놨다 전자금융법 개정 필요 사안 일정 기간 동안 규제 유예 규제 샌드박스 를 서비스 허가 금융위 이달 안 혁신금융심사위원회 후불결제 허용 계획 신용평가 지적 네이버 카카오 등 보유 금융 데이터 바탕 자체 평가 금융위 사회 초년생 주부 등 금융거래 기록 금융취약계층 후불결제 서비스 이용 수 것 후불결제 한 만원 유력 구체적 금액 혁신금융심사위원회 결정 업계 상반기 플랫폼 소액후불결제 가능 것 예상 박종서 기자
2021-02-09,"네이버페이 외상 것 되나요…""30만원까지",상반기 소액후불결제 허용 상반기 안 네이버페이 카카오페이 등 만원 정도 외상 물건 구입 수 금융위원회 일 저 차 디지털금융 협의회 네이버 카카오 등 빅테크 대형 정보기술 업체 제공 온라인 쇼핑 플랫폼 소액후불결제 허용 결정 도규상 금융위 부위원장 핀테크 플랫폼들 디지털금융 혁신 사업 수 과감 규제개선 주문해 며 플랫폼 소액후불결제 등 혁신적 금융 서비스 출시 수 적극 지원 말 지금 네이버 등 물건 때 선불방식 허용 현금 안 소비 방식 정부 지난해 월 디지털금융 종합혁신방안 네이버페 등 만원 소액후불결제 가능 발표 신용카드업계 반발 진행 소액 빅테크들 신용카드업 진출 물꼬 것 때문 카드사들 신용평가 외상 거래 허용해서 주장 금융위 쇼핑 플랫폼 후불결제 두 가지 방안 내놨다 전자금융법 개정 필요 사안 일정 기간 동안 규제 유예 규제 샌드박스 를 서비스 허가 금융위 이달 안 혁신금융심사위원회 후불결제 허용 계획 신용평가 지적 네이버 카카오 등 보유 금융 데이터 바탕 자체 평가 금융위 사회 초년생 주부 등 금융거래 기록 금융취약계층 후불결제 서비스 이용 수 것 후불결제 한 만원 유력 구체적 금액 혁신금융심사위원회 결정 업계 상반기 플랫폼 소액후불결제 가능 것 예상 금융위 예금보험공사 월 일 시행 착오송금 반환제도 대상 은행 토스 카카오페이 등 선불전자지급 수단 포함 착오송금 반환제도 송금자 실수 엉뚱 계좌 돈 예보 대 수취인 제도 토스 카카오페이 경우 예보 수취 이름 주민등록번호 파악 수 때 가능 연락처 송금 회원 송금 등 반환 지원 제한 수 박종서 기자
2021-02-09,사회 초년생·주부 네이버·카카오 후불결제,속도내 포용금융 저 차 디지털금융협의회 금융 데이터 이용 가능 핀테크 오픈뱅킹 일괄등록 허용 서울경제 앞 사회 초년생 주부 등 신용도 상대적 금융 취약 계층 비 금융 데이터 바탕 후불결제 서비 이용 수 핀테크 애플리케이션 일일 계좌 입력 오픈뱅킹 이용 수 금융위원회 금융감독원 일 저 차 디지털금융협의회 내용 제 개 과제 논의 금융 당국 핀테크 금융 기술 빅테크 대형 정보통신 기업 등 건의 과제 거 중 거 을 수용 개선 당국 플랫폼 소액 후불결제 서비스 허용 관련 법 개정 전 네이버페이 카카오페이 등 간편결제 업체 소비자 보호 등 충분한 요건 금융 규제 샌드박스 규제 유예제도 심사 등 후불 서비스 등 개시 수 것 네이버파이낸셜 후불결제 서비스 신청 후 최종 승인 혁신금융심사위원회 금융위 정례회의 통과 간편결제 업체 중 후불결제 서비스 개시 수 신용도 상대적 금융 취약 계층 온라인 쇼핑 등 플랫폼 축적 금융 정보 후불결제 서비스 이용 수 금융 당국 태스크포스 논의 바탕 올해 상반기 중 망분리 규제 합리화 방안 추진 기업 리스크 관리 능력 고객 정보 리 여부 업무 성격 등 망분리 규제 합리적 적용 방안 마련 계획 오픈뱅킹 참여 기관 정보 공유 범위 확대 카드사 결제 예정 금액 결제 계좌 등 핀테크 선불 계정 잔액 것 내용 등 제공 어카운트인포 서비스 오픈뱅킹 연계 추진 핀테크 이용 고객 오픈뱅킹 계좌 등록 시 일일 계좌 입력 일괄 등록 가능 것 마이데이터 본인신용정보관리업 사업 진출 중소 핀테크 경우 중계 기관 응용프로그램 인터페이스 이용 가능 이지윤 기자
2021-02-09,네이버·카카오 후불결제 가능,머니투데이 박준식 기 일 화 오후 판교 스타트업캠퍼스 층 컨퍼런스홀 스타트업캠퍼스 창업교육 입학식 김범수 스타트업캠퍼스 총장 환영사 사진제공 경기 정부 핀테크 빅테크 제도개선 현장애 해소방안 전자금융거래법상 일정 요건 전자금융업자 소액 후불결제 기능 허용 네이버 카카오 등 일정 규모 전자금융업자 카드사 선불전자지급수단 재화 용역 구매 소비자 잔액 부족시 일정한 한 내 후불결제 제공 수 것 금융위원회 일 도규상 부위원장 주재 올해 첫 디지털금융 협의회 차 를 핀테크 플랫폼 기업 디지털금융 혁신 과제 논의 도 부위원장 핀테크 기존 금융회사 원활한 협업 며 협업 디지털금융 혁신 중요 기반 현장 핀테크 투자시 법적근거 미약 접점 부족해 긴밀한 협업 목소리 지적 서울 뉴시스 전진환 기 도규상 금융위원회 부위원장 일 서울 여의 국회 본관 호 국회 정무위원회 법안심사제 소위원회 회의 첫 출석 인사말 공동취재사진 정부 금융규제 샌드박스 를 업계 건의 전자금융업자 소액 후불결제 허용 전금법 개정안 발의 수용 법 개정 전 소비자 보호 조치 등 일정 요건 기업 소액후불결제 업무 수 혁신금융서비스 지정 이 청년 사회초년생 등 금융소외 계층 디지털금융 접근성 핀테크 기업 등 혁신적 금융서비스 출시 수 환경 조성 목표 정부 마이데이터 중계기관 이용 수 자 범위 확대 안건 사업자 중 중 소 핀테크 기업 중계기관 이용 수 감독규정 개정 추진 중 소 핀테크 기업 자체적 시스템 구축 운영 비용 부담 경감 수 조치 정부 마이데이터 통합인증 체계 구축 지원 번 인증 금융회사 전송요구 가능 소비자 편의 마이데이터 사업자 사용자환경 개발부담 경감 수 판단 금융사 망분리 규정 개선 관련해 월 금융회사 핀테크기업 등 망분리 합리화 태스크포스 를 운영 계획 금융보안 금융사 기반 구축 환경 조성 수 취지 금융위 지난해 월 차례 핀테크 빅테크 간담회 개 제도개선 건의과제 발굴 중 건 수용과제 제도개선 착수 금융이용자 영향 등 점검 필요 부처 등 협의 필요 개 중장기 검토과제 개선방안 논의하기 마지막 추진 나머지 개 수용곤란 과제들 디지털 환경 여건 변화시 추진 수 지속 관리 필요시 검토 재개 박준식 기자
