,날짜,기사제목,본문내용
9,2021-05-10,삼성D 사상 첫 파업 돌입할까…이르면 이번 주 내 판가름,쟁의찬성 중노위 조정중지 결정 시 파업가능 조정기한 일까지 합의 시 일 연장가능 파업될지 태업될지 쟁의형태는 추후 논의 노조 기본 인상률 처우개선 사측 이데일리 신중섭 기자 회사와 임금협상 결렬 을 선언한 삼성디스플레이 노조의 사상 첫 파업 가능성에 대한 긴장감이 고조되고 있다 최근 진행한 쟁의행위 찬반 투표가 가결되면서 중앙노동위원회 중노위 의 조정 중지 결정만 있으면 노조는 곧바로 파업 태업 등 쟁의행위를 할 수 있게 돼서다 조정 기한은 오는 일까지다 이재용 삼성전자 부회장이 지난해 월 무노조 경영 폐기 를 선언한 후 삼성그룹에서 처음으로 파업이 발생할지 관심이 쏠린다 삼성디스플레이 노조는 지난 일 삼성전자 서초사옥 앞에서 교섭해태 규탄 기자회견을 열었다 사진 삼성디스플레이 노조 이르면 이번 주 내 파업 여부 판가름 일 업계에 따르면 삼성디스플레이 노조는 지난 일부터 나흘간 파업 등 쟁의 활동에 대한 찬반을 묻는 전자투표를 진행했다 조합원 명 중 명이 투표했으며 이 중 명 가 쟁의활동에 찬성 했다 재적 대비 찬성률은 다 노조가 파업 태업 보이콧 등 쟁의 행위 를 할 수 있는 권리는 중노위 조정중지 와 쟁의행위 찬성 이상 등의 요건을 충족하면 확보할 수 있다 이번 투표로 쟁의 행위 찬성 이상 은 갖추게 돼 중노위의 결정만 남은 셈이다 앞서 노조는 쟁의권 확보를 위해 지난 일 중노위에 노동쟁의 조정을 신청했으며 중노위는 이튿날인 일 이를 접수했다 중노위는 이번 주 두 차례에 걸쳐 조정을 진행하고 노사 간 견해차를 좁힐 수 없다고 판단하면 조정 중지 결정을 내릴 수 있다 조정 기간은 이번 주 금요일인 오는 일까지로 양측 합의가 있으면 최대 일 더 연장될 수 있다 만약 노사가 견해차를 좁히지 못하고 조정 기간 연장 합의도 하지 못한다면 노조는 당장 이번 주 쟁의권을 확보할 수 있게 된다 노조는 지난 월부터 사측과 임금협상을 진행해왔으나 입장 차를 좁히지 못하고 지난달 일 열린 제 차 단체교섭에서 임금협상 결렬을 선언했다 노조는 지난해 실적 등을 근거로 기본인상률 와 위험수당 현실화 해외 출장자에 대한 처우 개선 등을 요구하고 있다 반면 사측은 노사협의회와 합의한 기본 인상률 이외에는 어렵다고 밝힌 것으로 전해졌다 다만 쟁의행위의 시기와 형태는 아직 정해지지 않았다 쟁의행위로는 파업 태업 보이콧 생산관리 피케팅 등이 있다 노조가 쟁의권을 확보하게 되면 투표 등을 통해 시기와 형태를 정하게 된다 노조 관계자는 쟁의 활동 투표를 한 것은 당장 쟁의행위를 한다기보단 요건을 갖춰놓고자 한 것 이라며 쟁의행위 여부나 행위 형태에 대해서는 향후 다시 논의해봐야 한다 파업이 될지 태업이 될지 모른다 고 설명했다 기존 노사 관행 노조 임협 공존하면서 입장 차 삼성디스플레이는 지난해까지 삼성전자 등 다른 삼성 계열사들처럼 근로자 사용자 대표 등으로 구성된 노사협의회 를 통해 사원들의 임금인상률과 복리후생에 대한 협의를 진행해왔다 노사협의회는 인 이상 사업장에는 무조건 설치해야 하는 조직으로 노조와 같이 노조법에서 정하는 조직이 아니라 근로자참여 및 협력증진에 관한 법률 근참법 에서 정하고 있는 노사 협의 기구다 노조가 없었던 삼성디스플레이에선 노사협의회가 년 가까이 노조를 대신해 임금부터 복지 수준을 정해왔다 이런 가운데 삼성디스플레이에서도 지난해 월 한국노총 산하로 노조가 공식 출범했고 그룹 총수인 이 부회장이 무노조 경영 폐기 선언을 하면서 몸집을 불렸다 현재 조합원 수는 전체 직원의 수준인 여명이다 삼성디스플레이 노사는 올해 초 삼성 전자계열사 중 처음으로 단체협약을 체결했다 하지만 이후 진행한 임금협상에서 입장 차를 좁히지 못하고 있다 노조 출범 뒤에도 노사협의회를 통해 임금 수준 등을 합의하는 오랜 관행이 유지되면서 입장 차가 발생하고 있는 것 노사협의회의 합의 내용과 별개로 노조와 사측의 임금협상 결과는 해당 노조 조합원만 적용받게 된다 재계 관계자는 아직 노조 인원이 전체 구성원의 정도인 만큼 사측 입장에선 노조가 대표성을 갖기 힘들다고 판단했을 것 이라며 이에 노조뿐 아니라 기존처럼 노사협의회를 통해서도 임금 수준을 협의하는 것으로 보인다 고 설명했다 신중섭
10,2021-05-10,"삼성전자 1.6%↑·기관 1조 ""시장 끌어 올렸다""…공매도 두려움 극복...",이미지출처 연합뉴스 아시아경제 이선애 기자 지난 일 공매도 재개로 두려움이 팽배했던 국내 주식 시장이 이를 극복하고 종가 기준 사상 최고치의 역사를 새로 썼다 시가총액 상위 종목 위 대장주 삼성전자의 강세가 시장을 끌어 올렸다 개인 투자자들은 차익실현에 나섰지만 외국인과 기관이 동반 매수에 나서 시장 상승세에 탄력을 더했다 특히 이날 기관의 코스피 시장 순매수액은 조원에 가까웠다 일 코스피 지수는 포인트 오른 로 출발해 상승 폭을 키웠다 장중에는 선을 돌파했다 장중 선을 돌파한 것은 올해 월 일 이어 역대 두 번째다 이날 코스피는 오른 에 마감했다 종가 기준으로 사상 최고치를 기록했다 이전 종가 기준 최고가는 지난달 일 기록한 이다 개인은 조 억원을 순매도하며 차익실현에 나섰지만 외국인과 기관은 각각 억원 억원을 사들이며 지수 상승에 힘을 보탰다 외국인은 거래일만에 매수 전환한 것이며 기관이 최근 거래일동안 사들인 순매수액은 조 억원에 달한다 업종별로는 변동성지수 증권 운수창고 섬유의복 유통업 의약품 철강금속 운수장비 중형주 등 대부분이 오른 가운데 의료정밀 보험 등은 내렸다 시가총액 상위종목은 삼성전자 하이닉스 네이버 삼성바이오로직스 카카오 현대차 삼성 셀트리온 등 대부분 올랐다 화학 은 소폭 내렸다 코스닥은 포인트 오른 로 출발했다 장중 선으로 올라선 후 오른 에 장을 마감했다 개인과 기관이 각각 억원 억원 순매수했으며 외국인만 홀로 억원 순매도했다 시가총액 상위종목 셀트리온헬스케어 셀트리온제약 펄어비스 카카오게임즈 에코프로비엠 머티리얼즈 에이치엘비 알테오젠 스튜디오드래곤 솔브레인 등 모두 올랐다 서상영 미래에셋증권 연구원은 바이든 행정부의 적극적인 부양책 등으로 미국 증시가 강세를 보이면서 국내 증시에도 긍정적인 영향을 미쳤다 며 고용 위축으로 연방준비제도 연준 의 테이퍼링 양적완화 축소 우려가 해소된 것도 증싱에 우호적 영향을 준 것으로 풀이된다 고 말했다 채현기 케이프투자증권 연구원은 이번주 국내 증시는 성장주의 반등 가능성 경기민감주 상승세 지속 두가지 키워드로 정리한다 면서 코스피 주간 예상 밴드는 에서 이며 예상 상승요인으로는 테이퍼링 논의 시점이 지연될 가능성 연준위원들의 발언 예상 하락요인으로는 예상보다 높은 소비자물가지수를 꼽는다 고 전했다 이선애 기자
11,2021-05-10,삼성전자 꿈틀...코스피 사상 최고가 도전,삼성전자 장 중 대 강세 분기 실적 개선 본격화 주가 반등 전망 서울경제 지난 년 평택 삼성전자 메모리반도체 공장 건설 현장 모습 평택 연합뉴스 지난달부터 조정이 이어졌던 삼성전자 가 이날 넘게 상승 중이다 이에 코스피도 공매도 우려에서 벗어나 역대 최고가를 경신할 수 있을지에도 덩달아 관심이 쏠린다 일 오후 시 분 현재 유가증권시장에서 삼성전자는 전 거래일보다 오른 만 원에 거래 중이다 지난 월 일 삼성전자와 코스피 지수는 장 중 각각 만 원과 을 기록해 역대 최고가를 찍었다 이후 지수가 조정 국면에 접어들면서 삼성전자의 주가는 만 원 초반 대를 좀처럼 벗어나지 못했다 반면 최근 코스피 지수는 공매도 우려에도 불구하고 반등에 성공했다 이날 현재 지수는 전 거래일보다 포인트 오른 을 기록 중이다 종 전 최고가까지 밖에 남지 않았다 이에 코스피 시가 총액 대장주인 삼성전자가 본격 반등할 경우 지수는 사상 최고점을 경신할 수 있을 것으로 전망된다 특히 삼성전자는 오는 분기부터 원가구조 개선과 평택 공장 가동에 힘입어 본격적인 실적 개선이 기대된다 이에 따라 주가가 본격 반등에 나설 수 있다는 기대감이 커진다 김동원 증권 연구원은 삼성전자의 분기 반도체 부문 영업이익은 전분기대비 증가한 조 억 원으로 전망되고 분기 반도체 영업이익은 조 억 원으로 지난해 대비 배 늘 것 이라고 추정했다 그는 이어 올해 영업이익은 조 억 원으로 지난해 대비 늘어 년 만에 최대 실적이 기대된다 고 덧붙였다 앞서 지난달 일 신한금융투자는 삼성전자의 목표가를 증권사 중 최고가인 만 원으로 제시했다 이외에 미래에셋증권은 만 원을 유진투자증권과 금융투자 투자증권 등은 만 원을 목표가로 제시했다 신한나 기자
12,2021-05-10,"삼성전자, 케냐 난민촌 청소년들에게 갤럭시탭 1000대 기부",케냐 카쿠마 난민촌 그린라이트 중등학교 학생들이 갤럭시탭으로 수업에 참여하고 있다 파이낸셜뉴스 삼성전자가 코로나 로 더욱 어려워진 환경 속에서 교육을 받고 있는 난민촌 청소년들을 위해 유엔난민기구 에 태블릿 갤럭시탭 대를 기부했다 일 삼성전자에 따르면 이번에 기부한 갤럭시탭은 케냐의 카쿠마와 다답 지역 난민촌에 위치한 학교와 커뮤니티 센터 곳에 전달돼 열악한 교육 환경을 개선하고 청소년들에게 양질의 교육을 제공하기 위해 활용된다 코로나 상황으로 문을 닫았던 난민촌 내 학교들은 지난 월 다시 문을 열었으나 학교와 청소년들은 학용품과 수업을 위한 학습 콘텐츠를 제대로 갖추지 못하고 있다 은 난민 청소년들이 다양한 디지털 프로그램 기반의 교육을 받을 수 있게 지원하는 인스턴트 네트워크 스쿨 프로그램에 삼성전자가 기부한 갤럭시탭을 사용할 계획이다 카쿠마와 다답은 전 세계에서 오래된 난민촌이 위치한 곳 중 하나이다 올해 월 기준 만여명의 난민이 머물고 있으며 이 중 에 이르는 만여명이 교육을 받으며 성장해야 할 세의 아동과 청소년들이다 제임스 린치 한국 대표는 삼성전자의 지원을 통해 태블릿 대를 여러 학생들이 나눠써야 하는 상황이 개선됐다 며 이번 지원은 글로벌 기업이 자사의 역량을 활용해 선한 영향력을 펼친 사례다 앞으로도 삼성전자와 파트너십을 강화할 수 있기를 기대한다 고 밝혔다 김원경 삼성전자 지속가능경영추진센터장 부사장 은 코로나 상황에서 더욱 어려움이 가중된 난민촌 청소년들이 배움을 이어갈 수 있도록 지원하게 돼 뜻깊다 면서 청소년들이 교육의 기회에서 소외되지 않고 양질의 교육을 받을 수 있도록 하는 것은 모두를 위한 지속가능한 미래를 위해 필수 라고 말했다 김경민 기자
13,2021-05-10,"삼성전자, 케냐 난민촌 학교·커뮤니티 센터에 ‘갤럭시탭’ 1000대 ...",삼성전자가 신종 코로나 바이러스 감염증 코로나 으로 더욱 어려워진 환경 속에서 교육을 받고 있는 난민촌 청소년들을 위해 유엔난민기구 에 태블릿 갤럭시탭 대를 기부했다고 일 밝혔다 이번에 기부한 갤럭시탭 은 케냐의 카쿠마 와 다답 지역의 난민촌에 위치한 학교와 커뮤니티 센터 곳에 전달돼 열악한 교육 환경을 개선하고 청소년들에게 양질의 교육을 제공하기 위해 활용된다 코로나 상황으로 문을 닫았던 난민촌 내 학교들은 지난 월 다시 문을 열었으나 학교와 청소년들은 학용품과 수업을 위한 학습 콘텐츠를 제대로 갖추지 못하고 있다 유엔난민기구는 난민 청소년들이 다양한 디지털 프로그램 기반의 교육을 받을 수 있게 지원하는 인스턴트 네트워크 스쿨 프로그램에 삼성전자가 기부한 갤럭시탭 을 사용할 계획이다 삼성전자 지속가능경영추진센터장 김원경 부사장은 난민촌 청소년들이 배움을 이어갈 수 있도록 지원하게 돼 뜻 깊다 고 말했다 정세희 기자
14,2021-05-10,"[피플]삼성전자, 케냐 난민촌 청소년 위해 ‘갤럭시탭’ 기부",케냐 카쿠마 난민촌 그린라이트 중등학교 학생들이 갤럭시탭 을 보여주고 있다 유엔난민기구 제공 헤럴드경제 정세희 기자 삼성전자가 신종 코로나 바이러스 감염증 코로나 으로 더욱 어려워진 환경 속에서 교육을 받고 있는 난민촌 청소년들을 위해 유엔난민기구 에 태블릿 갤럭시탭 대를 기부했다고 일 밝혔다 이번에 기부한 갤럭시탭 은 케냐의 카쿠마 와 다답 지역의 난민촌에 위치한 학교와 커뮤니티 센터 곳에 전달돼 열악한 교육 환경을 개선하고 청소년들에게 양질의 교육을 제공하기 위해 활용된다 코로나 상황으로 문을 닫았던 난민촌 내 학교들은 지난 월 다시 문을 열었으나 학교와 청소년들은 학용품과 수업을 위한 학습 콘텐츠를 제대로 갖추지 못하고 있다 유엔난민기구는 난민 청소년들이 다양한 디지털 프로그램 기반의 교육을 받을 수 있게 지원하는 인스턴트 네트워크 스쿨 프로그램에 삼성전자가 기부한 갤럭시탭 을 사용할 계획이다 카쿠마와 다답은 전 세계에서 오래된 난민촌이 위치한 곳 중 하나이다 올해 월 기준 만여 명의 난민이 머물고 있으며 이 중 에 이르는 만여 명이 교육을 받으며 성장해야 할 세에서 세 사이의 아동과 청소년들이다 유엔난민기구 제임스 린치 한국 대표는 삼성전자의 지원을 통해 태블릿 대를 여러 학생들이 나눠써야 하는 상황이 개선됐다 며 이번 지원은 글로벌 기업이 자사의 역량을 활용해 선한 영향력을 펼친 사례이며 앞으로도 삼성전자와 파트너십을 강화할 수 있기를 기대한다 라고 밝혔다 삼성전자 지속가능경영추진센터장 김원경 부사장은 코로나 상황에서 더욱 어려움이 가중된 난민촌 청소년들이 배움을 이어갈 수 있도록 지원하게 돼 뜻 깊다 고 말했다
15,2021-05-10,"삼성전자, 케냐 난민촌 청소년들 위해 '갤럭시탭' 1000대 기부",케냐 카쿠마 난민촌 그린라이트 중등학교 교사와 학생이 갤럭시탭 을 활용해 수업하고 있다 사진 제공 삼성전자 삼성전자는 신종 코로나바이러스 감염증 코로나 로 더욱 어려워진 환경 속에서 교육을 받고 있는 난민촌 청소년들을 위해 유엔난민기구 에 태블릿 갤럭시탭 대를 기부했다고 일 밝혔다 이번에 기부한 갤럭시탭 은 케냐의 카쿠마 와 다답 지역 난민촌에 위치한 학교와 커뮤니티 센터 곳에 전달돼 열악한 교육 환경을 개선하고 청소년들에게 양질의 교육을 제공하기 위해 활용된다 코로나 상황으로 문을 닫았던 난민촌 내 학교들은 지난 월 다시 문을 열었으나 학교와 청소년들은 학용품과 수업을 위한 학습 콘텐츠를 제대로 갖추지 못하고 있다 유엔난민기구는 난민 청소년들이 다양한 디지털 프로그램 기반의 교육을 받을 수 있게 지원하는 인스턴트 네트워크 스쿨 프로그램에 삼성전자가 기부한 갤럭시탭 을 사용할 계획이다 카쿠마와 다답은 전 세계에서 오래된 난민촌이 위치한 곳 중 하나이다 올해 월 기준 만여 명의 난민이 머물고 있으며 이 중 에 이르는 만여 명이 교육을 받으며 성장해야 할 세에서 세 사이의 아동과 청소년들이다 유엔난민기구 제임스 린치 한국 대표는 삼성전자의 지원을 통해 태블릿 대를 여러 학생들이 나눠써야 하는 상황이 개선됐다 며 이번 지원은 글로벌 기업이 자사의 역량을 활용해 선한 영향력을 펼친 사례이며 앞으로도 삼성전자와 파트너십을 강화할 수 있기를 기대한다 라고 강조했다 삼성전자 지속가능경영추진센터장 김원경 부사장은 코로나 상황에서 더욱 어려움이 가중된 난민촌 청소년들이 배움을 이어갈 수 있도록 지원하게 돼 뜻깊다 고 말했다 이상규 매경닷컴 기자
16,2021-05-10,삼성 갤럭시폰으로 가상자산 금융서비스 쓴다,삼성 블록체인 월렛 아베 디파이 앱 탑재 디파이 분야는 처음 글로벌 세대 타겟 파이낸셜뉴스 세계 최대 스마트폰 제조사 삼성전자의 갤럭시폰을 이용해 간단하게 가상자산 예금 및 대출 서비스를 이용할 수 있게 됐다 갤럭시폰의 블록체인 가상자산 서비스 플랫폼 삼성 블록체인월렛에 디파이 서비스가 등록된 것이다 이더리움 블록체인 기반 디파이 서비스인 아베 가 삼성전자의 가상자산 지갑 및 블록체인 애플리케이션 앱 플랫폼인 삼성 블록체인 월렛에 탑재됐다 사진 삼성 블록체인 월렛 일 삼성전자의 가상자산 지갑 및 블록체인 애플리케이션 앱 플랫폼 삼성 블록체인 월렛 에는 탈중앙금융 디파이 서비스인 아베 가 등록돼 있는 것으로 확인됐다 그간 금융 게임 소셜미디어 라이프스타일 등 다양한 분야의 가상자산 앱을 탑재해온 삼성 블록체인 월렛이 디파이 서비스를 추가한 것은 이번이 처음이다 가상자산 금융 서비스인 디파이 탈중앙금융 는 기존에 금융 서비스를 제공하는 은행 등 중앙 기관 없이 블록체인 네트워크 위에서 탈중앙 방식으로 처리되는 금융 서비스다 모바일을 통해 누구나 이용할 수 있기 때문에 동남아시아나 중동 남미 아프리카 등 은행계좌가 없는 인구가 밀집된 나라에서 특히 활발히 쓰이고 있다 아베는 이더리움 블록체인 네트워크 기반의 디파이로 가상자산을 일정 기간 예치해 이자를 받거나 일정량의 가상자산을 담보로 잡고 가상자산을 대출받아 이용할 수 있는 서비스다 당초 개인간 대출로 시작한 아베는 현재의 풀 여러 이용자의 가상자산을 한 곳에 모으는 것 기반 대출로 방향을 전환했다 삼성 블록체인 월렛에 탑재된 아베 앱 서비스 모습 사진 삼성 블록체인 월렛 디파이 분석 사이트 디파이펄스에 따르면 아베의 총 예치자산 규모는 약 억달러 약 조원 로 메이커 약 억달러 예치 에 이어 전세계 번째로 많다 현재 아베는 이더리움 과 테더 를 포함해 총 개 가상자산에 대한 예치이자 및 담보대출 서비스를 제공하고 있다 즉 가상자산을 빌려주는 사용자는 유동성 풀에 가상자산을 예치함으로써 이자를 받을 수 있고 가상자산 대출을 원하는 사용자는 헤당 유동성 풀에서 가상자산을 빌릴 수 있는 구조다 아베는 다마고치 게임과 유사한 아베고치 라는 대체불가능한토큰 캐릭터를 예치하고 토큰을 발행해주는 디파이 서비스도 제공하고 있다 사용자는 아베고치를 예치하고 받은 에이토큰 을 아베의 유동성 풀에 넣고 이자를 받을 수 있다 아베는 이번 삼성 블록체인 월렛 탑재로 세대의 갤럭시폰 유저들이 쉽게 디파이 서비스에 접근할 수 있을 것으로 기대하고 있다 한편 현재 삼성 블록체인 월렛엔 이더리움 및 트론 블록체인 기반 앱이 각각 개 개씩 지원되고 있다 월렛에 보관 가능한 가상자산은 비트코인과 이더리움 클레이튼 스텔라 트론 등 개 블록체인 네트워크 기반의 가상자산이다 디파이 삼성블록체인월렛 에이브 김소라 기자
17,2021-05-10,손잡은 삼성전자-SK매직...렌털사업 윈윈행보 나서 [뉴스後],윤요섭 매직 대표 왼쪽 와 강봉구 삼성전자 한국총괄이 전략적 사업제휴 협약을 맺고 있다 매직 제공 삼성전자 소비자가전부문 와 매직이 최근 손을 잡았다 기업간 전략적 제휴 협약은 흔한 일 하지만 조금 들여다 보면 삼성의 소비자가전 렌털사업 본격화라는 내용이 함축돼 있다 소비자가전 글로벌 위를 다투는 사는 이미 국내에서 렌털사업을 시작 한창 덩치를 키우는 중이다 주방 환경가전 등 생활가전 제조 및 렌털사업을 하는 매직은 렌털 분야 국내 위권 기업이다 렌털게정 수 만에 이른 이 회사의 고민은 의류관리기 에어드레서 건조기 세탁기 냉장고 등 대형가전이 없다는 점 사업 확대를 위해 이 분야 보완이 절실했다 삼성 소비자가전 역시 렌털사업을 위해 따로 인력을 확보하고 전국적 조직을 마련하기엔 부담스럽다 거액의 일시불 구매 외 월단위 사용료를 내고 빌려쓰는 렌털에 대한 고객의 요구는 점차 높아지고 있다 이번 협약으로 매직은 삼성전자의 다양한 가전제품을 자사 플랫폼에서 판매하게 된다 이밖에 그룹 관계사 및 다양한 구독플랫폼으로 판매채널을 확장한다는 계획도 갖고 있다 매직은 이번 협약으로 그동안 고객의 요구가 강했던 대형가전에 대한 라인업을 강화하게 됐다 삼성전자는 렌털서비스를 원하는 고객의 요구에 즉각 대응할 수 있게 된다 이와 함께 양사는 고객의 다양한 요구를 충족시키는 새로운 결합상품도 내놓을 것으로 보인다 또 관련 제품과 서비스를 확대해 매출 확대에도 도움이 될 것으로 기대하고 있다 협약식에서 강봉구 삼성전자 한국총괄 부사장 은 양사의 앞선 역량을 기반으로 새로운 고객가치 창출할 것 이라고 했으며 윤요섭 매직 대표는 삼성전자와 제휴로 고객의 요구를 충족시키는 제품과 서비스 기반을 구축하게 됐다 고 말했다 조문술 기자
18,2021-05-10,[뉴스後]눈길 끄는 삼성전자와 SK매직의 악수,양사 렌탈사업 매개로 제품군 성장성 보완 상호윈윈 추구 윤요섭 매직 대표 왼쪽 와 강봉구 삼성전자 한국총괄이 전략적 사업제휴 협약을 맺고 있다 매직 제공 삼성전자 소비자가전부문 와 매직이 최근 손을 잡았다 기업간 전략적 제휴 협약은 흔한 일 하지만 조금 들여다 보면 삼성의 소비자가전 렌탈사업 본격화라는 내용이 함축돼 있다 소비자가전 글로벌 위를 다투는 사는 이미 국내에서 렌탈사업을 시작 한창 덩치를 키우는 중이다 주방 환경가전 등 생활가전 제조 및 렌탈사업을 하는 매직은 렌탈 분야 국내 위권 기업이다 렌탈게정 수 만에 이른 이 회사의 고민은 의류관리기 에어드레서 건조기 세탁기 냉장고 등 대형가전이 없다는 점 사업 확대를 위해 이 분야 보완이 절실했다 삼성 소비자가전 역시 렌탈사업을 위해 따로 인력을 확보하고 전국적 조직을 마련하기엔 부담스럽다 거액의 일시불 구매 외 월단위 사용료를 내고 빌려쓰는 렌탈에 대한 고객의 요구는 점차 높아지고 있다 이번 협약으로 매직은 삼성전자의 다양한 가전제품을 자사 플랫폼에서 판매하게 된다 이밖에 그룹 관계사 및 다양한 구독플랫폼으로 판매채널을 확장한다는 계획도 갖고 있다 매직은 이번 협약으로 그동안 고객의 요구가 강했던 대형가전에 대한 라인업을 강화하게 됐다 삼성전자는 렌탈서비스를 원하는 고객의 요구에 즉각 대응할 수 있게 된다 이와 함께 양사는 고객의 다양한 요구를 충족시키는 새로운 결합상품도 내놓을 것으로 보인다 또 관련 제품과 서비스를 확대해 매출 확대에도 도움이 될 것으로 기대하고 있다 협약식에서 강봉구 삼성전자 한국총괄 부사장 은 양사의 앞선 역량을 기반으로 새로운 고객가치를 창출할 것 이라고 했으며 윤요섭 매직 대표는 삼성전자와 제휴로 고객의 요구를 충족시키는 제품과 서비스 기반을 구축하게 됐다 고 말했다 조문술 기자
