,날짜,기사제목,본문내용
19,2021-05-10,외인이 삼성전자 3조 던질때 개미가 5조 사들였다,머니투데이 구단비 기자 오늘의 포인트 일러스트 임종철 디자인기자 코스피가 선까지 뛰었다 외국인과 기관 투자자들의 쌍끌이 매수세가 지수 급등을 이끌었다 일 오전 시 코스피는 전 거래일 대비 포인트 오른 를 기록 중이다 지난달 일 종가 기준 선이 무너진 이후 선까지 회복한 것이다 전날 미국 증시가 강세로 마감했고 미국 월 고용지표의 전망치 하회로 금리 인상 우려가 줄어들면서 강세를 보인 것으로 해석된다 또 지난 일 코스피 코스닥 종목들을 대상으로 재개된 공매도 충격이 사라진 것도 시장 분위기를 달궜다 이날 기관과 외국인은 각 억원 억원 순매수했다 개인은 홀로 억원 어치의 물량을 팔았다 다만 지난달 일부터 일까지 개인 투자자들은 약 조 억원대를 매수했다 같은 기긴 외국인과 기관은 약 조 억원 조 억원대를 매도했다 개인이 약 주 동안 매도 물량을 고스란히 받아낸 셈이다 한국거래소에 따르면 지난달 일부터 지난 일까지 거래량 기준 개인이 구매한 종목 위는 삼성전자다 위는 하이닉스 위는 현대모비스로 나타났다 이어 기아 카카오 셀트리온 현대차 삼성전자우 전자까지 위권내 종목들 대다수가 시총 상위주로 나타났다 같은 기간 외국인 거래량 기준 매도 상위 종목들은 삼성전자 기아 삼성전자우 하이닉스 카카오 등으로 나타났다 삼성전자의 경우 외국인이 조 억원 기관이 조 억원을 팔았다 개인이 이에 상응하는 조 억원 어치를 받아냈다 하이닉스도 개인이 억원어치 구매했는데 외국인과 기관이 각 억원과 억원을 팔았다 그 밖에도 카카오 기아 등 대다수 종목들이 외국인과 기관이 판 물량을 대다수 개인이 견인하는 모습이었다 하지만 최근 선과 선을 오가는 횡보 국면을 다시 맞이한 국내 증시가 박스권에 머물고 있다는 평가가 나오고 있다 이에 따라 올해 강한 순매수로 시장을 이끌고 있는 개인투자자들이 투자수익률은 다소 부진할 것으로 파악된다 특히 지난달 일부터 가장 많이 추가매수한 삼성전자의 경우 지난달 일 만 원에 거래 마감한 이후 현재까지 만 만 원대를 머물면서 이렇다할 큰 주가 변화가 없었다 오히려 만 원대에 매수했다면 지난 일 기준 만 원대로 하락하면서 손해를 본 셈이다 하이닉스와 현대모비스 등 개인 순매수 상위 종목들의 상황들이 대다수 유사하다 업종별 수익률로 보면 지난해 하반기 및 올해 초까지 시장을 주도했던 자동차와 반도체는 월 이후 수익률이 급감했고 반면 비인기 업종이었던 증권 보험 업종은 반등했다 강봉주 메리츠증권 연구원은 반도체 자동차는 내년까지 한국 증시 전체 이익 개선의 주력 업종이지만 문제는 너무 가파르게 상승해온 주가 라며 해당 업종은 하반기 및 내년 추가 상승 여력이 부각될 것 이라고 설명했다 이어 반도체 자동차는 이익 전망치 개선세가 뚜렷해보이지만 연초에 급격히 상승한 지표의 안정화 과정 진행과 외국인 매도세 등을 고려하면 상반기 내엔 횡보가 지속될 가능성이 높다 며 철강 은행 증권 등 경기민감주들이 저평가 매력이 부각되면서 주가가 강세를 보이고 있다 고 진단했다 그러면서 펀더멘탈이 우수한 종목과 외국인 매도 상위를 차지하는 종목에 투자할 것을 제시했다 강 연구원은 기관과 외국인 매도세도 부담요인이라 최근 한달간 외국인 매수 상위 종목 등을 선별한 개별 종목 대응이 유리할 것 이라고 봤다 경기민감주에 대한 투자 조언도 계속됐다 김대준 한국투자증권 연구원은 인플레이션 우려가 커지는 상황에선 성장주보단 경기민감업종이 더 유리하다 며 경기 개선 흐름 원자재 가격 상승의 직접적인 수혜를 볼 수 있기 때문 이라고 평가했다 신승진 삼성증권 연구원은 공매도 영향에서 자유롭고 실적 개선 속도가 빠른 화학 철강 정유 등 경기민감주가 투자 대응 순위 라며 시장의 컨센서스를 대폭 뛰어넘는 서프라이즈 행진을 보이고 있다 고 분석했다 채현기 케이프투자증권 연구원도 미국의 월 고용 지표 부진으로 테이퍼링 우려는 잠시 줄었지만 경기 회복세가 지속되면 결국 다시 논의된다는 점에서 성장업종에 대한 우려는 남아있을 것 이라며 단기적으로 경기민감업종의 상승 추세가 지속될 것 이라고 판단했다 구단비 기자
20,2021-05-10,삼성전자 ‘비스포크 홈’ 글로벌 시장 출격…11일 론칭 행사,삼성 비스포크 홈 글로벌 론칭 행사 초대장 삼성전자 제공 헤럴드경제 양대근 기자 삼성전자가 국내에서 맞춤형 가전 돌풍을 일으키고 있는 비스포크 홈 을 세계 시장에 본격 선보인다 삼성전자는 미국 동부시간 기준 오는 일 오전 시 한국시간 오후 시 비스포크 홈 글로벌 론칭 행사 를 진행한다고 밝혔다 이번 행사는 삼성전자 뉴스룸과 유튜브 채널에서 라이브 스트리밍 형식으로 진행된다 이재승 삼성전자 생활가전사업부장 사장 이 직접 나와 설명할 예정이다 비스포크 홈은 소비자 개인의 라이프스타일과 취향을 맞춰 주는 비스포크 콘셉트를 생활가전 제품 전체로 확대한 제품 라인업이다 국내 시장에서는 지난 월 출시됐다 주방에서 거실 침실 세탁실 등에 이르기까지 집안 전체를 다양한 제품과 디자인으로 통일감 있으면서도 개성 넘치는 공간으로 구현한다 여기에 가지 색상으로 구성된 프리즘 컬러 에서 자신의 취향에 맞는 색상을 주문할 수 있어 시간이 지나도 늘 새롭게 사용자에 맞춰 라이프스타일을 구현할 수 있다 이재승 사장은 삼성전자 글로벌 뉴스룸에 올린 기고문에서 비스포크 홈 만의 현대적인 디자인과 유연성 스마트한 연결성을 보여드리게 될 것 이라며 보다 진화된 기존 제품과 완전히 새로운 제품 서비스 등도 선보일 것 이라고 말했다
21,2021-05-10,"[특징주]라온시큐어, 삼성전자 가상화폐 전자지갑 사업 확대 강화 소식에...",아시아경제 장효원 기자 삼성이 스위스 기반 탈중앙화금융 디파이 서비스 아베프로토콜 을 지원한다는 소식에 삼성전자의 모바일 보안솔루션 업체인 라온시큐어가 강세다 일 오전 시 분 현재 라온시큐어는 전일 대비 오른 원에 거래 중이다 업계에 따르면 삼성 블록체인월렛은 최근 아베프로토콜 지원을 시작했다 이용자는 아베프로토콜이 발행한 가상화폐 아베 를 모바일에 보관할 수 있고 아베프로토콜 서비스를 이용 가능하다 라온시큐어는 삼성전자 공식 파트너이자 삼성전자 녹스 리셀러 삼성패스 사업협력 파트너로 알려졌다 또한 라온시큐어는 블록체인과 생체인증 관련 기술을 보유하고 있어 블록체인 지갑의 스마트폰 적용 확대 시 업계는 라온시큐어가 수혜를 입을 것으로 전망하고 있다 장효원 기자
22,2021-05-10,"케냐 난민촌 학교를 찾은 갤럭시탭···삼성, 유엔난민기구에 1,000대...",케냐 카쿠마 다답 난민촌 학교 등지에 전달 만 여명에 달하는 아동 청소년 위해 활용 케냐 카쿠마 난민촌 그린라이트 중등학교 학생들이 갤럭시탭을 들어보이고 있다 사진제공 유엔난민기구 서울경제 삼성전자 가 난민촌 청소년들을 위해 유엔난민기구 에 태블릿 갤럭시탭 대를 기부했다 일 삼성전자에 따르면 이번에 기부한 갤럭시탭은 케냐의 카쿠마 와 다답 지역 난민촌에 세워진 학교와 커뮤니티 센터 곳에 전달돼 열악한 교육 환경을 개선하고 양질의 교육 제공을 위해 활용된다 코로나 여파로 지난해 문을 닫았던 난민촌 내 학교들은 지난 월 다시 문을 열었지만 학용품이나 학습 콘텐츠가 절대적으로 부족한 상황이다 유엔난민기구는 난민 청소년들이 다양한 디지털 프로그램 기반의 교육을 받을 수 있게 지원하는 인스턴트 네트워크 스쿨 프로그램에 삼성전자가 기부한 갤럭시탭을 사용할 계획이다 카쿠마와 다답은 전 세계에서 오래된 난민촌이 조성된 지역 가운데 하나다 올해 월 기준 만여 명의 난민이 머물고 있으며 이 가운데 에 이르는 만여 명이 교육을 받으며 성장해야 할 세에서 세 사이의 아동과 청소년들이다 케냐 카쿠마 난민촌 그린라이트 중등학교 학생이 갤럭시탭을 수업 시간에 사용하고 있다 사진제공 유엔난민기구 제임스 린치 유엔난민기구 한국 대표는 삼성전자의 지원을 통해 태블릿 대를 여러 학생들이 나눠 써야 하는 상황이 개선됐다 며 이번 지원은 글로벌 기업이 자사의 역량을 활용해 선한 영향력을 펼친 사례이며 앞으로도 삼성전자와 파트너십을 강화할 수 있기를 기대한다 고 밝혔다 김원경 삼성전자 지속가능경영추진센터장 부사장은 코로나 상황에서 더욱 어려움이 가중된 난민촌 청소년들이 배움을 이어갈 수 있도록 지원하게 돼 뜻 깊다 고 말했다 한편 삼성전자는 함께가요 미래로 이라는 기업의 사회적 활동 비전 아래 삼성 주니어 소프트웨어 아카데미 삼성청년 소프트웨어 아카데미 삼성 드림클래스 삼성 스마트스쿨 등 청소년 교육 중심의 사회공헌 활동과 상생 활동을 펼치고 있다 이수민 기자
23,2021-05-10,"삼성전자, 케냐 난민촌 청소년에 '갤탭' 1천대 기부",케냐 카쿠마 다답 난민촌 학교 커뮤니티센터서 활용 삼성전자가 난민촌 청소년들을 위해 유엔난민기구 에 태블릿 인 갤럭시탭 대를 기부했다고 일 밝혔다 케냐 카쿠마 난민촌 그린라이트 중등학교 학생들이 전달받은 갤럭시탭을 보여주고 있다 아시아경제 차민영 기자 삼성전자가 코로나 로 더 어려워진 환경에서 교육을 받고 있는 난민촌 청소년들을 위해 유엔난민기구 에 태블릿 인 갤럭시탭 대를 기부했다고 일 밝혔다 이번에 기부한 갤럭시탭은 케냐의 카쿠마와 다답 지역 난민촌에 위치한 학교와 커뮤니티 센터 곳에 전달돼 열악한 교육 환경을 개선한다 청소년들에게는 양질의 교육을 제공하는데 쓰일 전망이다 코로나 상황으로 문을 닫았던 난민촌 내 학교들은 올해 월 다시 문을 열었으나 학교와 청소년들은 학용품과 수업을 위한 학습 콘텐츠를 제대로 갖추지 못하고 있다 유엔난민기구는 난민 청소년들이 다양한 디지털 프로그램 기반의 교육을 받을 수 있게 지원하는 인스턴트 네트워크 스쿨 프로그램에 삼성전자가 기부한 갤럭시탭을 사용할 계획이다 카쿠마와 다답은 전 세계에서 오래된 난민촌이 위치한 곳 중 하나이다 올해 월 기준 만여명의 난민이 머물고 있으며 이 중 에 이르는 만여명이 교육을 받으며 성장해야 할 세에서 세 사이의 아동과 청소년들이다 제임스 린치 유엔난민기구 한국 대표는 삼성전자의 지원을 통해 태블릿 대를 여러 학생들이 나눠 써야 하는 상황이 개선됐다 며 이번 지원은 글로벌 기업이 자사의 역량을 활용해 선한 영향력을 펼친 사례로 앞으로도 삼성전자와 파트너십을 강화할 수 있길 기대한다 고 밝혔다 김원경 삼성전자 지속가능경영추진센터장 부사장은 코로나 상황에서 어려움이 가중된 난민촌 청소년들이 배움을 이어갈 수 있도록 지원하게 돼 뜻 깊다 면서 청소년들이 교육의 기회에서 소외되지 않고 양질의 교육을 받을 수 있도록 하는 것은 모두를 위한 지속가능한 미래를 위해 필수 라고 말했다 삼성전자는 함께가요 미래로 이라는 비전 아래 삼성 주니어 아카데미 삼성청년 아카데미 삼성 드림클래스 삼성 스마트스쿨 등 청소년 교육 중심의 사회공헌 활동과 상생 활동을 펼치고 있다 차민영 기자
24,2021-05-10,"삼성전자, 케냐 난민촌 청소년위해 갤럭시탭 1000대 기부",케냐 카쿠마와 다답 난민촌 학교 수업서 활용 이데일리 신민준 기자 삼성전자 가 코로나 신종 코로나바이러스 감염증 로 더욱 어려워진 환경 속에서 교육을 받고 있는 난민촌 청소년들을 위해 유엔난민기구 에 태블릿 갤럭시탭 대를 기부했다 케냐 카쿠마 난민촌 그린라이트 중등학교 학생들이 갤럭시탭을 보여주고 있다 사진 유엔난민기구 이번에 기부한 갤럭시탭은 케냐의 카쿠마 와 다답 지역 난민촌에 위치한 학교와 커뮤니티 센터 곳에 전달돼 열악한 교육 환경을 개선하고 청소년들에게 양질의 교육을 제공하기 위해 활용된다 코로나 상황으로 문을 닫았던 난민촌 내 학교들은 지난 월 다시 문을 열었다 하지만 학교와 청소년들은 학용품과 수업을 위한 학습 콘텐츠를 제대로 갖추지 못하고 있다 유엔난민기구는 난민 청소년들이 다양한 디지털 프로그램 기반의 교육을 받을 수 있게 지원하는 인스턴트 네트워크 스쿨 프로그램에 삼성전자가 기부한 갤럭시탭을 사용할 계획이다 카쿠마와 다답은 전 세계에서 오래된 난민촌이 위치한 곳 중 하나다 올해 월 기준 만여 명의 난민이 머물고 있다 이 중 에 이르는 만여 명이 교육을 받으며 성장해야 할 세에서 세 사이의 아동과 청소년들이다 제임스 린치 유엔난민기구 한국 대표는 일 삼성전자의 지원을 통해 태블릿 대를 여러 학생들이 나눠써야 하는 상황이 개선됐다 며 이번 지원은 글로벌 기업이 자사의 역량을 활용해 선한 영향력을 펼친 사례다 앞으로도 삼성전자와 파트너십을 강화할 수 있기를 기대한다 라고 밝혔다 김원경 삼성전자 지속가능경영추진센터장 부사장 은 코로나 상황에서 더욱 어려움이 가중된 난민촌 청소년들이 배움을 이어갈 수 있도록 지원하게 돼 뜻깊다 고 말했다 또 청소년들이 교육의 기회에서 소외되지 않고 양질의 교육을 받을 수 있도록 하는 것은 모두를 위한 지속가능한 미래를 위해 필수 라고 덧붙였다 한편 삼성전자는 함께가요 미래로 인에이블링 피플 이라는 기업의 사회적책임 비전 아래 삼성 주니어 소프트웨어 아카데미 삼성청년 아카데미 삼성 드림클래스 삼성 스마트스쿨 등 청소년 교육 중심의 사회공헌 활동과 상생 활동을 펼치고 있다 신민준
25,2021-05-10,"[뉴스+]삼성전자 개인지분율 10% 돌파, 사실일까?",삼성전자 측 공식적인 통계는 분기별로 발표 거래소 예탁원 관련 통계 발표 자료 등 낸 적 없어 수급별 지분율 분류 기준은 제각각 이데일리 유준하 기자 이달 초 삼성전자 개인 지분율이 월 말 기준 를 돌파했다는 언론 보도가 쏟아졌다 이에 대해 한국거래소와 한국예탁결제원은 관련 자료를 낸 적이 없다고 밝혔다 삼성전자 측은 별도 주체별 집계를 하고 있지만 관련 수치에 대해선 원칙적으로 확인해줄 수 없다는 입장이다 지난 일 언론사들은 금융투자업계를 인용해 개인투자자 일명 개미들이 보유한 삼성전자 지분율이 지난달 말 기준 로 집계됐다고 보도했다 해당 보도에 쓰인 자료 출처는 예탁결제원과 한국거래소다 그러나 예탁원도 거래소도 공식적으로 관련 수치 자료를 낸 적도 확인해준 적도 없다고 밝혔다 한국거래소 관계자는 금융감독원에서 외국인 한도 관리 시스템을 운영하고 있고 저희는 해당 데이터를 표출하기 때문에 외국인 지분율만을 공시하고 있다 고 말했다 국민주가 된 삼성전자의 개인 지분율은 도대체 얼마인 것일까 그래픽 문승용 기자 금감원 거주 외국인은 외국인이 아닌 개인으로 집계 거주 외국인을 개인으로 포함하는지 외국인으로 분류하는 지에 따라 개인 지분율이 다소 달라질 수 있다 거주 외국인은 금융감독원과 거래소에서는 외국인에 포함하지 않고 기타외국인에 따로 분류를 한다 그렇기 때문에 통상적인 수급 주체인 개인 외국인 기관으로 분류할 때 거주외국인은 외국인에 포함하지 않고 개인으로 분류된다 삼성전자에서 공식 집계 후 발표하는 수급 주체는 국내 개인 국내 기관 외국인 최대주주 등인데 이 때 거주외국인은 외국인으로 분류한다 금융감독원 관계자는 외국인 법상 거주외국인은 내국민 대우를 받기 때문에 외국인으로 잡히지 않는다 며 외국인으로 잡히지 않기 때문에 거주 외국인이 개인이라면 개인으로 집계된다 고 설명했다 한국거래소 관계자는 저희가 말하는 외국인은 외국인 를 발급받은 비거주 외국인인데 이분들이 금융감독원에서 집계하는 외국인 한도 관리시스템 신고 대상 이라며 거주외국인은 외국인기타로 분류가 돼서 외국인에 포함되지 않는다 고 말했다 외국인 한도 관리시스템이란 외국인투자자 주문을 관리하는 금융감독원의 운영시스템으로 외국인투자관리시스템이라고도 불린다 지난 년 우리나라 자본시장 개방에 따라 외국인 주식투자 한도를 전산으로 관리하면서 시작됐으며 최근에는 한도 종목이 몇 안되는 만큼 투자 동향 파악을 위해 사용되는 시스템이다 한국예탁결제원 측은 금융감독원의 기준을 준용하되 증권사에서 보내주는 통계를 자체 집계한다고 설명했다 한국예탁결제원 관계자는 증권사에서 주주들 세부 명세를 취합하고 있어서 정확하게 알기는 어려우나 증권사 역시 감독원 기준을 준용하는 것으로 알고 있다 고 말했다 이에 증권업계 관계자는 집계는 거래소 자료를 토대로 진행하고 있다 고 설명했다 다시 말해 거주외국인을 외국인에 포함시키지 않는 거래소 입장과 동일한 셈이다 삼성전자 거주 외국인은 외국인으로 분류 반면 삼성전자는 국적 기준으로 거주 외국인도 외국인에 포함시킨다는 입장이다 삼성전자 관계자는 주주 구성자료는 홈페이지에 나오는 것처럼 외국인과 국내기관 국내개인 외국인으로 분류하는 만큼 거주 외국인은 외국인으로 분류한다 고 설명했다 이 같은 차이로 인해 실제 삼성전자가 자체 집계한 지분율과 예탁원 세이브로가 집계한 지분율 수치는 다소 상이하다 업계 한 관계자는 삼성전자 내부에선 지분율을 자체 집계할 때 예탁원 수치를 한 번 더 가공하는데 거주 외국인이 개인으로 잡히는 만큼 예탁원 수치가 더 크게 잡힐 때가 있는 것으로 안다 고 말했다 이에 삼성전자 측에 공식적으로 개인 지분율이 가 넘는 지 여부를 확인했으나 삼성전자 측 입장은 아직 어떤 언론사에도 확인해 준 적이 없는 만큼 공식적으로 확인해 줄 수 없다 고 밝혔다 한국예탁결제원 관계자는 세이브로 상 수급별 지분율 수치는 결산기에만 공개하고 있다 면서 분기 공개를 하지 말아달라는 상장사들의 요청이 있어 분기별 공개는 안하고 있다 개별 주주 내역을 상장사 당사들에 통보하지 않고 공개하는 게 맞지 않다는 민원이 많았었다 고 말했다 한편 삼성전자에 따르면 올해 분기말 기준 보통주 수급별 지분율은 국내 개인이 국내 기관 외국인 최대주주 등은 다 월말 기준 거주외국인을 제외한 개인 지분율이 로 기재 돼있는데다 월말이후 지난 일까지 거주외국인을 포함한 개인들이 삼성전자를 조 억원 규모로 순매수한 만큼 삼성전자의 개인 지분율은 사상 최고 수준일 것으로 추산된다 예탁결제원은 연말에만 한 차례 수급주체별 지분율을 공개하고 삼성전자는 분기단위로 수급주체별 지분율을 공시한다 오는 월 말이 되면 거주외국인을 제외한 개인의 정확한 삼성전자 보유지분율을 알 수 있을 전망이다 월말 기준 주체별 지분율 자료 삼성전자 홈페이지 유준하
26,2021-05-10,삼성전자 최고 경영진 잇딴 자사주 매입…주가 오를까?,매일경제 삼성전자 사장급 고위 경영진들이 잇따라 자사주를 매입하고 있다 분기 실적 전망치가 가파르게 상향되는 가운데 고위 임원들의 자사주 매입이 주가 상승의 신호탄이 될지 주목된다 일 금융감독원 전자공시시스템에 따르면 노태문 삼성전자 무선사업부 사장은 자사주 주를 주당 만 원에 총 억 만원 어치 매수했다고 지난 일 공시했다 같은 날 최윤호 삼성전자 경영지원실장 사장도 노 사장과 동일한 금액으로 자사주를 주 매수했다 지난달에는 김기남 대표이사 부회장이 이 회사 주식 만주를 주당 만 원에 매수했다 금액으로는 억 만원 어치다 이 회사의 사장급 임원이 자사주를 매입한 것은 지난해 월 이인용 담당 사장이 우선주를 주 매수한 이래 년여 만이다 앞서 지난 월에는 이상훈 전 이사회 의장이 주 지난해 월에는 박학규 디바이스솔루션 부문 경영지원실장 사장이 만 주 최시영 파운드리사업부장 사장이 만 주 등을 매도한 바 있다 삼성전자 주가는 지난해 월 코로나 판데믹 국면에서 만원선까지 밀렸다 월초 만원선이던 주가는 두달여 동안 랠리를 펼치면서 월 일 장중 만 원까지 올랐다 하지만 월 말 만원선으로 주가가 밀렸고 넉달째 만전자를 벗어나지 못하고 있다 이런 상황에서 삼성전자 고위 임원들이 잇따라 자사주를 사들이고 있는 것이다 경영진은 회사의 사정을 가장 잘 알기 때문에 임원들의 자사주 매입은 주가에 호재로 매도는 악재로 인식된다 최근 삼성전자의 분기 실적은 가파르게 상향 조정되고 있다 가이드 기준 삼성전자의 분기 영업이익 평균 전망치는 조 억원을 기록 중이다 지난 분기 영업이익 조 억원 지난해 분기 영업이익 조 억원을 크게 웃도는 금액이다 지난 월까지 삼성전자의 분기 영업이익 컨센서스는 조 억원이었지만 월 조 억원 월 조 억원 이달 조 억원으로 지속적으로 상향 조정되는 추세다 김동원 증권 연구원은 반도체 부문은 원가구조 개선과 평택 공장 가동에 따라 분기 영업이익이 전분기 대비 증가한 조 억원으로 전망된다 라며 삼성전자 분기 전체 영업이익은 디스플레이 부문 보상금 반영이 없어도 개 분기 만에 조원대를 회복할 것 이라고 말했다 고득관 매경닷컴 기자
