,날짜,기사제목,본문내용
0,2021-02-22,[특징주]시총 3위 놓고 네이버·LG화학 순위 싸움,헤럴드경제 이태형 기자 네이버와 화학이 시총 위 자리를 놓고 치열한 순위 싸움을 벌이고 있다 네이버는 일 개장 초반 유가증권시장에서 화학과 조원 가량 차이를 벌리며 코스피 시가총액 위에 올랐다 네이버는 오전 시 분 현재 전 거래일보다 오른 만 원에 거래되고 있다 시총은 약 조 억원이다 같은 시각 하락 중인 화학 약 조 원 을 시총에서 앞서고 있으나 격차는 줄었다 네이버는 년 월 처음 시총 위에 오른 이후 화학 등과 위 자리를 놓고 엎치락뒤치락했으나 최근에는 줄곧 화학이 위 자리를 지켰다 최근 네이버는 호실적과 쿠팡 뉴욕증시 상장에 따른 기업가치 재평가 기대 등에 힘입어 주가가 상승세를 이어갔다
1,2021-02-22,"네이버, LG화학 제치고 시총 3위 탈환",화학 의 주가가 하락하고 네이버의 주가가 상승하면서 두 기업간의 시가총액 순위가 일 뒤바뀌었다 이날 시 분 현재 유가증권 시장 시가총액 순위를 살펴보면 네이버는 조 억원으로 위를 화학은 조 억원으로 위를 기록하고 있다 같은 시각 네이버 주가는 상승하는 반면 화학은 하락하고 있다 네이버는 년 월 처음 시총 위에 올랐지만 화학 등에 자리를 내줬다가 이날 탈환했다 박지원 교보증권 연구원은 네이버는 년 거래액 조 억원으로 국내 이커머스 위 사업자 라면서 향후에도 대한통운과의 파트너십을 통해 물류 경쟁력을 갖추면서 국내 이커머스 시장의 최강자로 남을 것으로 예상한다 고 평가했다 목표주가는 만원으로 제시했다 김소희 기자
2,2021-02-22,[특징주]네이버 '파죽지세'…52주 신고가·장중 시총 3위 탈환,아시아경제 이선애 기자 네이버 가 일 장 초반 코스피 시가총액 위에 올랐다 이날 오전 시 분 현재 네이버는 전거래일대비 오른 만원에 거래중이다 장 초반 만 원까지 치솟으면서 주 신고가를 기록했다 같은 시각 시총은 조 억원으로 화학 조 억원 을 제치고 코스피 위를 차지하고 있다 네이버는 년 월 처음 시총 위에 오른 이후 화학 등과 위 자리를 놓고 엎치락뒤치락했으나 최근에는 줄곧 화학이 위 자리를 지켰다 최근 네이버는 호실적과 쿠팡 뉴욕증시 상장에 따른 기업가치 재평가 기대 등에 힘입어 주가가 상승세를 이어갔다 목표주가 상승도 이어졌다 현대차증권은 네이버의 투자의견 매수 유지와 목표주가 만원 을 유지했다 지난 일 목표주가를 기존 만원에서 만원으로 상향한 이후 일에는 이를 유지하며 인터넷 최선호주로 추천했다 김현용 현대차증권 연구원은 년이 네이버쇼핑 거래액 급증으로 인해 네이버페이가 급성장 수혜를 입은 구간이라면 년 하반기 플러스멤버십 본격 확산과 이번 네이버페이 신용결제 허용은 금융서비스 차별화가 쇼핑 거래액 고성장을 자극시키는 기제로 작용할 전망 이라면서 쇼핑에서 금융으로 금융에서 쇼핑으로의 양방향 시너지는 네이버가 경쟁 온라인 쇼핑기업들과 가장 차별화되는 포인트로 판단된다 고 설명했다 이선애 기자
3,2021-02-22,"[특징주]네이버, LG화학 제치고 시가총액 3위 탈환",시가총액 조 장중 한때 주 신고가 경신 서울경제 네이버 가 화학 을 제치고 시가총액 위를 차지했다 일 오전 시 분 현재 는 전 거래일보다 원 오른 만 원에 거래되고 있다 장중 한때 만 원까지 오르면서 주 신고가를 경신하기도 했다 장중 시가총액은 약 조 억 원이다 같은 시각 내린 화학 조 억 원 보다 높은 수준이다 네이버는 년 월 처음 시총 위에 오른 이후 화학 등과 위 자리를 놓고 경쟁을 벌여왔다 그러나 올해 들어서는 차전지 관련주 랠리가 이어지면서 화학이 줄곧 위를 석권하는 모습이었다 다만 최근 실적 상승과 쿠팡의 뉴욕 증시 상장으로 기업가치 재평가 기대감이 커지면서 네이버의 주가가 꾸준히 오르는 모습이었다 이번 달 들어 네이버 주가는 일 종가 기준 상승했다 심우일 기자
4,2021-02-22,"네이버, LG화학 제치고 장중 시총 3위 올라서",네이버가 화학을 제치고 코스피 시가총액 위를 기록 중이다 일 오전 시 분 현재 유가증권시장에서 네이버는 전 거래일 대비 원 오른 만 원에 거래되고 있다 장중 시총은 약 조 억원이다 같은 시각 화학은 약 조원으로 코스피 위를 차지하고 있다 최근 네이버는 호실적과 쿠팡 뉴욕증시 상장에 따른 기업가치 재평가 기대 등에 힘입어 주가가 상승세를 타고 있다 네이버는 년 월 처음 시총 위에 오른 이후 화학 등과 위 자리를 놓고 엎치락뒤치락했으나 최근에는 줄곧 화학이 위 자리를 지킨 바 있다 차은지 한경닷컴 기자
5,2021-02-22,"[특징주]호재 겹친 NAVER, LG화학 꺾고 시총 3위",머니투데이 김소연 기자 가 시가총액 위로 올라섰다 기존 위였던 화학이 각종 악재에 전기차 테마가 주춤한 탓에 최근 약세를 보인 영향이다 일 오전 시 분 는 전일대비 원 상승한 만 원을 나타내고 있다 외국인이 만여주 사들이고 있다 현재 시가총액은 조 억원 가량이다 반면 화학은 현재 만 원 떨어진 만 원을 나타내고 있다 시가총액은 조 억원 가량이다 외국인이 사흘 연속 순매도세를 나타내 이날도 만 여주 팔고 있다 는 빅히트와의 혈맹에 이어 호실적 쿠팡 뉴욕증시 상장을 앞두고 기업가치 재평가 등 호재가 잇따르고 있다 반면 그간 증시를 이끌어왔던 배터리 대장주 화학은 전기차 폭발에 최근 현대기아차 리콜 부담까지 겹치면서 약세를 면치 못하고 있다 다만 시가총액 격차가 억원 안팎으로 크지 않은데다 주가가 계속 변동하고 있어 이날 종가로도 가 위를 지킬지 지켜봐야 할 것으로 보인다 김소연 기자
6,2021-02-22,"네이버, '네이버 쇼핑' 가치만 25조원…목표가↑-교보",이데일리 이광수 기자 교보증권은 네이버 에 대해 국내 이커머스 위 사업자인 네이버 쇼핑 의 가치의 적정 가치가 조원으로 추산된다고 밝혔다 미국 증시에 상장하는 쿠팡의 밸류에이션을 기반으로 일부 디스카운트를 적용한 수치다 투자의견은 매수 를 유지했고 목표가는 만원에서 만원으로 상향했다 동시에 인터넷 업종 중 최선호주 로 선정했다 박지원 교보증권 연구원은 일 네이버는 작년 거래액 조 억원의 국내 이커머스 위 사업자 라며 시장 점유율은 년 년 로 년만에 포인트 증가했다 고 말했다 박 연구원은 전체 이커머스 시장 성장을 뛰어넘는 네이버쇼핑의 성공은 위주의 전략으로 스마트스토어 생태계를 조성한 덕분 이라며 또 네이버페이의 편리함과 공격적인 마케팅 높은 검색 엔진 점유율 덕분 이라고 분석했다 그는 앞으로도 이런 경쟁우위를 가져가면서 동시에 대한통운과 파트너십을 통해 물류 경쟁력을 강화하고 네이버멤버십으로 소비자 충성도를 높일 것으로 기대된다 고 말했다 쿠팡이 억달러 조원 로 뉴욕증권거래소 에 상장할 것으로 예상되는 가운데 박 연구원이 추산한 쿠팡의 적정가치는 억달러 약 조원 이다 그는 쿠팡의 예상되는 개월 선행 거래액 억달러 대비 기업가치 승수 배를 적용한 값 이라며 쿠팡의 밸류에이션을 기반으로 코스피와 자체 물류 인프라 미비에 따른 디스카운트를 적용하면 네이버 쇼핑의 적정가치는 조원 이라고 말했다 박 연구원은 네이버쇼핑은 향후에도 스마트스토어 생태계를 강화하고 대한통운과 파트너십을 통해 국내 이커머스 최강자로 남아있을 것 이라며 또 콘텐츠와 금융 산업에서는 다양한 플레이어들과 파트너십을 통해 규제리스크는 낮추면서 효율적으로 시장 내 영향력을 확대할 것 이라고 전망했다 이광수
7,2021-02-22,"""경쟁사 쿠팡보다 성장성 커··· 네이버 50만원 이상 간다""",증권사 쇼핑 금융 시너지 줄상향 이달 올라 장중 만원 돌파도 서울경제 신사업과 경쟁업체 쿠팡의 미국 상장 등으로 네이버 에 대한 재평가 기대감이 높아지고 있다 증권가에서는 특히 네이버 이커머스 부문의 성장 가능성을 높게 평가하고 있다 일 한국거래소에 따르면 유가증권시장에서 네이버의 주가는 이달에만 올라 만 원을 기록 중이다 지난 일에는 장 중 주가가 만 원을 돌파해 신고가 만 원 기록을 세우기도 했다 이달 주식시장에서는 쿠팡의 기업가치가 최대 조 원까지 인정받을 수 있다는 전망에 힘입어 경쟁 이커머스 업체들의 주가 재평가가 활발하다 특히 쿠팡과 국내 업계 위를 다투는 네이버는 쿠팡보다 총거래대금 이 높고 성장세도 비슷한 데 반해 지난달 시가총액이 조 원에 불과하다는 점이 주목 받았다 삼성증권에 따르면 지난해 쿠팡과 네이버 쇼핑의 총거래대금은 각각 조 원 조 원으로 네이버 쇼핑이 쿠팡을 웃돌며 거래액 성장률도 각각 와 로 유사한 수준이다 이에 박은경 삼성증권 연구원은 쿠팡의 지난해 거래액 대비 예상 기업 가치는 배 수준 이라며 네이버 쇼핑의 거래액은 지난해 조 원에서 올해 조 원으로 높아질 것으로 예상되는 만큼 네이버 커머스의 기업 가치는 할인률을 적용해도 최소 조 원 이상으로 평가 받을 전망 이라고 분석했다 증권가에서 제시하는 네이버의 전체 기업가치는 최대 조 원에 달한다 네이버가 금융 등 사업을 적극적으로 확장하고 있는 점도 기대 요인이다 지난 주 금융위원회는 제 차 혁신금융심사위원회에서 네이버페이의 소액 후불 결제를 혁신 금융 서비스로 지정했다 이에 네이버페이는 오는 월부터 개인별 최대 한도 만 원까지 후불 결제를 지원할 전망이다 김현용 현대차증권 연구원은 네이버페이와 스마트 스토어 판매자 대출에 이어 구매자 신용결제 지원으로 쇼핑과 금융 간의 시너지를 극대화하는 동시에 구매자와 판매자 모두 네이버 생태계에 락인시키는 효과를 낼 수 있다 고 평가했다 이에 증권사들은 네이버의 목표가를 만 원 이상으로 상향 조정하는 추세다 유안타증권은 네이버의 목표가를 기존 만 원에서 만 원까지 대폭 수정하고 나섰다 이외에도 이베스트투자증권 만 원 현대차증권 만 원 미래에셋대우 만 원 메리츠증권 만 원 등이 목표가를 올렸다 신한나 기자
