,날짜,기사제목,본문내용
0,2021-02-09,"전병성 기업은행 디지털그룹 부행장 ""올해 네이버 등 빅테크와 연계···...",막오른 은행 플랫폼 전쟁 끝 기업은행 디지털 금융의 궁극적 목적은 쉽고 편리한 고객 서비스 구현 전병성 기업은행 디지털그룹 부행장의 모습 사진 제공 기업은행 서울경제 전병성 기업은행 디지털그룹 부행장은 올해 네이버와 같은 빅테크 핀테크와 연계해 금융뿐만 아니라 유통 교육 문화 등의 분야에서 다양한 융복합 상품 서비스를 내놓을 것 이라고 밝혔다 전 부행장은 서울경제와의 서면 인터뷰에서 궁극적으로 고객이 쉽고 편리한 금융 을 제공할 것 이라며 이 같이 말했다 특히 디지털 정보기술 기업들이 밀집한 판교 테크노밸리 구로 디지털단지 담당 본부장을 역임해 디지털 기업의 특성을 잘 알고 있는 전 부행장은 혁신 기업과의 융복합을 강조했다 전 부행장은 기업은행은 디지털 혁신 기술 및 아이디어를 보유한 핀테크와 협업 기반인 퍼스트 랩 을 운영하고 있다 며 최근 이를 토대로 인공지능 부동산 자동 심사 서비스를 개발해 심사 시간을 분에서 분으로 줄였다 고 소개했다 그는 올해도 퍼스트 랩을 통해 고객 동의 없이는 광고성 문자메시지 발송이 제한되는 문자메시지 사전 검증 시스템 등 다양한 금융 혁신 사업을 추진할 계획 이라고 말했다 전 부행장은 핀테크를 포함한 외부와의 연계 강화를 위해 오픈 응용프로그램인터페이스 플랫폼 고도화도 진행하고 있다 며 은행의 다양한 금융 기능을 개방해 네이버 등과의 제휴를 통해 온오프라인 연계 서비스와 같은 융복합 서비스 상품을 출시할 것 이라고 예고했다 이를 위해서는 내부의 소통이 원활해야 한다고 봤다 전 부행장은 디지털 를 대외적으로 완성하는 것도 중요하지만 그러기 위해서는 내부 환경도 중요하다 며 직급을 떠나 자유롭게 직원들이 소통할 수 있도록 환경을 조성할 계획 이라고 말했다 그는 디지털 혁신의 가속화는 직원들의 상상력과 아이디어가 자유롭게 소통될 때 이뤄질 것 이라며 이런 환경이 조성된다면 올해는 금융시장을 선도하는 디지털 를 구현할 수 있을 것 이라고 내다봤다 이태규 기자
1,2021-02-09,네이버·카카오페이로 쇼핑 때 온라인 '소액 후불결제' 가능해진다,금융위 혁신 금융서비스 지원 후불결제 한도 만원 유력 이르면 상반기 안에 네이버페이와 카카오페이 등에서 만원 정도까지 외상으로 물건을 구입할 수 있게 된다 금융위원회는 일 제 차 디지털금융 협의회를 열어 네이버와 카카오 등 빅테크 대형 정보기술 업체 가 제공하는 온라인 쇼핑 플랫폼에서 소액후불결제를 허용하기로 결정했다 도규상 금융위 부위원장은 핀테크와 플랫폼들이 디지털금융 혁신을 위한 신사업이 빠르게 뿌리내릴 수 있도록 과감한 규제 개선을 주문해 왔다 며 플랫폼을 통한 소액후불결제 등 새롭고 혁신적인 금융 서비스가 신속히 출시될 수 있도록 적극 지원하겠다 고 말했다 지금까지 네이버 등에서 물건을 살 때는 선불 방식만 허용됐다 현금을 미리 넣어두고 그 안에서만 소비하는 방식이다 정부는 지난해 월 디지털금융 종합혁신방안을 통해 네이버페이 등에서 만원까지 소액후불결제가 가능하도록 하겠다고 발표했지만 신용카드업계의 반발로 진행되지 못했다 비록 소액이지만 빅테크들의 신용카드업 진출에 물꼬를 터주는 것이기 때문이다 카드사들은 신용평가도 제대로 하지 않고 외상 거래를 허용해서는 안 된다고 주장해 왔다 금융위는 쇼핑 플랫폼에서 후불결제가 이뤄질 수 있도록 두 가지 방안을 내놨다 먼저 전자금융법 개정이 필요한 사안이지만 일정 기간 동안 규제를 유예해주는 규제 샌드박스 를 통해 서비스를 미리 허가해주기로 했다 금융위는 이달 안에 혁신금융심사위원회를 거쳐 후불결제를 허용할 계획이다 신용평가가 제대로 이뤄지지 않는다는 지적에는 네이버와 카카오 등이 보유한 비금융 데이터를 바탕으로 자체 평가하도록 했다 금융위는 사회 초년생이나 주부 등 금융거래 기록이 별로 없는 금융취약계층도 후불결제 서비스를 이용할 수 있을 것으로 기대하고 있다 후불결제 한도는 만원이 유력하지만 구체적인 금액은 혁신금융심사위원회에서 결정된다 업계에서는 이르면 상반기에 플랫폼 소액후불결제가 가능해질 것으로 예상하고 있다 박종서 기자
2,2021-02-09,"네이버페이도 외상 거래 되나요…""30만원까지 OK""",이르면 상반기에 소액후불결제 허용 이르면 상반기 안에 네이버페이와 카카오페이 등에서 만원 정도까지 외상으로 물건을 구입할 수 있게 된다 금융위원회는 일 제 차 디지털금융 협의회를 열어 네이버와 카카오 등 빅테크 대형 정보기술 업체 가 제공하는 온라인 쇼핑 플랫폼에서 소액후불결제를 허용하기로 결정했다 도규상 금융위 부위원장은 핀테크와 플랫폼들이 디지털금융 혁신을 위한 신사업이 빠르게 뿌리내릴 수 있도록 과감한 규제개선을 주문해 왔다 며 플랫폼을 통한 소액후불결제 등 새롭고 혁신적인 금융 서비스가 신속히 출시될 수 있도록 적극 지원하겠다 고 말했다 지금까지 네이버 등에서 물건을 살 때는 선불방식만 허용됐다 현금을 미리 넣어두고 그 안에서만 소비하는 방식이다 정부는 지난해 월 디지털금융 종합혁신방안을 통해 네이버페이 등에서 만원까지 소액후불결제가 가능하도록 하겠다고 발표했지만 신용카드업계의 반발로 진행되지 못했다 비록 소액이지만 빅테크들의 신용카드업 진출에 물꼬를 터주는 것이기 때문이었다 카드사들은 신용평가도 제대로 하지 않고 외상 거래를 허용해서는 안 된다고 주장해 왔다 금융위는 쇼핑 플랫폼에서 후불결제가 이뤄지도록 하기 위해 두 가지 방안을 내놨다 먼저 전자금융법 개정이 필요한 사안이지만 일정 기간 동안 규제를 유예해주는 규제 샌드박스 를 통해 서비스를 미리 허가해주기로 했다 금융위는 이달 안에 혁신금융심사위원회를 거쳐 후불결제를 허용할 계획이다 신용평가가 제대로 이뤄지지 않는다는 지적에는 네이버와 카카오 등이 보유한 비금융 데이터를 바탕으로 자체 평가를 하도록 했다 금융위는 사회 초년생이나 주부 등 금융거래 기록이 별로 없는 금융취약계층도 후불결제 서비스를 이용할 수 있을 것으로 기대하고 있다 후불결제 한도는 만원이 유력하지만 구체적인 금액은 혁신금융심사위원회에서 결정된다 업계에서는 이르면 상반기에 플랫폼 소액후불결제가 가능해질 것으로 예상하고 있다 또한 금융위는 예금보험공사가 오는 월 일부터 시행하는 착오송금 반환제도 대상에 은행은 물론 토스와 카카오페이 등 선불전자지급 수단까지 포함했다 착오송금 반환제도는 송금자 실수로 엉뚱한 계좌에 보낸 돈을 예보가 대신 수취인으로부터 돌려받아주는 제도다 토스와 카카오페이의 경우 예보가 수취인 이름과 주민등록번호를 파악할 수 있을 때 가능하다 연락처를 통한 송금이나 회원 간 송금 등에는 반환 지원이 제한될 수 있다 박종서 기자
3,2021-02-09,사회 초년생·주부도 네이버·카카오 '후불결제' 쓴다,속도내는 포용금융 제 차 디지털금융협의회 비금융 데이터로 이용 가능해져 핀테크 오픈뱅킹 일괄등록 허용 서울경제 앞으로 사회 초년생 주부 등 신용도가 상대적으로 낮은 금융 취약 계층도 비 금융 데이터를 바탕으로 후불결제 서비를 이용할 수 있게 된다 또 핀테크 애플리케이션에서도 일일이 계좌 입력을 하지 않아도 오픈뱅킹을 이용할 수 있게 된다 금융위원회와 금융감독원은 일 제 차 디지털금융협의회를 열고 이 같은 내용의 제도 개선 과제를 논의했다고 밝혔다 금융 당국은 핀테크 금융 기술 빅테크 대형 정보통신 기업 등이 건의한 과제 건 중에 건 을 즉시 수용하고 개선하기로 했다 우선 당국은 플랫폼을 통한 소액 후불결제 서비스를 허용하기로 했다 관련 법 개정 전이지만 네이버페이와 카카오페이 등 간편결제 업체가 소비자 보호 등 충분한 요건을 갖췄다면 금융 규제 샌드박스 규제 유예제도 심사 등을 통해 후불 서비스 등을 개시할 수 있도록 한 것이다 네이버파이낸셜은 일찍이 후불결제 서비스를 신청한 후 최종 승인을 기다리고 있다 혁신금융심사위원회와 금융위 정례회의를 통과하면 간편결제 업체 중 가장 먼저 후불결제 서비스를 개시할 수 있게 된다 이와 함께 신용도가 상대적으로 낮은 금융 취약 계층도 온라인 쇼핑 등 플랫폼이 축적한 비금융 정보로 후불결제 서비스를 이용할 수 있게 됐다 금융 당국은 또 태스크포스 논의를 바탕으로 올해 상반기 중 망분리 규제 합리화 방안을 추진한다 기업의 리스크 관리 능력 고객 정보 분리 여부 업무 성격 등에 따라 망분리 규제를 합리적으로 적용하는 방안을 마련할 계획이다 오픈뱅킹 참여 기관의 정보 공유 범위도 확대된다 카드사는 결제 예정 금액 결제 계좌 등을 핀테크는 선불 계정 잔액 거래 내용 등을 제공한다 어카운트인포 서비스와 오픈뱅킹 간 연계도 추진된다 핀테크 이용 고객도 오픈뱅킹 계좌 등록 시 일일이 계좌를 입력하지 않아도 일괄 등록이 가능해지는 것이다 마이데이터 본인신용정보관리업 사업에 진출하려는 중소 핀테크의 경우 중계 기관의 응용프로그램 인터페이스 이용이 가능해진다 이지윤 기자
4,2021-02-09,네이버·카카오도 후불결제 가능해진다,머니투데이 박준식 기자 일 화 오후 판교 스타트업캠퍼스 층 컨퍼런스홀에서 열린 스타트업캠퍼스 창업교육 입학식 에서 김범수 스타트업캠퍼스 총장이 환영사를 하고 있다 사진제공 경기도 정부가 핀테크 빅테크 제도개선 및 현장애로 해소방안으로 전자금융거래법상 일정 요건을 갖춘 전자금융업자에 대해 소액 후불결제 기능을 허용하기로 했다 네이버나 카카오 등 일정 규모를 갖춘 전자금융업자는 카드사처럼 선불전자지급수단으로 재화 용역을 구매하려는 소비자가 잔액 부족시에도 일정한 한도 내에서 후불결제를 제공할 수 있게 되는 것이다 금융위원회는 일 도규상 부위원장 주재로 올해 첫 디지털금융 협의회 차 를 열어 핀테크와 플랫폼 기업을 통한 디지털금융 혁신 과제를 논의했다 도 부위원장은 핀테크와 기존 금융회사 간 원활한 협업이 이루어지도록 하겠다 며 협업은 디지털금융 혁신을 위한 매우 중요한 기반이나 현장에서는 핀테크 투자시 법적근거가 미약하고 접점이 부족해 긴밀한 협업이 쉽지 않다는 많은 목소리가 있었다 고 지적했다 서울 뉴시스 전진환 기자 도규상 금융위원회 부위원장이 일 서울 여의도 국회 본관 호에서 열린 국회 정무위원회 법안심사제 소위원회 회의에 첫 출석 인사말을 전하고 있다 공동취재사진 정부는 우선 금융규제 샌드박스 를 통해 업계에서 건의된 전자금융업자에 대한 소액 후불결제를 허용 전금법 개정안 발의를 수용해 법 개정 전까지 소비자 보호 조치 등 일정 요건을 갖춘 기업에 대해 소액후불결제 업무를 할 수 있도록 혁신금융서비스를 지정하기로 했다 이를 통해 청년이나 사회초년생 등 금융소외 계층의 디지털금융 접근성을 높이고 핀테크 기업 등이 혁신적인 금융서비스 출시할 수 있는 환경을 조성하겠다는 목표다 정부는 마이데이터 중계기관을 이용할 수 있는 자의 범위 확대를 요하는 안건에 대해선 사업자 중 중 소 핀테크 기업은 중계기관을 이용할 수 있도록 감독규정 개정 추진하기로 했다 중 소 핀테크 기업이 자체적으로 시스템을 구축 운영해야 하는 비용 부담을 경감할 수 있는 조치다 정부는 더불어 마이데이터 통합인증 체계 구축을 위한 지원에도 나선다 한 번의 인증으로 여러 금융회사에 전송요구가 가능해져 소비자 편의가 커지고 마이데이터 사업자의 사용자환경 개발부담이 경감될 수 있다는 판단이다 금융사의 망분리 규정 개선에 관련해선 월부터 금융회사 핀테크기업 등과 함께 망분리 합리화 태스크포스 를 운영할 계획이다 금융보안이 지켜지는 동시에 금융사의 기반 구축이 원활히 이루어지는 환경을 조성할 수 있다는 취지다 금융위는 지난해 월부터 차례에 걸친 핀테크 빅테크 간담회를 통해 총 개의 제도개선 건의과제를 발굴했다 이 중 건의 수용과제는 즉시 제도개선에 착수했고 금융이용자에 미치는 영향 등 점검이 필요하거나 타 부처 등의 협의가 필요한 개 중장기 검토과제는 개선방안을 논의하기로 했다 마지막으로 당장 추진하기 어려운 나머지 개 수용곤란 과제들은 디지털 환경이나 여건 변화시 추진될 수 있도록 지속 관리하고 필요시 검토를 재개하기로 했다 박준식 기자
