,날짜,기사제목,본문내용
0,2021-03-23,"네이버·카카오·엔씨, 직원 평균 연봉 ‘1억 클럽’ 가입",삼성전자 억 만원으로 업계 최고 다음은 이데일리 노재웅 기자 지난해 코로나 로 인한 비대면 특수를 누린 기업들이 직원들에게도 제대로 공을 돌린 모습이다 일 각사 사업보고서에 따르면 네이버 카카오 엔씨소프트 는 지난해 처음으로 직원 평균 연봉이 억원을 넘어섰다 네이버는 지난해 직원 평균 연봉이 억 억원으로 년 만원에서 증가했다 카카오는 년 만원에서 오른 억 만원을 엔씨는 만원에서 증가한 억 억원을 기록했다 직원 평균 연봉이 만원이었던 세 회사 모두 단번에 억 클럽 에 가입한 것이다 삼성전자 는 억 만원으로 업계 최고 수준의 대우를 지켰고 텔레콤 은 오른 억 만원을 기록하며 뒤를 이었다 이 밖에도 넥슨이 전 직원 연봉 만원 일괄 인상으로 먼저 공을 띄운 것을 시작으로 크래프톤 개발직 만원 넷마블 컴투스 게임빌 만원 인상 등 게임업계에는 연봉 릴레이 연상이 지금도 계속 이어지고 있다 업계의 이러한 연봉 인상에는 역대 최고 수준의 실적을 낸 것이 결정적인 역할을 했다 네이버는 지난해 전년 대비 증가한 조 억원의 영업이익을 올렸고 카카오는 늘어난 억원을 기록했다 넥슨은 게임업계 최초로 연매출 조원을 돌파했고 엔씨와 넷마블 역시 사상 최고 매출을 기록했다 노재웅
1,2021-03-23,"네이버, 5643억원 규모 ‘ESG 채권 발행’…韓 인터넷 기업 최초",인터넷 기업 최초 채권으로 글로벌 데뷔 지속가능 채권 으로 친환경 사회공헌 프로젝트 진행 억 달러 규모 년 만기 외화 채권 연 금리 헤럴드경제 헤럴드경제 김민지 기자 네이버가 년 만기 억달러 한화 약 억원 규모의 외화 환경 사회 지배구조 채권을 연간 금리로 발행했다고 일 밝혔다 데뷔 채권을 채권으로 발행한 건 전세계 인터넷 기업 중 네이버가 최초다 채권은 사회적 책임 투자를 목적으로 발행되는 특수목적 채권이다 네이버가 이번에 발행한 것은 지속가능 채권 으로 친환경 사업 분야에 활용되는 녹색 채권과 사회 문제 해결에 사용되는 사회적 채권을 결합해 포괄적으로 사용할 수 있는 채권이다 네이버는 지난 일 일 이틀간 개 기관 명 이상의 글로벌 기관투자자를 대상으로 투자자 로드쇼를 개최해 네이버의 이니셔티브를 홍보했다 그 결과 일 해외시장에서 진행한 수요 예측에서 모집금액의 배 이상인 억달러 규모의 자금이 밀려들어 가산금리를 로 축소하는 데 성공했다고 설명했다 이는 한국 민간 기업이 발행한 년 만기 외화채 사상 가장 낮은 가산금리이다 네이버는 이번 지속가능 채권을 통해 조달한 자금을 친환경 프로젝트와 사회공헌 프로젝트를 중심으로 한 경영 강화에 주로 활용할 예정이라고 밝혔다 친환경 분야에서는 현재 건축 중인 세종 제 데이터센터 와 분당 제 사옥 에 대한 에너지 절감 재생 에너지 사용 등 최첨단 친환경 기술 적용이 핵심이다 또한 대한통운과 탄소를 절감시킬 수 있는 친환경 물류 일괄 대행 풀필먼트 서비스 친환경 택배박스 제작도 추진 중이다 사회공헌 분야는 디지털 활용능력 리터러시 강화 코로나 바이러스 위기 대응 지원 중소상공인 창작자 스타트업 상생 양성평등 저소득층 고용 등을 중심으로 진행될 예정이다 세부적으로는 디지털 접근성이 약하거나 코로나 로 인해 피해를 본 를 대상으로 다양한 지원 또는 교육 프로그램 등을 준비 중이다 박상진 네이버 는 지속가능 채권을 통해 조성된 이번 자금을 통해 네이버의 비즈니스 경쟁력인 친환경적인 생태계 조성부터 친환경 인프라 조성 파트너 지원 확대 등에 활용할 계획 이라며 경영을 위한 네이버의 다양한 노력들을 글로벌 투자자들에게 투명하고 적극적으로 알리고 국내 대표 친환경 인터넷 기업으로서의 위상도 제고할 것으로 기대한다 고 말했다 한편 네이버는 지난해 이사회에 위원회와 관련한 전담 부서를 구축하고 년까지 탄소배출량 감축을 위한 카본 네거티브 정책을 발표하는 등 경영을 지속적으로 강화하고 있다
2,2021-03-23,"네이버, 5억 달러 규모 외화 ESG 채권 발행",글로벌 기업 최초 년 만기 채권 연 친환경 사회공헌 프로젝트 등 경영에 활용 파이낸셜뉴스 네이버는 억 달러 규모 약 억 원 로 년 만기 외화 채권인 지속가능 채권 을 연간 금리로 발행했다고 일 밝혔다 전 세계 인터넷 기업 중 첫 채권을 채권으로 발행하는 것은 네이버가 최초다 연간 금리 역시 한국 민간 기업이 발행한 년 만기 외화채 사상 가장 낮은 수치다 네이버 네이버는 지난 일부터 일까지 이틀간 개 기관 명 이상 글로벌 기관투자자를 대상으로 투자자 로드쇼를 개최했다 해외시장에서 진행한 수요 예측에서 모집금액의 배 이상인 억 달러 약 조 억 원 가 모여든 것으로 전해졌다 네이버가 발행한 채권은 사회적 책임 투자를 목적으로 발행되는 특수목적 채권이다 친환경 사업 분야에 활용되는 녹색 채권 사회 문제 해결에 사용되는 사회적 채권 녹색 채권과 사회적 채권의 목적을 결합해 포괄적으로 사용할 수 있는 지속가능 채권 등으로 구분된다 네이버는 이번 지속가능 채권을 통해 조달한 자금을 친환경 및 사회공헌 프로젝트를 중심으로 한 경영 강화에 활용할 예정이다 는 환경 사회 지배구조 를 통칭한다 네이버는 현재 건축 중인 세종 제 데이터센터 와 분당 제 사옥 관련 에너지 절감과 재생 에너지 사용 등 최첨단 친환경 기술을 적용하고 있다 또 대한통운과 탄소를 절감시킬 수 있는 친환경 물류 일괄 대행 풀필먼트 서비스와 친환경 택배박스 제작도 추진 중이다 사회공헌 분야에서는 디지털 활용능력 강화 코로나 위기 대응 지원 중소상공인 창작자 스타트업 상생 양성평등 저소득층 고용 등을 중심으로 진행할 예정이다 또 디지털 접근성이 약하거나 코로나 로 인해 피해를 본 나 소상공인들을 대상으로 다양한 지원 또는 교육 프로그램 등을 준비하고 있다 박상진 네이버 최고재무책임자 는 지속가능 채권을 통해 조성된 자금을 친환경적인 생태계 조성 친환경 인프라 조성 파트너 지원 확대 등에 활용할 계획 이라면서 경영을 위한 네이버의 다양한 노력들을 글로벌 투자자에게 투명하게 적극 알리고 친환경 인터넷 기업으로서 위상도 제고할 것으로 기대한다 고 전했다 한편 네이버는 경영을 지속적으로 강화하고 있다 지난해 이사회 내 위원회와 관련 전담부서 구축을 마쳤다 또 오는 년까지 탄소배출량 감축을 위한 카본 네거티브 정책도 발표했다 코로나 로 배송량이 급증한 상황 속에 동네시장 장보기 입점 가게들을 대상으로 만여 장의 생분해성 수지로 제작된 친환경 봉투를 지원했다 지난 년 완공된 춘천 데이터센터 각 에는 이미 태양광 재생 에너지 등 친환경 첨단 기술을 적용해 에너지 절감을 극대화하고 있다 네이버 카본네거티브 김미희 기자
3,2021-03-23,"네이버, '5억 달러' 외화 ESG 채권 발행…모집액 6배 몰려",머니투데이 이동우 기자 사진 뉴시스 네이버 가 첫 외화채권 발행에 성공했다 모집액의 배가 넘는 수요를 모으며 글로벌 기업으로서의 잠재력을 인정받았다 네이버는 억 달러 한화 약 억원 규모의 년 만기 외화 채권 지속가능 채권 을 연간 금리로 발행했다고 일 밝혔다 네이버는 지난 일부터 이틀간 개 기관 명 이상의 글로벌 기관투자자를 대상으로 투자자 로드쇼를 개최했다 전날 해외시장에서 진행한 수요예측에서 모집금액의 배 이상인 억달러 규모의 자금이 모였다 투자 수요가 쏟아지며 네이버는 가산금리를 로 축소하는 데 성공했다 한국 민간 기업이 발행한 년 만기 외화채 사상 가장 낮은 가산금리다 채권은 사회적 책임 투자를 목적으로 발행하는 특수목적 채권으로 친환경 사업 분야에 활용되는 녹색 채권 사회 문제 해결에 사용되는 사회적 채권 앞선 두 가지 목적을 결합해 포괄적으로 사용할 수 있는 지속가능 채권 등으로 구분된다 이번 지속가능 채권을 통해 조달한 자금을 친환경 프로젝트와 사회공헌 프로젝트를 중심으로 한 경영 강화에 주로 활용한다는 계획이다 친환경 분야에서는 현재 건축 중인 세종 제 데이터센터와 분당 제 사옥에 대한 에너지 절감 재생 에너지 사용 등 최첨단 친환경 기술이 적용된다 대한통운과 탄소를 절감시킬 수 있는 친환경 물류 일괄 대행 서비스 친환경 택배박스 제작도 추진 중이다 사회공헌 분야는 디지털 활용능력 강화 코로나 위기 대응 지원 중소상공인 창작자 스타트업 상생 양성평등 저소득층 고용 등을 중심으로 진행될 예정이다 박상진 네이버 최고재무책임자 는 채권을 통해 조성된 이번 자금을 통해 네이버의 비즈니스 경쟁력인 친환경적인 생태계 조성부터 친환경 인프라 조성 파트너 지원 확대 등에 활용할 계획 이라며 국내 대표 친환경 인터넷 기업으로서의 위상도 제고할 것으로 기대한다 고 말했다 한편 네이버는 지난해 이사회 내 위원회와 관련 전담부서 구축을 마쳤다 년까지 탄소배출량 감축을 위한 카본 네거티브 정책을 발표하기도 했다 이동우 기자
4,2021-03-23,"CJ→네이버→KT 합류한 김철연 대표 “KT그룹 콘텐츠 사업, 가슴 설...",김철연 스튜디오지니 대표 첫 행사 참여 그룹의 콘텐츠 사업 황금알을 낳는 거위 보수적 참 억울할 것 같다 청바지 차림 구현모 와 로봇 콘텐츠 등에서 인재 영입 이데일리 김현아 기자 김철연 스튜디오지니 공동대표 통신사 텔코 에서 디지털플랫폼사업자 디지코 로 변신을 선언한 지난해 월 구현모 대표가 디지코 로의 변신을 선언한 뒤 인재 영입이 잇따르고 있다 이번에 그룹의 콘텐츠 기획 제작 유통 법인인 스튜디오지니의 공동 대표가 된 김철연 대표도 그 중 한 명이다 김 대표는 과 에서 콘텐츠 기획 제작 글로벌 사업을 여년 간 맡다가 지난해 월 한성숙 네이버 대표의 제안으로 네이버에 합류했다 그리고 년만에 다시 스튜디오지니로 이직했다 년 월 이 스웨덴 방송 저작권 배급사 에코라이츠 의 경영권을 인수해 유럽 시장 네트워크를 강화한 것도 그의 작품이다 일 열린 그룹의 미디어 콘텐츠 전략 발표 간담회에 참석한 김철연 대표 그에게 네이버를 떠난 이유와 에 합류한 이유 그리고 네이버와 의 기업문화에 대한 생각을 물었다 그룹의 콘텐츠 사업 황금알을 낳는 거위 김철연 스튜디오지니 대표는 네이버에서 만 년 근무했다 원래 생각은 조금 더 있고 싶었는데 에서 콘텐츠 사업을 강화한다는 이야기를 들었을 때 스튜디오지니가 하나의 제작사가 아니고 그룹사업으로 시너지는 내는 구조를 상상하니 정말 가슴이 뛰고 한번 해보고 싶었다 고 말했다 그는 년 동안 에서 제작 채널 편성 마케팅 유통 글로벌 사업까지 모든 일을 했다 며 이 경험들을 한 데 모아 정말 한번 콘텐츠의 성과를 이뤄내고 싶다 처음 황금알을 낳는 거위라고 생각하게 됐고 처음 설렘을 느꼈다 고 부연했다 보수적 참 억울할 것 같다 네이버와의 기업 문화 비교에 대해서는 말을 아꼈다 김 대표는 조금 대답하기 민감한데 에 대해서만 말씀 드리겠다 면서 에서 느낀 것은 참 억울 할 것 같다 는 좀 느리지 않아 너무 보수적이지 않아 라고 하는 말을 간혹 들었다 고 했다 그러면서 제가 달 동안 느낀 는 굉장히 빠르고 탄력적이고 융통성있고 어떻게 하면 국민기업 답게 일할지 고민하는 등 따뜻했다 면서 네이버와 기업 문화 비교 등 자세한 답변은 년 쯤 지나서 하겠다 고 부연했다 함께 참석한 구 대표도 저도 억울한 사람 중 한 사람 이라고 해서 통신사로서의 견고한 이미지가 디지털 플랫폼 사업을 하는데 장애가 되고 있음을 인정하기도 했다 기자간담회에 참석한 구현모 대표가 인사말을 하고 있다 맨 왼쪽부터 순서대로 부문장 강국현 사장 구현모 대표 스튜디오지니 김철연 윤용필 공동 대표가 취재진의 질문에 답변하고 있다 청바지 차림 구현모 와 로봇 콘텐츠 등에서 인재 영입 이날 기자회견에 참석한 구현모 대표 강국현 커스터머부문장 김철연 스튜디오지니 공동대표 윤용필 스튜디오지니 공동대표는 모두 청바지 차림으로 참석했다 구 대표는 디지코 디지털 플랫폼 기업 로의 변신을 선언한 뒤 분야 배순민 소장 김철연 스튜디오지니 대표 이상호 로봇사업단장 케이뱅크 서호성 행장 비씨카드 최원석 대표 등 인재들을 많이 영입했다 며 그룹사 리스트럭처링도 계획대로 진행되고 있다 미디어는 디지코로 가는데 가장 중요한 플랫폼이다 이제 미디어 플랫폼 위에 콘텐츠를 더해 새롭게 더 도약하고 디지코로 변하려 한다 의 기업가치 향상에 도움이 될 것 이라고 말했다 는 앞서 네이버 출신 리더 의 배순민 박사를 융합기술원 내 신설 조직인 연구소장에 코리아에서 사업부를 총괄했던 이상호 상무를 융합사업부문 로봇사업단장에 선임했다 케이뱅크 새 행장에는 서호성 한국타이어앤테크놀로지 부사장 비씨카드 신임 사장에는 최원석 에프앤자산평가 대표를 선임했다 김현아
5,2021-03-23,“휴대폰 고장난 줄” 카톡·네이버 작동 오류…구글 “확인중”,이데일리 노재웅 기자 일 오전 동안 삼성전자 갤럭시 등 일부 안드로이드 스마트폰 사용자들이 카카오톡과 네이버 등 일부 앱이 중단되는 접속 장애를 겪은 가운데 삼성전자 가 긴급공지로 해결책을 안내했다 해당 문제는 구글 시스템 앱 문제로 안드로이드 최신 버전 업데이트 중 안드로이드 시스템 웹뷰 가 충돌 문제를 일으킨 것으로 현재까지 파악되고 있다 삼성전자는 삼성멤버스 앱 내 공지사항을 통해 앱 오류 시 조치 방법을 소개했다 삼성은 카카오톡 증권앱 네이버 등의 앱 실행 시 바로 꺼지는 현상이 발생할 경우 설정 애플리케이션 안드로이드 시스템 웹뷰 선택 더보기 업데이트 삭제 등의 조치를 취해야 한다고 안내했다 안드로이드 시스템 웹뷰가 검색되지 않을 경우에는 설정 애플리케이션 크롬 선택 더보기 업데이트 삭제 등의 조치를 취하면 된다 안내를 따랐지만 오류가 해결되지 않는 소비자들도 상당한 것으로 알려졌다 해당 오류를 겪은 한 고객은 안내대로 해봤지만 도저히 해결이 되지 않아 결국 카카오톡 앱을 완전 삭제한 뒤 다시 설치했다 며 내 스마트폰이 고장 난 줄 알고 센터에 문의하기도 했다 고 전했다 구글코리아 관계자는 웹뷰 관련 장애로 인해 일부 이용자의 안드로이드에서 일부 앱이 다운되는 현상이 나타나고 있다 구글은 현재 문제를 인지하고 해결책을 강구하고 있다 며 결과가 나오는 대로 공지하겠다 고 밝혔다 노재웅
6,2021-03-23,"""네이버·쿠팡이츠, '배민' 상대 못된다"" 공정위의 거절",머니투데이 세종 유선일 기자 음식배달 애플리케이션 앱 시장에서 쿠팡이츠 나 네이버 가 배달의민족 이나 요기요 를 위협하는 경쟁자가 될까 음식 배달앱 요기요의 운영사 딜리버리히어로가 배달의민족 운영사 우아한형제들 인수를 추진하면서 핵심 경쟁사로 네이버 쿠팡이츠를 지목했지만 공정거래위원회는 이를 인정하지 않은 것으로 나타났다 그러면서 공정위는 아무런 조건 없이 인수를 승인하면 배민이 수수료 체계 개편 을 재추진할 가능성이 있다고 판단한 것으로 확인됐다 지난해 초 배민 입점 음식점의 강한 반발을 불러 일으킨 수수료 사태 가 재발할 수 있다는 것이다 쿠팡이츠 네이버 경쟁 압력 불확실 서울 뉴스 박지혜 기자 서울 종로구 일대에서 배민과 요기요 배달원들이 근무하고 있다 뉴스 일 공정위의 와 우아한형제들 간 기업결합심사 의결서 를 확인한 결과 와 우아한형제들은 심사 과정에서 쿠팡이츠 네이버가 이미 상당한 경쟁 압력으로 작용하고 있다 며 기업결합으로 인한 시장경쟁 제한 우려는 크지 않다 고 주장했다 의결서는 공정위 심의 결과를 담은 판결문 이다 공정위는 지난해 월 요기요 매각 을 조건으로 의 우아한형제들 인수를 승인하고 지난달 해당 의결서를 측에 발송했다 우아한형제들의 주장은 해당 인수가 이뤄지면 자사가 당장은 배달앱 시장을 독과점 년 거래금액 기준 할 수 있지만 네이버 쿠팡이츠와 치열하게 경쟁하는 상황이라 폐해 우려가 작다는 점을 강조한 것으로 풀이된다 우아한형제들은 쿠팡이츠에 대해 출시 년 만에 폭발적으로 성장하고 있다 서비스 범위를 전국으로 확대하고 있어 년 내 전국 서비스가 가능할 것 이라고 평가했다 배달앱과 검색엔진의 연계 서비스인 간편주문 을 제공하는 네이버에 대해서는 막강한 자금력을 보유하고 있다 특정 사유가 해제되면 배달앱 시장에 진입할 것으로 예상된다 고 주장했다 그러나 공정위는 이런 주장을 받아들이지 않았다 현 상황에서 네이버 쿠팡이츠를 의미 있는 경쟁자라고 보기 어렵고 향후 변화를 예측하기도 힘들다는 것이다 쿠팡이츠의 경우 시장 점유율이 낮고 년 내 시장 경쟁 양상을 변화시킬 정도로 성장할지 전망이 불확실하다고 밝혔다 아울러 쿠팡이츠가 계속 적자를 내고 있으며 주문 밀도가 높아야 수익성이 확보되는 사업모델 특성상 전국 단위에서 경쟁력을 유지할 수 있을지는 알 수 없다고 평가했다 공정위는 네이버에 대해서는 간편주문 과 같은 사업모델로 배달앱 관리 등 비용을 충당할 만큼 안정적 수익 확보가 가능할지 의문이라고 분석했다 네이버 간편주문의 거래 실적이 미미하고 검색엔진 페이 등 연관 서비스와 시너지도 발휘하지 못하고 있어 등에 충분한 경쟁압력을 행사할 수 있을지 불분명하다고 평가했다 아울러 네이버가 배달앱 시장에 본격 진출할지 여부도 불확실하다고 봤다 수수료 사태 재발할라 서울 마포구 배민라이더스 중부지사에 배달 오토바이가 줄지어 서있다 사진 이기범 기자 공정위는 의 우아한형제들 인수가 이른바 배민 수수료 사태 재발로 이어질 가능성이 있다고 판단했다 배민은 지난해 초 입점 음식점으로부터 받는 수수료 과금 체계를 정액제에서 정률제로 변경하려다가 사실상 수수료 인상 이라는 반발에 부딪혀 계획을 철회한 바 있다 공정위에 따르면 배민의 주요 수입원은 입점 음식점으로부터 매달 받는 일정 금액의 수수료다 반면 요기요는 주문금액에 비례해 수수료를 받고 있다 정액제는 거래액 증가를 매출로 연결시킬 수 없는 근본적 한계가 있어 거래 규모가 가장 큰 배민에 불리한 수수료 체계라는 것이 공정위 분석이다 공정위에 따르면 배민은 안정적 수익 확보를 목적으로 년 정률제 기반 사업 모델로 개편을 모색 배달앱 화면 최상단 광고에 대해 주문 건당 일정 비율 수수료를 부과하는 오픈리스트 상품을 출시했다 지난해 월에는 오픈리스트 를 확대 개편한 오픈서비스 를 출시해 본격적으로 정률제로 개편을 추진했다 그러나 여론이 악화되면서 출시 일 만에 계획을 잠정 철회했다 공정위는 요기요의 존재는 배민이 그간 자사에 불리한 수익 모델을 쉽게 변경할 수 없도록 만드는 제약 요인으로 작용했다 며 배민과 요기요가 계열사가 되면 배민은 요기요의 경쟁 압력으로부터 벗어날 수 있어 가까운 시일 내에 정액제를 정률제로 개편할 유인은 더욱 강화될 것으로 보인다 고 밝혔다 아울러 그동안 배민이 정률제로 수익 모델을 개편하고자 한 근본적 이유가 수익성을 개선하기 위함이라는 점을 고려할 때 배민과 요기요가 계열사가 되면 음식점 그룹 전체가 부담하는 실질 수수료율이 인상될 것이라고 보는 것이 타당하다 고 설명했다 세종 유선일 기자
