,날짜,기사제목,본문내용
0,2021-05-12,"카카오엔터, 유희열 기획사 지분투자 '음악·영상 협업'",페퍼톤스 정승환 등 소속 카카오 콘텐츠 시너지 카카오엔터테인먼트가 가수 유희열씨가 대표를 맡고 있는 연예기획사 안테나 지분 일부를 사들이고 음악과 영상 콘텐츠 협업에 나선다 카카오엔터테인먼트 컴퍼니는 안테나 지분 를 인수하는 계약을 체결하고 이를 포함한 전략적 투자를 단행했다고 일 밝혔다 카카오엔터테인먼트 안테나 사진 카카오엔터테인먼트 제공 두 회사는 아티스트를 발굴 육성하고 음악 영상 콘텐츠 사업에서 긴밀한 협업을 이어갈 방침이다 안테나에는 정재형 루시드폴 페퍼톤스 정승환 권진아 샘김 적재 등 실력파 뮤지션들이 소속되어 있다 카카오엔터테인먼트는 안테나 소속 아티스트들과 함께 영화 및 카카오 오리지널 예능 드라마 등 영상 콘텐츠 사업에서 새로운 시너지를 낼 것으로 기대하고 있다 카카오엔터테인먼트 관계자는 카카오엔터테인먼트는 멀티 레이블 체제를 운영하며 글로벌 아이돌 보컬리스트 프로듀서 등 다양한 장르로 레이블을 확대해왔다 며 안테나와의 파트너십을 바탕으로 더욱 새롭고 다양한 시도를 통해 음악과 영상 콘텐츠 사업의 경쟁력을 강화해나갈 것 이라고 말했다 안테나 관계자는 이번 파트너십이 대중음악시장의 장르별 산업을 탄탄하게 확장시킬 수 있는 기회가 됐으면 한다 며 좋은 사람 좋은 음악 을 추구하는 안테나의 고유한 정서를 살리면서 적극적으로 콘텐츠 사업을 넓혀나갈 예정 이라고 말했다 구혜린
1,2021-05-12,"카카오엔터, '유희열 사단' 안테나에 전략적 투자",서울경제 카카오엔터테인먼트는 뮤지션 유희열이 이끄는 레이블 안테나 지분 일부를 인수하는 전략적 투자를 단행했다고 일 밝혔다 카카오엔터는 안테나와의 파트너십으로 다양한 음악 장르의 아티스트를 발굴 육성하고 카카오엔터의 음악 영상 콘텐츠 사업에서 긴밀한 협업을 이어갈 예정이다 안테나는 정재형 루시드폴 페퍼톤스 정승환 권진아 샘김 적재 등 개성적인 뮤지션들이 소속돼 있다 카카오엔터는 안테나 소속 아티스트들과 함께 드라마 영화를 비롯해 카카오 오리지널 예능과 드라마 등 영상 콘텐츠 사업에서도 새로운 시너지를 만들어 내겠다는 목표다 안테나 역시 이번 투자 유치를 통해 안정적인 자본과 시스템을 확보하고 아티스트들이 음악 활동에 더욱 몰입할 수 있도록 지원할 계획이다 카카오엔터 관계자는 카카오엔터는 스타쉽 플레이엠 크래커 플렉스엠 등 산하 레이블이 안정적인 시스템을 바탕으로 독립적인 음악 색깔을 유지할 수 있도록 멀티 레이블 체제를 운영하고 다양한 장르로 레이블을 확대해왔다 며 이번 안테나와 파트너십을 바탕으로 음악과 영상 콘텐츠 사업의 경쟁력을 더욱 강화해나가겠다 고 말했다 윤민혁 기자
2,2021-05-12,"카카오엔터, 유희열 회사 '안테나' 지분 19% 인수…""콘텐츠 협업""",카카오엔터테인먼트가 가수 겸 작곡가 유희열이 이끄는 음악 레이블 안테나와 손을 잡았다 카카오엔터테인먼트 컴퍼니는 일 안테나 지분 를 인수하는 계약을 체결하고 이를 포함한 전략적 투자를 단행했다 고 발표했다 두 회사는 다양한 장르의 아티스트를 함께 발굴 육성하며 음악 영상 콘텐츠 사업에서 협업할 예정이다 카카오엔터가 기획하고 있는 드라마 영화 오리지널 예능 및 드라마 등에도 안테나 소속 아티스트들이 참여해 시너지를 내겠다는 계획이다 카카오엔터는 웹툰과 웹소설을 비롯해 영화 음악 영상 등 디지털 콘텐츠 전반에 걸쳐 사업을 펼치고 있으며 산하에 스타쉽 플레이엠 크래커 플렉스엠 등 다양한 음악 레이블을 두고 있다 안테나에는 유희열을 비롯해 정재형 루시드폴 정승환 권진아 샘 김 이진아 페퍼톤스 박새별 등의 싱어송라이터들이 소속돼 있다 카카오엔터 관계자는 산하 레이블이 안정적인 시스템을 바탕으로 독립적인 음악 색깔을 유지할 수 있도록 멀티 레이블 체제를 운영하며 글로벌아이돌 보컬리스트 프로듀서 등 다양한 장르로 레이블을 확대해왔다 며 이번 안테나와의 파트너십을 바탕으로 더욱 새롭고 다양한 시도를 통해 음악과 영상 콘텐츠 사업의 경쟁력을 더욱 강화해나갈 것 이라고 말했다 노정동 한경닷컴 기자
3,2021-05-12,"현대차증권 “카카오, 미 콘텐츠사업 진출…해외 매출 확대 본격화”",현대차증권은 일 카카오 가 콘텐츠 부문에서 공격적인 크로스보터 인수합병 을 하고 있어 해외매출 비중이 본격 늘어날 것으로 전망했다 투자의견 매수 목표주가 만 원을 각각 유지했다 전날 카카오엔터테인먼트는 미국 웹툰 플랫폼 타파스 지분 와 웹소설 플랫폼 래디쉬 지분 를 각각 억 만원 억원에 현금 취득하기로 공시했다 이와 관련 김현용 현대차증권 연구원은 이날 보고서에서 이는 타파스 기업 가치를 억원 래디쉬 기업가치를 억원으로 인정한 딜로서 취득 완료 후 카카오의 보유 지분율은 각각 에 도달할 예정 이라며 이번 딜의 최종 완료는 타파스를 억 만달러 래디쉬를 억 만달러에 지분 전부를 취득하는 형태가 될 것으로 전망하고 있다 고 했다 그러면서 그는 이는 네이버 대비 미국 웹툰 웹소설 시장에서 약했던 입지를 단번에 도약시키고 카카오 콘텐츠 사업이 본격적으로 해외 확장에 나서는 계기가 될 것으로 판단된다 고 덧붙였다 김 연구원은 현재 미국의 웹툰 웹소설 시장은 올해 예상 기준으로 약 억원 규모로 만화시장 디지털 전환율도 에 불과한 단계 라며 시장 개화 이전에 경쟁에서 유리한 고지를 선점하려는 의지가 높은 밸류에이션으로 투영됐다 고 설명했다 그는 게임을 제외한 콘텐츠 사업은 올해 예상기준 매출액 조 억원 영업이익 약 억원으로 이상의 양호한 수익성이 예상된다 며 연매출 억원 규모의 음악사업을 빼고 보면 조 억원 매출이 모두 웹툰 웹소설 드라마 영화 등 고성장 전방산업으로 무장된 상태 라고 설명했다 이어 내년 상반기로 예상되는 카카오엔터 상장시 웹툰 드라마를 모두 보유한 유일무이한 독립법인이라는 점에서 차별적인 수급이 예상된다 고 말했다 이다비 기자
4,2021-05-12,"카카오, 美 콘텐츠사업 진출에 해외매출 확대 본격화 -현대차",이데일리 김소연 기자 현대차증권은 일 카카오 에 대해 콘텐츠 부문에서 공격적인 크로스보터 인수합병 으로 해외매출 비중확대가 본격화될 것으로 전망했다 미국의 웹툰 웹소설 성장 잠재력은 무궁무진할 것으로 예상했다 투자의견 매수 목표주가 만 원을 유지했다 현재 카카오의 주가는 일 기준 만 원이다 전날 카카오엔터테인먼트는 미국 웹툰 플랫폼 타파스 지분 와 웹소설 플랫폼 래디쉬 지분 를 각각 억 만원 억원에 현금 취득하기로 공시했다 이에 대해 김현용 현대차증권 연구원은 이는 타파스 기업 가치를 억원 래디쉬 기업가치를 억원으로 인정한 딜로서 취득 완료 후 카카오의 보유 지분율은 각각 에 도달할 예정 이라고 설명했다 김 연구원은 이번 딜의 최종 완료는 타파스를 억 만달러 래디쉬를 억 만달러에 지분 전부를 취득하는 형태가 될 것으로 전망하고 있다 며 이는 네이버 대비 미국 웹툰 웹소설 시장에서 약했던 입지를 단번에 도약시키고 카카오 콘텐츠 사업이 본격적으로 해외 확장에 나서는 계기가 될 것으로 판단된다 고 했다 김 연구원은 이번 카카오의 조원에 가까운 베팅은 네이버의 왓패드 인수에 적극적으로 대응하며 해외시장 개척의지를 피력한 것 이라며 현재 미국의 웹툰 웹소설 시장은 올해 예상 기준으로 약 억원 규모로 만화시장 디지털 전환율도 에 불과한 단계다 한국과 일본이 웹툰으로만 각각 조 단위 시장을 형성한 점 미국 경제 규모를 감안할 때 성장 잠재력은 무궁무진할 것으로 예상되는 시장이 미국 이라고 강조했다 이어 시장 개화 이전에 경쟁에서 유리한 고지를 선점하려는 의지가 높은 밸류에이션으로 투영됐다 고 설명했다 카카오 콘텐츠 사업은 연간 조원 매출로 이익성장 기여도가 높다고 김 연구원은 판단했다 그는 게임을 제외한 콘텐츠 사업은 올해 예상기준 매출액 조 억원 영업이익 약 억원으로 이상의 양호한 수익성이예상된다 며 연매출 억원 규모의 음악사업을 빼고 보면 조 억원 매출이 모두 웹툰 웹소설 드라마 영화 등 고성장 전방산업으로 무장된 상태 라고 설명했다 이어 내년 상반기로 예상되는 카카오엔터 상장시 웹툰 드라마를 모두 보유한 유일무이한 독립법인이라는 점에서 차별적인 수급이 예상된다 고 강조했다 김소연
5,2021-05-12,"카카오, 액면분할후 주가 약세 징크스 깼다",분할전 만원 최고가 현재가 더 높아 분할후 상당기간 부진 했던 네이버 삼성전자와 달라 배 넘어 네이버는 회계상 이익 급증에 배 이데일리 김재은 기자 카카오 가 실적 호조를 바탕으로 액면분할후 주가 약세 징크스를 깼다 삼성전자와 네이버는 앞서 액면분할을 단행한 이후 주가가 상당기간 지지부진했지만 카카오는 분할 직전 최고가보다도 높은 수준을 유지하고 있어 눈길을 끈다 개인들은 분할이후 조원이상 순매수하며 카카오 주가를 지지하고 있다 년 월 일 종가를 으로 환산한 상대적인 주가추이 수정주가 기준 자료 에프앤가이드 분할전 최고가 웃도는 강세 일 마켓포인트에 따르면 카카오 주가는 전일대비 원 하락한 만 원에 거래를 마쳤다 분할 상장 후 최고가 만 원 월 일 종가 에 비해선 원 가량 떨어진 수준이다 하지만 이날 종가를 분할전 주가로 환산하면 만 원에 해당 분할직전 기록한 최고가 만 원 를 가량 웃돈다 카카오는 지난 월 일 대 액면분할을 공시했다 공시 전날 종가는 만 원이었고 액분 공시이후 카카오 주가는 우상향 추세를 보이면서 분할전 마지막 거래일인 월 일엔 만 원까지 치솟았다 종가기준 상장 이후 최고가였다 카카오는 사흘간의 거래정지 이후 지난달 일 분할상장일엔 나 오른 만 원을 기록했다 이후 거래에 있어 지난 일 만원의 장중 저가를 제외하면 분할 상장 기준가 만 원을 여전히 웃돌고 있다 지난달 일엔 김범수 의장과 케이큐브홀딩스가 장마감이후 억원 규모의 블록딜을 단행한 주가 역시 만 원 만 원수준이다 수급주체별로는 카카오 분할이후 개인이 조 억원 순매수한 반면 외국인과 기관은 억원 억원 순매도했다 연초이후로 따지면 개인은 조 억원 순매수했고 외국인도 억원 매수우위다 기관만 억원이상 순매도했다 이같은 카카오 주가 강세는 앞서 액면분할을 단행했던 네이버나 삼성전자와 대조적인 흐름이다 네이버와 삼성전자가 분할기준가를 회복하는데는 적어도 개월에서 년반이상 걸렸기 때문이다 네이버 는 지난 년 월 일 주 액면가 원 를 주 액면가 원 로 나누는 액면분할 신주를 상장했다 명의개서 거래정지전인 월 일 주당 만 원에서 일 기준가 만 원대비 원 상승한 만 원으로 마감했다 그러나 이후 줄곧 우하향세를 그리며 하락했고 만원대를 위협받기도 했다 네이버는 액면분할 상장 이후 개월여만인 년 월 일에서야 종가기준 만원대 만 원 를 회복했다 삼성전자 의 경우 년 월 주주총회에서 액면가 원을 원으로 나누는 대 액면분할을 결정 월 일에 분할 신주가 상장됐다 액면분할 거래정지 전인 월 일 종가는 만원이었지만 월 일엔 주당 만 원에 신주가 상장됐다 분할상장 첫날 삼성전자는 원 하락한 만 원에 거래를 마쳤다 삼성전자는 같은 해 월 무렵 만원대를 이탈하고 연말엔 만 원대까지 추락했다 년에도 만원대를 오르내리다 년말부터 만원대로 올라섰다 삼성전자는 분할 기준가 회복까지 년 반 이상이 소요됐다 목표가 만원 등장 연초대비 상향 눈길 증권사들은 카카오 목표주가를 만 원까지 높여 잡고 있다 이베스트투자증권은 지난 일 카카오 주요사업부문이 모두 호조를 보일 것이라며 투자의견 매수 에 목표주가 만 원을 유지했다 대신증권도 분기 하반기가 더 기대된다며 목표주가를 만 원까지 높였다 투자증권 흥국증권 교보증권 투자증권 메리츠증권 등이 만원을 제시하고 있다 에프앤가이드에 따르면 현재 카카오의 목표주가 평균은 만 원 수준으로 연초 만 원 에 비해 나 높아진 상태다 이민아 대신증권 연구원은 목표주가 산출 기준연도를 로 변경하고 사업가치를 기존 조 억원에서 조 억원으로 상향했다 며 두나무 지분가치 조 억원을 새로 반영하는 등 이를 종합해 목표주가를 기존 만원 분할전 만원 에서 만 원으로 상향하고 업종 톱픽을 유지한다 고 밝혔다 자료 에프앤가이드 단위 억원 카카오의 분기 매출은 조 억원 영업이익 억원으로 전년동기대비 각각 급증했다 분기 매출과 영업이익은 조 억원 억원으로 전년동기대비 급증할 전망이다 분기와 분기 매출은 조 억원 조 억원으로 증가세이고 영업이익 역시 분기 억원 분기 억원으로 우상향세가 예상된다 다만 카카오의 현주가는 개월 미래 주가수익비율 배를 웃도는 수준으로 경쟁업체 네이버의 배에 비해 과도하게 높은 상태다 네이버는 올해 연간 순이익 규모가 연초 조 억원 수준에서 조 억원으로 배이상 대폭 증가하면서 이 배까지 하락했다 회사측은 월 일자로 라인과 홀딩스 경영통합이 완료돼 회계적 처분손익 등 현금 유출입이 없는 회계상 이익을 인식했다 고 설명했다 카카오의 경우 올해 순이익 추정치는 연초 억원에서 최근 억원으로 가량 늘어났다 김재은
6,2021-05-12,"""웹툰·웹소설로 글로벌 공략""..네이버·카카오 이유있는 인수전",머니투데이 윤지혜 기자 네이버 왓패드 인수 마무리 카카오 타파스 래디시 동시 인수 네이버와 카카오가 북미 웹툰 웹소설 콘텐츠 시장에서 맞붙는다 사진 각 사 네이버 와 카카오가 세계 최대 콘텐츠 시장인 북미에서 본격적으로 맞붙는다 네이버가 캐나다 웹소설 플랫폼 왓패드 인수를 마무리한 가운데 카카오엔터테인먼트도 북미 웹툰 웹소설 플랫폼을 잇달아 품에 안으며 영토 확장에 나섰다 특히 카카오엔터테인먼트의 북미 웹소설 사업은 대 초반 대표가 이끌게 돼 주목된다 일 네이버와 카카오엔터테인먼트는 나란히 북미 웹툰 웹소설 플랫폼 인수를 발표했다 네이버는 한국 미국 캐나다 등지의 경쟁당국 승인을 거쳐 왓패드 인수 절차를 마무리했다고 밝혔다 앞서 네이버는 올 초 억 달러 한화 약 억원 에 왓패드 지분 를 인수키로 한 바 있다 이로써 네이버는 네이버웹툰과 왓패드를 더해 총 억 만명의 월간 순 사용자와 창작자 만명 창작물 억개를 보유한 콘텐츠 플랫폼으로 재탄생했다 네이버는 네이버웹툰 수익화 모델과 지식재산권 사업 노하우를 왓패드에 적용해 사업모델을 고도화할 예정이다 또 웹툰 웹소설 를 활용한 원 소스 멀티 유즈 에 본격적으로 나선다 웹툰 웹소설을 바탕으로 올해 개의 영화 드라마 애니메이션을 제작하는 등 다양한 영상화 프로젝트를 진행한다는 방침이다 네이버는 콘텐츠 기술 개발에도 힘쓴다 이미 자동 채색 및 펜선따기 로 창작자 작업 효율을 높이고 인공지능 기반 툰레이더 로 웹툰 불법 복제 유통을 방지하고 있다 네이버웹툰은 올해 소프트웨어 개발 및 엔지니어 부문 채용을 시작으로 올해 세자릿수의 개발자를 채용한다 왓패드도 개발 마케팅 콘텐츠 등 관련 직원을 가까이 증원할 계획이다 한성숙 네이버 대표는 이번 인수를 통해서 웹툰과 왓패드 간의 시너지가 더욱 커질 것으로 기대한다 며 네이버는 웹툰 왓패드처럼 세대가 열광하는 스토리텔링 플랫폼을 기반으로 글로벌 엔터테인먼트 시장의 중요한 플레이어로 성장해갈 것 이라고 말했다 네이버 추격하는 카카오 북미 웹툰 웹소설 플랫폼 동시 인수 카카오엔터테인먼트는 타파스와 래디시를 동시에 인수한다 사진 카카오엔터테인먼트 네이버에 질세라 카카오엔터테인먼트도 북미 웹툰 플랫폼 타파스미디어 지분 를 확보한데 이어 이달 중 공개매수를 통해 웹소설 플랫폼 래디시 를 인수키로 했다 타파스와 래디시는 이번 투자 과정에서 각각 억원과 억원의 기업가치를 인정받았다 카카오엔터테인먼트는 두 플랫폼을 중심으로 북미 시장에 본격 진출하고 글로벌 영향력을 강화한다는 방침이다 타파스는 년 미국에서 설립된 북미 최초 웹툰 플랫폼으로 총 만개의 콘텐츠를 유통 중이다 지난해 월 타파스 최대주주에 오른 카카오엔터테인먼트는 북미 진출을 위해 지분 를 확보했다 이진수 카카오엔터테인먼트 대표는 지난해 타파스에 작품을 공급한 후 거래액이 뚜렷하게 성장하는 것을 보며 북미 시장에대한 자신감을 얻었다 고 말했다 래디시는 년 미국 뉴욕에서 설립된 웹소설 플랫폼이다 자체 제작 콘텐츠 래디시 오리지널 인기에 힘입어 지난해 매출이 전년 대비 배 이상 증가한 억원을 기록했다 왓패드가 무료 연재 작품 중심인 반면 래디시는 매출의 가 유료 콘텐츠인 래디시 오리지널에서 나올 정도로 확고한 이용자층을 보유하고 있다는 평가다 카카오엔터테인먼트 글로벌 콘텐츠 사업 년생이 이끈다 이승윤 래디시 대표와 김창원 타파스 대표 왼쪽부터 사진 카카오엔터테인먼트 김창원 타파스 대표와 이승윤 래디시 대표는 현재와 같은 독립 경영 체제를 유지하는 동시에 카카오엔터테인먼트의 글로벌전략담당 을 맡는다 북미에서 쌓은 경험을 바탕으로 카카오엔터테인먼트의 글로벌 사업 전반에 관여할 예정이다 눈여겨볼 점은 년생인 이 대표 가 카카오엔터테인먼트의 글로벌 웹소설 사업을 이끌게 됐다는 점이다 이 대표는 년 한국인으로는 최초로 옥스퍼드대학 토론클럽 옥스퍼드유니언 회장에 선출되며 언론의 조명을 받았다 대학 졸업 후 미디어 스타트업 바이라인 을 창업했으나 미디어 스타트업의 확장성에 한계를 느끼고 웹소설로 눈을 돌렸다 김 대표 는 한국 기업 최초로 구글이 인수한 테터앤컴퍼니 공동대표 출신이다 이후 구글에서 일하다가 타파스미디어를 창업했다 이진수 카카오엔터테인먼트 대표는 미국에서 확고한 리더십을 구축한 김 대표와 이 대표가 미국은 물론 글로벌 사업을 이끄는 핵심적인 역할을 하게 될 것 이라고 말했다 이어 이번 인수는 카카오엔터테인먼트는 글로벌 콘텐츠 기업으로 진화하는 계기 라며 글로벌 플랫폼 네트워크 확장에 박차를 가할 계획 이라고 강조했다 윤지혜 기자
