,날짜,기사제목,본문내용
0,2021-02-19,"블랙록, 카카오 지분 5.18% 매수",전 세계 최대 규모 자산운용사인 블랙록자산운용이 한국 플랫폼 간판주 카카오 지분을 이상 사들였다 일 블랙록은 단순투자 목적으로 장내 매수를 통해 카카오 지분 만 주 를 신규 취득했다고 공시했다 이날 카카오 주가는 전날보다 오른 만 원에 거래를 마감했다 블랙록은 지난달 일 카카오 주식을 장내 매수했다 블랙록 취득단가는 주당 만 원 수준이고 지분 를 사들이는 데 쓴 돈은 총 억원 이상일 것으로 추정된다 일 카카오 주가를 감안하면 블랙록 보유 지분 평가 이익은 총 조 억원에 이른다 수익률은 선이고 평가액은 총 조 억원 정도다 이번 공시는 블랙록이 특정 회사 지분 이상을 취득하면서 보고 의무가 발생해 이뤄졌다 김인오 기자
1,2021-02-19,"세계 최대 자산운용사 블랙록 ""카카오 지분 5.18% 보유""",아시아경제 이민지 기자 세계 최대 자산운용사인 블랙록이 카카오 지분을 넘게 보유하고 있다고 밝혔다 일 블랙록 산하 블랙록펀드어드바이저스는 이날 이상 의무 공시를 통해 카카오 주식 만 주 를 단순 투자 목적으로 장내 매수해 보유 중이라고 밝혔다 블랙록은 지난 일까지 카카오 지분을 이하 로 보유하고 있다가 추가 매수가 이뤄지면서 의무공시 대상자가 됐다 이날 카카오는 전 일대비 상승한 만 원을 기록했다 증권가에서는 카카오의 성장세가 지속될 것으로 보고 있다 지난해 의 매출성장과 가 넘는 영업이익 증가세를 기록한 가운데 올해도 광고와 커머스를 기반으로 매출 증가가 예상된다 최관순 증권 연구원은 올해 카카오 매출액 증가율은 로 예상돼 지난해의 고성장세가 지속될 것 이라며 카카오재팬 모빌리티의 매출 증가에 따른 손익개선과 이익레버리지가 높은 톡비즈 부문의 성장으로 영업이익률도 에서 로 증가할 것 이라고 전했다 이민지 기자
2,2021-02-19,"세계 최대 운용사 블랙록 ""카카오 지분 5.18% 보유""",머니투데이 백지수 기자 사진제공 카카오 세계 최대 자산운용사 블랙록이 카카오 지분을 갖고 있다고 일 공시했다 블랙록이 카카오 지분을 보유하고 있다고 공시한 것은 이번이 처음이다 블랙록 산하 블랙록펀드어드바이저스는 이날 이상 의무 공시를 통해 카카오 주식 만 주 를 단순 투자 목적으로 장내에서 매수해 보유 중이라고 밝혔다 블랙록은 지난 일까지는 카카오 지분을 이하 보유하고 있다가 추가 매수에 따라 의무공시 대상이 됐다 이날 카카오 종가 만 원 기준으로 블랙록 보유 지분의 평가가치는 조 만원에 달한다 현 주가 기준으로 블랙록의 수익률은 주당 만 원 다 평가차익은 조 억원 규모다 업계에서는 블랙록이 향후 카카오 계열사들의 잇단 상장 등으로 그룹 가치가 재평가될 것으로 보고 지분을 추가 매수할 가능성도 제기한다 카카오페이 카카오뱅크 카카오페이지 등은 기업공개 를 준비 중이다 내달에는 카카오의 콘텐츠 지식재산권 비즈니스를 담당할 카카오엔터테인먼트도 출범한다 비대면 시대가 이어지면서 카카오의 실적 개선이 두드러진다는 점도 이같은 전망에 무게를 더한다 카카오는 지난해 연간 조원 이상의 매출을 올리며 전년보다 가량 성장했다 영업이익도 억원으로 성장했다 증권가에서는 올해 분기에도 카카오 영업이익이 전년 동기 대비 이상 성장할 것으로 전망하고 있다 백지수 기자
3,2021-02-19,"블랙록, 카카오 지분 5.18% 보유",만주 넘어 첫 공시 세계 최대 자산운용사인 블랙록이 카카오 지분을 이상 갖고 있다고 공시했다 블랙록이 카카오 지분 보유 공시를 한 것은 이번이 처음이다 블랙록 산하 블랙록펀드어드바이저스는 지난 일 기준으로 특별관계자 인과 함께 카카오 주식 만 주 를 보유하고 있다고 일 공시했다 블랙록은 지난 일까지 카카오 지분 를 갖고 있어 의무공시 대상이 아니었지만 이번엔 지분이 를 넘겨 공시 대상이 됐다 이날 카카오 주가는 오른 만 원에 거래를 마쳤다 증권업계에서는 블랙록이 카카오 지분을 추가로 매입할 가능성이 있다는 관측도 나온다 카카오가 플랫폼주로서 본격적인 이익 구간에 들어서고 있기 때문이다 윤을정 신영증권 연구원은 카카오의 분기 수익성이 빠르게 개선되고 있는 데다 모빌리티와 핀테크 등 신사업도 예상보다 빨리 안정기에 들어섰다 며 최근 비트코인 등 새로운 산업 변화에 적극 투자하는 블랙록이 카카오에 대한 지분 확대에 나선 이유 라고 설명했다 카카오는 오는 월 카카오 지식재산권 비즈니스의 핵심이 될 카카오엔터테인먼트 출범을 앞두고 있다 카카오 모빌리티는 하반기부터 이익 구간에 진입할 전망이다 카카오페이 등 주요 자회사 상장도 예정돼 있다 그룹 가치가 재평가될 것이란 기대가 크다 올 들어 카카오 주가가 오른 배경이다 실적 개선도 가파르다 카카오의 올해 분기 영업이익 컨센서스 증권사 추정치 평균 는 지난해 동기보다 늘어난 억원이다 증권업계에서는 올해 카카오가 억원대 영업이익을 무난히 달성할 것으로 보고 있다 고윤상 기자
4,2021-02-19,"세계 최대 자산운용사 블랙록, 카카오 지분 5% 이상 늘렸다",카카오 지분 로 확대 투자 강화 전망 파이낸셜뉴스 세계 최대 자산운용사 블랙록이 카카오 지분을 이상 확보했다고 일 밝혔다 블랙록 산하 블랙록 펀드 어드바이저스가 지난 일 기준으로 특별관계자 인과 함께 카카오 주식 만 주 를 보유하게 된 것이다 앞서 블랙록은 지난 일까지 카카오 지분 를 갖고 있었다 하지만 이번에 카카오 지분율이 를 넘기면서 공시 대상이 됐다 이에 따라 블랙록은 카카오 김범수 의장 등 특수관계인 국민연금공단 텐센트 자회사 막시모 등에 이어 대 주주로 이름을 올릴 예정이다 카카오 블랙록의 이번 지분 확대는 카카오톡 을 무기로 플랫폼 비즈니스를 강화하고 있는 카카오 미래가치에 투자한 것이란 분석이 나온다 또 블랙록이 최근 환경 사회 지배구조 를 통칭하는 분야에 투자를 확대키로 한 의지도 반영된 것으로 풀이된다 카카오는 최근 최대주주인 김범수 의장이 개인 재산 를 사회에 환원할 것이란 계획을 밝혔다 또 자체 기업지배구조헌장 에 주주 이사회 감사기구 이해관계자 시장에 의한 경영 감시 등 개 영역에 대한 운영 방향을 담은 한편 김범수 의장이 총괄하는 위원회를 구성했다 여민수 카카오 대표는 최근 실적 컨퍼런스콜을 통해 카카오 최대주주인 김 의장의 이번 결정으로 카카오 기업가치가 높아지는 일이 더 나은 사회와 환경을 만드는 밑거름이 될 것 이라며 더 나아가 우리 사회에 선진적인 기업경영과 기부문화를 여는 촉매제가 될 것이라 기대한다 고 강조했다 카카오톡 김범수 블랙록 김미희 기자
5,2021-02-19,"블랙록, 카카오 지분 5.18% 신규 취득…평가차익 1.3조 웃돌아",이데일리 김재은 기자 글로벌 최대 운용사인 블랙록자산운용 이 카카오 지분 이상 신규로 취득했다 일 블랙록자산운용은 단순투자목적으로 장내매수를 통해 카카오 지분 만 주 를 신규 취득했다고 공시했다 블랙록은 지난달 일 장내매수를 통해 지분 이상 보고의무가 발생했다 블랙록의 취득단가는 주당 만 원 수준으로 지분 를 확보하는데 든 비용은 억원을 웃돈다 하지만 카카오의 일 종가는 만 원으로 블랙록의 보유지분 평가액은 조 억원을 넘어서고 있다 현주가 기준 블랙록의 수익률은 주당 만 원 에 달한다 평가차익은 조 억원 규모다 김재은
6,2021-02-19,"세계 최대 운용사 블랙록 ""카카오 지분 5% 이상 보유""",사진 세계 최대 자산운용사인 블랙록이 카카오 지분을 이상 갖고 있다고 공시했다 블랙록이 카카오 지분 공시를 한 건 이번이 처음이다 블랙록 산하 블랙록 펀드 어드바이저스는 지난 일 기준으로 특별관계자 인과 함께 카카오 주식 만 주 를 보유하고 있다고 일 공시했다 블랙록은 지난 일까지 카카오 지분 를 갖고 있어 의무공시 대상이 아니었지만 이번엔 지분이 를 넘겨 공시 대상이 됐다 이날 카카오 주가는 오른 만 원에 거래를 마쳤다 증권업계에서는 블랙록의 지분 확대가 추세적인 것으로 보고 있다 카카오가 플랫폼주로서 본격적인 이익구간에 들어서고 있기 때문이다 윤을정 신영증권 연구원은 카카오의 분기 수익성이 빠르게 개선하고 있는데다가 모빌리티나 핀테크 등 신사업도 예상보다 빨리 안정기에 들어섰다 며 최근 비트코인 등 새로운 산업 변화에 적극 투자하는 블랙록이 카카오에 대한 지분 확대에 나선 이유 라고 설명했다 카카오는 오는 월 카카오의 지식재산권 비즈니스의 핵심이 될 카카오엔터테인먼트의 출범을 앞두고 있다 카카오 모빌리티는 하반기부터 이익 구간에 진입할 전망이다 카카오페이 등 주요 자회사의 상장도 예정돼있다 그룹 가치가 재평가 될 것이란 기대가 크다 올 들어 카카오 주가가 나 오른 배경이다 실적 개선도 가파르다 카카오의 올해 분기 영업이익 컨센서스 증권사 추정치 평균 는 지난해 동기보다 늘어난 억원이다 증권업계에서는 올해 카카오가 억원대 영업이익을 무난히 달성할 것으로 보고 있다 고윤상 기자
