time,title,context
2021-03-19,"누하스, 22일 네이버 쇼핑 라이브 방송 진행",이데일리 이윤정 기 라이프 큐레이션 리빙 브랜드 누하스 일 네이버 쇼핑 라이브 라이브 방송 진행 일 업체 측은 이번 행사 누하스 창사 이래 쇼핑 라이브 만큼 본사 준비한 특별 혜택들 구성 누하스 진행 품목 누하스 베스트 셀러 클래식 안마의자 편안 착석감 선사 누하스 카레클린트 리클라이닝 브릭 소파 한정수량 한해 최대 할인가 구매 수 자세한 가격 혜택 당 라이브 방송 공개 특별 사은품 행사 진행 이날 구매 고객 전원 고급 원형 러그 원 상당 제스파 힐링온 눈 마사지 렉슨 램프 증정 누하스 관계자 브랜드 론칭 년 만 매출액 억 돌파 기념 고객들 보답 의미 창사 이래 혜택가로 쇼핑 라이브 준비 며 한정 시간 진행 파격 행사 만큼 분 혜택 말 네이버 쇼핑 라이브 일 오후 시 약 시간 분간 진행 네이버 스마트스토어 소식 스토어찜 알람 설정 경우 추 할인 수 자세한 내용 누하스 공식 홈페이지 스마트스토어 확인 수 이윤정
2021-03-19,"쿠첸, 네이버 쇼핑 라이브 등 이사혼수 특별전",이데일리 강경래 기 쿠첸 일 네이버 온라인 직영몰 쇼핑 라이브 이사혼수 특별전 을 진행 일 이번 특별전 네이버 리빙 빅 프로모션 일환 마련 삼성 등 국내 주요 가전 가구 주방 업체들 참가 일 오전 시 시간 동안 진행 네이버 쇼핑 라이브 방송 밥솥 클린가드 밥솥 미작 밥솥 프리미엄 인덕션 전기레인지 와이드 에어프라 미니오븐 등 소개 밥솥 다이어트 전용 모드 건강 식단관리 가능 카무트 귀리 병아리콩 렌틸콩 퀴노아 등 통곡물 모드 이용 식이섬유 당질 건강 밥맛 가능 편 대용식 귀 메뉴 방송 중 밥솥 클린가드 밥솥 미작 밥솥 구매 도자 홈 세트 증정 구매 고객 중 명 무작위 선정 인용 크리미 밥솥 을 무상 제공 추가 방송 중 진행 댓글 이벤트 명 추첨 전자레인지 용기 증정 예정 네이버 온라인 직영점 프리미엄 밥솥 인덕션 최대 할 행사 진행 일 쿠첸 프리미엄 미니밥솥 일 쿠첸 인용 이유식 밥솥 특가 판매 쿠첸 관계자 다양 생활 패턴 소비자 취향 쿠첸 기술 집약 스테디셀러 제품들 선택 폭 며 이사 혼수 시즌 비대면 주방가전 구매 이 기회 말 강경래
2021-03-19,"네이버, 서치 플랫폼 매출 '3조원'… 법인세 4630억원 공시",네이버 주총 사업보고 공시 법인세비용 억원 공시 증 매출액 조 억원 순이익 조 억원 네이버 지난해 매출액 조 억원 기록 데 이 법인세비용 억원 공시한 것 집계 사진 경기 성남시 분당구 소재한 네이버 본사 모습 연합뉴스 코 여파 속 비대 시장 활성화 시너지 극대화 네이버 지난해 매출액 조 억원 단 재무제표 기준 을 기록 뒤 억원 상회 법인세 사업보고서 계상한 것 일 네이버 공시한 사업보고서 네이버 지난해 법인세 억원 계상 이 전년 억원 억원 증가 수준 당기순이익 조 억원 기록 전년 조 억원 의 성장 기록 것 분석 업계 등 네이버 지난해 그간 역량 바탕 리스크 신중 관리 한편 비즈니스 포트폴리오 관리 장기적 성장 동력 확보 글로벌 경쟁력 강화 노력 평가 선제적 투자 커머스 핀테크 콘텐츠 클라우드 관련 사업 등 비대 문화 확산 변화 환경 기회 성과 내 역량 결집 네이버 주요 사업별 매출 현황 단 재무제표 기준 을 서치플랫폼 부문 조 억원 커머스 부문 조 억원 핀테크 부문 억원 콘텐츠 부문 억원 클라우드 부문 억원 기록 조 억 상회 매출 한성숙 네이버 대표이사 지난해 코 위 속 네이버 기술 서비스 활용 일상 단절 이용자들 어려움 해결 그간 강조 연결 상생 철학 하 창작자 중소상공 과 의미 성장 실현 해 평가 대표이사 이 네이버 환경 변화 중 이 환경 변화 도약 기회 그간 회상 성장 견인 혁신 바탕 글로벌 시장 신규 사업 도전 설명 앞 세상 미래 네이버 단계 도약 수 계기 것 이 공헌 네이버 감사인 삼일회계법인 저 기 당기 저 기 전기 저 기 전전기 단일재무제표 종속기업 연결재무제표 등 감사 감사보고서 최종 적정 의견 표명 감사 삼일회계법 측은 네이버 핵심감사사항 검색광고 수익 식 수준 으 분류 금융자산 공정가치 평 매각예정자산 부채 중단영업 표시 공시 등 중점적 며 감사 결과 최종 적정 의견 결정 네이버 일 수 경기 소재 그린팩토리 본사 정기 주주총회 네이버 이날 재무제표 승 정관 변경 사내이사 선 사외이사 선 감사위원 사외이사 선 이사 보수한 승 등 개 안건 상정 논의 예정 년 이상 근무 임직원 대상 지급 스톡옵션 관련 안건 표결 예정 이번 주주총회 신종 코로나바이러스 감염증 코 확산 방지 온라인 생중계
2021-03-19,“웹소설 수 야후 통합까지” 네이버 ‘기술’ 기반 글로벌 확장,네이버 기술 중점 투 행보 글로벌 위 웹소설 플랫폼 왓패드 수 스포티파 틱톡 경쟁 승리 스페 리셀 플랫폼 왈라팝 투 등 행보 네이버 사옥 연합 헤럴드경제 유동현 기 네이버 글로벌 겨냥 기술 중심 공격적 투자 글로벌 위 웹소설 플랫폼 왓패드 수 스페 위 리셀 플랫폼 왈라팝 투 라인 야후재팬 경영통합 완료 기술 기반 글로벌 확장 네이버 국내 깊이 기술 글로벌 파트너들 접목 방식 글로벌 성장 추진 년 스마트스토어 적용 기술 일본 시작 글로벌 네이버 일 홀딩스 라인 야후재팬 등 네이버 스마트스토어 기술 접목 것 네이버 국내 시장 입증 스마트스토어 기술 제공 라인 야후재팬 등 기술 활용 일본 상황 서비스 제공 커머스 기술 네이버 검색 광고 인프라 등 기술 홀딩스 라 야후재팬 페이페이 조조타운 등 접목 가능 북미 지역 네이버웹툰 왓패드 시너지 브이라이브 기술 제페토 등 세대 관심 엔터테인먼트 분야 활발 네이버 인공지능 기술 동영상 인프라 기술 등 엔터테인먼트 분야 경쟁력 확보 사용 수 네이버 수 투자 왓패드 왈라팝 유럽에서 미국 빅테크들 공략 시장 로컬 기업들 손 네이버 스페 최대 리셀 플랫폼 왈라팝 여억 원 이 프랑스 명품 리셀 플랫폼 베스티에르 투자 네이버 추천 기술 검색 기술 이 기업 접목 수 광고 스마트스토어 기술 활용 수 국내 기업 글로벌 톱 수준 파트너들 수 투자 성공 점 눈 성장 잠재력 기술 기업들 글로벌 브랜드 인지도 우리나라 기업 미국 중국 등 투자 선호 경향 때문 네이버 스포티파이 틱톡 운영 바이트댄스 참여 왓패드 인수전 승리 당시 알렌 라우 왓패드 창업자 왓패드 네이버 웹툰 우리 성장 수 최고 전략 잠재력 제공 수 판단 한 바 네이버 투자 스페 위 리셀 플랫폼 왈라팝 롭 전세계 혁신적 기술 기업 중 하나 네이버 협력 왈라팝 사용자들 지속적 최고 사용 경험 제공 것 이 말
2021-03-19,"일렉트로룩스, 22일 봄맞이 '네이버 쇼핑 라이브'…특별 혜택 풍성",일 오후 시 분간 진행 최대 할 아이패드 등 혜택 이데일리 신중섭 기 스웨덴 종합가전기업 일렉트로룩스 일 오후 시 풍성한 할 혜택 봄맞이 네이버 쇼핑 라이브 를 진행 일 일렉트로룩스 이번 네이버 쇼핑 라이브 이사 결혼 시즌 기획 간 특별 방송 일렉트로룩스 다양한 베스트셀러 제품들 최대 할 가격 스웨덴 이모님 유명 프리미엄 식기세척기 은 라이브 방송 만큼 파격적 혜택 제공 방송 중 혜택 적용 최초출시 대비 약 할인 만원 수 년 동안 일렉트로룩스 독보적 불조절 기술력 인덕션 플렉스 브릿지 만원대 구입 가능 강력 밀착 흡입력 세련 디자인 인기 자랑 무선청소기 퓨 파워프로 집안 내부 체계적 지도화 비전 시스템 탑재 로봇청소기 퓨 등 인기 가전 등 포함 생방송 중 구매 수 구성 출격 구매 고객 특별 행사 행운 이벤트 진행 라이브 방송 당 식기세척기 을 구매 전 고객 대상 식기세척기 전용 세제 박스 인덕션 구매 시 독 프리미엄 주방용품 브랜드 실리트 냄비 종 세트 일렉트로룩스 컴팩트 블렌더 증정 무선청소기 퓨 파워프로 구매 고객 만원 상당 배터리 무상교체 회 퍼포먼스 키트 로봇청소기 퓨 구매 고객 퍼포먼스 키트 제공 상품 최대 개월 무 할부 지원 외 추첨 신세계 모바 상품권 만원 아이패드 세대 일렉트로룩스 전자레인지 등 경품 추 증정 예정 일렉트로룩스 이번 라이브 방송 사전 이벤트 진행 중 네이버 쇼핑 라이브 소식 를 신청 식기세척기 로봇청소기 구매 시 만원 추 할인 수 소식 신청 후 댓글 기대평 고객 명 추첨 스타벅스 기프티콘 선물 한편 이번 봄맞이 라이브 방송 기념 특별 적립 이벤트 마련 일 네이버 일렉트로룩스 스마트스토어 구매 이용자 전원 포인트 적립 혜택 제공 라이브 방송이 진행 일 오후 시 시 분 의 추 적립 최대 적립 혜택 수 이신영 일렉트로룩스 코리아 대표 가전 구매 맞이 고객들 합리적 가격 수 가전 구매 수 이번 라이브 방송 마련 며 식기세척기 인덕션 등 세계적 인정 프리미엄 대형 가전 성능 디자인 청소기 일렉트로룩스 다양한 라인업 풍성한 혜택 말 신중섭
2021-03-19,"신한카드, 디지털 전환 올인···네이버·카카오페이",페이스페이 서비스 론칭 등 온라인결제 규모 조 확대 디지털부문 순익 절반 기대 서울경제 카드 업계 위 신한카드 성장 간편결제 업체 경쟁 디지털 전환 사활 올해 전체 순이익 절반 이상 디지털 부문 전통 금융사 디지털 금융사 전환 원년 각오 일 금융권 네이버페이 운영 네이버파이낸셜 년 억 원 당기순손실 기록 지난해 억 원 흑자 전환 카카오페이 당기순손실 규모 년 억 원 년 억 원 줄 올해 이익 실현 예 간편결제 시장 빅 업체 네이버페이 카카오페이 급성장 기존 카드업계 위협 것 신한카드 디지털 페이 업체 올해 본격적 경쟁 대비 간편결제 오프라인 영역 전통 카드사 신한카드 반대 디지털 비즈니스 강화 맞대응한다 계획 신한카드 지난해 조 원 온라인 결제 규모 올해 조 원 리 당기순이익 절반 이상 디지털 채널 리 목표 제시 신한카드 디지털 부문 영업이익 경비차감전 은 년 억 원 지난해 억 원 증가 디지털 수익 증대 중심 명 이용 신한카드 앱 신한페이판 데이터 디지털 기반 비즈니스 신한페이판 이용객 리 수익 창출 계획 신한카드 이날 대형 마트 홈플러스 얼굴 식 결제 가능 한 페이스페이 서비스 론칭했다 서비스 패스트푸드점 커피전문점 등 영역 확대 예정 디지털 전환 가속화 비용 감 추진 업무 영역 전반 디지털화 추진 올해 약 억 원 비용 줄 계획 이 전년 대비 억 원 규모 신한카드 관계자 영업 모집 등 전방 채널 프로세싱 자동화 등 후방 채널 전사적 밸류 체인 디지털 전환 추진 절감 비용 디지털 혁신 사업 발굴 재투자 전략 라 설명 빅테크와 주도권 경쟁 라이프 파이낸스 플랫폼 기업 도약 미래상 설정 올해 월 개 고객 금융 플랫폼 마이데이터 기반 종합 라이프 플랫폼 개 사업자 금융 플랫폼 대 미래 사업 론칭해 토털 생활 금융 서비스 차별화 서비스 제공 계획 김광수 기자
2021-03-19,[빅데이터 재테크 쿠팡 상장에…국내 1위 '네이버쇼핑' 보,네이버 작년 조원 것 위 쿠팡보다 조원 이마트 지분교환 소식 오프라 시너지 기대감 경기 성남시 위치한 네이버 본사 전경 매 쿠팡 미국 상장 지난주 국내 커머스 업계 재테크 시장 관심 일 금융정보업체 에프앤가이드 뉴욕증권거래소 성공적 상장 쿠팡 한 주 일 키워드 검색 순위 위 기록 상장 주 급등 투자자 관심 집중 상장 첫날 일 쿠팡 주가 공모 대비 급등 달러 거래 마감 국내 투자자들 이날 쿠팡 주식 만달러 약 억원 어치 순매수한 바 당 해외주식 순매수 위 이후 쿠팡 주가 등락 거듭 일 종 기준 달러 상황 쿠팡 기업공개 국내 이커머스 위 업체 네이버 쇼핑 가치 재조명 쿠팡 네이버 쇼핑 년 거래대금 조원 조원 거래대금 기준 네이버 쇼핑 위 쿠팡 상장 네이버 쇼핑 사업가치 재부각 가능성 관심 이유 이 증권가 네이버 목표 주가 줄 상향 조정 지난주 검색 순위 위 쿠팡 네이버 동상이몽 한국투자증권 정호윤 네이버 목표주가 만원 기존 대비 상향 내용 네이버 주가 일 종 기준 원 수준 일 종 기준 원 주간 반등했다 정호윤 연구원 목표주가 상향 네이버 커머스 사업부 가치 재평가 기인 며 네이버 커머스 사업부 가치 개월 거래액 쿠팡 올해 예상 거래액 대비 공모 비율 할 적용해 조 억원 추정 할인율 쿠팡 네이버 성장률 차 국내 증시 미국 증시 밸류에이션 차 등 산정 설명 커머스 업계 합종연횡 관심 일 네이버 이마트 지분 교환 소식 관심 이마트 네이버 지난주 각각 종목 검색 순위 위 이마트 네이버 지분 교환 전략적 협업 소식 오프라 위 업체 시너지 기대감 것 풀이 이마트 지난해 매출 조원 돌파 오프라 쇼핑 업체 위 자리 검색 순위 이 내용 이마트 이마트 네이버 무엇 수 미래에셋대우 김명주 경민정 위 네이버 일본 자회사 라인 이달 초 야후재팬 합작법인 홀딩스 설립 이커머스 사업 강화 상황 이 월 지분법이익 반영 일 쿠팡 상장 주목 대신증권 이민 이 지난주 검색 순위 위 보고서 네이버 월 통합 홀딩스 지분법 이익 반영함 년 순이익 추정치 기존 조 억원 조 억원 상향 내용 네이버 홀딩스 지주사인 홀딩스 지분 보유 홀딩스 중간 지주사인 홀딩스 지분 를 보유 홀딩스 라인 야후재팬 지분 소유 구조 홀딩스 출범 커머스 핀테크 로컬 버티컬 공공 등 개 분야 미래 사업 집중 육성 계획 발표 바 한편 효성화학 분기 어닝서프라이즈 기대감 주가 급등 종목 검색 순위 위 이름 순위 효성화학 부터 서프라이즈 중장기 투자수익률 가능 영역 하나금융투 윤재성 하재선 위 실적 개선 기대감 지난주 일 효성화학 주가 급등 바 문가영 기자
