time,title,context
2021-05-14,“하반기부터 영업이익 상당한 개 기대”-넷마블 컨콜,이데일리 이 호 기 신작 부재 연봉인상 인건비 상승 등 전체적 이익률 하락 것 사실 월 저 의나라 신작 모멘텀 시작 분기 실적 일부 반영 마케팅비 초 집행되다보 한계 하반기 상당한 수준 이익률 개선 것 인건비 비중 자체 분기 것 사실 하반기 실적 개선 인건비 비중 전년도 비슷 수준 유 것 일 넷마블 년 분기 실적발표 컨퍼런스콜 도기욱 전무 이 호
2021-05-14,"[넷마블 컨콜] “제2의나라, 출시 잠정 일정 6월 10일”",일 넷마블 권영식 대표 년 분기 실적발표 컨퍼런스콜 저 의나라 의 출시 일정 월 일 잠정 출시 예정 이 사전예약 수치 예상대로 긍정적 라 설명 이 종 신작 북미 스튜디오 국내 스튜디오 게임 개발 중 올해 출시 미확정 기회 공개 라 게임진 임영택기자
2021-05-14,"“제2의나라, 6월10 론칭…일정 차질 진행”-넷마블 컨콜",이데일리 이 호 기 저 의 월 일 론칭 예정 상황 일정 차질 진행 과거 게임 사전 예약 숫자 공개 추 예상한대 긍정적 게임 주요 수익모델 은 미디어 쇼케이스 이용자 친화적 방향 전체적 분위기 내외부적 관심 상황 일 넷마블 년 분기 실적발표 컨퍼런스콜 권영식 대표 이 호
2021-05-14,[넷마블 컨콜] “‘세븐나이츠2’·‘마블 COC’ 2Q 매출 반등”,일 넷마블 이승원 대표 년 분기 실적발표 컨퍼런스콜 마블 콘테스트오브챔피언스 분기 통상적 비수 월 매출 전년 비슷 분기 예년 유사 소폭 상향 매출 가능 것 이 세븐나이츠 분기 론칭 초 효과 월 이용자 소통 게임 안정성 콘텐츠 업데이트 집중 매출 확대 업데이트 자제 이용자 유지 월 매출 관련 업데이트 매출 상승 상황 이 게임진 임영택기자
2021-05-14,"넷마블, 1분기 영업익 542억…전년비 165. 7 ↑",헤럴드경제 증권부 넷마블 분기 연결기준 영업이익 억원 전년동기대비 증가 일 공시 기간 매출액 억원 것 당기순이익 억원 증가 것 잠정 집계
2021-05-14,넷마블 1분기 영업익 542억…전년比 165%↑,넷마블 연결재무제표 기준 올해 분기 영업이익 억원 전년 동기 대비 증가 것 집계 일 공시 기간 매출 억원 증가 순이익 억원 강경주 한경닷컴 기자
2021-05-14,"넷마블, 1분기 영업익 542억 작년 동기 대비 166 ↑",아시아경제 박지환 기 넷마블 연결 기준 올해 분기 영업이익 억원 지난해 동기 증가 것 잠정 집계 일 공시 매출 억원 작년 동기 대비 증가 순이익 억원 박지환 기자
2021-05-14,"넷마블, 1분기 영업익 542억원…전년比 165. 7%↑",이데일리 신중섭 기 넷마블 은 분기 연결기준 영업이익 억원 기록 일 공시 매출액 억원 전년 동기 대비 증가 당기순이익 증가 억원 기록 신중섭
