,날짜,기사제목,본문내용
0,2021-03-05,코스피 3000선 붕괴…SK하이닉스 네이버 삼바 3% 이상 급락,코스피가 넘게 떨어지면서 포인트가 붕괴됐다 미국 국채 금리 상승 여파가 코스피까지 번진 모양새다 일 오전 시 분 현재 포인트 떨어진 에 거래되고 있다 제롬 파월 연방준비제도 연준 의장의 발언에 실망한 미국 증시는 그대로 고꾸라졌다 파월 의장은 인플레이션이 대 이르고 완전 고용에 이를 때까지 완화적 통화정책을 계속하겠다고 언급하며 이런 목표 달성 시기는 한참 멀었다고 밝혔다 기회있을 때마다 파월 의장이 늘 강조했던 발언으로 시장 기대치에 부합하지 못했다 이에 뉴욕 다우존스 산업평균지수는 전일 대비 내린 만 에 지수는 하락한 에 나스닥 지수는 급락한 만 에 거래를 마쳤다 나스닥은 이날 하락으로 올해 상승분을 모두 반납하고 마이너스로 접어들었다 지난주 급등 이후 소폭 하락했던 미 국채 금리가 재차 오름세를 보이며 인플레이션 불안감이 커지고 있다 미 국채 년물 금리는 일 연속 상승을 보이면서 까지 뛰었다 이는 지난해 월 중순 이후 최고치로 신종 코로나바이러스 감염증 코로나 이전 수준을 거의 회복한 수치다 임재균 증권 연구원은 지난주 금리가 급등한 이후 금리가 하락한 것은 연준의 개입 가능성이 높아졌다고 판단했으나 파월의 발언으로 당분간 연준의 개입 가능성은 낮아졌다 면서 최근 연준 인사들은 금리 상승에 대해 경기 개선을 반영하고 있다는 평가하고 있는 데다 금리 상승에도 아직까지 신용시장의 충격은 나타나고 있지 않아 금리 상승 속도를 낮추기 위한 구두 개입 가능성도 없다 고 지적했다 이효석 증권 연구원은 금리 상승은 채권 가격의 하락을 의미하는데 최근 금리 상승은 유례가 없는 수준으로 채권 투자자들은 파월에게 뭔가를 해주기만을 기다리고 있는 상황 이라면서 큰 틀에서 연준의 생각은 바뀌지 않았으며 긴축으로 가는 길은 여전히 험난할 것 이라고 내다봤다 이날 시가총액 상위 대형주 전 종목이 약세다 삼성전자 하이닉스 화학 현대차 삼성바이오로직스 삼성 카카오 셀트리온 등 줄줄이 떨어지고 있다 같은 시간 코스닥은 전일대비 포인트 떨어진 에 머물고 있다 김규리 매경닷컴 기자
1,2021-03-05,"SK하이닉스, DRAM 가격 상승 예상 뛰어넘는다-신한",머니투데이 김태현 기자 신한금융투자는 하이닉스에 대해 가격 상승세에 실적 전망치를 상향 조정한다고 밝혔다 투자의견은 매수 목표주가는 만원으로 상향 조정했다 최도연 신한금융투자 연구원은 가격 상승 속도가 시장 예상을 상회할 전망 이라며 공급과 수요 측면에서 고정가 상승 여력은 남아있다 고 설명했다 의 재고자산 회전율은 지난 싸이클 상단의 에 불과하다 반면 서버 수요가 바닥을 확인했고 모바일과 수요는 강세를 보이고 있다 공급 제약과 가격 프리미엄 효과로 상승폭이 예상을 상회할 가능성이 매우 높다 도 턴어라운드 시그널이 발생했다 올해 분기 수요 성장은 로 예상된다 가격은 올해 분기 중 반등을 시작하고 분기부터 강하게 상승할 전망이다 최 연구원은 분기 실적 급증 구간 진입 내년 사상 최대 실적 기대감 턴어라운드 구간에서 인텔 인수 효과 등을 고려해 적극적인 매수를 추천한다 고 설명했다 김태현 기자
2,2021-03-05,"SK하이닉스, D램·낸드 가격 반등 전망…목표가↑-신한",이데일리 김성훈 기자 신한금융투자는 일 하이닉스 에 대해 디램 가격 상승 속도가 시장 예상을 상회하고 낸드 메모리 가격도 올해 분기부터 반등하며 성장세를 보일 것으로 전망했다 투자의견 매수 를 유지하고 목표주가는 만원에서 만원으로 만원 올려 잡았다 신한금융투자에 따르면 현물가 는 저점 대비 상승했다 현물가와 고정가의 괴리가 까지 확대한 것이다 재고자산 회전율은 지난 싸이클 상단의 에 불과하다 이는 고정가 상승 여력이 많이 남아 있다는 증거라는 설명이다 다가오는 분기부터 공급제약과 가격 프리미엄 효과로 평균판매가격 상승 폭이 예상을 웃돌 가능성이 매우 높다는 설명이다 가격도 분기부터 반등 조짐을 보이다 분기부터 강하게 상승할 것이란 전망이다 업체들의 투자 기조는 올해 상반기 이후 당분간 보수적일 것이라는 관측도 나온다 위 업체인 삼성전자 의 영업이익률 이 까지 하락할 것으로 예상되고 있어서다 이 때문에 분기 말로 갈수록 수급이 더욱 빡빡해 질 것으로 예상되고 있어 성수기 추가 주문 물량에 대한 가격 상승이 나타날 가능성도 있는 상황이다 최도연 신한금융투자 연구원은 업체들이 업황 회복에 주력할 시점이며 투자는 업황 회복을 확인할 년이 되어서야 급증할 전망이다 며 전환 더블스택 적용 등 공급 제약 심화로 년 연간 영업이익은 지난 년 고점을 상회할 전망이다 고 말했다 최 연구원은 분기부터 실적 급증 구간 진입 이후 내년인 년 사상 최대 실적 기대감이 영글고 있다 며 턴어라운드 구간에서 인텔 인수 효과 등의 기회도 있어 적극적인 매수를 고려할만 하다 고 말했다 김성훈
3,2021-03-05,"""SK하이닉스, 반도체 시황 개선따라 실적 상향 ···목표가 ↑""",신한금융투자 목표가 만원 제시 램 낸드 판가 상승 본격화 전망 서울경제 신한금융투자는 램 가격 상승 속도가 시장 예상을 상회할 것으로 보인다며 일 하이닉스 의 목표가를 만원에서 만원으로 높이고 투자의견 매수를 유지했다 램 가격 상승 속도가 목표가 상승의 배경이다 최도연 신한금융투자 연구원은 서버 수요가 바닥을 확인했고 모바일과 수요는 강세를 보이고 있다 며 분기부터 부터 전환이 개시되면 공급제약과 가격 프리미엄 효과로 램 평균판매단가 상승 폭이 예상을 상회할 가능성이 매우 높다 고 진단했다 신한금융투자는 올해 분기별 램 상승 폭을 분기 분기 기존 분기 기존 등으로 높였다 아울러 낸드 가격도 회복세다 최 연구원은 분기 낸드 수요는 전년 대비 성장할 것으로 예상되는 반면 투자기조는 당분간 보수적일 전망 며 가격은 중 반등을 시작하고 부터 강하게 상승할 것 이라고 전망했다 신한금융투자는 올해 하이닉스의 영업이익을 조 억원으로 전망했다 양사록 기자
4,2021-03-05,"SK하이닉스, D램·낸드 가격 상승으로 주가 상승 지속 기대-신한",사진 뉴스 파이낸셜뉴스 신한금융투자는 일 하이닉스에 대해 램 가격 상승 속도가 예상보다 높고 낸드 가격도 분기 중 반등할 것이라며 투자의견 매수 를 유지하고 목표주가를 만원에서 만원으로 상향 조정했다 최도연 신한금융투자 연구원은 이날 하이닉스의 투자 포인트를 올해 분기부터 실적 급증 구간에 진입하고 내년엔 사상 최대 실적이 기대된다는 점 낸드 턴어라운드 구간에서 인텔 인수 효과 기회가 있다는 점 등을 꼽았다 램 가격 상승 속도가 시장 예상을 상회할 것으로 전망되고 낸드 가격도 올해 분기 중 반등해 분기부터 크게 상승할 것으로 예측되면서다 램 현물가 는 저점 대비 상승했다 현물가와 고정과의 괴리는 까지 확대됐다 그럼에도 재고자산 회전율은 지난 사이클 상단의 에 불과해 램 고정가 상승 여력이 남아 있단 평가가 나온다 낸드 역시 올해 분기 수요 비트그로스 비트 당 출하량 가 증가할 전망이다 최 연구원은 낸드 투자는 관련 업체들이 업황 회복을 확인할 수 있는 년이 되면 급증할 전망 이라고 내다봤다 이에 최 연구원은 올해와 내년 영업이익 전망치를 각각 상향한 조 억원 조 억원으로 예측하면서 향후 가파른 실적 컨센서스 상승에 의한 주가 상승 지속을 예상하니 적극적인 매수를 추천한다 고 말했다 하이닉스 조윤진 기자
5,2021-03-05,"[클릭 e종목]""SK하이닉스, 실적 추정치 상향…목표가 20만원""",아시아경제 송화정 기자 신한금융투자는 일 하이닉스에 대해 향후 가파른 실적 전망치 상승으로 주가 상승이 지속될 것으로 보고 목표주가를 기존 만원에서 만원으로 상향 조정했다 투자의견은 매수 를 유지했다 최도연 신한금융투자 연구위원은 년 및 년 영업이익 전망치를 조 억원 조 억원으로 각각 상향 조정한다 면서 이번 상승 사이클의 실적 고점은 년 분기도 예상하는데 전환 낸드 더블 스택 적용 등 공급 제약 심화로 년 연간 영업이익은 지난 년 고점을 상회할 것 이라고 전망했다 이같은 전망을 반영해 목표주가를 상향 조정했다는 설명이다 램 가격 상승 속도는 시장 예상을 웃돌 것으로 전망된다 램 현물가는 저점 대비 상승했다 현물가와 고정가의 괴리가 까지 확대됐다 재고자산 회전율은 지난 사이클 상단의 에 불과하다 최 연구위원은 램 고정가 상승 여력이 많이 남아있다는 증거 라면서 년 분기별 램 평균판매단가 상승폭을 분기 분기 분기 분기 로 상향 조정한다 고 말했다 서버 수요가 바닥을 확인했고 모바일과 수요는 강세를 보이고 있어 올해 분기부터 전환이 개시되면 공급 제약과 가격 프리미엄 효과로 램 상승폭이 예상을 상회할 가능성도 매우 높다는 분석이다 낸드도 올해 분기 중 반등이 예상된다 최 연구원은 낸드 가격은 분기 중 반등을 시작해 분기부터 강하게 상승할 것 이라며 낸드 업체들이 업황 회복에 주력할 시점으로 투자 기조는 올해 상반기 이후 당분간 보수적일 것 이라고 내다봤다 송화정 기자
6,2021-03-05,"KB증권 ""SK하이닉스, 올해 2분기 3년 만에 최대 실적 기대""",증권은 일 하이닉스 에 대해 올해 분기에 년 만에 최대 실적이 예상된다고 전망했다 투자 의견은 매수 를 유지하고 개월 목표주가는 만원으로 상향 조정했다 증권에 따르면 하이닉스의 분기 영업이익은 조 억원으로 예상된다 이는 년 분기 조 억원 이후 최대 실적이다 이는 디램 수요가 늘어나고 있는 덕분이다 김동원 증권 연구원은 올해 디램 반도체 평균판매가격 의 연간 상승률 전망치를 에서 로 높인다 면서 세트와 유통업체의 메모리 재고가 바닥을 나타내는 가운데 비트코인 채굴과 더불어 모바일 컴퓨터 수요가 지속되고 북미 데이터센터 업체의 클라우드 마이그레이션 수요가 큰 폭으로 증가하고 있기 때문 이라고 설명했다 이에 따른 올해 하이닉스의 매출액은 조 억원으로 지난해 같은 기간보다 영업이익은 조 억원으로 증가할 전망이다 김 연구원은 서버 디램 기업용 솔리드스테이트드라이브 등 서버용 메모리 수요 증가가 예상되는 만큼 매출 비중이 높은 하이닉스가 경쟁사보다 최대 수혜를 누릴 것 이라고 예상했다 김소희 기자
7,2021-03-05,삼성전자·SK하이닉스 목표가 줄상향…반도체 부품주 볕드나,삼성전자 만원 하이닉스 만원 목표가 제시 반도체시장 가격 상승 사이클 본격 진입 전망 반도체 장비 년 실적 최대 예상 주가 선반영되나 이데일리 김소연 기자 올해 반도체 시장이 가격 상승 사이클에 진입할 것이란 전망이 나오면서 증권사들이 줄줄이 삼성전자 와 하이닉스 의 목표가 상향에 나섰다 삼성전자 목표주가는 만원 하이닉스의 목표주가는 만원까지 나오는 등 향후 주가상승에 대한 기대감이 커졌다 이에 반도체 대장주에 이어 반도체 장비 관련 중소형주에도 온기가 전해질 지 투자자들의 관심이 모아진다 일 마켓포인트에 따르면 하이닉스는 이날 만 원으로 거래를 마쳐 작년 연말 대비 올랐다 지난 일에는 장중 한때 만원까지 올라 신고가를 갈아치웠다 삼성전자는 최근 만원대에서 주춤한 모양새지만 반도체 가격 상승 수혜 기대감이 크다 올해 분기 램 가격 상승전환 이후 분기에 큰 폭으로 가격이 올라 분기에도 가격 상승이 지속될 것으로 예상된다 코로나 상황 이후 수요가 높아져 메모리 수요 역시 높다 이날 증권은 하이닉스의 목표가를 기존 만원에서 만원으로 올려잡았다 키움증권 역시 만원 하이투자증권도 만 원을 목표주가로 제시했다 김동원 증권 연구원은 올해 월 현재 램 시장은 세트 및 유통업체의 메모리 재고가 바닥을 나타내는 가운데 비트코인 채굴 수요와 더불어 모바일 수요 강세가 지속되고 북미 데이터센터 업체들의 클라우드 마이그레이션 구축 수요가 큰 폭으로 증가하고 있다 고 설명했다 증권사들은 삼성전자 메모리 반도체부문의 실적 개선을 전망하며 목표주가를 만원대로 올려잡고 있다 하나금융투자가 삼성전자의 목표주가를 만 원으로 제시했고 신한금융투자가 만원 증권은 만 원 등을 제시했다 그래프 이데일리 김정훈 기자 반도체 대장주들의 실적 증가가 예상된 만큼 반도체 장비 관련주의 기대감도 커지고 있다 증권업계에서는 장비 부품주 중에서도 주가 상승 여력이 충분한 기업이나 분기 실적 개선 가능성이 높은 기업을 주목하고 있다 송명섭 하이투자증권 연구원은 반도체 메모리 부분에서 투자금액이 작년보다 늘어날 것으로 보인다 투자규모가 크게 늘어나는 것은 아니기 때문에 상대적으로 반도체 장비 회사별로 시장점유율이 증가하거나 외산 장비를 대체하는 기업은 큰 폭으로 성장할 것 이라며 이런 기업들을 골라서 투자하는 전략이 유효하다 고 설명했다 나성준 신한금융투자 연구원은 반도체 장비업체 주가는 결국 삼성전자와 하이닉스와 같은 방향 이라며 장비주 주가는 년 사상 최대 실적을 선행해 반영될 것 이라고 분석했다 신한금융투자는 내년 명확한 실적 개선이 기대되고 주당순이익 증가율 역시 를 넘어설 것으로 보이는 기업을 골라내야 한다는 설명이다 신한금융투자는 반도체 장비주에서 유니테스트 유진테크 를 꼽았고 제우스 와 월덱스 원익 피에스케이 테크윙 엘오티베큠 을 추천했다 공급과잉에 시달렸던 낸드 산업은 가파른 회복세를 보이고 수요가 확대하면서 정상궤도에 오를 것으로 보인다 키움증권은 반도체 장비 업종에서 테스 를 최선호주로 꼽았다 김소연
