,날짜,기사제목,본문내용
0,2021-03-18,"신한금투 ""네이버, 쿠팡보다 평가 절하될 이유 없어...목표주가 52만...",신한금융투자는 일 쿠팡 상장에 따라 동종 업계 네이버 의 가치도 상향했다고 판단했다 투자의견은 매수 목표주가는 만원에서 만원으로 상향 조정했다 이문종 신한금융투자 연구원은 와이즈앱에 따르면 네이버쇼핑과 쿠팡의 월 거래액 성장률은 유사하다 면서 쿠팡이 높은 가치로 성장한 만큼 네이버의 저평가된 목표주가도 올려 잡았다 고 설명했다 그는 이어 네이버는 파트너십을 통해 부족한 부문을 보완했다 면서 대한통운 신세계그룹 물류 스타트업과의 협력으로 약점으로 평가됐던 배송과 식품 명품 상품군을 보완했다 고 평가했다 네이버는 대한통운과 협력해 년 개의 브랜드스토어에서 빠른 배송을 실험했고 익일 도착률은 에 달했다 연내 빠른 배송 이용 브랜드사를 개까지 확대할 전망이며 년까지 현재 보다 빠른 배송 규모를 배 늘리는 것이 목표다 이마트 점포를 도심형 물류창고로 활용하고 부릉 생각대로 등 투자 배달대행사를 통해 시간 내 배송하는 것도 가능해질 전망이다 다양한 파트너십을 통해 신세계포인트 티빙 항공마일리지 등 유저 맞춤형 멤버십 제공 혜택 제공이 가능해진 점도 긍정적이라는 게 신한금융투자의 설명이다 김소희 기자
1,2021-03-18,"네이버, e커머스 사업 日진출로 성장 기대감-메리츠",파이낸셜뉴스 메리츠증권은 일 네이버에 대해 국내 커머스 전자상거래 위에서 일본 진출을 통해 아시아 핵심 플레이어로 성장할 것으로 전망했다 지난해 네이버쇼핑의 커머스 거래액은 조원으로 국내 전자상거래 조원시장에서 점유율 의 위 사업자이다 년에는 시장점유율 이상의 더욱 확고한 위 사업자가 되겠다는 목표로 판매자 솔루션 파트너쉽 생태계 확대 데이터 기반 온디맨트 풀필먼트 구축 글로벌 진출 등의 성장 전략을 내놓았다 여기에 네이버 쇼핑은 올해 일본 전자상거래 시장 진출에 나서고 있다 네이버는 년 이내 스마트스토어 개수는 만개 지난해 만개 대비 성장 올해 거래액은 조원으로 전년 조원 대비 성장을 목표로 내걸었다 김동희 메리츠증권 연구원은 브랜드스토어 역시 지난해 월 오픈 이후 개사가 입점하며 목표치를 크게 상회하는 성장세를 시현했다 며 장기적으로 상위 스마트스토어 브랜드스토어에 머천트 솔루션 브랜드 전략 광고 페이 신상위크 캠페인 리포팅까지 을 제공해 수익화할 계획이다 고 설명했다 김 연구원은 참고로 중국 의 브랜드사는 광고 포함 의 수수료를 지불한다 며 쇼핑라이브의 성장 또한 고무적이며 중국 전자상거래에서 라이브커머스 비중이 에 달하는 점 감안하면 네이버 쇼핑의 성장여력도 풍부하다 전용 라이브 스튜디오를 구축했으며 브랜드 커넥트 플랫폼 브랜드사와 인플루언서 연결 구축 통해 라이브스타 육성에도 나설 계획이다 고 전했다 지난 일 네이버는 이마트 신세계 인터내셔널과 총 억원 규모의 지분스왑을 통한 협력을 발표했다 양사 통합 거래액은 조원 이용 고객은 네이버 만명 신세계 만명으로 확대 만개의 판매자수를 확보하게 된다 김 연구원은 또한 지난해 대한통운과 특가창고를 통해 익일배송을 위한 테스트를 진행했는데 마무리 단계로 올해는 대한통운과의 협업 물동량을 배 증가시킨다는 계획이다 며 년 이내에 그룹과 메가물류센터 설립 이마트와 협업을 통해 쿠팡의 신선식품 생필품 배송과 유사한 수준의 배송 경쟁력을 확보한다 고 내다봤다 네이버 스마트스토어는 올해 상반기 일본 시장에 진출한다 김 연구원은 홀딩스의 연간 커머스 거래액은 조원 수준 일본 소매시장은 조원으로 한국 대비 배 규모인데 전자상거래 시장은 조원 침투율은 에 불과해 성장 잠재력이 크다 며 한국에서 이미 검증된 스마트스토어 플랫폼이 홀딩스라는 파트너와 결합해 성공 가능성이 높다 상반기 라인과 메신저 커머스 모델 오픈 하반기에는 야후쇼핑 조조타운 로하코 등과 강력한 협력 모델이 구축된다 고 진단했다 이진석 기자
2,2021-03-18,"네이버, 적극적 제휴로 상품·물류 경쟁력 강화-삼성",이데일리 양희동 기자 삼성증권은 일 네이버 의 적극적인 제휴를 통한 상품 및 물류 경쟁력 강화가 국내 커머스 내 지배력 강화에 기여할 것으로 전망했다 투자의견은 매수 목표주가는 만원을 각각 유지했다 네이버의 현재 주가는 지난 일 종가 기준 만 원이다 네이버는 지난 일 애널리스트 데이를 통해 커머스 성장 전략을 발표했다 네이버는 신세계 이마트와의 제휴로 신선식품 유통을 강화하고 와의 추가 물류센터 설립으로 쿠팡과 유사한 수준의 빠른 배송 시스템을 구축할 계획이다 오동환 삼성증권 연구원은 광범위한 제휴와 캐팩스 생산시설 투자 멤버십 강화를 위한 마케팅으로 비용 증가가 예상되나 판매자 솔루션 수익화와 거래액 증가에 따른 매출 증가가 이를 상당부분 상쇄할 것으로 예상된다 며 적극적 제휴를 통한 상품 및 물류 경쟁력 강화는 국내 커머스 시장 내 네이버의 지배력 강화에 기여할 전망 이라고 분석했다 네이버는 커머스 부문 대 성장 전략으로 판매자 솔루션 강화 라이브쇼핑과 렌탈 등 다양한 구매 방식 지원 멤버십 제휴 확대 물류 풀필먼트 강화 글로벌 진출을 통해 커머스 성장 등을 지속할 계획이다 이를 통해 지난해 조원이었던 스마트스토어 거래액을 올해 조원으로 성장시키고 년까지 시장 점유율 를 달성한다고 발표했다 오 연구원은 네이버는 신세계 이마트 그룹과의 지분 교환 협력으로 이마트의 신선식품과 신세계의 명품을 네이버 쇼핑에 입점시킬 계획 이라며 국내 최대 온라인 신선식품 판매처인 이마트를 입점시킴으로써 신선식품의 경쟁력을 높이고 중장기적으로 이마트의 신선식품 물류센터를 활용한 공동 영업까지 협력을 확대할 예정 이라고 설명했다 이어 네이버는 장보기 서비스 활성화를 위해 상당의 네이버 포인트 적립과 네이버 멤버십이용자 대상 무료 배송 등의 유인을 제공할 것 이라며 상품마다 다양한 물류 수요를 충족시키기 위해 다양한 물류 파트너와 협력할 계획 이라고 덧붙였다 네이버는 이마트 등 다양한 물류 업체들과의 제휴로 빠른 배송 신선식품 가구 명품 등 상품별로 특화된 배송을 제공할 계획이다 오 연구원은 와 네이버 전용 메가 물류센터를 구축하고 현재 빠른 배송의 물동량을 년까지 배 확대할 계획 이라며 신선식품의 경우에도 이륜차 배송 업체인 부릉과의 협업으로 이마트 상품의 시간 내 배송 서비스를 제공할 예정 이라고 전했다 양희동
3,2021-03-18,"네이버, 비즈니스모델 확장·해외진출 본격화 기대 -한국",이데일리 김소연 기자 한국투자증권은 일 네이버 에 대해 스마트스토어를 중심으로 한 네이버의 자생적 생태계가 안정적으로 성장하고 있고 비즈니스모델 다각화라는 질적 성장이 동시에 이루어질 것이라고 전망했다 쿠팡의 기업가치에 비해 네이버 커머스 사업부의 가치는 현저하게 저평가돼 있어 시간이 지날수록 이 차이가 줄어들 것으로 내다봤다 투자의견 매수 목표가 만원을 유지했다 네이버의 현재 주가는 일 기준 만 원이다 정호윤 한국투자증권 연구원은 이날 보고서에서 전날 네이버는 애널리스트 데이를 통해 전자상거래 사업의 청사진을 밝혔다 며 물류역량 강화 비즈니스 모델 확장 글로벌 진출 본격화라는 세가지 포인트로 요약할 수 있다 고 설명했다 정 연구원은 조원 수준인 네이버의 스마트스토어 거래액을 년 조원으로 끌어올리고 장기적으로 년까지 전자상거래 시장에서의 점유율을 이상으로 끌어올리는 것을 목표로 한다 며 스마트스토어 및 브랜드스토어 입점사들을 위한 프리미엄 솔루션의 유료화 라이브커머스 등 비즈니스 모델을 다각화해 전자상거래에서 발생하는 수익 규모를 확대할 계획 이라고 덧붙였다 네이버는 배송과 관련해 협력을 통한 경쟁력 강화를 꾀하고 있다 정 연구원은 배송 니즈를 해결하기 위해 파트너사들과 협력관계를 강화하고 있다 빠른배송은 대한통운과 협력을 통해 서비스를 확대 년까지 현재 보다 배 수준으로 물량을 증가시킬 예정 이라고 말했다 이어 이마트와는 신선식품의 배송 분야에서 협력을 확대한다 이마트 콜드체인 센터를 통해 물류서비스를 제공하고 기존 이마트 점포를 도심형 물류창고로 활용함으로써 네이버의 약점이었던 신선식품 영역에서 경쟁력을 강화할 전망 이라며 단순히 속도가 아닌 소비자들의 니즈를 충족시킬 물류경쟁력을 갖출 계획 이라고 덧붙였다 네이버는 전자상거래 비즈니스 모델은 구독을 기반으로 하는 유료솔루션 제공으로 확대할 방침이다 검색기반 쇼핑에서 라이브커머스 등 다양한 분야로 확장한다는 것이 네이버의 목표다 해외진출도 본격화할 방침이다 정 연구원은 네이버의 전자상거래 성공 모델인 스마트스토어를 홀딩스를 통해 일본 시장에 접목시킬 예정이다 스마트스토어를 메신저인 라인과 검색포털인 야후재팬 야후의 전자상거래 서비스인 야후쇼핑 등 다양한 서비스와 연결하고 간편결제와도 연결해 국내와 동일한 전자상거래 생태계를 구축할 것 이라며 수익모델은 판매수수료 결제수수료 광고로 이루어진다 고 설명했다 이어 네이버는 이를 홀딩스와 분배하는 형태로 수익을 인식할 예정 이라며 장기적으로 일본 대만 태국 등 동남아시아로 전자상거래 사업을 확장할 것 이라고 덧붙였다 김소연
4,2021-03-18,[생생확대경]카카오·네이버 키우는 `전금법`이 수상하다,이데일리 최정희 기자 네이버 특혜법이다 빅브라더법이다 한국은행과 금융위원회가 금융결제원을 놓고 겨루는 밥그릇 쟁탈전이다 금융위원회가 주도하고 윤관석 정무위원장 더불어민주당 소속 이 대표 발의한 전자금융거래법 일부 개정안 을 두고 하는 말이다 어떻게 된 법이기에 이렇게 다양한 논쟁거리를 만들어낼까 전금법 개정안에는 빅테크 업체들이 종합지급결제업 소액 후불 신용결제업 등의 외연을 확장할 수 있도록 하는 방안이 담겨 있다 그러나 각종 혜택만 주자니 이러다가 사모펀드 꼴날까 걱정이 된다 년 금융위는 자산운용 경험이 없는 사람도 사모펀드를 운용할 수 있도록 했고 운용보고서를 투자자에게 교부토록 하는 의무도 없앴다 그 결과 라임 옵티머스자산운용 사기가 벌어졌다 금융위가 생각해 낸 것은 페이업체가 예탁금을 은행 등 제 의 기관에 예치하는 것을 의무화하는 것이다 고객 돈을 빼돌리지 말라는 뜻에서다 그런데 이마저도 못 믿겠단다 그래서 생각해 낸 것이 빅테크 업체의 내부 거래를 외부업체에 위탁해 상계 처리 하도록 한 것이다 동일 페이업체 거래 고객 가 에게 만원 이체하고 가 에게 만원 이체했다면 의 계좌에서 만원을 빼서 와 한테 각각 만원씩 주라고 외부기관이 대신 계산해주는 것이다 이 외부기관의 법적 명칭이 전자지급거래청산기관 이다 한국은행이 관할하는 지급 청산 결제 중 중간 단계인 청산 업무를 담당하는 금융결제원을 전자지급청산기관으로 지정하고 금융위가 금결원의 업무승인부터 감독 제재권까지 패키지로 가져가는 방안이 개정안에 담겨 있다 한은은 중앙은행의 지급결제 업무 중 중간 단계인 청산만 쏙 빼서 금융위 감독 대상으로 하는 것은 중앙은행의 결제리스크 관리 유동성 지원 등과 충돌하게 된다고 반발했다 또 이 과정에서 고객의 결제내역이 금결원에 유출돼 빅브라더 논란 정보 독점으로 사회 통제하는 감시자 을 야기할 수 있다고 비판했다 더구나 금결원은 기존까지 회사와 회사간 청산 업무는 했어도 회사 자체 내에서 벌어지는 상계 업무를 처리하진 않았다 그런데도 이를 청산 이라고 부르고 금결원 설립이후 년간 나몰라라 해온 금융위를 주무관청이라며 금결원에 대한 관할권을 부여하겠다니 한은이 황당해 하는 것도 이해할 만하다 한쪽에선 은행과 비슷한 업무를 함에도 소비자 보호를 위한 각종 규제는 열외인 네이버 특혜법 이요 다른 한쪽에선 소비자 보호를 내세워 금결원을 손에 쥐겠다는 금융위 권한 확대법 이라는 비난도 나온다 과연 이 다툼이 한은과 금융위간의 밥그릇 다툼인지 다시 볼 때다 겉으론 금결원을 누가 관할하느냐 금결원장에 누구를 앉히느냐의 싸움으로 비치지만 본질은 다른데 있다 빅테크기업들로부터 소비자를 보호하는 방식이 빅테크 내부 거래를 금결원이 상계토록 하는 것밖에 없는지 빅브라더 논란을 무릎쓰고라도 그렇게 하겠다면 그것을 하는 기관이 꼭 금결원이어야 하는지 의문이다 안정성이 생명인 지급결제를 건드리면서까지 말이다 금융회사 자금팀 정도면 할 수 있는 업무니 다른 기관 누구도 할 수 있지 않을까 싶다 고객 돈을 제 의 은행에 맡기는 것도 못 믿겠다면 증권사 고객 돈을 관리하는 한국증권금융 같은 공신력 있는 기관을 후보로 제안해 본다 이것도 저것도 아니라면 지금의 싸움은 밥그릇 싸움이라기보다 그냥 밥그릇 뺏기다 최정희
