,날짜,기사제목,본문내용
0,2021-02-05,"네이버웹툰, 웹소설·웹툰 제작사 에이투지에 400억 투자",에이투지 지분 취득 사업제휴 및 콘텐츠 확보 파이낸셜뉴스 네이버웹툰은 오는 월 국내 웹소설 웹툰 제작사 에이투지 지분 주 를 현금 억 원에 취득한다고 일 공시했다 취득 목적은 사업제휴 및 콘텐츠 확보로 전했다 네이버 웹툰 사업부문에서 분할된 네이버웹툰은 그동안 국내외 웹툰 비즈니스 분야에 투자를 이어왔다 앞서 네이버도 지난달 약 억 달러를 투입해 세계 최대 웹소설 플랫폼 왓패드 를 인수했다 기존 네이버웹툰과 더불어 매월 전 세계 억 만여명이 사용하는 스토리텔링 콘텐츠 플랫폼 을 갖추기 위한 목표다 네이버 웹툰 웹툰 웹소설 네이버웹툰 왓패드 에이투지 김미희 기자
1,2021-02-05,"대우건설, 네이버클라우드와 '원격드론관제 사업 추진' 맞손",신사업 신시장 개척 벨류체인 확장 추진 일환 왼쪽부터 장승규 대우건설 기술연구원장 상무 와 김태창 네이버클라우드 클라우드 사업총괄 전무가 업무협약을 체결한 후 기념사진을 촬영하고 있다 사진 대우건설 년 국내 건설업계 최초로 드론관제시스템 개발에 성공한 대우건설이 원격드론관제 사업을 본격 추진한다 대우건설은 지난 일 을지로 본사에서 네이버클라우드와 원격드론관제 사업을 본격화하기 위한 업무협약 을 체결했다고 일 밝혔다 네이버클라우드는 국내 클라우드 기업 중 가장 큰 규모의 클라우드 서비스를 제공하고 있는 전문 기업으로 산업 특화 클라우드 서비스를 제공하고 있다 이번 협약에 따라 양사는 원격드론관제 시스템의 클라우드 활용 신규사업 발굴 등에 협력키로 했다 대우건설은 개발한 드론관제시스템 은 현장마다 드론 전문가 없이도 중앙 관제시스템을 통해 주기적이고 안정적인 드론 자동 비행을 수행할 수 있는 것이 특징이다 최근에는 관제시스템을 활용해 해외현장의 드론 영상전송뿐만 아니라 드론측량을 원격으로 지원하고 있다 대우건설은 작년 사내서비스를 실시한 뒤 현재 국내외 개 현장에 드론관제시스템을 적용하고 있다 올해부터는 네이버클라우드와 함께 건설분야 이외 소방 인명 수색 해안 정찰과 같은 다양한 산업군에 서비스를 제공할 계획이다 대우건설 관계자는 불투명한 국내외 건설 시장 환경을 극복하고 지속적으로 회사가 성장해 나갈 수 있는 신성장 동력을 확보해 기업가치를 제고해 나갈 예정 이라고 말했다 조성신 매경닷컴 기자
2,2021-02-05,"대우건설-네이버클라우드, 드론관제 사업 본격화",업무협약을 체결한 장승규 대우건설 기술연구원장 왼쪽 과 김태창 네이버클라우드 클라우드 사업총괄 전무 대우건설 제공 대우건설은 원격드론관제 사업을 본격화하기 위해 네이버클라우드와 업무협약 을 체결했다고 일 밝혔다 양사는 원격드론관제 시스템의 클라우드 활용과 신규사업 발굴 등에 협력하기로 했다 대우건설은 지난 년 국내 건설업계 최초로 드론관제시스템 을 개발 했다 김은희 기자
3,2021-02-05,"대우건설, 원격드론관제 사업 본격화…네이버클라우드와 제휴",년 개발한 드론관제시스템 소방 인명 수색 해안 정찰 등에 활용 대우건설과 네이버클라우드는 지난 일 대우건설 본사에서 전략적 제휴를 위한 업무협약을 체결했다 장승규 대우건설 기술연구원장 왼쪽 네번째 과 김태창 네이버클라우드 클라우드 사업총괄 전무 왼쪽 다섯번째 등이 협약을 체결한 뒤 기념촬영을 하고 있다 대우건설 제공 헤럴드경제 김은희 기자 대우건설은 원격드론관제 사업을 본격화하기 위해 네이버클라우드와 업무협약 을 체결했다고 일 밝혔다 지난 일 대우건설 본사에서 열린 업무협약식에서 양사는 원격드론관제 시스템의 클라우드 활용과 신규사업 발굴 등에 협력하기로 했다 대우건설은 지난 년 국내 건설업계 최초로 드론관제시스템 을 개발해 국내외 개 현장에 적용 중이다 드론관제시스템은 현장에서 드론 전문가 없이도 중앙 관제시스템을 통해 주기적이고 안정적인 드론 자동 비행을 수행할 수 있는 것이 특징이다 올해부터는 네이버클라우드와 함께 건설분야 이외 소방 인명 수색 해안 정찰과 같은 다양한 산업군에 서비스를 제공할 계획이다 대우건설 관계자는 건설현장에 활용되는 모든 드론의 비행 정보와 건설현장의 영상을 활용해 현장 전체의 자재 시공현황 변동사항 등을 자동으로 분석하는 시스템도 구축할 예정 이라고 전했다 대우건설은 지난해 드론 제조 소프트웨어 전문기업인 아스트로엑스에 지분 투자하는 등 드론을 활용한 신사업 발굴에 적극 나서고 있다 이번 업무협약으로 건설 산업과 시너지 창출이 가능한 신사업을 발굴해 밸류체인을 확장하겠다는 전략이다
4,2021-02-05,"대우건설, 네이버클라우드와 '원격드론관제 사업' 본격화",머니투데이 방윤영 기자 지난 일 을지로 대우건설 본사에서 대우건설 기술연구원장 장승규 상무 왼쪽 네이버클라우드 클라우드 사업총괄 김태창 전무가 업무협약을 체결한 후 기념사진을 촬영하고 있다 사진 대우건설 대우건설은 지난 일 서울 중구 을지로 본사에서 네이버클라우드와 원격드론관제 사업을 함께 추진하기 위해 업무협약을 맺었다고 밝혔다 양사는 원격드론관제 시스템의 클라우드 활용 신규사업 발굴 등에 협력하기로 했다 대우건설은 년 업계에서는 처음으로 드론관제시스템을 개발했다 현장에 드론 전문가가 없어도 중앙 관제시스템을 통해 드론을 자동 비행할 수 있는 시스템이다 드론이 촬영한 건설현장 영상을 실시간으로 모든 공사 관계자들에게 전달해 건설 공정과 안전 관리 생산성을 높이고 있다 대우건설 관계자는 앞으로 건설현장에 활용되는 모든 드론의 비행 정보와 영상을 활용해 현장 전체의 자재 시공현황 변동사항 등을 자동으로 분석할 수 있는 시스템도 구축할 것 이라고 말했다 대우건설은 현재 국내외 개 현장에 드론관제시스템을 적용 중이다 올해부터는 네이버클라우드와 함께 건설 분야 이외에 소방 인명 수색 해안 정찰 등 다양한 산업군에 서비스를 제공한다는 계획이다 방윤영 기자
5,2021-02-05,"대우건설-네이버클라우드, 원격드론관제 사업 본격화 MOU",지난 일 서울 을지로 대우건설 본사에서 열린 업무협약식에 참석한 대우건설 기술연구원장 장승규 상무 왼쪽 와 네이버클라우드 클라우드 사업총괄 김태창 전무가 기념촬영을 하고 있다 사진 대우건설 제공 대우건설이 지난 일 서울 을지로 본사에서 네이버클라우드와 원격드론관제 사업 본격화를 위한 업무협약 을 체결했다고 일 밝혔다 이번 협약에 따라 두 회사는 원격드론관제 시스템의 클라우드 활용한 신규사업 발굴 등에 협력할 방침이다 앞서 대우건설은 년 국내 건설업계 처음으로 드론관제시스템 을 개발해 현장마다 드론 전문가 없이도 중앙 관제시스템을 통해 안정적인 자동비행을 수행하는 환경을 마련했다 현장의 실시간 드론영상을 모든 공사관계자에게 전달해 공정 안전관리 생산성 증대를 이끄는 시스템으로 현재 국내외 개 현장에 적용 중이다 최근에는 이 시스템을 활용해 해외현장 드론 영상전송뿐 아니라 드론측량 원격지원도 이뤄지고 있다 향후 현장에서 활용되는 모든 드론의 비행정보와 영상을 통해 현장 전체의 자재 시공현황 변동사항 등을 자동 분석하는 시스템도 구축할 예정이다 올해부터는 네이버클라우드와 함께 건설분야 이외 소방 인명 수색 해안 정찰과 같은 다양한 산업군에 서비스를 제공한다는 계획이다 네이버클라우드는 네이버의 기술 경험을 기반으로 한 산업 특화 클라우드 서비스를 제공한다 대우건설은 이번 전략적 제휴로 신시장 진출 기반 마련을 기대하고 있다 대우건설 관계자는 불투명한 국내외 건설 시장 환경을 극복하고 지속적으로 회사가 성장해 나갈 수 있는 신성장 동력을 확보해 기업가치를 제고해 나갈 예정 이라고 말했다
6,2021-02-05,"대우건설-네이버클라우드, 원격드론관제 사업 맞손",장승규 왼쪽 대우건설 기술연구원장이 지난 일 서울시 중구 을지로 대우건설 본사에서 김태창 네이버클라우드 클라우드 사업총괄 전무와 업무협약을 맺고 협약서를 들어보이고 있다 사진제공 대우건설 서울경제 대우건설이 네이버클라우드와 손잡고 원격드론관제사업을 본격화한다 대우건설은 지난 일 서울시 중구 을지로 대우건설 본사에서 네이버클라우드와 원격드론관제 사업 업무협약 을 체결했다고 일 밝혔다 이번 협약에서 양사는 원격드론관제 시스템의 클라우드 활용 신규사업 발굴 등에 협력하기로 했다 대우건설은 지난 년 국내 건설업계 최초로 드론관제시스템 개발에 성공했다 대우건설이 개발한 드론관제시스템 은 현장마다 드론 전문가 없이도 중앙 관제시스템을 통해 주기적이고 안정적인 드론 자동 비행을 수행할 수 있는 것이 특징이다 대우건설 관계자는 앞으로 건설현장에 활용되는 모든 드론의 비행 정보와 건설현장의 영상을 활용해 현장 전체의 자재 시공현황 변동사항 등을 자동으로 분석할 수 있는 시스템도 구축할 예정 이라고 말했다 대우건설은 년 사내서비스를 실시한 뒤 현재 국내외 개 현장에 드론관제시스템을 적용 중이며 년부터는 네이버클라우드와 함께 건설분야 이외 소방 인명 수색 해안 정찰과 같은 다양한 산업군에 서비스를 제공할 계획이다 네이버클라우드는 국내 클라우드 기업 중 가장 큰 규모의 클라우드 서비스를 제공하고 있는 전문 기업으로 네이버의 기술과 경험을 기반으로 한 산업 특화 클라우드 서비스를 제공한다 대우건설 관계자는 이번 업무협약 체결은 건설 산업과 시너지 창출이 가능한 신사업을 발굴해 벨류체인을 확장하겠다는 중장기 전략에 따라 진행된 것 이라며 네이버클라우드와의 전략적 제휴로 신시장 진출의 기반을 마련할 수 있을 것 이라고 밝혔다 박윤선 기자
7,2021-02-05,"대우건설, 원격드론 관제사업 본격화…네이버클라우드와 MOU",지난 일 을지로 대우건설 본사에서 대우건설 기술연구원장 장승규 상무 왼쪽 네이버클라우드 클라우드 사업총괄 김태창 전무가 업무협약을 체결한 후 기념사진을 촬영하고 있다 사진제공 대우건설 대우건설은 일 을지로 대우건설 본사에서 네이버클라우드와 원격드론관제 사업을 위한 양해각서 를 체결했다고 일 밝혔다 이번 협약에서 양사는 원격드론관제 시스템의 클라우드 활용 신규사업 발굴 등에 협력하기로 했다 네이버클라우드는 국내 클라우드 기업 중 가장 큰 규모의 클라우드 서비스를 제공하고 있는 전문 기업이다 대우건설은 이번 협약으로 올해부터 네이버클라우드와 함께 건설은 물론 소방 인명 수색 해안 정찰과 같은 다양한 산업군에 자사의 드론관제시스템 서비스를 제공할 방침이다 드론관제시스템 은 대우건설이 년 업계 최초로 개발한 것으로 드론 전문가 없이도 중앙 관제시스템을 통해 주기적이고 안정적인 드론 자동 비행을 수행할 수 있는 기술이다 최근에는 코로나 에 대응해 이 시스템으로 해외현장의 드론 영상전송뿐 아니라 드론측량을 원격지원하고 있다 대우건설은 현재 국내외 개 현장에 이 시스템을 적용중이다 김동표 기자
8,2021-02-05,"대우건설, 네이버클라우드와 원격드론관제 사업 본격화",대우건설은 원격드론관제 사업을 본격화하기 위해 네이버클라우드와 업무협약 을 체결했다고 일 밝혔다 두 회사는 원격드론관제 시스템의 클라우드 활용 신규사업 발굴 등을 협력하기로 했다 이번 전략적 제휴는 대우건설의 건설 산업과 시너지 창출이 가능한 신사업을 발굴해 벨류체인 을 확장하겠다는 중장기 전략의 일환이다 네이버클라우드와의 전략적 제휴로 신시장 진출 기반을 마련할 수 있을 것이라는 게 이 회사의 기대다 네이버클라우드는 국내 클라우드 기업 중 가장 큰 규모의 클라우드 서비스를 제공하고 있는 전문 기업으로 산업 특화 클라우드 서비스를 제공한다 지난 일 서울 을지로 대우건설 본사에서 대우건설 기술연구원장 장승규 상무 왼쪽 와 네이버클라우드 클라우드 사업총괄 김태창 전무가 업무협약을 체결한 후 기념사진을 촬영하고 있다 대우건설 대우건설은 미래 신사업을 위해 드론 에 대한 지속적으로 투자개발을 해왔다 지난 년 국내 건설업계 최초로 드론관제시스템 개발에 성공했으며 현재 국내외 개 현장에 적용 중이다 회사 측에 따르면 이 회사의 드론관제시스템 을 통해 현장마다 드론 전문가 없이도 중앙 관제시스템을 통해 주기적이고 안정적으로 드론 자동 비행을 수행할 수 있다 또 건설현장의 생생한 드론영상을 실시간으로 모든 공사 관계자에게 전달해 건설 공정 안전 관리 생산성을 높이고 있다 최근에는 관제시스템을 활용해 해외현장의 드론 영상전송뿐 아니라 드론측량을 원격지원하는 등 코로나시대에 대응하고 있다 올해부터는 네이버클라우드와 함께 건설 분야 이외 소방 인명 수색 해안 정찰과 같은 다양한 산업군에 드론관제시스템 서비스를 제공할 계획이다 앞서 작년 대우건설은 드론 제조 소프트웨어 전문기업 아스트로엑스에 지분 투자한 바 있다 대우건설 관계자는 앞으로 건설현장에 활용되는 모든 드론의 비행 정보와 건설현장의 영상을 활용해 현장 전체의 자재 시공현황 변동사항 등을 자동으로 분석할 수 있는 시스템도 구축할 예정 이라고 밝혔다 또 그는 불투명한 국내외 건설 시장 환경을 극복하고 지속적으로 회사가 성장해 나갈 수 있는 신성장 동력을 확보해 기업가치를 제고해 나가겠다 고 덧붙였다 허지윤 기자
9,2021-02-05,"대우건설, 네이버클라우드와 전략적 제휴로 원격드론관제 사업 본격화",이데일리 황현규 기자 대우건설 은 지난 일 을지로 대우건설 본사에서 원격드론관제 사업을 본격화하기 위해 네이버클라우드와 업무협약 을 체결했다고 일 밝혔다 이번 협약에서 양사는 원격드론관제 시스템의 클라우드 활용 신규사업 발굴 등에 협력하기로 했다 대우건설은 지난 년 국내 건설업계 최초로 드론관제시스템 개발에 성공했다 대우건설이 개발한 드론관제시스템 은 현장마다 드론 전문가 없이도 중앙 관제시스템을 통해 주기적이고 안정적인 드론 자동 비행을 수행할 수 있는 것이 특징이다 건설현장의 생생한 드론영상을 실시간으로 모든 공사 관계자에게 전달해 건설 공정 및 안전 관리 생산성을 높이고 있다 최근에는 관제시스템을 활용해 해외현장의 드론 영상전송뿐 아니라 드론측량을 원격지원하는 등 코로나시대에 대응하고 있다 대우건설 관계자는 앞으로 건설현장에 활용되는 모든 드론의 비행 정보와 건설현장의 영상을 활용해 현장 전체의 자재 시공현황 변동사항 등을 자동으로 분석할 수 있는 시스템도 구축할 예정이다 고 말했다 대우건설은 년 사내서비스를 실시한 뒤 현재 국내외 개 현장에 드론관제시스템을 적용 중이며 년부터는 네이버클라우드와 함께 건설분야 이외 소방 인명 수색 해안 정찰과 같은 다양한 산업군에 서비스를 제공할 계획이다 네이버클라우드는 국내 클라우드 기업 중 가장 큰 규모의 클라우드 서비스를 제공하고 있는 전문 기업으로 네이버의 기술과 경험을 기반으로 한 산업 특화 클라우드 서비스를 제공한다 대우건설 관계자는 불투명한 국내외 건설 시장 환경을 극복하고 지속적으로 회사가 성장해 나갈 수 있는 신성장 동력을 확보해 기업가치를 제고해 나갈 예정이다 고 말했다 황현규
10,2021-02-05,"대우건설-네이버클라우드, '드론 관제 사업' 협력",왼쪽부터 대우건설 기술연구원장 장승규 상무와 네이버클라우드 클라우드 사업 총괄 김태창 전무 자료 대우건설 대우건설은 네이버클라우드와 드론관제시스템 네이버 클라우드 플랫폼 활용 업무협약 을 맺었다고 일 밝혔다 네이버 클라우드 플랫폼이 제공하는 클라우드 인프라를 활용해 대우건설의 드론관제시스템을 건설분야 외에 소방 인명 수색 해안 정찰 등 다양한 분야에 확대 제공할 계획이다 또한 드론관제시스템에 인공지능 이미지 분석 기술을 접목해 드론이 촬영한 영상을 중요도에 따라 자동 분석하고 사용자에게 효과적으로 제공할 수 있는 서비스를 개발한다 각 업계를 선도하는 양사의 기술력과 노하우를 융합해 대우건설 신사업 분야 관련 클라우드 기술 협업을 지속할 방침이다 드론관제시스템은 드론을 원격 자동제어해 건설 현장의 공정기록 안전관리 현황 등을 촬영하고 영상으로 모니터링할 수 있는 서비스다 국내 건설사 최초로 대우건설이 개발했다 년 하반기에 대우건설이 개발해 년 사내서비스를 실시한 뒤 현재 국내외 개소의 건설현장에 적용 중이다 드론이 자동임무비행을 수행함으로써 현장 내 같은 위치와 구도에서 일정하게 찍은 영상물을 안전하게 촬영하고 관리할 수 있다 사람이 하기 어려운 임무를 대신할 수 있고 건설 관계자들이 수시로 공정 변화를 확인하고 안전관리에 필요한 정보를 제공받을 수 있다 네이버 클라우드 플랫폼은 클라우드 기반의 시스템 구축에 필수적인 기술 요소와 직관적인 사용자 환경 및 경험 을 제공해 사용자 접근성이 높다 세계적인 수준의 보안 기술을 더해 고객이 구현하고자 하는 시스템을 안전한 환경에서 실행할 수 있을 전망이다 대우건설 기술연구원장인 장승규 상무는 앞으로 건설현장에 활용되는 모든 드론의 비행 정보와 건설현장의 영상을 활용해 현장 전체의 자재 시공현황 변동사항 등을 자동으로 분석할 수 있는 시스템을 구축할 예정이다 며 네이버클라우드와의 협력을 통해 드론관제시스템을 보다 안정적으로 건설분야 뿐만 아니라 다양한 산업분야에 제공할 계획이다 라고 말했다 김하나 한경닷컴 기자
11,2021-02-05,"“2억 명 Z세대, 제페토에서 구찌 입는다”..네이버",가상공간 제페토에서 구찌 활용한 의상 지원 메타버스 트렌드 속 글로벌 와 협업지속 예정 파이낸셜뉴스 네이버제트는 글로벌 럭셔리브랜드 구찌 와 제휴를 맺고 인공지능 기반 얼굴인식 증강현실 아바타 서비스 제페토 에서 구찌 지식재산권 를 활용한 패션 아이템을 출시한다고 일 밝혔다 제페토는 글로벌 세대 년 이후 출생 가 이용하는 메타버스 가상과 현실이 공존하는 가상세계 플랫폼이다 이에 따라 전 세계 억 명에 달하는 제페토 이용자는 자신의 이미지로 만든 아바타를 구찌 특유의 화려한 색감과 패턴이 수놓아진 의상 핸드백 액세서리 등 총 여 종 아이템들로 꾸밀 수 있다 또 제페토 월드맵에 구찌 정체성이 담긴 가상공간도 마련됐다 제페토 이용자 아바타들은 구찌 본사가 위치한 이탈리아 피렌체 배경 구찌 빌라 월드맵에서 직접 아이템을 착용해볼 수 있고 유럽풍 건축물과 아름다운 정원을 거닐며 세계 각국 이용자들과 만나며 소통할 수 있다 네이버제트 구찌와 협업 네이버 제공 김대욱 네이버제트 공동대표는 전 세계 메타버스 트렌드 속에서 제페토 이용자들에게 더욱 차별화된 즐거움을 선사할 수 있을 것으로 생각된다 며 향후에도 다양한 글로벌 와의 지속 가능한 협업을 통해 무궁무진한 가상 세계에 새로운 가치를 만들어 나가겠다 고 전했다 구찌 아바타 메타버스 네이버제트 제페토 김미희 기자
12,2021-02-05,"네이버, 라이브 e커머스 ‘쇼핑라이브’ 전문가 키운다",서경환 리코 김해나 노금미 등 라이브 스타 인과 계약 네이버 콘텐츠 기획 및 기술력으로 라이브쇼 콘텐츠 강화 파이낸셜뉴스 네이버는 실시간 전자상거래 라이브 커머스 전문가를 라이브 스타 로 발굴 육성한다고 일 밝혔다 자사 라이브 커머스 서비스인 네이버 쇼핑 라이브 에서 활약할 이들과 라이브 스타 계약을 맺고 라이브쇼 콘텐츠를 강화할 계획이다 네이버는 우선 최근 쇼핑 라이브에서 활약하고 있는 서경환 리코 김해나 미미언니 노금미 등 전문성을 갖춘 라이브 스타들과 계약을 맺었다 이들과 함께 이달 말부터 라이브쇼도 선보일 예정이다 네이버는 자사 인플루언서 검색 블로그 마켓 지식인 엑스퍼트 등 다양한 플랫폼을 통해 구축한 전문가 창작자 생태계 안에서 라이브 스타를 발굴할 계획이다 네이버 쇼핑라이브 김해나 리코 라이브 스타 진행 모습 네이버 제공 네이버 쇼핑 라이브를 이끄는 송재훈 리더는 네이버 기술력 우수한 콘텐츠 경쟁력 중소형업체 및 브랜드사 참여로 라이브 커머스 생태계가 다양화되고 있다 며 새로운 창작자 집단인 라이브 스타도 발굴 육성해 커머스형 콘텐츠를 창작하고 즐기는 트렌드를 이끌고자 한다 고 전했다 쇼핑라이브 라이브스타 서경환 리코 김해나 미미언니 노금미 김미희 기자
